,Unnamed: 0.1,Unnamed: 0,date,review,rating,isEdited,userName,title,developerResponse,sentiment,reviewId,userImage,thumbsUpCount,reviewCreatedVersion,replyContent,repliedAt,standardizedReview
505,505,321,2019-12-10 05:10:37,Really good so far a tip would be make a customization panel so it doesnt feel like your being treated as a kid :),4,,A Google user,,,POSITIVE,10a73257-e3cb-4402-b10c-c3c20444fde8,https://play-lh.googleusercontent.com/EGemoI2NTXmTsBVtJqk8jxF9rh8ApRWfsIMQSt2uE4OcpQqbFu7f7NbTK05lx80nuSijCz7sc3a277R67g,1.0,4.6,,,really good far tip would make customization panel doesnt feel like treated kid
506,506,322,2019-12-03 13:06:22,"Wasn't expecting it, but great app!",5,,A Google user,,,POSITIVE,e8f195bf-d5bd-4c2a-be60-ac82d3f1454b,https://play-lh.googleusercontent.com/EGemoI2NTXmTsBVtJqk8jxF9rh8ApRWfsIMQSt2uE4OcpQqbFu7f7NbTK05lx80nuSijCz7sc3a277R67g,0.0,4.6,,,wasnt expecting great app
507,507,323,2019-12-03 00:53:07,Amazing and Educative App,5,,A Google user,,,POSITIVE,dd4a8146-007f-4dc3-89b1-5821fcd82216,https://play-lh.googleusercontent.com/EGemoI2NTXmTsBVtJqk8jxF9rh8ApRWfsIMQSt2uE4OcpQqbFu7f7NbTK05lx80nuSijCz7sc3a277R67g,0.0,4.6,,,amazing educative app
508,508,324,2019-11-28 10:24:57,Muito bom! Transmite e ensina as informações de forma simples e agradável! Estou amando a experiência!,5,,A Google user,,,POSITIVE,0230c865-6329-4671-b50f-e621941e0aa3,https://play-lh.googleusercontent.com/EGemoI2NTXmTsBVtJqk8jxF9rh8ApRWfsIMQSt2uE4OcpQqbFu7f7NbTK05lx80nuSijCz7sc3a277R67g,0.0,4.6,,,muito bom transmite e ensina informacoes de forma simples e agradavel estou amando experiencia
509,509,325,2019-11-22 02:38:17,Great app,5,,A Google user,,,POSITIVE,db14033a-3477-4eb5-bad4-5142fa4bf1ff,https://play-lh.googleusercontent.com/EGemoI2NTXmTsBVtJqk8jxF9rh8ApRWfsIMQSt2uE4OcpQqbFu7f7NbTK05lx80nuSijCz7sc3a277R67g,0.0,4.6,,,great app
510,510,326,2019-11-18 17:11:40,ดีมากๆ เรียนรู้ได้ง่ายและเข้าใจง่าย,5,,A Google user,,,NEGATIVE,6e9b1bb7-49ac-43b5-a24f-56390c6c52be,https://play-lh.googleusercontent.com/EGemoI2NTXmTsBVtJqk8jxF9rh8ApRWfsIMQSt2uE4OcpQqbFu7f7NbTK05lx80nuSijCz7sc3a277R67g,0.0,4.6,,,dmaak+ erynraidngaayaelaekhaaaicchngaay
511,511,327,2019-11-17 20:30:36,"Great, easy to use by far the easiest to understand out of any i have used",5,,A Google user,,,POSITIVE,2631c13b-b807-4557-ac90-3573d4c81ce2,https://play-lh.googleusercontent.com/EGemoI2NTXmTsBVtJqk8jxF9rh8ApRWfsIMQSt2uE4OcpQqbFu7f7NbTK05lx80nuSijCz7sc3a277R67g,0.0,4.6,,,great easy use far easiest understand used
512,512,328,2019-11-16 14:13:06,Easy to learn and i like the extra challenges when you buy pro,5,,A Google user,,,POSITIVE,ae5cd074-c904-4ef2-9f29-2948aa8c6df8,https://play-lh.googleusercontent.com/EGemoI2NTXmTsBVtJqk8jxF9rh8ApRWfsIMQSt2uE4OcpQqbFu7f7NbTK05lx80nuSijCz7sc3a277R67g,0.0,4.6,,,easy learn like extra challenges buy pro
513,513,329,2019-11-14 02:23:40,"😃😃Very nice app to learn coding free and easily with a variety of languages like -- HTML,css,python and etc",5,,A Google user,,,POSITIVE,18fc6181-d2c6-4cf5-bb43-044231409f0c,https://play-lh.googleusercontent.com/EGemoI2NTXmTsBVtJqk8jxF9rh8ApRWfsIMQSt2uE4OcpQqbFu7f7NbTK05lx80nuSijCz7sc3a277R67g,1.0,4.6,,,nice app learn coding free easily variety languages like htmlcsspython etc
514,514,330,2019-11-09 12:13:34,Really useful for training and learning!,5,,A Google user,,,POSITIVE,ed2aa11b-ee90-46eb-bfd7-c6ed68a65fc2,https://play-lh.googleusercontent.com/EGemoI2NTXmTsBVtJqk8jxF9rh8ApRWfsIMQSt2uE4OcpQqbFu7f7NbTK05lx80nuSijCz7sc3a277R67g,1.0,4.6,,,really useful training learning
515,515,331,2019-11-07 22:35:26,Best app to learn coding offline.,5,,A Google user,,,POSITIVE,54c194fe-6ecb-408e-bddd-17ce3155f1b6,https://play-lh.googleusercontent.com/EGemoI2NTXmTsBVtJqk8jxF9rh8ApRWfsIMQSt2uE4OcpQqbFu7f7NbTK05lx80nuSijCz7sc3a277R67g,0.0,,,,best app learn coding offline
516,516,332,2019-11-07 08:35:26,Good app for learners.,4,,A Google user,,,POSITIVE,705cbbf9-cf31-49a9-a5c8-068835a1e7b9,https://play-lh.googleusercontent.com/EGemoI2NTXmTsBVtJqk8jxF9rh8ApRWfsIMQSt2uE4OcpQqbFu7f7NbTK05lx80nuSijCz7sc3a277R67g,0.0,4.6,,,good app learners
517,517,333,2019-11-03 09:37:16,"So far, the format and pacing of the lessons are ideal for me - not patronising, but not overly difficult either. Will update this once I've completed the python course.",5,,A Google user,,,POSITIVE,d8e3f451-dbfb-4bbb-9770-9957771578d2,https://play-lh.googleusercontent.com/EGemoI2NTXmTsBVtJqk8jxF9rh8ApRWfsIMQSt2uE4OcpQqbFu7f7NbTK05lx80nuSijCz7sc3a277R67g,1.0,4.6,,,far format pacing lessons ideal patronising overly difficult either update ive completed python course
518,518,334,2019-11-02 19:44:45,Great app to practice basic js concepts!,5,,A Google user,,,POSITIVE,6b74b81d-f66a-4afc-b5c4-ab02c0529292,https://play-lh.googleusercontent.com/EGemoI2NTXmTsBVtJqk8jxF9rh8ApRWfsIMQSt2uE4OcpQqbFu7f7NbTK05lx80nuSijCz7sc3a277R67g,0.0,4.6,,,great app practice basic js concepts
519,519,335,2019-10-31 22:46:39,It's great! They give you a small selection of text to read then give you a coding challenge every couple of readings to test what you read. Makes it really easy to practice your coding step by step!,4,,A Google user,,,POSITIVE,d224f239-e658-4067-928a-d96f98e7a58d,https://play-lh.googleusercontent.com/EGemoI2NTXmTsBVtJqk8jxF9rh8ApRWfsIMQSt2uE4OcpQqbFu7f7NbTK05lx80nuSijCz7sc3a277R67g,17.0,4.6,,,great give small selection text read give coding challenge every couple readings test read makes really easy practice coding step step
520,520,336,2019-10-28 08:22:17,this app has made leaning to code fun and enjoyable. the app is very basic in the sense that even school kids could easily pick up how to code within weeks/months. so far i have only used the free side of this app and therefor cannot comment on the paid side to the site. thank you to the developers for such a great way to learn code. :),5,,A Google user,,,POSITIVE,5f912cf9-a7d9-4ec4-a6b7-0d69ad02ef41,https://play-lh.googleusercontent.com/EGemoI2NTXmTsBVtJqk8jxF9rh8ApRWfsIMQSt2uE4OcpQqbFu7f7NbTK05lx80nuSijCz7sc3a277R67g,4.0,4.6,,,app made leaning code fun enjoyable app basic sense even school kids could easily pick code within weeksmonths far used free side app therefor cannot comment paid side site thank developers great way learn code
521,521,337,2019-10-25 02:19:57,Great for teaching kids coding,5,,A Google user,,,POSITIVE,72c02790-a99a-460f-8943-39ddf5f7b3e0,https://play-lh.googleusercontent.com/EGemoI2NTXmTsBVtJqk8jxF9rh8ApRWfsIMQSt2uE4OcpQqbFu7f7NbTK05lx80nuSijCz7sc3a277R67g,0.0,4.6,,,great teaching kids coding
522,522,338,2019-10-20 10:13:21,Really useful if u want to learn about phyton and java in your phone,5,,A Google user,,,POSITIVE,5cbe83d7-89b1-4c67-9a84-a12b08fb0564,https://play-lh.googleusercontent.com/EGemoI2NTXmTsBVtJqk8jxF9rh8ApRWfsIMQSt2uE4OcpQqbFu7f7NbTK05lx80nuSijCz7sc3a277R67g,0.0,4.6,,,really useful u want learn phyton java phone
523,523,339,2019-10-15 18:12:06,Very helpful learning beginner JavaScript and HTML/CSS,5,,A Google user,,,POSITIVE,255d8831-5c74-42f9-83ac-5edec6d34f4d,https://play-lh.googleusercontent.com/EGemoI2NTXmTsBVtJqk8jxF9rh8ApRWfsIMQSt2uE4OcpQqbFu7f7NbTK05lx80nuSijCz7sc3a277R67g,0.0,4.6,,,helpful learning beginner javascript htmlcss
524,524,340,2019-10-14 06:25:44,Finally! A coding program that doesn't make me feel like an idiot or leave me hanging w/no clear instructions. I love this one!,5,,A Google user,,,POSITIVE,e97a93e7-9edb-4662-8276-5cc308b6ff9b,https://play-lh.googleusercontent.com/EGemoI2NTXmTsBVtJqk8jxF9rh8ApRWfsIMQSt2uE4OcpQqbFu7f7NbTK05lx80nuSijCz7sc3a277R67g,2.0,4.6,,,finally coding program doesnt make feel like idiot leave hanging wno clear instructions love one
525,525,341,2019-10-13 13:43:48,"Loving it, and is funny, also, please add a place where you can write your own code",5,,A Google user,,,POSITIVE,b7a99a85-4f2c-4270-8d3b-d3851820e6d8,https://play-lh.googleusercontent.com/EGemoI2NTXmTsBVtJqk8jxF9rh8ApRWfsIMQSt2uE4OcpQqbFu7f7NbTK05lx80nuSijCz7sc3a277R67g,1.0,4.6,,,loving funny also please add place write code
526,526,342,2019-10-04 12:16:47,Great way to learn basic coding concepts with no previous experience.,5,,A Google user,,,POSITIVE,d3b71521-414d-4d31-8d86-34fad3b53c73,https://play-lh.googleusercontent.com/EGemoI2NTXmTsBVtJqk8jxF9rh8ApRWfsIMQSt2uE4OcpQqbFu7f7NbTK05lx80nuSijCz7sc3a277R67g,1.0,4.6,,,great way learn basic coding concepts previous experience
527,527,343,2019-10-03 01:36:47,Amazing!,5,,A Google user,,,POSITIVE,bf99efc5-d8b9-4d01-a8ce-fd93a3cbc208,https://play-lh.googleusercontent.com/EGemoI2NTXmTsBVtJqk8jxF9rh8ApRWfsIMQSt2uE4OcpQqbFu7f7NbTK05lx80nuSijCz7sc3a277R67g,0.0,4.6,,,amazing
528,528,344,2019-10-02 02:53:04,Better than Mimo! The only thing is that it is not 100% free like Duolingo,4,,A Google user,,,POSITIVE,7158d579-1192-4b7d-8345-e2ad0a854e5f,https://play-lh.googleusercontent.com/EGemoI2NTXmTsBVtJqk8jxF9rh8ApRWfsIMQSt2uE4OcpQqbFu7f7NbTK05lx80nuSijCz7sc3a277R67g,0.0,4.6,,,better mimo thing 100 free like duolingo
529,529,345,2019-09-28 18:01:19,love it am getting better at coding though i am 12. thank you so much the person that created this app without this app i would have not known haw to code. add more features and if i could i would rate this 20/5,5,,A Google user,,,POSITIVE,ed33181a-9411-4a5e-849a-140443d4aae7,https://play-lh.googleusercontent.com/EGemoI2NTXmTsBVtJqk8jxF9rh8ApRWfsIMQSt2uE4OcpQqbFu7f7NbTK05lx80nuSijCz7sc3a277R67g,0.0,4.6,,,love getting better coding though 12 thank much person created app without app would known haw code add features could would rate 205
530,530,346,2019-09-28 08:22:24,nice,5,,A Google user,,,POSITIVE,b2144ba1-0a64-469a-a9e5-eb87bbb13f93,https://play-lh.googleusercontent.com/EGemoI2NTXmTsBVtJqk8jxF9rh8ApRWfsIMQSt2uE4OcpQqbFu7f7NbTK05lx80nuSijCz7sc3a277R67g,0.0,4.6,,,nice
531,531,347,2019-09-26 00:03:45,Cost feel like the option to learn coding should be free,3,,A Google user,,,NEGATIVE,3d6980ce-c4ba-4f8f-b24a-009c89869659,https://play-lh.googleusercontent.com/EGemoI2NTXmTsBVtJqk8jxF9rh8ApRWfsIMQSt2uE4OcpQqbFu7f7NbTK05lx80nuSijCz7sc3a277R67g,1.0,4.6,,,cost feel like option learn coding free
532,532,348,2019-09-23 20:44:41,"It just clicked in with my way of learning. But the app is not complete, it will only teach you a little bit of the basics.",5,,A Google user,,,NEGATIVE,f833dff2-23f4-4f6a-af37-40642d033307,https://play-lh.googleusercontent.com/EGemoI2NTXmTsBVtJqk8jxF9rh8ApRWfsIMQSt2uE4OcpQqbFu7f7NbTK05lx80nuSijCz7sc3a277R67g,0.0,4.6,,,clicked way learning app complete teach little bit basics
533,533,349,2019-09-19 11:59:07,its almost good,3,,A Google user,,,POSITIVE,d7bd0e6f-1163-4839-b537-260d4d555606,https://play-lh.googleusercontent.com/EGemoI2NTXmTsBVtJqk8jxF9rh8ApRWfsIMQSt2uE4OcpQqbFu7f7NbTK05lx80nuSijCz7sc3a277R67g,1.0,4.6,,,almost good
534,534,350,2019-09-16 14:33:10,"Amazing app, I'm in Grade 9 and taking CAT for grade 10. Pretty certain this will help me tremendously. Thank you for an amazing app.",5,,A Google user,,,POSITIVE,2017cad1-6f81-467b-9892-74b70bd53153,https://play-lh.googleusercontent.com/EGemoI2NTXmTsBVtJqk8jxF9rh8ApRWfsIMQSt2uE4OcpQqbFu7f7NbTK05lx80nuSijCz7sc3a277R67g,6.0,4.6,,,amazing app im grade 9 taking cat grade 10 pretty certain help tremendously thank amazing app
535,535,351,2019-09-15 14:22:12,"I have gone through so many coding apps and this one is easily the best. It takes you through everything step by step, gives examples and let's you write some code.",5,,A Google user,,,POSITIVE,f0c8eea0-9bfd-4521-aac2-69bbc84d717f,https://play-lh.googleusercontent.com/EGemoI2NTXmTsBVtJqk8jxF9rh8ApRWfsIMQSt2uE4OcpQqbFu7f7NbTK05lx80nuSijCz7sc3a277R67g,6.0,4.6,,,gone many coding apps one easily best takes everything step step gives examples lets write code
536,536,352,2019-09-05 19:39:25,Its not bad I just wish that you could have your own personal page to where you can type out codes.,3,,A Google user,,,POSITIVE,7d8f6f9f-9557-4803-ba9f-934bc53fa972,https://play-lh.googleusercontent.com/EGemoI2NTXmTsBVtJqk8jxF9rh8ApRWfsIMQSt2uE4OcpQqbFu7f7NbTK05lx80nuSijCz7sc3a277R67g,0.0,4.6,,,bad wish could personal page type codes
537,537,353,2019-09-04 12:31:58,Awesome app,5,,A Google user,,,POSITIVE,4e26fe0a-6682-4323-8d07-b252c5dffa05,https://play-lh.googleusercontent.com/EGemoI2NTXmTsBVtJqk8jxF9rh8ApRWfsIMQSt2uE4OcpQqbFu7f7NbTK05lx80nuSijCz7sc3a277R67g,0.0,4.6,,,awesome app
538,538,354,2019-09-02 15:32:05,Great app for developers.,4,,A Google user,,,POSITIVE,bc5effd4-0e55-40b9-9d2c-022bc2682e63,https://play-lh.googleusercontent.com/EGemoI2NTXmTsBVtJqk8jxF9rh8ApRWfsIMQSt2uE4OcpQqbFu7f7NbTK05lx80nuSijCz7sc3a277R67g,0.0,4.6,,,great app developers
539,539,355,2019-09-01 02:33:58,"I got a best experience with this app, it gives you the core knowledge of programming in an easy way.",4,,A Google user,,,POSITIVE,ac5e8483-eb35-4a08-b001-a98155af208b,https://play-lh.googleusercontent.com/EGemoI2NTXmTsBVtJqk8jxF9rh8ApRWfsIMQSt2uE4OcpQqbFu7f7NbTK05lx80nuSijCz7sc3a277R67g,0.0,4.6,,,got best experience app gives core knowledge programming easy way
540,540,356,2019-08-30 07:12:26,I have currently only done 3 of the many java script challenges and i must say it is incredible unlike other apps that teach you to program (mimo) it gives you every thing you need to start coding for free. Thanks to the developers of this app for making it.,5,,A Google user,,,POSITIVE,7c4709b2-48ec-4de3-8c80-1d191bd50fa8,https://play-lh.googleusercontent.com/EGemoI2NTXmTsBVtJqk8jxF9rh8ApRWfsIMQSt2uE4OcpQqbFu7f7NbTK05lx80nuSijCz7sc3a277R67g,2.0,4.6,,,currently done 3 many java script challenges must say incredible unlike apps teach program mimo gives every thing need start coding free thanks developers app making
541,541,357,2019-08-29 01:14:31,Best feature it runs offline.... and its doesnt crash.... well done developers,5,,A Google user,,,POSITIVE,6b58cb29-bc95-4040-9728-8d407a074fb9,https://play-lh.googleusercontent.com/EGemoI2NTXmTsBVtJqk8jxF9rh8ApRWfsIMQSt2uE4OcpQqbFu7f7NbTK05lx80nuSijCz7sc3a277R67g,1.0,4.6,,,best feature runs offline doesnt crash well done developers
542,542,358,2019-08-26 10:20:49,"Very gud , so nice ...i thank for encode app , tq somuch..im happy for this ....",4,,A Google user,,,POSITIVE,93fe7d54-2a19-4858-8d25-c74b965a5dbb,https://play-lh.googleusercontent.com/EGemoI2NTXmTsBVtJqk8jxF9rh8ApRWfsIMQSt2uE4OcpQqbFu7f7NbTK05lx80nuSijCz7sc3a277R67g,0.0,4.6,,,gud nice thank encode app tq somuchim happy
543,543,359,2019-08-22 16:59:30,Very good app even for beginners,5,,A Google user,,,POSITIVE,0e1cd625-e65b-45c7-b670-bf4d0201bbf2,https://play-lh.googleusercontent.com/EGemoI2NTXmTsBVtJqk8jxF9rh8ApRWfsIMQSt2uE4OcpQqbFu7f7NbTK05lx80nuSijCz7sc3a277R67g,0.0,4.6,,,good app even beginners
544,544,360,2019-08-17 00:46:50,very useful,5,,A Google user,,,POSITIVE,5294bb9c-5e62-452a-847a-ffb4b89f801b,https://play-lh.googleusercontent.com/EGemoI2NTXmTsBVtJqk8jxF9rh8ApRWfsIMQSt2uE4OcpQqbFu7f7NbTK05lx80nuSijCz7sc3a277R67g,0.0,4.6,,,useful
545,545,361,2019-08-16 19:49:39,Very good app. Helps sharpen programming skillz,5,,A Google user,,,POSITIVE,340056a8-216b-4e72-bdde-207a298d83e2,https://play-lh.googleusercontent.com/EGemoI2NTXmTsBVtJqk8jxF9rh8ApRWfsIMQSt2uE4OcpQqbFu7f7NbTK05lx80nuSijCz7sc3a277R67g,0.0,,,,good app helps sharpen programming skillz
546,546,362,2019-08-16 12:19:14,great apps,5,,A Google user,,,POSITIVE,8fefecbe-fa03-4624-a45d-1267a791197a,https://play-lh.googleusercontent.com/EGemoI2NTXmTsBVtJqk8jxF9rh8ApRWfsIMQSt2uE4OcpQqbFu7f7NbTK05lx80nuSijCz7sc3a277R67g,0.0,4.6,,,great apps
547,547,363,2019-08-15 07:59:16,one of the best so far.,5,,A Google user,,,POSITIVE,f1694d90-2d25-4a76-8ace-ee82c44d2160,https://play-lh.googleusercontent.com/EGemoI2NTXmTsBVtJqk8jxF9rh8ApRWfsIMQSt2uE4OcpQqbFu7f7NbTK05lx80nuSijCz7sc3a277R67g,0.0,4.6,,,one best far
548,548,364,2019-08-14 21:16:58,Not worth the money for pro. Challenges are not hard enough even for a beginner like myself,2,,A Google user,,,NEGATIVE,b9cc41c0-d7b9-49a8-99e0-8e86cfeb9a3d,https://play-lh.googleusercontent.com/EGemoI2NTXmTsBVtJqk8jxF9rh8ApRWfsIMQSt2uE4OcpQqbFu7f7NbTK05lx80nuSijCz7sc3a277R67g,1.0,4.6,,,worth money pro challenges hard enough even beginner like
549,549,365,2019-08-12 05:45:06,it's still good so far.,5,,A Google user,,,POSITIVE,aa4d7864-4991-4e61-a419-5ba0045c8617,https://play-lh.googleusercontent.com/EGemoI2NTXmTsBVtJqk8jxF9rh8ApRWfsIMQSt2uE4OcpQqbFu7f7NbTK05lx80nuSijCz7sc3a277R67g,0.0,4.6,,,still good far
550,550,366,2019-08-12 02:36:13,"Very intuitive, also super easy to dive into as a complete beginner.",5,,A Google user,,,POSITIVE,a01c12c0-2516-4f2a-b91b-715f9b1509e3,https://play-lh.googleusercontent.com/EGemoI2NTXmTsBVtJqk8jxF9rh8ApRWfsIMQSt2uE4OcpQqbFu7f7NbTK05lx80nuSijCz7sc3a277R67g,0.0,4.6,,,intuitive also super easy dive complete beginner
551,551,367,2019-08-10 23:48:48,bst for learning coding for beginners this app eliminate fear about coding,5,,A Google user,,,POSITIVE,fc31f9ad-6cc6-4c7f-b544-e5462c466289,https://play-lh.googleusercontent.com/EGemoI2NTXmTsBVtJqk8jxF9rh8ApRWfsIMQSt2uE4OcpQqbFu7f7NbTK05lx80nuSijCz7sc3a277R67g,0.0,4.6,,,bst learning coding beginners app eliminate fear coding
552,552,368,2019-08-06 21:02:20,"This app has helped me learn python, web, and java script. This is also child freindly:)",5,,A Google user,,,POSITIVE,8a710efe-3a13-48be-a943-d7910d91ffe9,https://play-lh.googleusercontent.com/EGemoI2NTXmTsBVtJqk8jxF9rh8ApRWfsIMQSt2uE4OcpQqbFu7f7NbTK05lx80nuSijCz7sc3a277R67g,0.0,4.6,,,app helped learn python web java script also child freindly
553,553,369,2019-08-05 12:33:47,The best app for encoding.,5,,A Google user,,,POSITIVE,825baec6-1571-47f8-a4a0-be0786ba92e1,https://play-lh.googleusercontent.com/EGemoI2NTXmTsBVtJqk8jxF9rh8ApRWfsIMQSt2uE4OcpQqbFu7f7NbTK05lx80nuSijCz7sc3a277R67g,0.0,4.6,,,best app encoding
554,554,370,2019-08-05 06:20:18,best app ever,5,,A Google user,,,POSITIVE,a11d15c8-2415-4d1d-9d87-e21a8b7a968c,https://play-lh.googleusercontent.com/EGemoI2NTXmTsBVtJqk8jxF9rh8ApRWfsIMQSt2uE4OcpQqbFu7f7NbTK05lx80nuSijCz7sc3a277R67g,0.0,4.6,,,best app ever
555,555,371,2019-08-04 17:09:27,"Quick and easy to follow project-based lessons! I went through all the CSS, HTML, & Javascript Courses. This app is great for beginners. I was hoping the Extra Challenges would help out with the more complex concepts; but it was more of a reiterations of what was taught.",4,,A Google user,,,POSITIVE,f6ff787b-c5e1-4a87-8dcd-b08e9aff3c3d,https://play-lh.googleusercontent.com/EGemoI2NTXmTsBVtJqk8jxF9rh8ApRWfsIMQSt2uE4OcpQqbFu7f7NbTK05lx80nuSijCz7sc3a277R67g,0.0,4.6,,,quick easy follow projectbased lessons went css html javascript courses app great beginners hoping extra challenges would help complex concepts reiterations taught
556,556,372,2019-07-31 22:37:58,It is great and amazing and effective way to teach coding,5,,A Google user,,,POSITIVE,7d63f906-167e-46e2-9cf0-cb188a52a49a,https://play-lh.googleusercontent.com/EGemoI2NTXmTsBVtJqk8jxF9rh8ApRWfsIMQSt2uE4OcpQqbFu7f7NbTK05lx80nuSijCz7sc3a277R67g,0.0,4.6,,,great amazing effective way teach coding
557,557,373,2019-07-30 11:29:44,helped me out alot friendly to newbs,5,,A Google user,,,POSITIVE,6f9a3cf7-ec23-46b4-92f1-8fc3c274b4ac,https://play-lh.googleusercontent.com/EGemoI2NTXmTsBVtJqk8jxF9rh8ApRWfsIMQSt2uE4OcpQqbFu7f7NbTK05lx80nuSijCz7sc3a277R67g,0.0,4.6,,,helped alot friendly newbs
558,558,374,2019-07-28 22:07:15,3 bcoz it didn't provide platform to implement it in originality.,3,,A Google user,,,NEGATIVE,fb22d23c-6cef-4045-9eea-1e62b2dca893,https://play-lh.googleusercontent.com/EGemoI2NTXmTsBVtJqk8jxF9rh8ApRWfsIMQSt2uE4OcpQqbFu7f7NbTK05lx80nuSijCz7sc3a277R67g,0.0,4.6,,,3 bcoz didnt provide platform implement originality
559,559,375,2019-07-28 19:31:23,good app for beginners.,5,,A Google user,,,POSITIVE,a8a13f3b-d24a-467e-a853-0ad9377d3021,https://play-lh.googleusercontent.com/EGemoI2NTXmTsBVtJqk8jxF9rh8ApRWfsIMQSt2uE4OcpQqbFu7f7NbTK05lx80nuSijCz7sc3a277R67g,0.0,4.6,,,good app beginners
560,560,376,2019-07-28 03:42:25,Please at least explain things.. I could not figure out what you are trying to teach. At least explain what these symbols mean. You just can't start telling people to start coding.I am new to coding.,1,,A Google user,,,NEGATIVE,28152230-802d-420b-a6eb-27c79c5b0ea4,https://play-lh.googleusercontent.com/EGemoI2NTXmTsBVtJqk8jxF9rh8ApRWfsIMQSt2uE4OcpQqbFu7f7NbTK05lx80nuSijCz7sc3a277R67g,2.0,4.6,,,please least explain things could figure trying teach least explain symbols mean cant start telling people start codingi new coding
561,561,377,2019-07-26 09:48:04,Just installed the app and am loving the lessons so far. It's a great way to learn code in just small chunks of time. I would really like to see a compiler included so that I could practice what I have learnt outside of the lessons.,4,,A Google user,,,POSITIVE,4d21ee45-384e-46ed-93f2-2701e01369f3,https://play-lh.googleusercontent.com/EGemoI2NTXmTsBVtJqk8jxF9rh8ApRWfsIMQSt2uE4OcpQqbFu7f7NbTK05lx80nuSijCz7sc3a277R67g,5.0,4.6,,,installed app loving lessons far great way learn code small chunks time would really like see compiler included could practice learnt outside lessons
562,562,378,2019-07-25 09:22:56,"great apps, funny way to learn coding.",5,,A Google user,,,POSITIVE,c85ed693-f2c1-4883-b21d-cc71042ef844,https://play-lh.googleusercontent.com/EGemoI2NTXmTsBVtJqk8jxF9rh8ApRWfsIMQSt2uE4OcpQqbFu7f7NbTK05lx80nuSijCz7sc3a277R67g,0.0,4.6,,,great apps funny way learn coding
563,563,379,2019-07-21 01:55:43,very good and educative!,5,,A Google user,,,POSITIVE,8a51cbc1-28e0-425b-8f42-10def191f85b,https://play-lh.googleusercontent.com/EGemoI2NTXmTsBVtJqk8jxF9rh8ApRWfsIMQSt2uE4OcpQqbFu7f7NbTK05lx80nuSijCz7sc3a277R67g,0.0,,,,good educative
564,564,380,2019-07-20 11:02:13,"encode is a very good app but how do I upgrade it, if I don't have a debit or credit card, that is unfair on your part, do something please",3,,A Google user,,,NEGATIVE,b9f7946b-312d-4220-900e-afbfd8e110af,https://play-lh.googleusercontent.com/EGemoI2NTXmTsBVtJqk8jxF9rh8ApRWfsIMQSt2uE4OcpQqbFu7f7NbTK05lx80nuSijCz7sc3a277R67g,1.0,4.6,,,encode good app upgrade dont debit credit card unfair part something please
565,565,381,2019-07-17 03:05:25,umm good for begining expireince,4,,A Google user,,,NEGATIVE,224a7d8f-3f7b-474b-8450-795ebffdcf71,https://play-lh.googleusercontent.com/EGemoI2NTXmTsBVtJqk8jxF9rh8ApRWfsIMQSt2uE4OcpQqbFu7f7NbTK05lx80nuSijCz7sc3a277R67g,0.0,4.6,,,umm good begining expireince
566,566,382,2019-07-12 09:33:30,very cool,5,,A Google user,,,POSITIVE,a416f781-17cc-43e1-876c-4611da1d23c6,https://play-lh.googleusercontent.com/EGemoI2NTXmTsBVtJqk8jxF9rh8ApRWfsIMQSt2uE4OcpQqbFu7f7NbTK05lx80nuSijCz7sc3a277R67g,0.0,4.6,,,cool
567,567,383,2019-07-11 09:17:07,i acctaly like this app tbh it is cool im just trying to do coding as a hobby and its fun and i understand it too woild definitely recommend!!!,5,,A Google user,,,POSITIVE,1cfd2e36-8ec9-46c4-8cb6-a46c760cd6fa,https://play-lh.googleusercontent.com/EGemoI2NTXmTsBVtJqk8jxF9rh8ApRWfsIMQSt2uE4OcpQqbFu7f7NbTK05lx80nuSijCz7sc3a277R67g,0.0,4.6,,,acctaly like app tbh cool im trying coding hobby fun understand woild definitely recommend
568,568,384,2019-07-10 14:24:49,"Can i give more than 5 stars!? Keep up the awesome work, Encode devs! 😁",5,,A Google user,,,POSITIVE,e44de27a-6e15-4be7-9a54-d65acbc7542e,https://play-lh.googleusercontent.com/EGemoI2NTXmTsBVtJqk8jxF9rh8ApRWfsIMQSt2uE4OcpQqbFu7f7NbTK05lx80nuSijCz7sc3a277R67g,3.0,4.6,,,give 5 stars keep awesome work encode devs
569,569,385,2019-07-09 19:39:44,great app,5,,A Google user,,,POSITIVE,abee4291-6dc3-44c2-9073-c2ccb5262d9c,https://play-lh.googleusercontent.com/EGemoI2NTXmTsBVtJqk8jxF9rh8ApRWfsIMQSt2uE4OcpQqbFu7f7NbTK05lx80nuSijCz7sc3a277R67g,0.0,4.6,,,great app
570,570,386,2019-07-09 18:10:07,"Simple, good start to programming concepts",5,,A Google user,,,POSITIVE,7b525dc5-a79b-4c7d-828f-05adbb953ad3,https://play-lh.googleusercontent.com/EGemoI2NTXmTsBVtJqk8jxF9rh8ApRWfsIMQSt2uE4OcpQqbFu7f7NbTK05lx80nuSijCz7sc3a277R67g,0.0,4.6,,,simple good start programming concepts
571,571,387,2019-07-09 13:09:46,with this app I can easily learn coding it is better than minor and grasshopper because it suddenly takes test and you can be caught easily that you are not clear with the concept such a nice app best app ever for coding on play store,5,,A Google user,,,POSITIVE,60052c54-cb47-4610-a4d5-b3372924eef4,https://play-lh.googleusercontent.com/EGemoI2NTXmTsBVtJqk8jxF9rh8ApRWfsIMQSt2uE4OcpQqbFu7f7NbTK05lx80nuSijCz7sc3a277R67g,0.0,4.6,,,app easily learn coding better minor grasshopper suddenly takes test caught easily clear concept nice app best app ever coding play store
572,572,388,2019-07-09 08:30:27,in python session it takes so longer time to process the answer,3,,A Google user,,,NEGATIVE,37a5bb89-239b-45ed-92f9-41a4114f9327,https://play-lh.googleusercontent.com/EGemoI2NTXmTsBVtJqk8jxF9rh8ApRWfsIMQSt2uE4OcpQqbFu7f7NbTK05lx80nuSijCz7sc3a277R67g,1.0,4.6,,,python session takes longer time process answer
573,573,389,2019-07-08 10:49:41,Just got started ... but got the paid version and so far I am happy with the app. Hoping to learn quik so I can start developing apps. I am really excited.,5,,A Google user,,,POSITIVE,f13d05ed-dff1-4925-913d-5c9c339ab516,https://play-lh.googleusercontent.com/EGemoI2NTXmTsBVtJqk8jxF9rh8ApRWfsIMQSt2uE4OcpQqbFu7f7NbTK05lx80nuSijCz7sc3a277R67g,0.0,4.6,,,got started got paid version far happy app hoping learn quik start developing apps really excited
574,574,390,2019-07-07 19:41:17,it's a good app to learn coding,5,,A Google user,,,POSITIVE,0506b389-fa9b-4516-82e5-40ddbed9c4a3,https://play-lh.googleusercontent.com/EGemoI2NTXmTsBVtJqk8jxF9rh8ApRWfsIMQSt2uE4OcpQqbFu7f7NbTK05lx80nuSijCz7sc3a277R67g,0.0,,,,good app learn coding
