,Unnamed: 0.1,Unnamed: 0,date,review,rating,isEdited,userName,title,developerResponse,sentiment,reviewId,userImage,thumbsUpCount,reviewCreatedVersion,replyContent,repliedAt,standardizedReview
998,998,814,2018-04-10 02:09:48,"Best app that can teach you how to code better and faster , thank you Encode 😂😂😂",5,,A Google user,,,POSITIVE,650fffdf-1716-4bb6-8b7a-c4fd36ae4531,https://play-lh.googleusercontent.com/EGemoI2NTXmTsBVtJqk8jxF9rh8ApRWfsIMQSt2uE4OcpQqbFu7f7NbTK05lx80nuSijCz7sc3a277R67g,0.0,4.1,,,best app teach code better faster thank encode
999,999,815,2018-04-09 11:23:46,It is one of the best app to learn web and python. I love it most,5,,A Google user,,,POSITIVE,a56ff353-57d1-43ca-8798-6a126c614b25,https://play-lh.googleusercontent.com/EGemoI2NTXmTsBVtJqk8jxF9rh8ApRWfsIMQSt2uE4OcpQqbFu7f7NbTK05lx80nuSijCz7sc3a277R67g,1.0,4.1,,,one best app learn web python love
1000,1000,816,2018-04-08 18:17:38,Great stuff!,5,,A Google user,,,POSITIVE,8a8a1f3b-8128-46c4-8aed-836130b66edc,https://play-lh.googleusercontent.com/EGemoI2NTXmTsBVtJqk8jxF9rh8ApRWfsIMQSt2uE4OcpQqbFu7f7NbTK05lx80nuSijCz7sc3a277R67g,0.0,4.1,,,great stuff
1001,1001,817,2018-04-08 09:47:25,A very good app for beginners,5,,A Google user,,,POSITIVE,29561641-2e9c-4510-a4b5-ce7b2adc5992,https://play-lh.googleusercontent.com/EGemoI2NTXmTsBVtJqk8jxF9rh8ApRWfsIMQSt2uE4OcpQqbFu7f7NbTK05lx80nuSijCz7sc3a277R67g,0.0,,,,good app beginners
1002,1002,818,2018-04-08 09:06:38,"Engaging introduction to coding, really easy to get in to",5,,A Google user,,,POSITIVE,4eff4fce-ba69-4268-ade2-cda57b120a5c,https://play-lh.googleusercontent.com/EGemoI2NTXmTsBVtJqk8jxF9rh8ApRWfsIMQSt2uE4OcpQqbFu7f7NbTK05lx80nuSijCz7sc3a277R67g,0.0,4.1,,,engaging introduction coding really easy get
1003,1003,819,2018-04-07 19:11:54,"Great app.I'm an adult and I'm back  in school for coding. My course materials are awesome but sometimes the reading followed by the huge practice drills are too much, especially if I felt like I didn't fully grasp the language rules of a particular element or style. So I began to look for miniature, focused tutorials that I could practice in prior to doing the big assignments for  school. This app is by far the best I've tried. It breaks things down into tiny chunks which makes them easier to retain.You actually learn it, not just memorize it. The app looks clean and flows nicely, too. I started using it 2 days ago and I am picking concepts up and retaining them, which was my goal. I decided to pay the $3.99 for the Pro and it was worth it.I highly recommend.",5,,A Google user,,,POSITIVE,3899b5fe-3f82-40b9-ac40-f5615211cad1,https://play-lh.googleusercontent.com/EGemoI2NTXmTsBVtJqk8jxF9rh8ApRWfsIMQSt2uE4OcpQqbFu7f7NbTK05lx80nuSijCz7sc3a277R67g,11.0,4.1,,,great appim adult im back school coding course materials awesome sometimes reading followed huge practice drills much especially felt like didnt fully grasp language rules particular element style began look miniature focused tutorials could practice prior big assignments school app far best ive tried breaks things tiny chunks makes easier retainyou actually learn memorize app looks clean flows nicely started using 2 days ago picking concepts retaining goal decided pay 399 pro worth iti highly recommend
1004,1004,820,2018-04-06 12:36:59,Love it.Just started learn Python and bought a PRO for a challege.Good luck to me :) Please add Ruby if possible.Thank you.Great app.,5,,A Google user,,,POSITIVE,23092e66-da14-491d-8a14-694ceffccfa5,https://play-lh.googleusercontent.com/EGemoI2NTXmTsBVtJqk8jxF9rh8ApRWfsIMQSt2uE4OcpQqbFu7f7NbTK05lx80nuSijCz7sc3a277R67g,0.0,4.1,,,love itjust started learn python bought pro challegegood luck please add ruby possiblethank yougreat app
1005,1005,821,2018-04-06 05:25:15,Best for developer .,5,,A Google user,,,POSITIVE,50cb1575-f5d4-43bd-a5db-d404af5684b2,https://play-lh.googleusercontent.com/EGemoI2NTXmTsBVtJqk8jxF9rh8ApRWfsIMQSt2uE4OcpQqbFu7f7NbTK05lx80nuSijCz7sc3a277R67g,0.0,,,,best developer
1006,1006,822,2018-04-05 17:30:22,"Best app to learn coding! If you are a developer or you need to learn to code, download this app!!! Love It!!!",5,,A Google user,,,POSITIVE,a0674e9f-abb4-48b7-96df-adbfe926badf,https://play-lh.googleusercontent.com/EGemoI2NTXmTsBVtJqk8jxF9rh8ApRWfsIMQSt2uE4OcpQqbFu7f7NbTK05lx80nuSijCz7sc3a277R67g,0.0,4.1,,,best app learn coding developer need learn code download app love
1007,1007,823,2018-04-05 04:35:22,Very good to learn in short snippets. Highly recommend for those beginning with Python.,5,,A Google user,,,POSITIVE,c6b34705-5d4a-4d97-8222-103e85b68b24,https://play-lh.googleusercontent.com/EGemoI2NTXmTsBVtJqk8jxF9rh8ApRWfsIMQSt2uE4OcpQqbFu7f7NbTK05lx80nuSijCz7sc3a277R67g,0.0,4.1,,,good learn short snippets highly recommend beginning python
1008,1008,824,2018-04-04 19:08:50,Was excited to start but I can't seem to download it. Are the servers down.,1,,A Google user,,,NEGATIVE,27ac8b5e-dcdf-4042-89df-296a0b5a0603,https://play-lh.googleusercontent.com/EGemoI2NTXmTsBVtJqk8jxF9rh8ApRWfsIMQSt2uE4OcpQqbFu7f7NbTK05lx80nuSijCz7sc3a277R67g,0.0,2.3,"Hi L,

Downloading of apps is managed by Google Play.

As a general tip, please try restarting your phone and ensuring you have enough free space.",2018-04-04 21:19:29,excited start cant seem download servers
1009,1009,825,2018-04-04 18:45:45,Outstanding introductory coding app. Engaging. Simple. Effective. Thank you !,5,,A Google user,,,POSITIVE,5eead1e9-2655-4d5f-8e24-b146853812f4,https://play-lh.googleusercontent.com/EGemoI2NTXmTsBVtJqk8jxF9rh8ApRWfsIMQSt2uE4OcpQqbFu7f7NbTK05lx80nuSijCz7sc3a277R67g,0.0,4.1,,,outstanding introductory coding app engaging simple effective thank
1010,1010,826,2018-04-04 10:44:48,Hhh,5,,A Google user,,,NEGATIVE,993edeef-ae83-43b8-bb36-422f0b3dc70f,https://play-lh.googleusercontent.com/EGemoI2NTXmTsBVtJqk8jxF9rh8ApRWfsIMQSt2uE4OcpQqbFu7f7NbTK05lx80nuSijCz7sc3a277R67g,0.0,,,,hhh
1011,1011,827,2018-04-04 04:27:52,This app provides usefull information about understanding different languages of code. Great app.,5,,A Google user,,,POSITIVE,03304665-42d4-4076-8f11-dee5e7639e0c,https://play-lh.googleusercontent.com/EGemoI2NTXmTsBVtJqk8jxF9rh8ApRWfsIMQSt2uE4OcpQqbFu7f7NbTK05lx80nuSijCz7sc3a277R67g,0.0,4.1,,,app provides usefull information understanding different languages code great app
1012,1012,828,2018-04-04 01:33:39,Its ass,1,,A Google user,,,POSITIVE,8a11d213-e367-45b6-8d0a-09b404e6d01f,https://play-lh.googleusercontent.com/EGemoI2NTXmTsBVtJqk8jxF9rh8ApRWfsIMQSt2uE4OcpQqbFu7f7NbTK05lx80nuSijCz7sc3a277R67g,1.0,4.1,"Hi Retonix

Sorry to hear that.

Please email us at support@upskew.com with your feedback, we'd love to improve the Encode experience for you.",2018-04-05 01:06:00,ass
1013,1013,829,2018-04-03 18:34:41,The best for beginners I've found,5,,A Google user,,,POSITIVE,87ffd1fe-cd05-4b6a-a086-bb3cea32fb32,https://play-lh.googleusercontent.com/EGemoI2NTXmTsBVtJqk8jxF9rh8ApRWfsIMQSt2uE4OcpQqbFu7f7NbTK05lx80nuSijCz7sc3a277R67g,0.0,4.0,,,best beginners ive found
1014,1014,830,2018-04-02 21:32:36,Great app! Brilliant interactive drills that really help you learn instead of read ~ test apps. Any plans to add Java?,5,,A Google user,,,POSITIVE,353c2c33-0664-4c2f-ba41-7b61dcfc324d,https://play-lh.googleusercontent.com/EGemoI2NTXmTsBVtJqk8jxF9rh8ApRWfsIMQSt2uE4OcpQqbFu7f7NbTK05lx80nuSijCz7sc3a277R67g,0.0,4.1,"Hi Tanveer

Thanks for your review, I'm glad to hear you're finding the interactive way of teaching to be effective!

Right now we don't have plans for Java as it is a more verbose language, which would be a bit cumbersome to type on mobile.",2018-04-05 01:08:09,great app brilliant interactive drills really help learn instead read test apps plans add java
1015,1015,831,2018-04-02 17:55:43,This app is incredible. I found very simple and fun to learn. With a great neat interface and fun guide. Highly recommended!,5,,A Google user,,,POSITIVE,abe0b10d-b3ad-4e77-b221-3788360bd693,https://play-lh.googleusercontent.com/EGemoI2NTXmTsBVtJqk8jxF9rh8ApRWfsIMQSt2uE4OcpQqbFu7f7NbTK05lx80nuSijCz7sc3a277R67g,3.0,4.1,,,app incredible found simple fun learn great neat interface fun guide highly recommended
1016,1016,832,2018-04-02 15:23:46,Keep up the good work. Need more challenges.,4,,A Google user,,,POSITIVE,11fe1463-d1fb-4c81-a7dd-9fc1dddfbed7,https://play-lh.googleusercontent.com/EGemoI2NTXmTsBVtJqk8jxF9rh8ApRWfsIMQSt2uE4OcpQqbFu7f7NbTK05lx80nuSijCz7sc3a277R67g,0.0,4.1,,,keep good work need challenges
1017,1017,833,2018-04-02 05:33:38,Awesome,5,,A Google user,,,POSITIVE,f42bac08-6750-44a9-9c27-704fcec47f80,https://play-lh.googleusercontent.com/EGemoI2NTXmTsBVtJqk8jxF9rh8ApRWfsIMQSt2uE4OcpQqbFu7f7NbTK05lx80nuSijCz7sc3a277R67g,0.0,4.1,,,awesome
1018,1018,834,2018-04-01 20:36:01,Really useful,5,,A Google user,,,POSITIVE,f647e56e-387a-42d0-9a23-88669956dadd,https://play-lh.googleusercontent.com/EGemoI2NTXmTsBVtJqk8jxF9rh8ApRWfsIMQSt2uE4OcpQqbFu7f7NbTK05lx80nuSijCz7sc3a277R67g,0.0,4.1,,,really useful
1019,1019,835,2018-04-01 20:10:42,Absolutely amazing. Learning so much more through this do it yourself type learning,5,,A Google user,,,POSITIVE,4eb1021b-54ab-4c0d-bb00-5530507cb350,https://play-lh.googleusercontent.com/EGemoI2NTXmTsBVtJqk8jxF9rh8ApRWfsIMQSt2uE4OcpQqbFu7f7NbTK05lx80nuSijCz7sc3a277R67g,0.0,4.1,,,absolutely amazing learning much type learning
1020,1020,836,2018-04-01 05:50:32,Great app but i hope if it all free,5,,A Google user,,,POSITIVE,4e8f8eac-b4fc-4820-9a16-97ca102219ed,https://play-lh.googleusercontent.com/EGemoI2NTXmTsBVtJqk8jxF9rh8ApRWfsIMQSt2uE4OcpQqbFu7f7NbTK05lx80nuSijCz7sc3a277R67g,0.0,4.1,,,great app hope free
1021,1021,837,2018-04-01 03:40:57,It is simple and easy to use and learn,5,,A Google user,,,POSITIVE,e2c4e317-7db6-4dd1-8124-62a064a30173,https://play-lh.googleusercontent.com/EGemoI2NTXmTsBVtJqk8jxF9rh8ApRWfsIMQSt2uE4OcpQqbFu7f7NbTK05lx80nuSijCz7sc3a277R67g,0.0,4.1,,,simple easy use learn
1022,1022,838,2018-04-01 03:20:47,nice,4,,A Google user,,,POSITIVE,9cb89f1f-0b6b-4ea8-8ca7-2ef3c11d0f0c,https://play-lh.googleusercontent.com/EGemoI2NTXmTsBVtJqk8jxF9rh8ApRWfsIMQSt2uE4OcpQqbFu7f7NbTK05lx80nuSijCz7sc3a277R67g,0.0,,,,nice
1023,1023,839,2018-03-31 10:49:01,Awesome app.,5,,A Google user,,,POSITIVE,cc10e8ba-b055-4e1e-83ca-f2897740da8c,https://play-lh.googleusercontent.com/EGemoI2NTXmTsBVtJqk8jxF9rh8ApRWfsIMQSt2uE4OcpQqbFu7f7NbTK05lx80nuSijCz7sc3a277R67g,1.0,4.1,,,awesome app
1024,1024,840,2018-03-29 08:52:48,Great app! Would give it 5 stars but I can't get past the adding numbers part in python because it just won't load the answer so stuck on loading screen,3,,A Google user,,,NEGATIVE,ed607b18-6863-41c0-a9f5-1acea91fca3c,https://play-lh.googleusercontent.com/EGemoI2NTXmTsBVtJqk8jxF9rh8ApRWfsIMQSt2uE4OcpQqbFu7f7NbTK05lx80nuSijCz7sc3a277R67g,1.0,4.1,,,great app would give 5 stars cant get past adding numbers part python wont load answer stuck loading screen
1025,1025,841,2018-03-27 20:22:06,Nice when you start from the base,4,,A Google user,,,POSITIVE,98819b84-1405-4ffd-923d-efad706054d9,https://play-lh.googleusercontent.com/EGemoI2NTXmTsBVtJqk8jxF9rh8ApRWfsIMQSt2uE4OcpQqbFu7f7NbTK05lx80nuSijCz7sc3a277R67g,0.0,4.1,,,nice start base
1026,1026,842,2018-03-27 13:33:25,This app is Awesome.,5,,A Google user,,,POSITIVE,e507fd5f-f933-4c2f-ab50-da3241bd780c,https://play-lh.googleusercontent.com/EGemoI2NTXmTsBVtJqk8jxF9rh8ApRWfsIMQSt2uE4OcpQqbFu7f7NbTK05lx80nuSijCz7sc3a277R67g,0.0,4.1,,,app awesome
1027,1027,843,2018-03-26 20:27:52,"So far it's been amazing, i just can't get enough.",4,,A Google user,,,POSITIVE,83cd7bd2-3567-4429-8563-988d9faff8bd,https://play-lh.googleusercontent.com/EGemoI2NTXmTsBVtJqk8jxF9rh8ApRWfsIMQSt2uE4OcpQqbFu7f7NbTK05lx80nuSijCz7sc3a277R67g,0.0,,,,far amazing cant get enough
1028,1028,844,2018-03-25 21:15:00,Packs quite a punch!👍👍,4,,A Google user,,,POSITIVE,20f675b3-c13b-4c5a-82a6-ade37ef2564b,https://play-lh.googleusercontent.com/EGemoI2NTXmTsBVtJqk8jxF9rh8ApRWfsIMQSt2uE4OcpQqbFu7f7NbTK05lx80nuSijCz7sc3a277R67g,0.0,4.1,,,packs quite punch
1029,1029,845,2018-03-25 19:14:01,"Great intro into coding basics.  Love the format.  Does a great job of translating ""real-world"" into code.",5,,A Google user,,,POSITIVE,f78aaf9c-0d68-4fa7-b111-76cfc6a5d6a2,https://play-lh.googleusercontent.com/EGemoI2NTXmTsBVtJqk8jxF9rh8ApRWfsIMQSt2uE4OcpQqbFu7f7NbTK05lx80nuSijCz7sc3a277R67g,2.0,4.1,,,great intro coding basics love format great job translating realworld code
1030,1030,846,2018-03-24 17:33:40,"Great app for Learning code for beginners, would highly recommend",5,,A Google user,,,POSITIVE,84ffe8e3-304e-4172-9efe-5ff3e3f59c4c,https://play-lh.googleusercontent.com/EGemoI2NTXmTsBVtJqk8jxF9rh8ApRWfsIMQSt2uE4OcpQqbFu7f7NbTK05lx80nuSijCz7sc3a277R67g,0.0,,,,great app learning code beginners would highly recommend
1031,1031,847,2018-03-24 14:30:25,"I'm using this app in conjunction with SoloLearn to learn Python, and Encode is clarifying and giving me practice in every concept I've struggled with in SoloLearn.",5,,A Google user,,,POSITIVE,7160b425-cd09-4b0b-a864-0c005f457a6d,https://play-lh.googleusercontent.com/EGemoI2NTXmTsBVtJqk8jxF9rh8ApRWfsIMQSt2uE4OcpQqbFu7f7NbTK05lx80nuSijCz7sc3a277R67g,3.0,4.1,,,im using app conjunction sololearn learn python encode clarifying giving practice every concept ive struggled sololearn
1032,1032,848,2018-03-23 13:06:39,"Great App, everything explained well.",5,,A Google user,,,POSITIVE,ed0fda3c-29ea-405b-bdd6-90ba5144ff8d,https://play-lh.googleusercontent.com/EGemoI2NTXmTsBVtJqk8jxF9rh8ApRWfsIMQSt2uE4OcpQqbFu7f7NbTK05lx80nuSijCz7sc3a277R67g,0.0,4.1,,,great app everything explained well
1033,1033,849,2018-03-21 13:51:21,Great interface for a mobile app.,5,,A Google user,,,POSITIVE,eb350e10-44a1-4cc0-a63d-24f419279da1,https://play-lh.googleusercontent.com/EGemoI2NTXmTsBVtJqk8jxF9rh8ApRWfsIMQSt2uE4OcpQqbFu7f7NbTK05lx80nuSijCz7sc3a277R67g,0.0,4.1,,,great interface mobile app
1034,1034,850,2018-03-20 18:52:03,I loooooved it 😍😍😍😍 what a nice way to enter the world of Code....   ...   ..   .,5,,A Google user,,,POSITIVE,20971c82-af1d-4d30-b4eb-1c53f59368ae,https://play-lh.googleusercontent.com/EGemoI2NTXmTsBVtJqk8jxF9rh8ApRWfsIMQSt2uE4OcpQqbFu7f7NbTK05lx80nuSijCz7sc3a277R67g,1.0,4.1,,,loooooved nice way enter world code
1035,1035,851,2018-03-18 02:23:09,"This is a well put together app, not very difficult & I always look forward to learning more about coding.",5,,A Google user,,,POSITIVE,8bd68f94-57a2-48df-a2a6-4f78f5b88152,https://play-lh.googleusercontent.com/EGemoI2NTXmTsBVtJqk8jxF9rh8ApRWfsIMQSt2uE4OcpQqbFu7f7NbTK05lx80nuSijCz7sc3a277R67g,0.0,4.1,,,well put together app difficult always look forward learning coding
1036,1036,852,2018-03-17 10:09:16,"Good app, like the way you practice the concept immediately.",5,,A Google user,,,POSITIVE,bb403d2f-07a0-4472-af41-8b698731dc3f,https://play-lh.googleusercontent.com/EGemoI2NTXmTsBVtJqk8jxF9rh8ApRWfsIMQSt2uE4OcpQqbFu7f7NbTK05lx80nuSijCz7sc3a277R67g,0.0,4.1,,,good app like way practice concept immediately
1037,1037,853,2018-03-17 01:29:21,"Encode keeps evolving with each update! Python and other programming language lessons are taught in an accessible, creative, and entertaining way. This app lays out the basics and keeps challenging you from start to finish. I only wish the courses were longer, the teaching style is that great. Go Pro - you will not be disappointed! The developers are amazingly helpful if you have any questions. Thanks for this winning app, Upskew!",5,,A Google user,,,POSITIVE,f9ae84a3-869f-4a26-937a-5aa69f126d8d,https://play-lh.googleusercontent.com/EGemoI2NTXmTsBVtJqk8jxF9rh8ApRWfsIMQSt2uE4OcpQqbFu7f7NbTK05lx80nuSijCz7sc3a277R67g,16.0,4.1,,,encode keeps evolving update python programming language lessons taught accessible creative entertaining way app lays basics keeps challenging start finish wish courses longer teaching style great go pro disappointed developers amazingly helpful questions thanks winning app upskew
1038,1038,854,2018-03-14 06:33:32,"Update: it worked! Thanks guys Bought the pro on my phone .. but I can't use it or buy it for my tablet, because I already own this. :(",5,,A Google user,,,POSITIVE,32df039a-ad0e-4e20-bcef-8d7e73beb712,https://play-lh.googleusercontent.com/EGemoI2NTXmTsBVtJqk8jxF9rh8ApRWfsIMQSt2uE4OcpQqbFu7f7NbTK05lx80nuSijCz7sc3a277R67g,0.0,4.1,"Hi Florin

If Pro doesn't activate automatically, just tap the purchase button on your tablet and it will force activation if you've already purchased Pro.

Please email us at support@upskew.com should you require more assistance.",2018-03-14 06:29:10,update worked thanks guys bought pro phone cant use buy tablet already
1039,1039,855,2018-03-14 05:45:18,"I have been dabbling with apps to help me learn Python for years, but nothing has come close to the level of engagement, fun and well balanced learning curves that Encode has.  Beautifully written and presented tasks for me to complete - a breath of fresh air compared to the dry and dull worded questions most other tutorials drag me through.   Colour me impressed - you've found a way to keep my artist brain focused and not bored or overwhelmed. Absolute kudos to the devs! :D",5,,A Google user,,,POSITIVE,e3066fd9-ec40-4493-8677-c84634684250,https://play-lh.googleusercontent.com/EGemoI2NTXmTsBVtJqk8jxF9rh8ApRWfsIMQSt2uE4OcpQqbFu7f7NbTK05lx80nuSijCz7sc3a277R67g,34.0,4.1,,,dabbling apps help learn python years nothing come close level engagement fun well balanced learning curves encode beautifully written presented tasks complete breath fresh air compared dry dull worded questions tutorials drag colour impressed youve found way keep artist brain focused bored overwhelmed absolute kudos devs
1040,1040,856,2018-03-14 04:37:50,"Great app! Very engaging, and also good for beginners. Good job guys. Would love more languages. (Think C, C++!)",5,,A Google user,,,POSITIVE,35304e00-20a2-4d92-9662-7b26b5f0eacf,https://play-lh.googleusercontent.com/EGemoI2NTXmTsBVtJqk8jxF9rh8ApRWfsIMQSt2uE4OcpQqbFu7f7NbTK05lx80nuSijCz7sc3a277R67g,0.0,4.1,,,great app engaging also good beginners good job guys would love languages think c c
1041,1041,857,2018-03-12 14:06:32,Great app for beginners.,5,,A Google user,,,POSITIVE,93df79b3-acde-4321-ab1c-d0039f2d7a21,https://play-lh.googleusercontent.com/EGemoI2NTXmTsBVtJqk8jxF9rh8ApRWfsIMQSt2uE4OcpQqbFu7f7NbTK05lx80nuSijCz7sc3a277R67g,0.0,4.1,,,great app beginners
1042,1042,858,2018-03-12 10:58:15,"Awesome and great app for coding. Amongst the very best. If not the best. As for me, its a must have for any who loves coding and seeks basic or more knowledge.",5,,A Google user,,,POSITIVE,cf11977b-f8c0-4041-a35f-4331682d769b,https://play-lh.googleusercontent.com/EGemoI2NTXmTsBVtJqk8jxF9rh8ApRWfsIMQSt2uE4OcpQqbFu7f7NbTK05lx80nuSijCz7sc3a277R67g,2.0,4.1,,,awesome great app coding amongst best best must loves coding seeks basic knowledge
1043,1043,859,2018-03-11 04:21:06,No,1,,A Google user,,,NEGATIVE,b6de45f5-cf79-40af-90d6-eeead3780891,https://play-lh.googleusercontent.com/EGemoI2NTXmTsBVtJqk8jxF9rh8ApRWfsIMQSt2uE4OcpQqbFu7f7NbTK05lx80nuSijCz7sc3a277R67g,0.0,,,,
1044,1044,860,2018-03-10 10:28:26,This is great and  is helpful,5,,A Google user,,,POSITIVE,fab9617e-472a-400e-9cfc-ecdf982b3645,https://play-lh.googleusercontent.com/EGemoI2NTXmTsBVtJqk8jxF9rh8ApRWfsIMQSt2uE4OcpQqbFu7f7NbTK05lx80nuSijCz7sc3a277R67g,0.0,4.1,,,great helpful
1045,1045,861,2018-03-10 03:56:25,Awesome  Better than solo,5,,A Google user,,,POSITIVE,b310d90c-5e09-455b-b289-4ec56ea9e58c,https://play-lh.googleusercontent.com/EGemoI2NTXmTsBVtJqk8jxF9rh8ApRWfsIMQSt2uE4OcpQqbFu7f7NbTK05lx80nuSijCz7sc3a277R67g,0.0,,,,awesome better solo
1046,1046,862,2018-03-09 23:36:36,I've always wanted to learn coding. This app helped me learn the basics. Best code learning app in the Play Store,5,,A Google user,,,POSITIVE,3d8df2fb-3c0b-47d8-ab2b-2890d679a0b6,https://play-lh.googleusercontent.com/EGemoI2NTXmTsBVtJqk8jxF9rh8ApRWfsIMQSt2uE4OcpQqbFu7f7NbTK05lx80nuSijCz7sc3a277R67g,0.0,4.1,,,ive always wanted learn coding app helped learn basics best code learning app play store
1047,1047,863,2018-03-09 20:56:30,"This app is the best. I have one query. If I purchase pro mode for one lesson, will all pro mode will be unlocked or should I buy for each and every lesson",5,,A Google user,,,POSITIVE,164b5a96-a9ee-45d5-81a9-91e67439426e,https://play-lh.googleusercontent.com/EGemoI2NTXmTsBVtJqk8jxF9rh8ApRWfsIMQSt2uE4OcpQqbFu7f7NbTK05lx80nuSijCz7sc3a277R67g,0.0,4.1,"Hi,

Thanks for your review and question. Pro unlocks all lessons. 🔓

Please feel free to email us at support@upskew.com should you have any other questions.",2018-03-09 23:27:42,app best one query purchase pro mode one lesson pro mode unlocked buy every lesson
1048,1048,864,2018-03-08 19:08:24,I tried a few coding apps but none of them engaged me like this so far. I love how instead of using the learn and test format they use the learn and try it yourself with sometimes a question about yourself to answer. The only thing i would ask is to provide maybe 2 more languages. But overall i love this app. 💖💝💕💟💗💘,4,,A Google user,,,POSITIVE,1be2b14b-d168-48ae-8aa6-d0a9e8f4aa51,https://play-lh.googleusercontent.com/EGemoI2NTXmTsBVtJqk8jxF9rh8ApRWfsIMQSt2uE4OcpQqbFu7f7NbTK05lx80nuSijCz7sc3a277R67g,52.0,4.1,,,tried coding apps none engaged like far love instead using learn test format use learn try sometimes question answer thing would ask provide maybe 2 languages overall love app
1049,1049,865,2018-03-06 23:13:21,It's a good app but how can i restore purchase at android phone since i purchased encode pro at iphone?,3,,A Google user,,,NEGATIVE,45cca9f4-6678-4f1b-9ea1-d2140171395a,https://play-lh.googleusercontent.com/EGemoI2NTXmTsBVtJqk8jxF9rh8ApRWfsIMQSt2uE4OcpQqbFu7f7NbTK05lx80nuSijCz7sc3a277R67g,0.0,4.1,"Hi Xuan

Please email us at support@upskew.com so we can look into this for you.

Thank you.",2018-03-09 23:28:22,good app restore purchase android phone since purchased encode pro iphone
1050,1050,866,2018-03-05 15:42:34,Its good for beginners,5,,A Google user,,,NEGATIVE,40161fe5-2f20-4234-8745-42b9d564ac46,https://play-lh.googleusercontent.com/EGemoI2NTXmTsBVtJqk8jxF9rh8ApRWfsIMQSt2uE4OcpQqbFu7f7NbTK05lx80nuSijCz7sc3a277R67g,0.0,4.1,,,good beginners
1051,1051,867,2018-03-05 13:35:15,Great,5,,A Google user,,,POSITIVE,489a589d-3ab7-439a-9d1b-065d154b59a6,https://play-lh.googleusercontent.com/EGemoI2NTXmTsBVtJqk8jxF9rh8ApRWfsIMQSt2uE4OcpQqbFu7f7NbTK05lx80nuSijCz7sc3a277R67g,0.0,4.1,,,great
1052,1052,868,2018-03-05 11:51:32,Very useful for beginners and people trying to brush up,5,,A Google user,,,POSITIVE,828607ca-cabf-4c63-911a-cb48503a0fe0,https://play-lh.googleusercontent.com/EGemoI2NTXmTsBVtJqk8jxF9rh8ApRWfsIMQSt2uE4OcpQqbFu7f7NbTK05lx80nuSijCz7sc3a277R67g,2.0,4.1,,,useful beginners people trying brush
1053,1053,869,2018-03-04 23:25:13,Cool app never coded before and I'm having no trouble learning how to its perfect.,5,,A Google user,,,POSITIVE,ab2032cc-6b94-45cf-9ab1-acf8969b0b0d,https://play-lh.googleusercontent.com/EGemoI2NTXmTsBVtJqk8jxF9rh8ApRWfsIMQSt2uE4OcpQqbFu7f7NbTK05lx80nuSijCz7sc3a277R67g,0.0,4.0,,,cool app never coded im trouble learning perfect
1054,1054,870,2018-03-04 11:57:37,It really explains everything so well.,5,,A Google user,,,POSITIVE,5eb82098-33d7-4bd5-8d03-c10ecbdf7319,https://play-lh.googleusercontent.com/EGemoI2NTXmTsBVtJqk8jxF9rh8ApRWfsIMQSt2uE4OcpQqbFu7f7NbTK05lx80nuSijCz7sc3a277R67g,0.0,4.1,,,really explains everything well
1055,1055,871,2018-03-03 23:20:13,"So far so good. Makes understanding of coding so simple and easy ,I could do this the whole day without getting bored",5,,A Google user,,,POSITIVE,17467d6c-0eb1-44d4-93d7-919e6318a3e5,https://play-lh.googleusercontent.com/EGemoI2NTXmTsBVtJqk8jxF9rh8ApRWfsIMQSt2uE4OcpQqbFu7f7NbTK05lx80nuSijCz7sc3a277R67g,0.0,4.1,,,far good makes understanding coding simple easy could whole day without getting bored
1056,1056,872,2018-03-03 19:26:01,Love it,5,,A Google user,,,POSITIVE,a92fb0e6-35f8-45be-b8fd-b0a6d3bef2a3,https://play-lh.googleusercontent.com/EGemoI2NTXmTsBVtJqk8jxF9rh8ApRWfsIMQSt2uE4OcpQqbFu7f7NbTK05lx80nuSijCz7sc3a277R67g,0.0,4.0,,,love
1057,1057,873,2018-03-03 19:09:26,App was too difficult for me to understand still feels like this is beyond basic coding so you have to have some understanding into codding in general like make it for actual beginners.,3,,A Google user,,,NEGATIVE,ffca865a-56f5-48c2-8c1a-67f30b4ccaad,https://play-lh.googleusercontent.com/EGemoI2NTXmTsBVtJqk8jxF9rh8ApRWfsIMQSt2uE4OcpQqbFu7f7NbTK05lx80nuSijCz7sc3a277R67g,8.0,4.1,,,app difficult understand still feels like beyond basic coding understanding codding general like make actual beginners
1058,1058,874,2018-03-03 12:05:35,"Simple and intuitive, yet teaching coding easily",5,,A Google user,,,POSITIVE,55ab529f-53d3-470d-a15b-9dd77ab01515,https://play-lh.googleusercontent.com/EGemoI2NTXmTsBVtJqk8jxF9rh8ApRWfsIMQSt2uE4OcpQqbFu7f7NbTK05lx80nuSijCz7sc3a277R67g,2.0,4.1,,,simple intuitive yet teaching coding easily
1059,1059,875,2018-03-03 00:22:07,Bring back Arnold c!,3,,A Google user,,,POSITIVE,9f7c00ac-0c9c-4dda-92e7-21bc3b40f6d6,https://play-lh.googleusercontent.com/EGemoI2NTXmTsBVtJqk8jxF9rh8ApRWfsIMQSt2uE4OcpQqbFu7f7NbTK05lx80nuSijCz7sc3a277R67g,0.0,3.0.1,,,bring back arnold c
1060,1060,876,2018-03-01 23:50:42,Amazing,4,,A Google user,,,POSITIVE,7b573182-9a09-4070-8181-b89611f4e9cc,https://play-lh.googleusercontent.com/EGemoI2NTXmTsBVtJqk8jxF9rh8ApRWfsIMQSt2uE4OcpQqbFu7f7NbTK05lx80nuSijCz7sc3a277R67g,0.0,4.1,,,amazing
1061,1061,877,2018-03-01 04:18:32,Great,5,,A Google user,,,POSITIVE,228a4199-b3e9-4b05-a6b3-3270224b8bf9,https://play-lh.googleusercontent.com/EGemoI2NTXmTsBVtJqk8jxF9rh8ApRWfsIMQSt2uE4OcpQqbFu7f7NbTK05lx80nuSijCz7sc3a277R67g,0.0,4.1,,,great
