,Unnamed: 0.1,Unnamed: 0,date,review,rating,isEdited,userName,title,developerResponse,sentiment,reviewId,userImage,thumbsUpCount,reviewCreatedVersion,replyContent,repliedAt,standardizedReview
1465,1465,1281,2017-05-24 21:45:04,"Nice app! But why doesn't the description say, ""Learn to code with byte-sized programming lessons."" 😉",4,,A Google user,,,POSITIVE,b631d639-fc56-4002-9d85-4c267a4cdc49,https://play-lh.googleusercontent.com/EGemoI2NTXmTsBVtJqk8jxF9rh8ApRWfsIMQSt2uE4OcpQqbFu7f7NbTK05lx80nuSijCz7sc3a277R67g,0.0,3.1,,,nice app doesnt description say learn code bytesized programming lessons
1466,1466,1282,2017-05-24 18:58:59,Great way to learn about coding,5,,A Google user,,,POSITIVE,8d757dac-bd2f-4163-8021-e54ca34accfd,https://play-lh.googleusercontent.com/EGemoI2NTXmTsBVtJqk8jxF9rh8ApRWfsIMQSt2uE4OcpQqbFu7f7NbTK05lx80nuSijCz7sc3a277R67g,0.0,3.1,,,great way learn coding
1467,1467,1283,2017-05-23 11:55:49,I really enjoy this app. It helps me stay productive and code fresh in my mind. I can easily use it in my free time at work or while riding in the car.,5,,A Google user,,,POSITIVE,dc775329-c437-4ad8-bec2-a2243e780389,https://play-lh.googleusercontent.com/EGemoI2NTXmTsBVtJqk8jxF9rh8ApRWfsIMQSt2uE4OcpQqbFu7f7NbTK05lx80nuSijCz7sc3a277R67g,0.0,3.1,,,really enjoy app helps stay productive code fresh mind easily use free time work riding car
1468,1468,1284,2017-05-22 02:24:26,Very nic apk,5,,A Google user,,,POSITIVE,79601557-9d3f-4e54-b542-46d1f5b868f3,https://play-lh.googleusercontent.com/EGemoI2NTXmTsBVtJqk8jxF9rh8ApRWfsIMQSt2uE4OcpQqbFu7f7NbTK05lx80nuSijCz7sc3a277R67g,0.0,3.1,,,nic apk
1469,1469,1285,2017-05-21 10:16:11,It's a very good app to learn JS,4,,A Google user,,,POSITIVE,4f94c0d4-47a6-40f4-8a07-e12b09b68365,https://play-lh.googleusercontent.com/EGemoI2NTXmTsBVtJqk8jxF9rh8ApRWfsIMQSt2uE4OcpQqbFu7f7NbTK05lx80nuSijCz7sc3a277R67g,0.0,3.1,,,good app learn js
1470,1470,1286,2017-05-18 04:06:34,Great and interactive,5,,A Google user,,,POSITIVE,66df5d68-b052-4f88-8100-1d8aecafb0b6,https://play-lh.googleusercontent.com/EGemoI2NTXmTsBVtJqk8jxF9rh8ApRWfsIMQSt2uE4OcpQqbFu7f7NbTK05lx80nuSijCz7sc3a277R67g,0.0,3.1,,,great interactive
1471,1471,1287,2017-05-17 18:53:34,Easy to follow,5,,A Google user,,,POSITIVE,0232687e-5553-41c5-9128-6bd0871ca2bd,https://play-lh.googleusercontent.com/EGemoI2NTXmTsBVtJqk8jxF9rh8ApRWfsIMQSt2uE4OcpQqbFu7f7NbTK05lx80nuSijCz7sc3a277R67g,0.0,3.1,,,easy follow
1472,1472,1288,2017-05-17 14:41:20,Great app,5,,A Google user,,,POSITIVE,279e623b-0b53-46c6-9ab9-2322712d45c0,https://play-lh.googleusercontent.com/EGemoI2NTXmTsBVtJqk8jxF9rh8ApRWfsIMQSt2uE4OcpQqbFu7f7NbTK05lx80nuSijCz7sc3a277R67g,0.0,,,,great app
1473,1473,1289,2017-05-17 05:33:33,The app is a perfect start for  programmers,4,,A Google user,,,POSITIVE,05d3cb27-d454-4fdf-981a-c67f9d7d2d71,https://play-lh.googleusercontent.com/EGemoI2NTXmTsBVtJqk8jxF9rh8ApRWfsIMQSt2uE4OcpQqbFu7f7NbTK05lx80nuSijCz7sc3a277R67g,0.0,3.1,,,app perfect start programmers
1474,1474,1290,2017-05-16 14:50:42,"Hello, tried this on my old phone, only one concern, as my cousin studies programming in college he advice me to study C++, C and Java. Javascript and HTML are used for making websites, unfortunately not for apps of any kind... I wanna learn programming to make my own app",4,,A Google user,,,NEGATIVE,0c132a68-64d7-45a8-b021-189c1115327b,https://play-lh.googleusercontent.com/EGemoI2NTXmTsBVtJqk8jxF9rh8ApRWfsIMQSt2uE4OcpQqbFu7f7NbTK05lx80nuSijCz7sc3a277R67g,0.0,3.1,,,hello tried old phone one concern cousin studies programming college advice study c c java javascript html used making websites unfortunately apps kind wanna learn programming make app
1475,1475,1291,2017-05-16 05:46:12,yes!  fantastic application. wow... complete Innovative idea,5,,A Google user,,,POSITIVE,6859c77c-3868-4836-9fea-057211f21954,https://play-lh.googleusercontent.com/EGemoI2NTXmTsBVtJqk8jxF9rh8ApRWfsIMQSt2uE4OcpQqbFu7f7NbTK05lx80nuSijCz7sc3a277R67g,0.0,,,,yes fantastic application wow complete innovative idea
1476,1476,1292,2017-05-15 16:49:51,Super helpful for a basic beginner such as myself!,5,,A Google user,,,POSITIVE,d6288f12-7ca4-4956-8bbe-65677dbf4f21,https://play-lh.googleusercontent.com/EGemoI2NTXmTsBVtJqk8jxF9rh8ApRWfsIMQSt2uE4OcpQqbFu7f7NbTK05lx80nuSijCz7sc3a277R67g,0.0,3.1,,,super helpful basic beginner
1477,1477,1293,2017-05-13 11:47:29,"The first and last app on Play Store for learning code. Pretty cheap pro teaching as it offer with html and css. Hope it will add for java, c++, ruby and more by adding 'buy package' on every type of course and download for every course package in app separately. For improvement, I hope that you'll add setting for backup progress. I really hope for it",5,,A Google user,,,POSITIVE,8c9050b0-ad8d-4f0e-a275-a4164371f026,https://play-lh.googleusercontent.com/EGemoI2NTXmTsBVtJqk8jxF9rh8ApRWfsIMQSt2uE4OcpQqbFu7f7NbTK05lx80nuSijCz7sc3a277R67g,0.0,,,,first last app play store learning code pretty cheap pro teaching offer html css hope add java c ruby adding buy package every type course download every course package app separately improvement hope youll add setting backup progress really hope
1478,1478,1294,2017-05-11 15:11:04,The lessons and the exercises are very helpful.,4,,A Google user,,,POSITIVE,b71828cc-aca0-48dc-8342-fb10c105a125,https://play-lh.googleusercontent.com/EGemoI2NTXmTsBVtJqk8jxF9rh8ApRWfsIMQSt2uE4OcpQqbFu7f7NbTK05lx80nuSijCz7sc3a277R67g,0.0,3.1,,,lessons exercises helpful
1479,1479,1295,2017-05-10 09:22:28,Awesome,5,,A Google user,,,POSITIVE,eaff8a3b-4d42-4643-8cbe-0f2401d54dd0,https://play-lh.googleusercontent.com/EGemoI2NTXmTsBVtJqk8jxF9rh8ApRWfsIMQSt2uE4OcpQqbFu7f7NbTK05lx80nuSijCz7sc3a277R67g,0.0,3.1,,,awesome
1480,1480,1296,2017-05-10 07:08:31,Awesome,5,,A Google user,,,POSITIVE,cd86de72-7080-4282-8769-2cd5527de70f,https://play-lh.googleusercontent.com/EGemoI2NTXmTsBVtJqk8jxF9rh8ApRWfsIMQSt2uE4OcpQqbFu7f7NbTK05lx80nuSijCz7sc3a277R67g,0.0,3.1,,,awesome
1481,1481,1297,2017-05-10 06:22:04,I learned a lot of things from it,5,,A Google user,,,POSITIVE,a1c63a76-2442-4d22-91a6-f191cb21fe75,https://play-lh.googleusercontent.com/EGemoI2NTXmTsBVtJqk8jxF9rh8ApRWfsIMQSt2uE4OcpQqbFu7f7NbTK05lx80nuSijCz7sc3a277R67g,0.0,3.1,,,learned lot things
1482,1482,1298,2017-05-09 17:13:47,"Easy to follow. Clear, great for beginners",4,,A Google user,,,POSITIVE,ff9e9716-d55e-4bd9-9765-1edc77b4d77b,https://play-lh.googleusercontent.com/EGemoI2NTXmTsBVtJqk8jxF9rh8ApRWfsIMQSt2uE4OcpQqbFu7f7NbTK05lx80nuSijCz7sc3a277R67g,0.0,3.1,,,easy follow clear great beginners
1483,1483,1299,2017-05-09 10:33:02,"Straight forward, easy to pick up, short, but informative lessons.",5,,A Google user,,,POSITIVE,918c3ae3-7898-4e77-a269-7454a01acf53,https://play-lh.googleusercontent.com/EGemoI2NTXmTsBVtJqk8jxF9rh8ApRWfsIMQSt2uE4OcpQqbFu7f7NbTK05lx80nuSijCz7sc3a277R67g,1.0,,,,straight forward easy pick short informative lessons
1484,1484,1300,2017-05-09 09:30:26,Easy to learn and very informative.,5,,A Google user,,,POSITIVE,b91e31c2-4708-40b4-b919-3578a137f430,https://play-lh.googleusercontent.com/EGemoI2NTXmTsBVtJqk8jxF9rh8ApRWfsIMQSt2uE4OcpQqbFu7f7NbTK05lx80nuSijCz7sc3a277R67g,1.0,3.1,,,easy learn informative
1485,1485,1301,2017-05-09 02:42:05,It's cool but de money is to much that all,5,,A Google user,,,NEGATIVE,a736a668-0a63-44df-89c6-62c1e35b1038,https://play-lh.googleusercontent.com/EGemoI2NTXmTsBVtJqk8jxF9rh8ApRWfsIMQSt2uE4OcpQqbFu7f7NbTK05lx80nuSijCz7sc3a277R67g,0.0,3.1,,,cool de money much
1486,1486,1302,2017-05-08 01:28:16,Really good for beginners. I learned the basics in like 45 mins,4,,A Google user,,,POSITIVE,54d780c3-a0f4-4121-9896-6df5c2e22f1c,https://play-lh.googleusercontent.com/EGemoI2NTXmTsBVtJqk8jxF9rh8ApRWfsIMQSt2uE4OcpQqbFu7f7NbTK05lx80nuSijCz7sc3a277R67g,0.0,3.1,,,really good beginners learned basics like 45 mins
1487,1487,1303,2017-05-07 13:49:35,It is simple yet rich for anyone to understand and follow.  Am enjoying every step,5,,A Google user,,,POSITIVE,8d8806fe-e925-4ec5-a149-721fc7690546,https://play-lh.googleusercontent.com/EGemoI2NTXmTsBVtJqk8jxF9rh8ApRWfsIMQSt2uE4OcpQqbFu7f7NbTK05lx80nuSijCz7sc3a277R67g,0.0,3.1,,,simple yet rich anyone understand follow enjoying every step
1488,1488,1304,2017-05-07 12:32:07,Very fun and easy way to learn.,5,,A Google user,,,POSITIVE,8bdcaa8c-37c0-480a-81c5-8829bcf413e8,https://play-lh.googleusercontent.com/EGemoI2NTXmTsBVtJqk8jxF9rh8ApRWfsIMQSt2uE4OcpQqbFu7f7NbTK05lx80nuSijCz7sc3a277R67g,0.0,3.1,,,fun easy way learn
1489,1489,1305,2017-05-07 08:21:07,Really great app.,5,,A Google user,,,POSITIVE,28895237-bee6-4093-94d5-45b691875307,https://play-lh.googleusercontent.com/EGemoI2NTXmTsBVtJqk8jxF9rh8ApRWfsIMQSt2uE4OcpQqbFu7f7NbTK05lx80nuSijCz7sc3a277R67g,0.0,3.1,,,really great app
1490,1490,1306,2017-05-07 02:44:23,Very helpful and easy to understand!,5,,A Google user,,,POSITIVE,b2ef6241-2392-48ca-8386-0a3bd86ad90f,https://play-lh.googleusercontent.com/EGemoI2NTXmTsBVtJqk8jxF9rh8ApRWfsIMQSt2uE4OcpQqbFu7f7NbTK05lx80nuSijCz7sc3a277R67g,0.0,3.1,,,helpful easy understand
1491,1491,1307,2017-05-06 21:54:18,Amazing usability. Keep it up. Finally an app i will continue to use,5,,A Google user,,,POSITIVE,2a2535a7-d49a-40c7-b929-6631159b9986,https://play-lh.googleusercontent.com/EGemoI2NTXmTsBVtJqk8jxF9rh8ApRWfsIMQSt2uE4OcpQqbFu7f7NbTK05lx80nuSijCz7sc3a277R67g,0.0,3.1,,,amazing usability keep finally app continue use
1492,1492,1308,2017-05-06 03:46:15,It's Awesome ! I Am Enjoying It . Good Work ✌✌,5,,A Google user,,,POSITIVE,f072b848-8c18-4d0e-9668-ea122e73e522,https://play-lh.googleusercontent.com/EGemoI2NTXmTsBVtJqk8jxF9rh8ApRWfsIMQSt2uE4OcpQqbFu7f7NbTK05lx80nuSijCz7sc3a277R67g,0.0,3.1,,,awesome enjoying good work
1493,1493,1309,2017-05-06 01:55:36,"THE Best platform to learn programming,trust me ,as a beginner,one would fall in love with it. 👌👌👌👌👌👌👍👍👍👍👍",5,,A Google user,,,POSITIVE,4e514ed8-57fc-474c-9c75-4e77c372bb86,https://play-lh.googleusercontent.com/EGemoI2NTXmTsBVtJqk8jxF9rh8ApRWfsIMQSt2uE4OcpQqbFu7f7NbTK05lx80nuSijCz7sc3a277R67g,0.0,,,,best platform learn programmingtrust beginnerone would fall love
1494,1494,1310,2017-05-05 00:00:03,Great,5,,A Google user,,,POSITIVE,e05eccbc-e669-4d61-adfe-04efd7a2d05f,https://play-lh.googleusercontent.com/EGemoI2NTXmTsBVtJqk8jxF9rh8ApRWfsIMQSt2uE4OcpQqbFu7f7NbTK05lx80nuSijCz7sc3a277R67g,0.0,3.1,,,great
1495,1495,1311,2017-05-03 18:30:27,awesome app,5,,A Google user,,,POSITIVE,b21b5268-a31f-42b6-b040-3f0078f2f40d,https://play-lh.googleusercontent.com/EGemoI2NTXmTsBVtJqk8jxF9rh8ApRWfsIMQSt2uE4OcpQqbFu7f7NbTK05lx80nuSijCz7sc3a277R67g,0.0,3.1,,,awesome app
1496,1496,1312,2017-05-02 13:32:03,Excellent app,5,,A Google user,,,POSITIVE,84dbb02a-51fd-4477-be9b-467fadada37b,https://play-lh.googleusercontent.com/EGemoI2NTXmTsBVtJqk8jxF9rh8ApRWfsIMQSt2uE4OcpQqbFu7f7NbTK05lx80nuSijCz7sc3a277R67g,0.0,3.0.1,,,excellent app
1497,1497,1313,2017-05-02 10:53:32,Awesome app,5,,A Google user,,,POSITIVE,2120f194-ae10-4e84-8d64-f333c4dcf9a3,https://play-lh.googleusercontent.com/EGemoI2NTXmTsBVtJqk8jxF9rh8ApRWfsIMQSt2uE4OcpQqbFu7f7NbTK05lx80nuSijCz7sc3a277R67g,0.0,3.1,,,awesome app
1498,1498,1314,2017-05-02 08:29:44,Easy to use!!,5,,A Google user,,,POSITIVE,46d7e543-72f3-44e9-b5f9-a4478c9d3e38,https://play-lh.googleusercontent.com/EGemoI2NTXmTsBVtJqk8jxF9rh8ApRWfsIMQSt2uE4OcpQqbFu7f7NbTK05lx80nuSijCz7sc3a277R67g,0.0,3.1,,,easy use
1499,1499,1315,2017-05-01 21:45:18,Great app for those who are interested in starting to learn java script physical text not children programming,5,,A Google user,,,POSITIVE,61243216-84bb-4188-9541-8d8c72887a36,https://play-lh.googleusercontent.com/EGemoI2NTXmTsBVtJqk8jxF9rh8ApRWfsIMQSt2uE4OcpQqbFu7f7NbTK05lx80nuSijCz7sc3a277R67g,0.0,3.1,,,great app interested starting learn java script physical text children programming
1500,1500,1316,2017-05-01 01:14:41,"It's Great and Cheap for its content, don't wait any longer  just buy it, it's worth more than 5$ so get it before the prices rise up.",5,,A Google user,,,POSITIVE,9220afec-297d-4cd9-86a7-1a6da3ab4ed7,https://play-lh.googleusercontent.com/EGemoI2NTXmTsBVtJqk8jxF9rh8ApRWfsIMQSt2uE4OcpQqbFu7f7NbTK05lx80nuSijCz7sc3a277R67g,0.0,3.1,,,great cheap content dont wait longer buy worth 5 get prices rise
1501,1501,1317,2017-04-30 09:16:44,I like  it can u guys make a website just to right lines of code,5,,A Google user,,,POSITIVE,443862c4-c8a1-4b2a-9042-4809a7f18756,https://play-lh.googleusercontent.com/EGemoI2NTXmTsBVtJqk8jxF9rh8ApRWfsIMQSt2uE4OcpQqbFu7f7NbTK05lx80nuSijCz7sc3a277R67g,0.0,3.1,,,like u guys make website right lines code
1502,1502,1318,2017-04-29 06:22:39,Best app,5,,A Google user,,,POSITIVE,73d52095-423a-44ca-ad3e-f1b1b3b17a5e,https://play-lh.googleusercontent.com/EGemoI2NTXmTsBVtJqk8jxF9rh8ApRWfsIMQSt2uE4OcpQqbFu7f7NbTK05lx80nuSijCz7sc3a277R67g,0.0,3.1,,,best app
1503,1503,1319,2017-04-29 01:21:25,Great so far.,5,,A Google user,,,POSITIVE,d81b99c4-0817-49ce-b45d-6b2806feb23c,https://play-lh.googleusercontent.com/EGemoI2NTXmTsBVtJqk8jxF9rh8ApRWfsIMQSt2uE4OcpQqbFu7f7NbTK05lx80nuSijCz7sc3a277R67g,0.0,3.1,,,great far
1504,1504,1320,2017-04-28 17:49:57,Its very self explained and simple! A very good app to learn coding.,5,,A Google user,,,POSITIVE,588078a1-1ec8-481c-a375-3e59dc384da9,https://play-lh.googleusercontent.com/EGemoI2NTXmTsBVtJqk8jxF9rh8ApRWfsIMQSt2uE4OcpQqbFu7f7NbTK05lx80nuSijCz7sc3a277R67g,0.0,3.1,,,self explained simple good app learn coding
1505,1505,1321,2017-04-28 13:19:24,Verry good indeed,5,,A Google user,,,POSITIVE,4db1b843-b4fc-4e40-9929-03e9f06468a5,https://play-lh.googleusercontent.com/EGemoI2NTXmTsBVtJqk8jxF9rh8ApRWfsIMQSt2uE4OcpQqbFu7f7NbTK05lx80nuSijCz7sc3a277R67g,0.0,3.1,,,verry good indeed
1506,1506,1322,2017-04-27 10:04:14,"It did not specify what language it was teaching. The description says it is POWERED by JavaScript  (which is both obsolete and just overall regarded as one of the worst languages in the coding community) and does not actually specify how to implement any of the code, how to run it, or again, what language. Does it need a compiler? Does it need an IDE? Does it run in a virtual machine like Java or on the hardware like C++? I have so many qustions, but there's nothing to indicate anything. Now, if it's all in the paid version, that's just low. Teach a person a language they can't use. Though, the Web section did save the app two stars. That was a lot more straight forward. Overall the UI looked good. But there's just so much missing that leaves the user who actually wants to use the language for something unsure of everything. They know a language, but not the name, or in what cases you should use it. Also, I feel ""this is a string. A string is letters in quotations"" is not the best way to teach. Maybe explain when it's used. I mean, I already know what a strong is because of my background in c++ and python and java, but people that are seeking a skill they have no experience with, they probably won't know a great deal. Yeah, you can amke a sentence without using ""char a = 'a';""",2,,A Google user,,,NEGATIVE,6ede8b1b-3567-4cbf-9d46-33c3d86028e8,https://play-lh.googleusercontent.com/EGemoI2NTXmTsBVtJqk8jxF9rh8ApRWfsIMQSt2uE4OcpQqbFu7f7NbTK05lx80nuSijCz7sc3a277R67g,0.0,,,,specify language teaching description says powered javascript obsolete overall regarded one worst languages coding community actually specify implement code run language need compiler need ide run virtual machine like java hardware like c many qustions theres nothing indicate anything paid version thats low teach person language cant use though web section save app two stars lot straight forward overall ui looked good theres much missing leaves user actually wants use language something unsure everything know language name cases use also feel string string letters quotations best way teach maybe explain used mean already know strong background c python java people seeking skill experience probably wont know great deal yeah amke sentence without using char
1507,1507,1323,2017-04-27 08:06:46,"I have only taken a couple of classes, but this clarifies coding for me, and helps me learn what I want, when I want.",5,,A Google user,,,POSITIVE,be66f7ed-5f8f-444c-a413-f74f274bce0d,https://play-lh.googleusercontent.com/EGemoI2NTXmTsBVtJqk8jxF9rh8ApRWfsIMQSt2uE4OcpQqbFu7f7NbTK05lx80nuSijCz7sc3a277R67g,0.0,3.1,,,taken couple classes clarifies coding helps learn want want
1508,1508,1324,2017-04-26 07:29:39,There are a variety of things you can learn on this app for future use and I needed this because I'm definitely doing coding in the near future,5,,A Google user,,,POSITIVE,68d0047a-ca58-40ec-beb1-ce6ff17cf379,https://play-lh.googleusercontent.com/EGemoI2NTXmTsBVtJqk8jxF9rh8ApRWfsIMQSt2uE4OcpQqbFu7f7NbTK05lx80nuSijCz7sc3a277R67g,0.0,3.1,,,variety things learn app future use needed im definitely coding near future
1509,1509,1325,2017-04-24 01:49:59,Useful,4,,A Google user,,,POSITIVE,1c11f84d-7068-4973-b77e-66d6fc003911,https://play-lh.googleusercontent.com/EGemoI2NTXmTsBVtJqk8jxF9rh8ApRWfsIMQSt2uE4OcpQqbFu7f7NbTK05lx80nuSijCz7sc3a277R67g,0.0,3.1,,,useful
1510,1510,1326,2017-04-23 10:30:32,Good... Interactive,4,,A Google user,,,POSITIVE,49db8cf8-2ead-4322-9c95-be49b0a97839,https://play-lh.googleusercontent.com/EGemoI2NTXmTsBVtJqk8jxF9rh8ApRWfsIMQSt2uE4OcpQqbFu7f7NbTK05lx80nuSijCz7sc3a277R67g,0.0,3.1,,,good interactive
1511,1511,1327,2017-04-23 01:39:53,Im a rooky and barely trying to learn...got it in first few tries,5,,A Google user,,,NEGATIVE,67aee0f7-a037-4bdc-83f8-8e1d2e441fc2,https://play-lh.googleusercontent.com/EGemoI2NTXmTsBVtJqk8jxF9rh8ApRWfsIMQSt2uE4OcpQqbFu7f7NbTK05lx80nuSijCz7sc3a277R67g,0.0,3.1,,,im rooky barely trying learngot first tries
1512,1512,1328,2017-04-22 14:29:32,BEST APP FOR COMPUTER LOVERS AND BEST CODE TEACHER,5,,A Google user,,,POSITIVE,ac0d1278-eebc-4094-8b42-8c3869c9a195,https://play-lh.googleusercontent.com/EGemoI2NTXmTsBVtJqk8jxF9rh8ApRWfsIMQSt2uE4OcpQqbFu7f7NbTK05lx80nuSijCz7sc3a277R67g,0.0,3.1,,,best app computer lovers best code teacher
1513,1513,1329,2017-04-22 10:04:30,A very best app to learn encoding,5,,A Google user,,,POSITIVE,c83f5bc8-4b9c-4a48-9350-b03db6b631d5,https://play-lh.googleusercontent.com/EGemoI2NTXmTsBVtJqk8jxF9rh8ApRWfsIMQSt2uE4OcpQqbFu7f7NbTK05lx80nuSijCz7sc3a277R67g,0.0,3.1,,,best app learn encoding
1514,1514,1330,2017-04-20 21:56:20,Its ok it just needs to tell us what your doing wrong like where to put the code,4,,A Google user,,,NEGATIVE,5b50db60-5791-4f75-b527-59da8878bcce,https://play-lh.googleusercontent.com/EGemoI2NTXmTsBVtJqk8jxF9rh8ApRWfsIMQSt2uE4OcpQqbFu7f7NbTK05lx80nuSijCz7sc3a277R67g,0.0,3.1,,,ok needs tell us wrong like put code
1515,1515,1331,2017-04-20 11:36:06,It's very good but it's not totally free😟😟 so students like me won't be able to learn all the stuff,4,,A Google user,,,POSITIVE,20b9e192-ef19-4082-8595-afd45ca25110,https://play-lh.googleusercontent.com/EGemoI2NTXmTsBVtJqk8jxF9rh8ApRWfsIMQSt2uE4OcpQqbFu7f7NbTK05lx80nuSijCz7sc3a277R67g,0.0,3.1,,,good totally free students like wont able learn stuff
1516,1516,1332,2017-04-20 08:57:34,Its very interactive which makes it seem easy,5,,A Google user,,,POSITIVE,f7963d48-59bc-4b74-b4cd-ff5f06982c66,https://play-lh.googleusercontent.com/EGemoI2NTXmTsBVtJqk8jxF9rh8ApRWfsIMQSt2uE4OcpQqbFu7f7NbTK05lx80nuSijCz7sc3a277R67g,0.0,3.1,,,interactive makes seem easy
1517,1517,1333,2017-04-19 18:22:25,Well it could be better if pro was also included as free. It is also very fun and easy . it explains the subject very precise and short,4,,A Google user,,,NEGATIVE,4964878e-3975-4970-bf1a-8fd73c385dfb,https://play-lh.googleusercontent.com/EGemoI2NTXmTsBVtJqk8jxF9rh8ApRWfsIMQSt2uE4OcpQqbFu7f7NbTK05lx80nuSijCz7sc3a277R67g,0.0,3.1,,,well could better pro also included free also fun easy explains subject precise short
1518,1518,1334,2017-04-19 17:00:34,Explanation of sintax is not enough educational.,3,,A Google user,,,NEGATIVE,5ad9fda4-4a0f-4602-a4a5-41ed36714bab,https://play-lh.googleusercontent.com/EGemoI2NTXmTsBVtJqk8jxF9rh8ApRWfsIMQSt2uE4OcpQqbFu7f7NbTK05lx80nuSijCz7sc3a277R67g,1.0,3.1,,,explanation sintax enough educational
1519,1519,1335,2017-04-19 10:31:51,"This is a pretty good coding app, let's hope this can help me on the future!",4,,A Google user,,,POSITIVE,c118cfe2-76c2-4298-a6da-5d355ecfc784,https://play-lh.googleusercontent.com/EGemoI2NTXmTsBVtJqk8jxF9rh8ApRWfsIMQSt2uE4OcpQqbFu7f7NbTK05lx80nuSijCz7sc3a277R67g,0.0,3.1,,,pretty good coding app lets hope help future
1520,1520,1336,2017-04-18 16:22:49,Woo,5,,A Google user,,,POSITIVE,ee9fa12b-b7e3-402b-9beb-71d1dddfac9c,https://play-lh.googleusercontent.com/EGemoI2NTXmTsBVtJqk8jxF9rh8ApRWfsIMQSt2uE4OcpQqbFu7f7NbTK05lx80nuSijCz7sc3a277R67g,0.0,3.1,,,woo
1521,1521,1337,2017-04-18 11:11:30,This app is great if you're trying to learn code if you have downtime at work or school.,5,,A Google user,,,POSITIVE,1cb7ef3b-e2a8-4103-8be3-87b73d332996,https://play-lh.googleusercontent.com/EGemoI2NTXmTsBVtJqk8jxF9rh8ApRWfsIMQSt2uE4OcpQqbFu7f7NbTK05lx80nuSijCz7sc3a277R67g,1.0,3.1,,,app great youre trying learn code downtime work school
1522,1522,1338,2017-04-18 09:01:22,Thanks to this app i know what's the coding about! Great!,5,,A Google user,,,POSITIVE,ef7c177c-a654-40f0-8f61-4b9f3bdc3ed3,https://play-lh.googleusercontent.com/EGemoI2NTXmTsBVtJqk8jxF9rh8ApRWfsIMQSt2uE4OcpQqbFu7f7NbTK05lx80nuSijCz7sc3a277R67g,0.0,3.1,,,thanks app know whats coding great
1523,1523,1339,2017-04-17 13:08:28,"I'm not gonna become a programmer soon, but it's a really good way to learn the basics.",5,,A Google user,,,POSITIVE,cf59c24f-3f55-4e92-9298-ebb7ab379844,https://play-lh.googleusercontent.com/EGemoI2NTXmTsBVtJqk8jxF9rh8ApRWfsIMQSt2uE4OcpQqbFu7f7NbTK05lx80nuSijCz7sc3a277R67g,0.0,3.1,,,im gonna become programmer soon really good way learn basics
1524,1524,1340,2017-04-13 10:35:05,It's extremely helpful and learning but costs money to get all of it.,4,,A Google user,,,NEGATIVE,d0e2e28c-b4d5-4f23-aa12-7fc66638784e,https://play-lh.googleusercontent.com/EGemoI2NTXmTsBVtJqk8jxF9rh8ApRWfsIMQSt2uE4OcpQqbFu7f7NbTK05lx80nuSijCz7sc3a277R67g,0.0,3.1,,,extremely helpful learning costs money get
1525,1525,1341,2017-04-13 06:50:43,Made coding as easy as pie!,5,,A Google user,,,POSITIVE,3e2305f6-342e-49e4-8ddb-b263d7f92a98,https://play-lh.googleusercontent.com/EGemoI2NTXmTsBVtJqk8jxF9rh8ApRWfsIMQSt2uE4OcpQqbFu7f7NbTK05lx80nuSijCz7sc3a277R67g,0.0,3.1,,,made coding easy pie
1526,1526,1342,2017-04-13 05:16:14,This app is amazing. It introduced me into the world of codding. I love it,5,,A Google user,,,POSITIVE,06be4185-3b37-43d8-a657-2ad7d8cecad3,https://play-lh.googleusercontent.com/EGemoI2NTXmTsBVtJqk8jxF9rh8ApRWfsIMQSt2uE4OcpQqbFu7f7NbTK05lx80nuSijCz7sc3a277R67g,1.0,3.1,,,app amazing introduced world codding love
1527,1527,1343,2017-04-12 22:51:48,AWESOME! BEST ONE EVER THATLT ISMT A UNIVERSITY BECUASE I AM 11!!,5,,A Google user,,,POSITIVE,16e6e486-a910-4265-a234-f0af198f2299,https://play-lh.googleusercontent.com/EGemoI2NTXmTsBVtJqk8jxF9rh8ApRWfsIMQSt2uE4OcpQqbFu7f7NbTK05lx80nuSijCz7sc3a277R67g,1.0,3.1,,,awesome best one ever thatlt ismt university becuase 11
1528,1528,1344,2017-04-11 20:31:41,Good teaches you how to code  well,5,,A Google user,,,POSITIVE,336a21eb-d605-4cda-a8fe-8ebaf29241e7,https://play-lh.googleusercontent.com/EGemoI2NTXmTsBVtJqk8jxF9rh8ApRWfsIMQSt2uE4OcpQqbFu7f7NbTK05lx80nuSijCz7sc3a277R67g,0.0,3.1,,,good teaches code well
1529,1529,1345,2017-04-11 12:19:14,"I love this app, simple and easy to use!",5,,A Google user,,,POSITIVE,da93d784-eadf-49f9-9ac9-874ce63c1bd2,https://play-lh.googleusercontent.com/EGemoI2NTXmTsBVtJqk8jxF9rh8ApRWfsIMQSt2uE4OcpQqbFu7f7NbTK05lx80nuSijCz7sc3a277R67g,0.0,3.1,,,love app simple easy use
1530,1530,1346,2017-04-11 10:26:34,Good,4,,A Google user,,,POSITIVE,ebe9e7a1-0509-49bd-9b31-dff39730263a,https://play-lh.googleusercontent.com/EGemoI2NTXmTsBVtJqk8jxF9rh8ApRWfsIMQSt2uE4OcpQqbFu7f7NbTK05lx80nuSijCz7sc3a277R67g,0.0,3.1,,,good
1531,1531,1347,2017-04-10 09:54:09,Its great and they give you really simple instructions! Thanks for making this I don't think I could find a better app thank you -Orange,5,,A Google user,,,POSITIVE,950642dd-fed3-4f3b-9a31-8337442bf8e7,https://play-lh.googleusercontent.com/EGemoI2NTXmTsBVtJqk8jxF9rh8ApRWfsIMQSt2uE4OcpQqbFu7f7NbTK05lx80nuSijCz7sc3a277R67g,31.0,3.1,,,great give really simple instructions thanks making dont think could find better app thank orange
1532,1532,1348,2017-04-10 05:31:43,Awesome app,5,,A Google user,,,POSITIVE,99aa2439-6afd-46cb-bccb-46d551d2d022,https://play-lh.googleusercontent.com/EGemoI2NTXmTsBVtJqk8jxF9rh8ApRWfsIMQSt2uE4OcpQqbFu7f7NbTK05lx80nuSijCz7sc3a277R67g,0.0,3.1,,,awesome app
1533,1533,1349,2017-04-09 13:26:46,Love it,5,,A Google user,,,POSITIVE,4310c135-6c96-4c06-ad4e-48da6838b2bb,https://play-lh.googleusercontent.com/EGemoI2NTXmTsBVtJqk8jxF9rh8ApRWfsIMQSt2uE4OcpQqbFu7f7NbTK05lx80nuSijCz7sc3a277R67g,0.0,3.1,,,love
1534,1534,1350,2017-04-08 14:25:17,"It's an excellent app. The programming course in my school was not very good so I tried this app and I love it. It makes learning cose quick, easy and surprisingly fun unlike my school's course which made it time consuming and boring.",5,,A Google user,,,POSITIVE,b6e788f2-1ba1-4be6-9f75-b7aa136a2cd4,https://play-lh.googleusercontent.com/EGemoI2NTXmTsBVtJqk8jxF9rh8ApRWfsIMQSt2uE4OcpQqbFu7f7NbTK05lx80nuSijCz7sc3a277R67g,42.0,3.1,,,excellent app programming course school good tried app love makes learning cose quick easy surprisingly fun unlike schools course made time consuming boring
