Unnamed: 0,date,review,rating,isEdited,title,userName,sentiment,standardizedReview,mentionedFeature,mentionedSynonyms
5,2018-12-26 05:19:18,"Just downloaded the app after signing up for the pro account Christmas Day 2018, actually. Love everything you guys are trying to do. However, the app doesn’t work, or not properly at least. Went into web developer section, finished the review cards, finished my first question in the practice section , clicked “next” and it wouldn’t filter to the next question. I backed out and tried again, same problem. Did that several times, to no avail. Now, I’m currently locked in the search window, I clicked the search icon at bottom of screen, and it wouldn’t let me out of that window. I’m guessing there’s a glitch that needs to be fixed. I have an up to date iPhone. Thank you.",5,False,Not working,Wardog2,NEGATIVE,downloaded app signing pro account christmas day 2018 actually love everything guys trying however app doesnt work properly least went web developer section finished review cards finished first question practice section clicked next wouldnt filter next question backed tried problem several times avail im currently locked search window clicked search icon bottom screen wouldnt let window im guessing theres glitch needs fixed date iphone thank,status quo sloth,account
6,2021-08-20 05:33:29,"I'd rather not write reviews here with app dev feedback. The app is good. You need to update the review cards to list the language referenced for review on the card. It seems to jump from html, to command, SQL, to javascript, or css with no context for someone that might not know what they are reviewing. They might log away cd into their brain for html which would be weird and a mess to sort out later for that person. Like the app, any good training offers multiple methods of learning and this is it. Glad i left my previous provider for codeacademy.",5,False,Please add a feedback section to the app.,cliffclof,NEGATIVE,id rather write reviews app dev feedback app good need update review cards list language referenced review card seems jump html command sql javascript css context someone might know reviewing might log away cd brain html would weird mess sort later person like app good training offers multiple methods learning glad left previous provider codeacademy,status quo sloth,person
18,2022-07-14 18:45:00,"I’ve heard good things about the computer version of this which I’ll at least give a shot but this app is utter nonsense. All of the classes throw you right to the wolves giving you flash cards the size of your tiny screen which an explanation that only someone that already knew the material would understand before giving you “practice” tests that barely fit within the bounds of the material they arbitrarily threw in front of you.

I personally tried the Command Prompt, Intro to Java and SQL courses and even as someone who knows a little more than a beginner in SQL, I couldn’t understand a thing it was trying to say.",1,False,Beginners stay away,Dnsowofiabwlapxujbensms,NEGATIVE,ive heard good things computer version ill least give shot app utter nonsense classes throw right wolves giving flash cards size tiny screen explanation someone already knew material would understand giving practice tests barely fit within bounds material arbitrarily threw front personally tried command prompt intro java sql courses even someone knows little beginner sql couldnt understand thing trying say,status quo sloth,person
25,2021-06-18 21:48:09,"In regards to the HTML review and practice:

The content repeats itself, in no particular order- there’s no progression or gradual knowledge building. You can’t see what you’re actually coding, and there seems to be many errors in the questions asked and the given answers to submit… many more issues and annoyances like the seemingly random colors added into texts, but I digress. 

This is definitely not an app for you, if you’re a beginner, trying to learn the basics.",2,False,There are much better apps for learning,MsContrarian,NEGATIVE,regards html review practice content repeats particular order theres progression gradual knowledge building cant see youre actually coding seems many errors questions asked given answers submit many issues annoyances like seemingly random colors added texts digress definitely app youre beginner trying learn basics,voting,content r
26,2019-06-21 14:44:24,"The app itself is a great learning tool to keep your mind sharp on subjects you already know, as far as trying to grasp new information it seems almost like reviewing flash cards. A. You learn something. But B. You see it over & over again. The material is very repetitive, i usually go under HTML & it’s nothing new nor difficult, if you can introduce more difficult problems or better questions. That would make it more challenging & engaging.",3,False,Concept is Good but.... The Material lacks.,Hihahajananakens,NEGATIVE,app great learning tool keep mind sharp subjects already know far trying grasp new information seems almost like reviewing flash cards learn something b see material repetitive usually go html nothing new difficult introduce difficult problems better questions would make challenging engaging,challenges,challeng
35,2020-12-17 14:41:39,"Running iOS 14.3.  App goes into an endless loop when trying to start a course. I’ve deleted it and reinstalled it. I log in with my pro account, select a course, which takes me to the ‘allow notifications’ screen, which I enable, click continue, which flashes to the next screen and then rolls me back to the ‘choose course’ screen putting me in an endless loop. App is totally useless. I hope they fix so I can give a proper review and change my star rating.",1,False,Great website but IOS app is 100% broken and doesn’t work,bitlifter,NEGATIVE,running ios 143 app goes endless loop trying start course ive deleted reinstalled log pro account select course takes allow notifications screen enable click continue flashes next screen rolls back choose course screen putting endless loop app totally useless hope fix give proper review change star rating,status quo sloth,account
41,2018-12-22 13:25:57,"When I first loaded this app, it worked perfectly. Then mysteriously, the practice sessions stopped working, after the first one the app freezes and will not respond to continue unless I reboot my phone When this is resolved, I will gladly update to 5 stars, best practice app for beginners I have found When compared to other forms of education , the pro account is a deal. iOS 12.1.2 on Iphone 6s",3,False,Practice sessions freeze,Nerdacouis,NEGATIVE,first loaded app worked perfectly mysteriously practice sessions stopped working first one app freezes respond continue unless reboot phone resolved gladly update 5 stars best practice app beginners found compared forms education pro account deal ios 1212 iphone 6s,status quo sloth,account
52,2020-09-28 01:55:29,"So, last Friday, I started my subscription at 7:30 PM central time. One week later, this Friday, I canceled my subscription at around 5:30 PM central time. I received an email saying that my trial had been ended and I will not be charged. Two hours later, around 7:30 PM central time, I received a $40 chargeAnd a notification saying I had been.I’m currently trying to work it out with customer support I will update my review if I am successful in getting my money back.",1,False,Charged me before seven days ended on free trial,Jack23456432,NEGATIVE,last friday started subscription 730 pm central time one week later friday canceled subscription around 530 pm central time received email saying trial ended charged two hours later around 730 pm central time received 40 chargeand notification saying beenim currently trying work customer support update review successful getting money back,status quo sloth,custom
54,2022-10-20 19:01:01,"I like the courses on it but it seems as if it has no correlation with the website at all other than using the same account. The web development course, for instance, is in a completely different order than on their website.",2,False,Seems like it’s completely separate than the website,Brightside92,NEGATIVE,like courses seems correlation website using account web development course instance completely different order website,status quo sloth,account
55,2022-12-05 16:25:01,"This is honestly so annoying! I want to access my own account in the app but you can’t because there’s no access to it! I am trying to sign up on the website using the same email I used for the app, but it’s making me a new account! I just want to have the same enrolled courses and progress that I have on the app!!! It’s irritating to have 2 different accounts on the website and app! BE BETTER PLEASE!!!!",1,False,PLEASE ADD ACCOUNT SETTINGS,CriticalSeagull,NEGATIVE,honestly annoying want access account app cant theres access trying sign website using email used app making new account want enrolled courses progress app irritating 2 different accounts website app better please,status quo sloth,account
61,2018-10-19 16:16:26,"I utilize the desktop site and think it’s a good service, and good way to learn coding. The difference with the app is you have to have a pro account for JavaScript practice and learning. This makes me want to practice on other coding learning apps",5,False,Pro,5e7en,POSITIVE,utilize desktop site think good service good way learn coding difference app pro account javascript practice learning makes want practice coding learning apps,status quo sloth,account
78,2020-04-12 15:09:27,"I got the app when I was on my free trial of pro, and now once the trial ended it’s still showing pro stuff, I’m also not using pro on my account anymore. Is there a way I can fix this?",4,False,"Works good, there is one little problem though",BestNumber_72,NEGATIVE,got app free trial pro trial ended still showing pro stuff im also using pro account anymore way fix,status quo sloth,account
81,2023-03-16 23:15:59,"In order to sign in, you have to sign up.
 In order to sign up, you have to sign in with either a Google account or a Facebook account. 
I am very much against both Facebook and Google and therefore I am not able to use this app at all. The requirement to sign in with either Facebook or Google is very limiting and restrictive.",1,False,Just A Vehicle For Facebook & Google,SoloDanceParty,NEGATIVE,order sign sign order sign sign either google account facebook account much facebook google therefore able use app requirement sign either facebook google limiting restrictive,status quo sloth,account
97,2019-06-10 17:22:04,"I couldn’t sign up with my iCloud email on the app, and then couldn’t login using the account I made via their mobile website. I played with it for 20 minutes and it’s a frustrating waste of time. The error messages simply state I am “unable to login at this time.” Stop making sleek, beautifully animated apps if users cannot even use your app.",1,False,Unable to Sign Up and Login,Kyder99,NEGATIVE,couldnt sign icloud email app couldnt login using account made via mobile website played 20 minutes frustrating waste time error messages simply state unable login time stop making sleek beautifully animated apps users cannot even use app,status quo sloth,account
122,2020-12-12 04:33:48,"I'm really enjoying learning Python with codecademy. The mix of lectures, hands on and coding challenges are great. I also like using the phone app to practice concepts.",5,False,Phone app is a great way to practice,davejet7,POSITIVE,im really enjoying learning python codecademy mix lectures hands coding challenges great also like using phone app practice concepts,challenges,challeng
139,2021-08-26 08:10:38,"I signed up to codeacademy with my LinkedIn account. However, there is no option to sign into it on the phone app and I cannot access my progress or work on my development.",2,False,Can’t login with LinkedIn account on the app,MyTurnBecauseMyNameIsMia,NEGATIVE,signed codeacademy linkedin account however option sign phone app cannot access progress work development,status quo sloth,account
142,2019-12-19 01:07:08,"If you created your account using a third party account(Facebook, LinkedIn, etc.) it does not process your login, and you are unable to set a password for your account via desktop. The website itself is good so far, this is purely a review of this app, which does not work for account holders like myself.",1,False,Login Issues,"Shackleford, Admiral Rusty",NEGATIVE,created account using third party accountfacebook linkedin etc process login unable set password account via desktop website good far purely review app work account holders like,status quo sloth,account
147,2021-03-05 21:36:32,"I’d expect an app from a company such as Codecademy to accommodate at least landscape mode, especially given the premium cost of being a member. You can have 1x iPhone or 2x iPhone in portrait only. iPads aren’t supported in the browser either.  

There are 2 years worth of viewable requests on Codecademy’s forums requesting iPad support and zero movement.",1,False,“Works on iPad” is a stretch,EOZ17gw,NEGATIVE,id expect app company codecademy accommodate least landscape mode especially given premium cost member 1x iphone 2x iphone portrait ipads arent supported browser either 2 years worth viewable requests codecademys forums requesting ipad support zero movement,boosters,special
148,2020-04-10 21:35:47,"Its an iPhone app they're trying to pass off for iPad i.e. it orients to vertical at all times. 

Can't login either. Can login using a browser but says I have the wrong pass word or wrong account. Logged out of my browser and back in no trouble after trying to use the app. Silliness.",1,False,"Despite being labeled as an iPad app, it isn't.",Camenzie,NEGATIVE,iphone app theyre trying pass ipad ie orients vertical times cant login either login using browser says wrong pass word wrong account logged browser back trouble trying use app silliness,status quo sloth,account
159,2019-06-04 05:55:06,Wanted to use the app but I couldn’t sign up. I don’t use Facebook or have an google account so I guess I’ll have to stick to using the website. So disappointing. Everyone doesn’t use Facebook or google. I should be able to just use my email that I have in order to use the app. Oh well.,1,False,No account,LuxeRose,NEGATIVE,wanted use app couldnt sign dont use facebook google account guess ill stick using website disappointing everyone doesnt use facebook google able use email order use app oh well,status quo sloth,account
180,2019-12-16 02:36:53,Good especially when you are not near a computer,5,False,Godsend to devs,sigma.dev,POSITIVE,good especially near computer,boosters,special
202,2020-12-08 08:08:40,Great interface and good content to refresh memory.,5,False,Amazing,kevvo1215,POSITIVE,great interface good content refresh memory,voting,content r
223,2021-10-15 22:43:29,In case you do not feel compelled to sign up using your social media account letting you know now before install this app is not for you.,1,False,Sign up attached to google or facebook,mynameisanymouse,NEGATIVE,case feel compelled sign using social media account letting know install app,status quo sloth,account
248,2020-10-10 15:21:47,Would sign up if I could use my regular email account but since the only two options available require linking either my Google or FB account I’m not going to.,1,False,Sign up constraints,Criostasis,NEGATIVE,would sign could use regular email account since two options available require linking either google fb account im going,status quo sloth,account
274,2019-04-19 17:20:33,I already have an account using Facebook but apparently it doesn’t let me sign in when I try to use the app with Facebook.,1,False,Can’t sign in,jdjejefnkwks,NEGATIVE,already account using facebook apparently doesnt let sign try use app facebook,status quo sloth,account
312,2020-08-25 20:54:18,Forcing to use Facebook or Google account to sign in!,1,False,No regular email registration option,أبوسما,NEGATIVE,forcing use facebook google account sign,status quo sloth,account
319,2020-09-28 15:00:50,"I’m using this to learn JavaScript, but I signed up with my Github account since I refuse to use Google or Facebook due to privacy.",1,False,GitHub login,Github stan,POSITIVE,im using learn javascript signed github account since refuse use google facebook due privacy,status quo sloth,account
328,2020-11-28 16:32:47,"Facebook login not working. So, I can’t access my pro account",1,False,Not working,General McGirt,NEGATIVE,facebook login working cant access pro account,status quo sloth,account
334,2019-11-20 01:38:18,I can not belive that there’s not an iPad version for this app. I expected better from Codecademy!,1,False,No iPad version?,Dschmunis1,NEGATIVE,belive theres ipad version app expected better codecademy,torture breaks,live
336,2020-10-13 15:13:13,why can’t i sign in with github on mobile? i don’t know how to get into my account otherwise. please add this functionality.,2,False,sign in,mav3rikc,NEGATIVE,cant sign github mobile dont know get account otherwise please add functionality,status quo sloth,account
355,2020-07-25 20:52:26,No sign in w/o google or fb account,1,False,No sign in w/o google or fb,Jay23E,NEGATIVE,sign wo google fb account,status quo sloth,account
380,2022-08-03 02:39:48,It’s a great on the go solution for learning to code with bite sexed challenges,5,False,Just what I was looking for,Mr..Dessert,POSITIVE,great go solution learning code bite sexed challenges,challenges,challeng
383,2022-04-12 01:03:43,"The platform is fantastic, the built in code editor takes the hassle out of setting up your dev environment in VScode/IDE while you’re just getting into programming. Their customer service is amazing as well. Any time I’ve had an issue they reply quickly and straight to the point. I started using Codecademy to prepare for a software development boot camp and I have to say, I was over prepared thanks to Codecademy. Their catalogue contains a WEALTH of knowledge, regardless of what discipline of software development you’re in. I recommend Codecademy to every person I meet who’s interested in programming or wants to brush up on their skills in the latest tech.
(p.s. The Pro membership is 100% worth it)",5,False,"Great platform, Great company",Shwag777,POSITIVE,platform fantastic built code editor takes hassle setting dev environment vscodeide youre getting programming customer service amazing well time ive issue reply quickly straight point started using codecademy prepare software development boot camp say prepared thanks codecademy catalogue contains wealth knowledge regardless discipline software development youre recommend codecademy every person meet whos interested programming wants brush skills latest tech ps pro membership 100 worth,status quo sloth,"person, custom"
389,2021-10-26 23:04:22,"I quote you guys “I mean pacifically those looking to learn any skills pertaining to the field software engineering and/or development a.k.a. “holding “which is a generalised vague summation of software development…I never understood the whole “learn to code” nonsense— because, “coding” in its broadest sense is nothing more than the execution of software…by that definition; anyone capable of running the following function in an IDE is a “coder”…

print(‘Hello world’)

Grats!

When I first began learning software development, resources were limited to books and websites with personal blogs…before smart phones, using Windows ‘99.

 I recently began ‘learning to code’ (I get some more accurate explanation would be remembering to code whilst learning about what’s changed in almost 15Y— i’ll admit it was a bit intimidating at first until I realise that just like always (at least when it comes to engineering/tech )Evolution is based in its simplest user friendly experience and so the UX/UI would be easy after a decade and a half of pivoting to finance for the 2nd half of my 20s. My goodness was I right.

I don’t know how to say this but python is a joke. In either case, I’ve returned to home my craft and I am blessed with a bittersweet life.

I grew up with crippling OCD/autism/ADHD and so the syntax and indentation that really bugs most developers was something I actually enjoy it and C++/CSS.

I am/was uniquely poised for this whole fintech/crypto revolution—Needless to say there were NOT many people that have an educational tantamount to an MBA in finance and Master’s computer science which is exactly what you need to fully understand fintech. I feel really stupid for paying 300 something bucks for annual subscription at DataCamp when FCC is more than enough in terms of educational resources in Data science/data analysis/machine learning/etc. 

From a former MIT grad: shout-out to the devs at FCC for expediting access to your personal resources, fundamentals and exercises. At this rate I should be up to speed by the end of the quarter! Thanks to ya’ll!

Respectfully,
-Ahmed T",5,False,You guys have no idea how lucky you have it…,Ahmad tarabichi,NEGATIVE,quote guys mean pacifically looking learn skills pertaining field software engineering andor development aka holding generalised vague summation software developmenti never understood whole learn code nonsense coding broadest sense nothing execution softwareby definition anyone capable running following function ide coder printhello world grats first began learning software development resources limited books websites personal blogsbefore smart phones using windows 99 recently began learning code get accurate explanation would remembering code whilst learning whats changed almost 15y ill admit bit intimidating first realise like always least comes engineeringtech evolution based simplest user friendly experience uxui would easy decade half pivoting finance 2nd half 20s goodness right dont know say python joke either case ive returned home craft blessed bittersweet life grew crippling ocdautismadhd syntax indentation really bugs developers something actually enjoy ccss amwas uniquely poised whole fintechcrypto revolutionneedless say many people educational tantamount mba finance masters computer science exactly need fully understand fintech feel really stupid paying 300 something bucks annual subscription datacamp fcc enough terms educational resources data sciencedata analysismachine learningetc former mit grad shoutout devs fcc expediting access personal resources fundamentals exercises rate speed end quarter thanks yall respectfully ahmed,status quo sloth,person
390,2022-02-06 17:08:20,I want a full refund on my purchase since they did not provide the service they offer. Bought the full subscription after initially liking the app but do not buy this app! Most of the courses they “offer” have content missing. Node.js missing! Really? AI stuff missing. Any advanced topic worth learning is missing. You shouldn’t offer a paid subscription if your content is not ready. Terrible! Never come across anything like this before.,1,False,Do not buy the app!,jimmycanfly247,NEGATIVE,want full refund purchase since provide service offer bought full subscription initially liking app buy app courses offer content missing nodejs missing really ai stuff missing advanced topic worth learning missing shouldnt offer paid subscription content ready terrible never come across anything like,voting,content r
426,2020-06-09 19:22:35,I tried to create account in the code academy app and I couldn’t sign up or even though I couldn’t sign in my google account. It said something wnt wrong. Can a technician support help me please?,5,False,Something went wrong,Watupgal,NEGATIVE,tried create account code academy app couldnt sign even though couldnt sign google account said something wnt wrong technician support help please,status quo sloth,account
428,2020-05-04 13:38:11,I used to be able to code back in my MySpace days 😉 but this just shows me how little I know about the behind the scenes in coding. I just started and I’m so excited to dive in. The app makes it super easy and I’m thrilled I get the chance to take this challenge on.,5,False,Awesome,Becster14,POSITIVE,used able code back myspace days shows little know behind scenes coding started im excited dive app makes super easy im thrilled get chance take challenge,challenges,challeng
447,2019-09-12 23:09:49,It’s definitely a challenge for a beginner with zero experience but I enjoyed learning concepts and testing them out. All while repeating the problems until you get it right. I look forward to learning more so it can all slow down and become more clear in translation and structure. 5 stars for this app and program!,5,False,Code academy app,wowzers1111,POSITIVE,definitely challenge beginner zero experience enjoyed learning concepts testing repeating problems get right look forward learning slow become clear translation structure 5 stars app program,challenges,challeng
464,2018-12-30 14:50:42,"Please look at alternatives to learning tech. This is a horrific company and it is nearly impossible to receive any competent support.  You have to wait several hours for a response to any website or program glitches. Fraudulent billing as they don’t deactivate your account as requested. Again, BEWARE!!!!!",1,False,BEWARE!!! BEWARE of Code Acadamy!!!,Chacha96486432668,NEGATIVE,please look alternatives learning tech horrific company nearly impossible receive competent support wait several hours response website program glitches fraudulent billing dont deactivate account requested beware,status quo sloth,account
