Unnamed: 0,date,review,rating,isEdited,userName,title,developerResponse,sentiment,standardizedReview,mentionedFeature,mentionedSynonyms
1356,2022-11-22 19:28:38,"Tl;dr at the bottom. 

The app so far is great– it's beginner friendly and very step by step, and you're able to look at solutions for practices when you're stumped. There are comment sections on the lessons where you can find helpful information from other users. 

My only problems would be that the ""challenge weapons"" (what code you can use for special challenges) do not include Kotlin, which is the main language I am learning. Many of the solutions for practices do not include what the lesson taught (for example, the Kotlin practice example for filtering arrays does not use that command, instead going for forEach.) They do work of course, but it isn't helpful to see what you did wrong in implementing what you learned. 

A minor problem is there is no way to contact support within the app itself. There is an email and a way to do it through the site, but I would appreciate there being one in the app as well. I haven't contacted support for this due to forgetting my login information (the main reason I would like support within the app) so take it with a grain of salt as there might be a solution, but I bought the annual pro subscription and have not been able to access some of the features promised– the main one being seeing past errors in your practices rather than having them being locked. 

Tl;dr: Good app with a helpful community. Most issues I have with it are relatively minor, and I would definitely still recommend it. So far I wouldn't count the pro subscription as worth it, but you do you.",4,False,WrathOfGaia,"Great app, would like some things to be added",,NEGATIVE,tldr bottom app far great beginner friendly step step youre able look solutions practices youre stumped comment sections lessons find helpful information users problems would challenge weapons code use special challenges include kotlin main language learning many solutions practices include lesson taught example kotlin practice example filtering arrays use command instead going foreach work course isnt helpful see wrong implementing learned minor problem way contact support within app email way site would appreciate one app well havent contacted support due forgetting login information main reason would like support within app take grain salt might solution bought annual pro subscription able access features promised main one seeing past errors practices rather locked tldr good app helpful community issues relatively minor would definitely still recommend far wouldnt count pro subscription worth,"challenges, boosters","challeng, special"
1361,2022-11-22 14:04:53,"Solo learn has no customer service number, and will not refund your money even if there’s a system error on their end. 
I have screenshots showing that my account had been cancelled before the terms and they sent me an email response saying they would not refund my money because I cancelled after the payment. 

Don’t recommend, unless you want to risk tanking 69.99 on a membership you might not end up using.",1,False,Topsylaye,Would not recommend.,"{'id': 33407408, 'body': 'Hello,\nThanks for your feedback! Unfortunately, there is a refund policy that we cannot disregard. In the meanwhile, make sure to unsubscribe from the Sololearn PRO subscription, to prevent future charges in our code learning app. For more details, please get back to us at info@sololearn.com.', 'modified': '2022-11-28T13:34:09Z'}",NEGATIVE,solo learn customer service number refund money even theres system error end screenshots showing account cancelled terms sent email response saying would refund money cancelled payment dont recommend unless want risk tanking 6999 membership might end using,status quo sloth,"custom, account"
1370,2022-09-13 21:57:38,I’ve enjoyed the app and got excited to code on the iPad. the issue is Sololearn doesn’t seem to have any customer service. I think I found a typo in one of the lessons and sent an email to see if it is the app or my lack of understanding. The other is I opted in for the monthly plan that is almost $6. I was charged a yearly plan this morning and I KNOW I didn’t want the yearly plan. This resulted my account going in the negative and fee on top of that. The only way to contact them is email and no phone number I can find works.,1,False,Blanketparty,Love the app but not the customer service,"{'id': 32099683, 'body': 'Hello! Thanks for your feedback! We are sorry for the inconvenience! Please send more detailed information to us at info@sololearn.com so that we can help resolve the issue. Looking forward to hearing from you!', 'modified': '2022-09-19T11:36:14Z'}",NEGATIVE,ive enjoyed app got excited code ipad issue sololearn doesnt seem customer service think found typo one lessons sent email see app lack understanding opted monthly plan almost 6 charged yearly plan morning know didnt want yearly plan resulted account going negative fee top way contact email phone number find works,status quo sloth,"custom, account"
1371,2022-08-15 03:38:34,"I understand that the pro membership provides benefits, but how often it is pushed in my face is annoying. I’d rather have an occasional ad than see the Pro pop up constantly. I am even unable to run the code examples in the lessons. With the difficult user interface in the code writing sections, I am starting regret downloading the app. There are a multitude of free coding resources available on the internet and I might have utilize them. The Pro membership has a lot of features that I am really not interested in for it to be interested in. I’m not interested in any of the leaderboard or following anyone on the app. Really just looking for a refresher on some coding languages I use to write.",1,False,Rinny Kagamine,The Pro membership pop up are a massive nuisance,"{'id': 31550157, 'body': 'Hey Rinny,\nThanks for your feedback.\nWe work tirelessly to improve our content, platform, and services by listening to and responding to members of our community. We value every piece of feedback we get and we love to hear ways to make Sololearn a better place for coders.\nYour suggestions have been forwarded to the Product team for consideration.', 'modified': '2022-08-19T09:13:42Z'}",NEGATIVE,understand pro membership provides benefits often pushed face annoying id rather occasional ad see pro pop constantly even unable run code examples lessons difficult user interface code writing sections starting regret downloading app multitude free coding resources available internet might utilize pro membership lot features really interested interested im interested leaderboard following anyone app really looking refresher coding languages use write,"leaderboard/competition, status quo sloth","leaderboard, leaderboard"
1372,2022-08-07 21:07:49,"This app is a great way to learn how to code especially
With the pro subscription",5,False,airplane720,Great app,,POSITIVE,app great way learn code especially pro subscription,boosters,special
1375,2022-07-30 20:41:20,"Used to use before it turned into Sololearn. It was great. Now paywalls in make it a terrible experience unless you’re willing to pay. Can’t run code more than a few times, can’t see hints or answers. That was just from trying for a few minutes. Shame.",2,False,kelogistics,Ruined by paywall,"{'id': 31231603, 'body': 'Hey,\nThanks for your feedback!\n\nPlease note that you can collect and spend your Bits on unlocking more advanced practice exercises and Hints/Answers.\n\nLet us know if you have any further questions at info@sololearn.com', 'modified': '2022-08-02T10:51:05Z'}",NEGATIVE,used use turned sololearn great paywalls make terrible experience unless youre willing pay cant run code times cant see hints answers trying minutes shame,torture breaks,paywal
1379,2022-06-25 21:04:43,"Pretty good app to learn. More challenging than your typical “learn to code” apps which actually helps you learn.

The daily streak is broken at 2 days tho. Pretty bad for a coding app to have broken code in it.",3,False,Dmahf14,Daily streak,"{'id': 30663507, 'body': 'Hello! Thanks for your feedback! We are sorry for the inconvenience! Please send more detailed information to us at info@sololearn.com so that we can help resolve the issue. Looking forward to hearing from you!\n', 'modified': '2022-07-01T11:10:13Z'}",NEGATIVE,pretty good app learn challenging typical learn code apps actually helps learn daily streak broken 2 days tho pretty bad coding app broken code,"daily streaks, challenges","daily streak, challeng"
1381,2022-06-24 18:48:45,"You cannot restart a course which is a huge problem because you cannot review easily. I could care less about the point system.

My experience is with the python course(s) for the most basic things, the explanations are sufficient, but In my opinion, they don’t know how to teach in general. I study some psychology and am good at turning around and teaching things I learn. Many times the questions are confusing or try to get you solve something that hasn’t been explained well at all OR they intentionally make it so challenging that you basically are forced to give up and look at what other people are saying or look at the answer. I don’t have a problem with the right level of challenge because you grow from it, but if challenges are consistently too difficult, humans tend to give up (when you train a dog or a human baby, it is the same. Btw, usually the dog isn’t the problem. It is the trainer. Telling a dog they are a stupid idiot does nothing to make the dog better). About 3/4 of the topics, people in the comments explained the topic better than the app does.. I recently started watching bro code on YouTube. Much better. I was going to use this as a back up resource to refresh my memory of certain topics from a different perspective, but it is too much trouble.",2,False,Fushigimigi,Frustrated,"{'id': 30663362, 'body': 'Hey,\nThanks for your feedback.\nWe work tirelessly to improve our content, platform, and services by listening to and responding to members of our community. We value every piece of feedback we get and we love to hear ways to make Sololearn a better place for coders.\nYour suggestions have been forwarded to the Product team for consideration.', 'modified': '2022-07-01T11:04:10Z'}",NEGATIVE,cannot restart course huge problem cannot review easily could care less point system experience python courses basic things explanations sufficient opinion dont know teach general study psychology good turning around teaching things learn many times questions confusing try get solve something hasnt explained well intentionally make challenging basically forced give look people saying look answer dont problem right level challenge grow challenges consistently difficult humans tend give train dog human baby btw usually dog isnt problem trainer telling dog stupid idiot nothing make dog better 34 topics people comments explained topic better app recently started watching bro code youtube much better going use back resource refresh memory certain topics different perspective much trouble,challenges,challeng
1396,2022-02-12 17:08:41,"I’ve wrote code by hacking apart programs that someone else already wrote - to make them do what I want.  This took considerable time and effort, as not understanding the basics had me searching the web or forums for answers to the most basic things - and even the ones who wanted to help, I couldn’t give context into what I was doing as I wasn’t the one who wrote the code to begin with.

I’ve tried learning from the roots, but everything out there was way too toddler style basic.  Even though I was a hack job of a programmer, I still had a good understanding of syntax.  When I found SoloLearn, and it’s community, I felt like I finally…FINALLY after all these years found a tool that teaches the basics but swiftly brings you up to intermediate and professional.  The coach challenges give great examples and practice as to how or why you would use what you just learned.  The community aspect is thriving and supports each individual lesson for those times you just can’t get it.  

SoloLearn is now a widget on my iOS Home Screen, it’s now the go to app whenever I have free time, and I absolutely love it.  Thank you so much.  Solo Pro was the best thing I ever did.  If you are a dreamer, looking for your own set of tools, this app will get you there - I promise.",5,False,tristanjsmith,For the Dreamers,,POSITIVE,ive wrote code hacking apart programs someone else already wrote make want took considerable time effort understanding basics searching web forums answers basic things even ones wanted help couldnt give context wasnt one wrote code begin ive tried learning roots everything way toddler style basic even though hack job programmer still good understanding syntax found sololearn community felt like finallyfinally years found tool teaches basics swiftly brings intermediate professional coach challenges give great examples practice would use learned community aspect thriving supports individual lesson times cant get sololearn widget ios home screen go app whenever free time absolutely love thank much solo pro best thing ever dreamer looking set tools app get promise,challenges,challeng
1402,2022-01-23 11:04:49,"It’s a great app that deserves a five-star rating. I’m very new to coding and it’s making learning super simple and fun. I’m blind and rely on a screen-reader to access everything. For the most part it works well for me. But some parts of the app, like code repo in lesson 3.2 of the HTML course does not work. I had a sighted person who does not use a screen-reader try out code repo and it didn’t work well for them either. So there are definitely some glitches, hence I took off a star. But it’s still my favorite app that’s helping me achieve a big goal quickly.",4,False,DotReader,"Great app, but accessibility is sketchy",,POSITIVE,great app deserves fivestar rating im new coding making learning super simple fun im blind rely screenreader access everything part works well parts app like code repo lesson 32 html course work sighted person use screenreader try code repo didnt work well either definitely glitches hence took star still favorite app thats helping achieve big goal quickly,status quo sloth,person
1405,2022-01-04 23:10:14,"The Free version of this app seemed great at first as it appeared that Pro meant access to more lessons. Unfortunately later you find out that the Code Playground is also only available in Pro after you get to use it for the first few lessons. This is where the visual learning and practice actually happens, which is pretty important because the reading portions don’t tell you everything and in some portions, you are left to infer information. 

Overall the app is very user friendly and well design but the paywall is limiting for those who don’t go Pro. I would prefer an ad-supported version with more features in Free or for them to just limit more lessons rather than take away the Code Playground. As it is, I uninstalled the app and will look for other options.",3,False,Secondbushome,Unfortunate that the Code Playground is behind pay wall,,NEGATIVE,free version app seemed great first appeared pro meant access lessons unfortunately later find code playground also available pro get use first lessons visual learning practice actually happens pretty important reading portions dont tell everything portions left infer information overall app user friendly well design paywall limiting dont go pro would prefer adsupported version features free limit lessons rather take away code playground uninstalled app look options,torture breaks,paywal
1409,2021-11-10 13:21:29,"You know how they give you free trials for a short period of time and you forget you even subscribed in the first place and now you’re $$$ less in your pocket? Well, letting that accident happen for me changed my direction in life.

I forgot about this $65 subscription (after tax) & after seeing it in my bank statement (but playing with the app for a couple days), i realized this was an investment, not a mistake. 

Sololearn has quickly grown to become one of my most used apps on my phone & it’s not because of the extensive library of courses, not because of the ability to create an account & save your progress, not because of the ability to add, train, and compete with your friends. It’s mostly due to the comment section feature that has been added to each section/page of each lesson! I love the extra little ‘tips’ everyone has & all the motivation they give each other. 

I’d say this app has made it to stardom in my eyes simply for the classroom aspect of it all. it sure makes it feel like i’m in a class setting, knowing that I can filter the comments by most recent if needed, having multiple Pro teachers within that comment section also helps in situations where you can’t understand the lesson. 

I never once wanted to code because of how complicated everything seemed, how expensive schools were, and how niche it felt. I can’t express enough how natural I feel learning how to program through an app! I would have never imagined. Now I’ve downloaded xCode, followed YouTube coders, and even made learning how to code with Sololearn, a priority. 

Overall, this $5/m purchase that occurred on my device was ultimately one of the best accidental decisions of my life - hands down. 

Try the 7-Day, but you won’t regret it if you pay for the yearly either!",5,False,cjmusto,Best Accident Ever!,,POSITIVE,know give free trials short period time forget even subscribed first place youre less pocket well letting accident happen changed direction life forgot 65 subscription tax seeing bank statement playing app couple days realized investment mistake sololearn quickly grown become one used apps phone extensive library courses ability create account save progress ability add train compete friends mostly due comment section feature added sectionpage lesson love extra little tips everyone motivation give id say app made stardom eyes simply classroom aspect sure makes feel like im class setting knowing filter comments recent needed multiple pro teachers within comment section also helps situations cant understand lesson never wanted code complicated everything seemed expensive schools niche felt cant express enough natural feel learning program app would never imagined ive downloaded xcode followed youtube coders even made learning code sololearn priority overall 5m purchase occurred device ultimately one best accidental decisions life hands try 7day wont regret pay yearly either,status quo sloth,account
1417,2021-09-25 11:32:28,"It’s a great way to learn to program, and has nearly all the functionality and customization of the web version.

My only issue is that the code writing is a little lackluster, even though a lot of the symbols are on a scrollbar. I really think the app could benefit from an in-app keyboard that had everything we need so we could use tabs and symbols without switching over to alternate keyboards constantly. It’s more than usable right now, but it could use some tuning up.",4,False,Kellen Klein,Everything I Need,,POSITIVE,great way learn program nearly functionality customization web version issue code writing little lackluster even though lot symbols scrollbar really think app could benefit inapp keyboard everything need could use tabs symbols without switching alternate keyboards constantly usable right could use tuning,status quo sloth,custom
1422,2021-08-29 00:11:08,"Some of the reviews say how great it is that it doesn’t block content behind a paywall, but those are 3 years old. The app works mostly alright, but it’s annoying how you have to pay to run your code. It’s be great if I could see what the code is doing",3,False,Slimey Turtles,You have to pay to access some of the app,,NEGATIVE,reviews say great doesnt block content behind paywall 3 years old app works mostly alright annoying pay run code great could see code,torture breaks,paywal
1423,2021-08-23 19:03:55,"I’m a Pro member here at Sololearn.com and so far I was enjoying the lessons and challenges! However, I’m starting to consider other free coding options because I keep encountering error pages everytime I try to post a question in the Q&A discussions forums.  The errors state that I have been blocked and unable to access sololearn.com and that I’m rate limited and banned temporarily from sololearn.com. Such errors only occur when I use the Desktop site, but not at all in the mobile app. If it wasn’t for these errors I’m experiencing I would actually rate the site a 5 star.",3,False,STANDARD_DEVIATION,Error Pages everytime I post question on Discuss section of Desktop Site,"{'id': 24755654, 'body': ' Hello! \r\nThanks for your feedback!\r\nPlease send more detailed information to us at info@sololearn.com so that we can help resolve the issue. \r\nLooking forward to hearing from you!\r\n', 'modified': '2021-08-27T10:19:17Z'}",NEGATIVE,im pro member sololearncom far enjoying lessons challenges however im starting consider free coding options keep encountering error pages everytime try post question qa discussions forums errors state blocked unable access sololearncom im rate limited banned temporarily sololearncom errors occur use desktop site mobile app wasnt errors im experiencing would actually rate site 5 star,challenges,challeng
1426,2021-08-02 17:08:39,"Great app overall. However, I enjoyed looking at my win to lose ratio on tracing code challenges. It would be great if this feature was brought back.",5,False,Nxnskajd,Wonder app but...,,POSITIVE,great app overall however enjoyed looking win lose ratio tracing code challenges would great feature brought back,challenges,challeng
1434,2021-07-08 19:04:58,If you have no actual experience in code this is not a proper learning tool. The practice questions have severely limited tutoring resources. The only option is to send a message and await a response that can take (and has taken) 24 hours to respond. The response usually is only half correct or the person is unable to understand the error. I paid for the pro and it has not been an easy experience learning JavaScript from them. If they can edit the app where practice problems can have comment boards instead and allow community answers to be available that could significantly help improve the user experience.,1,True,Jeshua Pence,Not made for beginners,"{'id': 23800157, 'body': 'Hello! \r\nThanks for your feedback!\r\nPlease send more detailed information to us at info@sololearn.com so that we can help resolve the issue. \r\nLooking forward to hearing from you!\r\n', 'modified': '2021-07-08T19:04:59Z'}",NEGATIVE,actual experience code proper learning tool practice questions severely limited tutoring resources option send message await response take taken 24 hours respond response usually half correct person unable understand error paid pro easy experience learning javascript edit app practice problems comment boards instead allow community answers available could significantly help improve user experience,status quo sloth,person
1436,2021-06-06 20:38:51,"Personally, I think it’s great. It deserves a five star review. How it’s being taught, the sleek menus, the variety of courses, it’s perfect. Well, to me, it would be very close to perfect. I have just a suggestion, and that is a course teaching you how to do Lua, another way to code.",5,False,timothydoan,An (Almost) Perfect Coding Learning App,,POSITIVE,personally think great deserves five star review taught sleek menus variety courses perfect well would close perfect suggestion course teaching lua another way code,status quo sloth,person
1442,2021-05-21 15:10:26,"Wanted the monthly PRO plan, was charged for the annual plan and it won’t even give me PRO services, still on the free account even after paying $70. Tried to contact SoloLearn, no answer. Will be learning to code elsewhere once I figure out how to get my money back. Super disappointing I was excited about coding with SoloLearn.",1,False,Jordan01120112,Doesn’t work,"{'id': 22995161, 'body': 'Hello! \r\nThanks for your feedback!\r\nPlease send more detailed information to us at info@sololearn.com so that we can help resolve the issue. \r\nLooking forward to hearing from you!\r\n', 'modified': '2021-05-25T08:13:17Z'}",NEGATIVE,wanted monthly pro plan charged annual plan wont even give pro services still free account even paying 70 tried contact sololearn answer learning code elsewhere figure get money back super disappointing excited coding sololearn,status quo sloth,account
1446,2021-04-24 11:10:30,"I paid $39.99 for a full year of sololear pro and after my account was charged I was still asked to upgrade for an additional $69.99. I reached out to customer service, but they never responded to the request I submitted. Terrible service.",1,True,Thechoedenkal,"Paid for pro, Didn't receive it.","{'id': 15006942, 'body': ""We are sorry for the inconvenience.\nSoloLearn's maintenance effort has been successfully completed and everything is now operating normally. We thank you for your patience. Please try again now.\r\nFor more information you can contact us via info@sololearn.com."", 'modified': '2021-04-24T11:10:31Z'}",NEGATIVE,paid 3999 full year sololear pro account charged still asked upgrade additional 6999 reached customer service never responded request submitted terrible service,status quo sloth,"custom, account"
