Unnamed: 0,date,review,rating,isEdited,userName,title,developerResponse,sentiment,standardizedReview,mentionedFeature,mentionedSynonyms
513,2022-05-02 10:38:45,I think the course progresses well with plenty of learner input. Coding challenges reinforce the learning. Well done.,5,False,MWH 7734,Excellent learning tool,,POSITIVE,think course progresses well plenty learner input coding challenges reinforce learning well done,challenges,challeng
530,2019-07-16 04:07:47,"This app is a joke. You can’t even sign up for an account. I’ve tried both, sign in with google and sign up methods. You always getting an error saying you should try again in a little bit. I waited an entire day to try again and still can’t sign in.
What an amazing app! Best one yet!",1,False,Cabery,Can’t even sign in.,"{'id': 9686825, 'body': 'Hi, please accept our apologies for any inconvenience caused. We are having technical difficulties and are working to resolve them ASAP. Thank you for your patience.', 'modified': '2019-07-16T11:56:49Z'}",NEGATIVE,app joke cant even sign account ive tried sign google sign methods always getting error saying try little bit waited entire day try still cant sign amazing app best one yet,status quo sloth,account
553,2018-10-04 00:42:17,Super informative and helpful! Especially when you’re in school and want to learn as much as you can!!!,5,False,Spc1208,Love this app!,,POSITIVE,super informative helpful especially youre school want learn much,boosters,special
575,2022-01-21 16:17:39,"If you get a call during a challenge, time doesn't stop and you lose.",4,False,полгатурновас,"Good app, but...",,NEGATIVE,get call challenge time doesnt stop lose,challenges,challeng
591,2018-10-03 07:28:42,Its pretty cool how you could challenge others on programming knowledge. Just a cool app overall. Definitely worthy of a download👍🏼,5,False,JohnGonz94,Fun for developers,,POSITIVE,pretty cool could challenge others programming knowledge cool app overall definitely worthy download,challenges,challeng
597,2020-11-25 02:58:17,"You can’t use if you don’t setup an account. They want you to sign in with google or facebook account.
You can create a new account.
After you do all that, then you have to pay to use. That is not in-app purchases, that is a subscription purchase and you have to buy it. Scam.",1,False,iPad-Fad,Scam,,NEGATIVE,cant use dont setup account want sign google facebook account create new account pay use inapp purchases subscription purchase buy scam,"torture breaks, status quo sloth","inapp purchas, account"
605,2018-01-11 15:07:41,I love the ability to challenge random people to test my knowledge. Sometimes simple tutorials just don’t do it. SoloLearn does it differently...,5,False,kdeems,Best coding App,,POSITIVE,love ability challenge random people test knowledge sometimes simple tutorials dont sololearn differently,challenges,challeng
610,2019-09-02 03:55:40,This app has helped me a lot with programming especially because I just got into programming,5,False,CreamyBeans,Really Informational!!,,POSITIVE,app helped lot programming especially got programming,boosters,special
640,2020-08-22 00:18:10,Super easy and convenient.. I can do it in between dash deliveries! Great way to pass the time as well.,5,False,Joshy0511,Great,,POSITIVE,super easy convenient dash deliveries great way pass time well,torture breaks,live
656,2018-05-25 22:53:47,"It is a really fun and good app!!!
I love challenging people to html, css, JavaScript, and Python challenges but IT IS SOOO FREAKING SLOW TO LOAD!!
Im only around 12 so I don’t pay for my own internet (of course), but my dad works from home via remote connection (Since his office is about 8 hours away)!
So my dads company pays for... 
wait for it...
GIGABIT INTERNET FOR OUR WHOLE FAMILY!!
And yet even with the super speed of GIGABIT it still takes about 5 minutes for the app to load!!",3,False,See This please,Good i guess...,,NEGATIVE,really fun good app love challenging people html css javascript python challenges sooo freaking slow load im around 12 dont pay internet course dad works home via remote connection since office 8 hours away dads company pays wait gigabit internet whole family yet even super speed gigabit still takes 5 minutes app load,challenges,challeng
658,2019-04-03 21:18:02,I love it! I never had anything that challenged my intelligence with extreme clarity. I’m very excited and tend to complete all task to gain additional knowledge regarding coding. Thanks!,5,False,Codegirl40,Coding,,POSITIVE,love never anything challenged intelligence extreme clarity im excited tend complete task gain additional knowledge regarding coding thanks,challenges,challeng
674,2018-08-16 22:02:15,I wanted to try this out considering the great reviews I saw but it’s saying it cannot create an account for me. I have it two stars because I couldn’t even get through the sign up process😞,2,False,Kimikikat1983,Could not create an account,"{'id': 4733270, 'body': ""We'd like to know more information about your issue, please contact us via info@sololearn.com and we will be happy to help you!"", 'modified': '2018-08-20T12:03:22Z'}",NEGATIVE,wanted try considering great reviews saw saying cannot create account two stars couldnt even get sign process,status quo sloth,account
681,2017-12-27 16:54:21,"This app is great for reviewing already learned material. A complete content rich course would still be preferred for learning from scratch. 
Fun and enticing GUI.",5,False,JDPizzaLvr,Recap,,POSITIVE,app great reviewing already learned material complete content rich course would still preferred learning scratch fun enticing gui,voting,content r
718,2018-08-20 03:04:16,There should be a difficulty setting for people who want more of a challenge.,3,False,King Cyrus III,Questions too easy,"{'id': 4795554, 'body': 'Hi,\n\nYou can choose who you want to challenge. For example if you want a difficult challenge, you can try playing with users who have more experience points and higher level.\nFor more information you can contact us via info@sololearn.com and we will be happy to assist!', 'modified': '2018-08-24T12:19:28Z'}",NEGATIVE,difficulty setting people want challenge,challenges,challeng
721,2020-07-09 11:51:34,"Excellent learning environment, lots of programming languages, active community, engaging short games for the busy person.",5,False,Cleon7177,Proper!,,POSITIVE,excellent learning environment lots programming languages active community engaging short games busy person,"strike habit/competition, status quo sloth","community engag, person"
763,2018-04-11 18:40:38,Challenges should tell you the correct answer not just that its wrong.,3,False,Huluappsucks,Need correct answers in challenges,"{'id': 3110520, 'body': 'Hi, \nThanks for your feedback. You can view the correct answers after the match, from the results page.', 'modified': '2018-04-12T07:24:09Z'}",NEGATIVE,challenges tell correct answer wrong,challenges,challeng
766,2022-04-29 19:25:51,"I wanted to subscribe to pro and I did. I checked my account and I was not counted as a subscriber. I then looked at my subscriptions and it said that I did subscribe ON APPLE, but then I decided to cancer the subscription and neither Sololearn or Apple refunded me. They stole my money.",1,False,KBSP YT,I got robbed,"{'id': 29548167, 'body': 'Hello,\nThanks for your feedback!\nIf you subscribed to Sololearn PRO using your Apple ID, refunds are handled by Apple, not Sololearn. If you wish to request a refund, please visit https://support.apple.com/en-us/HT204084\n\nHope this helps!', 'modified': '2022-05-04T08:39:27Z'}",NEGATIVE,wanted subscribe pro checked account counted subscriber looked subscriptions said subscribe apple decided cancer subscription neither sololearn apple refunded stole money,status quo sloth,account
770,2019-07-17 02:28:51,"I have tried multiple times to create an account but it just says “can’t right now try again later” 

Very disappointing since it has such great reviews. I guess I will never know",1,False,toria854,Won’t let me create an account,"{'id': 9808153, 'body': 'We are sorry for the inconvenience.\r\nThe reported issue has been resolved. Whenever you face any issue, please contact us via info@sololearn.com and we will help.', 'modified': '2019-07-23T14:44:06Z'}",NEGATIVE,tried multiple times create account says cant right try later disappointing since great reviews guess never know,status quo sloth,account
785,2020-04-27 02:46:00,I think personally it is a great app to learn coding. But the adds are extensive but I guess that’s how they money.,4,False,DallyP,So far so good but,,POSITIVE,think personally great app learn coding adds extensive guess thats money,status quo sloth,person
799,2019-04-21 00:30:03,We hope for the new version with chat facility as soon as possible as well as teaming challenges,3,False,Mike_0007,Chat,,POSITIVE,hope new version chat facility soon possible well teaming challenges,challenges,challeng
825,2019-12-27 07:50:38,This is app keeps crashing during quizzes/challenges. Terrible experience...,3,False,Dontusethisap,App keeps crashing during quizzes,"{'id': 12794172, 'body': 'We are sorry for the inconvenience.\r\nPlease let us know more information regarding your issue by contacting us via info@sololearn.com and we will help.', 'modified': '2020-01-08T12:14:03Z'}",NEGATIVE,app keeps crashing quizzeschallenges terrible experience,challenges,challeng
826,2018-03-14 16:14:54,"I love this app for what it delivers. Don't expect a do it yourself scenario, this app teaches, and helps you practice syntax.",5,False,Quelle03,Great app!!,,POSITIVE,love app delivers dont expect scenario app teaches helps practice syntax,torture breaks,live
832,2019-10-01 20:05:14,You don't know until you create an account that you have to make monthly payments to use the app. The devs are taking their app too seriously. You can easily learn this stuff for free online.,1,False,Cabe999,Hidden pay wall,"{'id': 11057352, 'body': ""We'd like to inform you that the entire content of SoloLearn is completely free! \r\nPRO offering enables advanced tools and provides uninterrupted ad-free access to learning. It is up to you to choose the preferred option of SoloLearn. For more information please contact us via info@sololearn.com"", 'modified': '2019-10-04T12:24:20Z'}",NEGATIVE,dont know create account make monthly payments use app devs taking app seriously easily learn stuff free online,status quo sloth,account
919,2019-07-17 02:10:20,I've tried everything but when I try to make an account it says it can't so I can't get into the dang app. I've already deleted and reinstalled etc.,1,False,nicolrenex,Can't make an account,"{'id': 9808162, 'body': 'We are sorry for the inconvenience.\r\nThe reported issue has been resolved. Whenever you face any issue, please contact us via info@sololearn.com and we will help.', 'modified': '2019-07-23T14:44:18Z'}",NEGATIVE,ive tried everything try make account says cant cant get dang app ive already deleted reinstalled etc,status quo sloth,account
974,2021-07-08 00:10:32,"I haven’t used this in years and don’t have a subscription. Out of nowhere, $48 was taken from my account ???",1,False,skfnejfosk,?,,NEGATIVE,havent used years dont subscription nowhere 48 taken account,status quo sloth,account
1007,2019-09-04 15:06:02,has just the right amount of information and is delivered exceptionally well.,5,False,annoyed2deth,wonderful,,POSITIVE,right amount information delivered exceptionally well,torture breaks,live
1076,2019-09-27 16:13:37,"It’s NOT free before Pro. It’s a trial that lasts for a whopping 3 days, in which you’ll be charged thereafter. (Any company or person that hides that information isn’t worth ANY payment.)",1,False,Jamesl41,Lie,"{'id': 10999554, 'body': ""We'd like to inform you that the entire content of SoloLearn is completely free! \r\nPRO offering enables advanced tools and provides uninterrupted ad-free access to learning. It is up to you to choose the preferred option of SoloLearn. For more information you can contact us via info@sololearn.com and we will help."", 'modified': '2019-10-01T13:16:39Z'}",NEGATIVE,free pro trial lasts whopping 3 days youll charged thereafter company person hides information isnt worth payment,status quo sloth,person
1106,2018-08-28 10:31:18,Really wanted to try but I couldn’t even sign up for an account. The SoloLearn HTML app also gives me an error upon startup. So disappointing.,1,False,Gamehouse Rulez,😓,"{'id': 4857581, 'body': 'Hi,\n\nPlease contact us via info@sololearn.com and we will be happy to help you.', 'modified': '2018-08-29T10:30:00Z'}",NEGATIVE,really wanted try couldnt even sign account sololearn html app also gives error upon startup disappointing,status quo sloth,account
1113,2021-04-09 22:23:23,"Not gonna dwell on praises, except to say that the app and the website are the best, and pro is worth it.

One day I downloaded this app and taught myself Python, and now I’m working in aerospace, coding in many languages including Python. This app has your bases covered. One day at work I suddenly had to learn C, and this app had it. Then I had to learn C++ and this app had it. Then Java, then web development, and this app had it. It even has tutorials for tools like git, and concepts like cryptography.

You won’t become a pro in any area with the app alone, but you’ll get the tools you need to make your ideas a reality.

A computer is like a free brain, you can use to think about and remember things you don’t feel like thinking about and remembering. A computer is not unlike having your own personal “Rain Man”... except this rain man does exactly what you tell him 100% of the time, even to your own demise, and he can telepathically communicate with other rain men.

With programming, you can automate any process, all the way down to the typing and clicking you do as a user (which is why you have to tell websites you’re not a robot). Find yourself in a loop of repeatedly clicking and dragging and typing? All in the same pattern? You can automate it. 

If something is boring and easy, you can automate it. Therefore, by definition, programming is always challenging. For me, it is a deeply satisfying challenge, which is why I made a career out of it. And this app has been a valuable resource.",5,False,Bobbybob32134282,Started my career,,POSITIVE,gonna dwell praises except say app website best pro worth one day downloaded app taught python im working aerospace coding many languages including python app bases covered one day work suddenly learn c app learn c app java web development app even tutorials tools like git concepts like cryptography wont become pro area app alone youll get tools need make ideas reality computer like free brain use think remember things dont feel like thinking remembering computer unlike personal rain man except rain man exactly tell 100 time even demise telepathically communicate rain men programming automate process way typing clicking user tell websites youre robot find loop repeatedly clicking dragging typing pattern automate something boring easy automate therefore definition programming always challenging deeply satisfying challenge made career app valuable resource,"challenges, status quo sloth","challeng, person"
1115,2019-07-16 11:59:23,I’ve tried for a day now to create an account but it won’t let me,1,False,mitch217,Won’t let me create an account :(,"{'id': 9808233, 'body': 'We are sorry for the inconvenience.\r\nThe reported issue has been resolved. Whenever you face any issue, please contact us via info@sololearn.com and we will help.', 'modified': '2019-07-23T14:47:00Z'}",NEGATIVE,ive tried day create account wont let,status quo sloth,account
1164,2020-09-05 16:06:48,"UPDATED REVIEW:
The developer seemed to have fixed whatever the ad issue was that I and several other reviewers pointed out. (Original review is below this one)

The only thing I find kind of odd is that the developer doesn’t actually publicly acknowledge the ad issue, just tells you to contact support. To what end? The issue is obvious?

Regardless of the obvious misstep by SoloLearn support in responding to reviews. As I stated in my original review, the app is quite good. I’ve used it a lot over the past several months and there’s a lot to like and it works fantastically as a means to support other more thorough learning methods (videos, books, mentors, etc.)

I definitely recommend the app as someone looking to add a mobile resource to their learning routine. 

My main suggestion to the developer is to give more time on the challenges and require the authors of the questions to add descriptions and explanations to help aid learning and not just offer competition. 

ORIGINAL REVIEW:
The newest update added a pretty awful feature. 

Ads that can’t be closed or skipped. You sit there looking at the ad thinking it’ll close in 30 seconds or so like every other free app... but no, you can sit there until the zombie apocalypse, it will never close. 

So now I get to force close the app every time I complete a section. 

All kidding aside...
I will 100% return and update this review to 5 stars when this unacceptable bug is fixed as the content and usability of the rest of the app is amazing.",4,True,Dr. Plati,Ads?!?,"{'id': 15186462, 'body': 'Hello! Thank you for your feedback. SoloLearn uses ads to keep the education free - so you will never be charged. If you upgrade your subscription to PRO, you will have an ad-free experience. However, it should not be like that, please contact us at info@sololearn.com. We will help you.', 'modified': '2020-09-05T16:06:48Z'}",NEGATIVE,updated review developer seemed fixed whatever ad issue several reviewers pointed original review one thing find kind odd developer doesnt actually publicly acknowledge ad issue tells contact support end issue obvious regardless obvious misstep sololearn support responding reviews stated original review app quite good ive used lot past several months theres lot like works fantastically means support thorough learning methods videos books mentors etc definitely recommend app someone looking add mobile resource learning routine main suggestion developer give time challenges require authors questions add descriptions explanations help aid learning offer competition original review newest update added pretty awful feature ads cant closed skipped sit looking ad thinking itll close 30 seconds like every free app sit zombie apocalypse never close get force close app every time complete section kidding aside 100 return update review 5 stars unacceptable bug fixed content usability rest app amazing,challenges,challeng
1167,2018-09-25 20:56:08,"This app won't let me make an account, don't bother downloading.",1,False,M1kethetiger,Not usable,"{'id': 5258702, 'body': 'Hi,\n\nPlease contact us via info@sololearn.com and we will be happy to help you.', 'modified': '2018-09-27T11:01:05Z'}",NEGATIVE,app wont let make account dont bother downloading,status quo sloth,account
1263,2018-09-23 04:31:20,Wont let me create a account,1,False,Aredstone_team,Ummm?!?,"{'id': 5199587, 'body': 'Hi, \n\nPlease contact us via info@sololearn.com and we will be happy to help you.', 'modified': '2018-09-24T12:19:22Z'}",NEGATIVE,wont let create account,status quo sloth,account
1348,2023-03-13 16:22:52,"1) Have no ability to add, let alone update my name. So my certificates are blank after completion.

2) No feedback tab available in-app to report issues.

3) Code languages are very error sensitive, yet there a lot of careless typos and mistakes in the lessons.

4) 3 hearts are insufficient for free users to be able to have a progressive learning experience, people are going to be tempted to look at the comments for solutions instead of actually learning when they have few chances to get them right. 

5) They aggressively push the pro feature on users — I understand supporting the app, but there also young learners who don’t have that kind of money to just shell out. I get the advert for pro at least twice every time I open the app.

The only reason I put two stars is because I have managed to learn a thing or two through my courses, and there aren’t a lot of C# courses. Otherwise I would slap one star. The community involvement is the only thing keeping it a float — there is a lot of room for improvement here. If Mimo had C# I wouldn’t be using this app.",2,False,sugarplum10001,Issues on issues,,NEGATIVE,1 ability add let alone update name certificates blank completion 2 feedback tab available inapp report issues 3 code languages error sensitive yet lot careless typos mistakes lessons 4 3 hearts insufficient free users able progressive learning experience people going tempted look comments solutions instead actually learning chances get right 5 aggressively push pro feature users understand supporting app also young learners dont kind money shell get advert pro least twice every time open app reason put two stars managed learn thing two courses arent lot c courses otherwise would slap one star community involvement thing keeping float lot room improvement mimo c wouldnt using app,social discovery,community involv
1354,2023-02-12 14:48:42,"This was one of the best coding apps I ever experienced it had no micro transactions no overexplotation of a points system and everything was simple. Initially you only needed bits for hints and the hints were always optional. Now this app is slow and has become everything that I hate. First there's the aesthetic that had no reason to change you didn't need a mascot I just wanted to code and many others did too. I think we were all fine with how the app initially was designed and liked it's simple aesthetic. I wouldn't have a problem with this change if it didn't make learning slower since each time you learn a lesson you have to see how many points you got. It wasn't this slow 2 years ago! And the hearts system is an exploitative system that doesn't make coding ""fun"" no quite the opposite it punishes newcomers for making natural mistakes! And in order to get more hearts you have to go ""Premium"" or already have a lot of bits as a long-time user who has come back with a new account this is a unfair and unoriginal system that only pushes both veterans and newcomers away from your app. So yes I've not come here to report a bug no I have a problem with how you run this app now. My message to you is just to reflect on why you made this app in the first place because it sure wasn't to make this mess.",1,False,Cut Ge 707,Used to be good,"{'id': 34972802, 'body': 'Hi,\r\nThanks for your feedback. Your suggestions have been forwarded to the appropriate team for consideration.\r\nWe work tirelessly to improve our content, platform, and services by listening to and responding to members of our community. We learn from every piece of feedback we get and we love to hear ways to make Sololearn a better academy for coders.', 'modified': '2023-02-20T14:19:39Z'}",NEGATIVE,one best coding apps ever experienced micro transactions overexplotation points system everything simple initially needed bits hints hints always optional app slow become everything hate first theres aesthetic reason change didnt need mascot wanted code many others think fine app initially designed liked simple aesthetic wouldnt problem change didnt make learning slower since time learn lesson see many points got wasnt slow 2 years ago hearts system exploitative system doesnt make coding fun quite opposite punishes newcomers making natural mistakes order get hearts go premium already lot bits longtime user come back new account unfair unoriginal system pushes veterans newcomers away app yes ive come report bug problem run app message reflect made app first place sure wasnt make mess,"points system, status quo sloth","points system, account"
1355,2023-01-17 13:30:49,"They have an introduction to Java course then code challenges for intermediate Java users so there’s a gap that made me have to stop paying for premium because there’s nothing I can do. If they either made code challenges with solutions that started at the introduction level OR if they made an intermediate Java course that could take me to the point of being able to do the code challenges, I couldn’t kept the premium subscription indefinitely to have practice and learn more.",4,False,NoooWaaaayJoooseee,Excellent app but not enough courses,"{'id': 34435010, 'body': 'Hello,\n\nThanks for reaching out!\n\nWe are sorry for the inconvenience. Could you please send more detailed information to us so that we can understand your issue better and try to resolve it? Currently, with Sololearn you can study the Intermediate Java course as well.\n\nLooking forward to hearing from you at info@sololearn.com\n', 'modified': '2023-01-23T11:57:01Z'}",NEGATIVE,introduction java course code challenges intermediate java users theres gap made stop paying premium theres nothing either made code challenges solutions started introduction level made intermediate java course could take point able code challenges couldnt kept premium subscription indefinitely practice learn,challenges,challeng
