Unnamed: 0,date,content,rating,isEdited,userName,title,developerResponse,sentiment,matched_stem
153,2021-10-30 23:57:20,"Used the app  at least twice a day for a few weeks and was really enjoying the experience. So much so that I decided to sign up for the Pro subscription. Unfortunately, I started the app one day and noticed all my progress had vanished. Disappointed but hopeful that the developer might solve this as it seems to be a common occurrence.",3,False,8bitGrayFox,Lost progress,"{'id': 26100064, 'body': 'Hello! Thanks for your feedback! We are sorry for the inconvenience! Please send more detailed information to us at info@sololearn.com so that we can help resolve the issue. Looking forward to hearing from you!\r\n', 'modified': '2021-11-05T13:13:52Z'}",NEGATIVE,"progress, point"
160,2019-10-11 18:34:52,"Great app for learning the fundamentals to many programming languages as well as a place to continue learning through head-to-head challenges and it’s coding playground which supports many languages. Top it with coding challenges, profile progression, and discussion boards. This app makes for an engaging way to SoloLearn.",5,False,Oscar H 92,Helped me learn Python,,POSITIVE,"challeng, progress"
173,2018-05-31 22:23:32,"They have exactly what is needed for a learning tool. Digestible content through progressive disclosure, quizzes, games and competition, but what is important for me is the community. You’re able to comment on content and ask questions. The only thing I would think to add is some pdf or document with the notes from the lessons.",4,False,oceanreigns,Great Learning Tool,,POSITIVE,"competit, progress"
181,2022-08-21 01:34:45,"Just coming back from a break from college and my coding skills were pretty rusty, this is just what I needed, you can blow through the basics in like an hour or less if all you need to do is jog your memory.",5,False,CrypticCrafts,Great to learn fresh or review!,,POSITIVE,break
185,2019-01-10 13:58:41,"The title says it all. Explanations are straight to the point, and lots of people add comments from lesson to lesson. 
Tip: check out the comments in every section, they include additional information and explanations.

Overall, I have had a good experience with the app.",5,False,Dasaed,Easy to test your programs and examples,,POSITIVE,point
192,2019-02-06 15:37:58,"I have been using the app for over three weeks, and I have complete 12 of the 13 courses and I have nearly finished JQuery. I have achieved 12th level with nearly 500 challenges in HTML. Unfortunately, older concepts in HTML and CSS accepted in 
HTML4 but deprecated in HTML5 or HTML5.2 are not uncommon in their challenge questions. I would not rely on SoloLearn alone in preparing a job in web development or app development.",3,False,mactechnic,"A good app in concept, but HTML CSS concepts are often outdated",,NEGATIVE,challeng
196,2020-12-02 15:20:07,"This app isn’t free. While it has great content and explains things well, you only get a few practice tokens. After that, if you don’t pay you can’t practice. So what’s the point of having the app? I can understand if you want to limit the number of practices per day if you’re going the free route. But to cut off practice completely unless you pay, don’t think so.",2,False,Klucas72,Not Free and you can’t practice unless you pay,,NEGATIVE,point
198,2019-01-25 12:22:56,The progression and method of teaching is easy and helpful. The best part of this tool is the community behind it. Every section of the lesson has a comments section where both novice and expert users interact. The knowledge of the experts shines here and helps assist the beginners. Fantastic learning tool.,5,False,ErrorlessStone,Great Learning Tool . . . Better Community,,POSITIVE,progress
207,2022-12-21 03:22:40,"I love this app. Very useful to learn. And the community is great

I would like to have the ability to reset progress to test my knowledge again. 

This is the only thing missing to make this 5 stars",5,False,Trunks0408,Great learning tool and very fun!,,POSITIVE,progress
222,2017-11-18 23:10:25,"Learned python on this, really good tutorial, discussion/comments on each topic. I keep doing challenges and plan to start learning Java or C++ with SoloLearn. For developers: please add quiz submission on iOS or web browser. I want to contribute (give back) but there is no option on the iPhone app rn",5,False,Je314159,"Love this app, Add Quiz Factory for iOS please","{'id': 1790828, 'body': 'Thanks for your feedback! The Quiz Factory is coming to iOS soon, so stay tuned!', 'modified': '2017-11-19T14:29:55Z'}",POSITIVE,challeng
229,2020-03-16 00:24:17,"It has been great until now. I’m in the java course, section conditionals and loops, within the section I am in the logical statements section (4/9), second question about the OR operator, after I insert my answer and hit check, the Check Button does not work. It is not checking it, what happens is my key board pops up instead and therefore cannot move to the next problem. So now I am kind of at a stand point..",1,False,giasanfilippo,Check Button not working in Java,"{'id': 14074799, 'body': 'We are sorry for the inconvenience.\nPlease contact us via info@sololearn.com and we will help.', 'modified': '2020-03-18T07:32:04Z'}",NEGATIVE,point
244,2018-09-12 18:15:30,"I have some programming experience but haven’t delved deeper into it. This program allows me to pick up new languages in my spare time. Great addition to the phone much better than wasting time social media or Instagram accounts.

Jeff Shumway",5,False,Jeffreygssssssssssssss,Great App for learning Python on the fly,,POSITIVE,social
247,2021-12-30 06:50:24,"I am very new to coding 100%. So far, the challenge’s have been fun and functional! I’ve been checking out other platforms and haven’t made the progress I am here .",5,False,Steve/Crew,Simple mind,,POSITIVE,"challeng, progress"
253,2019-07-09 20:37:20,"SoloLearn is a great app. I love it, specially because it is free. Tons of knowledge and a great reference tool. 

But I have one recommendation: make more and more complex questions, they are too easy!

Also I want to point out something negative you should watch out, always my phone overheats when this app is opened.",4,False,mrpeepe,Great App,,NEGATIVE,point
274,2019-08-28 13:10:54,"Uninstalled!

Reply to developer reply: Understood an account allows me to track progress, but what if I don’t care about that? You want me to give You something (my personal info) when you’ve given me Nothing in return first? Sorry, but the world doesn’t work that way. Let’s not forget who the buyer and seller is here. You are selling and IF I’m a buyer, I want to see the product BEFORE I invest in it.",1,False,OOffW,Account required to even look around!,"{'id': 10416643, 'body': ""Hi,\r\n\r\nWe've noticed that you have given SoloLearn a three star rating, however your written feedback was positive. If you are experiencing any issues with our app, please contact us via info@sololearn.com."", 'modified': '2019-08-29T12:07:34Z'}",NEGATIVE,progress
275,2019-03-14 02:02:09,"I am using Udemy to learn C# and saw a comment from the Udemy group mention the app. Now I use this app to learn C# on the go.

Instead of playing games, browsing reddit, or wasting my time on social media, I just spend it on this app to improve my skills. I love it!",5,False,TrueRican95,Highly Recomendable!!,,POSITIVE,social
294,2018-09-25 01:56:49,It has been thoroughly teaching me python to the point where I’m getting comfortable with the language and it didn’t cost me a cent. Worth every second of time I’ve spent on this app!,5,False,Jared Schneedle,More than what you expect from a free app,,POSITIVE,point
297,2017-11-21 21:27:50,"Absolute garbage. New update forces download of a new app introducing a ""feed"" to imitate Facebook. Will not allow you to continue from old app. I downloaded this to LEARN, not to pretend I'm on social media or be rewarded with meaningless ""achievements.""

Besides that, the app runs half as fast. This is an absolute garbage update, and if I had created this program, I'd be embarrassed by what it is now.

There's great ways to learn programming besides this. Look elsewhere if you're serious.",1,False,Sam118345,Trash,"{'id': 1819138, 'body': 'Hi, \nSorry to hear that. You can actually continue learning in this app for free. All the same features are supported, plus many additional learning features are available. \nPlease contact us via info@sololearn.com for additional information.', 'modified': '2017-11-22T08:59:36Z'}",NEGATIVE,social
309,2022-03-13 13:21:39,"I have not been able to access any free content. It looks like this offers a two week trial that requires payment info up front. It may be a great program for an affordable price, but if that’s true, just be honest about it instead of touting yourself as the “world’s largest collection of FREE programming courses.” Just sets people up for disappointment and makes you look dishonest.",1,False,jac@72,Not Free,"{'id': 28582098, 'body': ""Hello, we'd like to inform you that almost the entire content of Sololearn is completely free! The Sololearn premium subscription enables advanced tools and provides uninterrupted ad-free access to learning. It is up to you to choose the preferred option of Sololearn. For more information please contact us via info@sololearn.com"", 'modified': '2022-03-15T10:30:35Z'}",NEGATIVE,point
318,2021-02-19 14:18:23,"Horrible for learning syntax.  Regurgitate information to progress.  In the end, the information is there.

Edit: I’ve come to believe the lessons (especially HTML and CSS) are designed to show the user as many ads as possible.",3,False,OoRyan42oO,Read a Book,,NEGATIVE,progress
337,2022-01-12 23:23:30,"This used to be an amazing app. Easily the best one. Used to be able to learn and it was actually free. They’ve changed a lot. I guess it was only a matter of time, especially with how lucrative programming has become. Very disappointed. Finally just gave up and deleted the app.",2,False,TigerSoul613,Too many ads,,NEGATIVE,point
345,2022-08-07 01:27:14,"I am a pro user on iPhone and I just picked up the app today after a long break, and it turns out the sound toggle will not stay off. No matter what I do, the in-app sounds toggle switch will not stay off.",3,False,dburris554,Good but new bug is aggravating,"{'id': 31377539, 'body': 'Hello! Thanks for your feedback! We are sorry for the inconvenience! Please send more detailed information to us at info@sololearn.com so that we can help resolve the issue. Looking forward to hearing from you!', 'modified': '2022-08-10T05:15:55Z'}",NEGATIVE,break
364,2021-03-03 22:40:02,"I created an account, selected JavaScript, got the free trial, & start the course. I get to the first question which I answer correctly however there is no ability to progress forward available on my screen. Only gestures available are swipe back to start the course over again or swipe up to read comments. I am using an Apple iPad Air 1st Gen.",1,False,obbert42,Unable to go past question 1,"{'id': 21474326, 'body': 'We are sorry for the inconvenience, it should not be like that. Please contact us via info@sololearn.com and we will fix it.', 'modified': '2021-03-05T14:25:56Z'}",NEGATIVE,progress
365,2020-05-26 21:33:43,"Everything was great until ads stopped allowing me to finish a piece of work. In other words, after a challenge, a stupid loan ad would pop up, and their would be no action button for me to jump out of this. Instead I have to completely restart the application...",2,False,AerialDre.com,Ad issue,"{'id': 15777087, 'body': 'Hello,\nWe are sorry for the inconvenience.\nPlease let us know more information regarding your feedback, so we can understand it better and try to help. You can contact us at info@sololearn.com.', 'modified': '2020-06-04T13:01:09Z'}",NEGATIVE,challeng
368,2020-07-22 08:37:01,"Please fix the issue of it freezing (whenever i play a challenge and my network fluctuates, it freezes and won’t move to the next challenge) in that wise i loose that round even though i got the answer right 😑😑😑",3,False,Wf Da Kuz,Good app but a little issue,,NEGATIVE,challeng
373,2019-01-02 01:28:45,"Thanks for breaking down SQL so much with your generic examples, and your specific examples with clear formatting and key terms to help me really master the material! I feel so empowered and interested to keep learning more!",5,False,InspiredBrunette777,I’m Learning!,,POSITIVE,break
375,2022-05-24 22:10:53,"This app helped me a lot with my programming skills, the best thing about this app is the social option where you are free to talk about codes",5,False,LolWilly,Amazing!!!!!,,POSITIVE,social
395,2022-08-10 20:31:49,"Great way to learn before they adopted the stupid CandyCrush aspect of hearts. If you make 3 mistakes, a common thing for learning, you’ll need to wait for hours to be able to progress. Everything worth really using to learn, mistakes, a coding playground, etc. are behind a paywall. Save your time if you really want to learn on a free app and go elsewhere.",1,False,nickname648285,Was amazing before the paywall,"{'id': 31423521, 'body': 'Hey, Thanks for your feedback! Sololearn Hearts serve as a reminder for you to take your time, it is shown that shorter, more frequent learning sessions are more effective for students. Hearts refill every few hours, so you have a chance to get back to unlimited learning! You can refill your Hearts with Bits. For more details: info@sololearn.com', 'modified': '2022-08-12T08:27:15Z'}",NEGATIVE,progress
397,2021-05-06 02:58:46,"This used to be what I used to learn programming. But after I went to use it again after a large break, I got 4 different ads within 5min of using it with two of them being videos with sound. No thank you.",2,False,Ariuss3,"Used to be good, but ad-pocalypse",,NEGATIVE,break
401,2018-07-17 15:27:54,Very informative and enjoying the course and break down the basic before getting into intermediate level.,5,False,RickyRose99,Studying,,POSITIVE,break
408,2022-11-19 23:25:20,Overall it is a good app but i got the trial in september and cancelled it a day later. Two months later i found out my PayPal got blocked because i didn’t pay 52€. I’m really disappointed that something like this can happen in such a good app. i can’t afford to pay it back to paypal so i guess i won’t have paypal anymore.,1,False,Ferre Casteleyn,Trial wasn’t a trial,"{'id': 33281348, 'body': 'Hello,\nThanks for your feedback.\n\nPlease look through our FAQ: How can I cancel my PRO subscription\xa0and Refund Policy.\n\nFor more information, please contact us at info@sololearn.com', 'modified': '2022-11-21T13:23:47Z'}",NEGATIVE,point
415,2018-06-10 03:58:26,It is fun in this app because you can learn a lot. My favorite is the html and python lessons. You can socialize on this and help each other at the same time. I enjoyed this even though I’m still in level one. HOPE YOU’LL JOIN TO!!!!!!!!!!!!!!!!!!!!!!!!!!!!!!!!!!!!,4,False,fifapro7,App review,,POSITIVE,social
416,2017-12-04 08:00:52,"This app is very helpful to learn C++ as a pass time, or as an Engineering student like myself. It’s very user friendly, it gets straight to the point and it’s simple enough for any body to learn from!",5,False,Mechatronial,C++ On the go!,,POSITIVE,point
420,2017-11-19 16:34:51,"I really love how you guys combined all the apps into one!!  I don't have to have 5 different apps on my home screen anymore, and the socialization/functions on the new app are A+",5,False,CelicaFan420,Love it,,POSITIVE,social
426,2022-08-10 23:32:08,"I like when you complete a lesson it gives you a lot of points so when you run out of hearts by miss clicking on mistake you can always refill them for free, I don’t like the hearts though",3,False,robert cosola,The hearts,"{'id': 31423535, 'body': 'Hey Robert, Thanks for your feedback! Sololearn Hearts serve as a reminder for you to take your time, it is shown that shorter, more frequent learning sessions are more effective for students. Hearts refill every few hours, so you have a chance to get back to unlimited learning! You can refill your Hearts with Bits. For more details: info@sololearn.com', 'modified': '2022-08-12T08:27:54Z'}",NEGATIVE,point
513,2022-05-02 10:38:45,I think the course progresses well with plenty of learner input. Coding challenges reinforce the learning. Well done.,5,False,MWH 7734,Excellent learning tool,,POSITIVE,"challeng, progress"
518,2022-04-19 16:47:53,I’m a beginner and it breaks things down in to bites and pieces and I’m considering buying pro for a year at this point,5,False,Twizzzzzzzy,So far so good,,NEGATIVE,"point, break"
523,2018-02-20 04:46:02,As someone who uses a different programming language almost daily this is a very great way for keeping syntax and paradigms fresh in my mind.,5,False,jacobireview,Great for staying fresh...,,POSITIVE,parad
568,2018-07-20 22:23:33,"So far it’s pretty easy to
Navigate and understand the coding by breaking down each element",5,False,TBezzey,Like it,,POSITIVE,break
573,2023-03-08 13:19:10,Thanks for the recent updates. I am happy that I can do a lesson on my computer and the streak counts!,5,False,ChaiAndSquishy,Streak,"{'id': 35355379, 'body': 'Hello, Thanks for your feedback! We are happy to hear you had a positive experience at Sololearn! We value your input and encourage you to develop your programming skills. Happy coding!', 'modified': '2023-03-13T12:03:02Z'}",POSITIVE,streak
575,2022-01-21 16:17:39,"If you get a call during a challenge, time doesn't stop and you lose.",4,False,полгатурновас,"Good app, but...",,NEGATIVE,challeng
590,2019-01-05 00:59:48,"Using this app I have fallen in love with coding in Python 3. I thought I was not smart enough to learn coding languages, but I this app breaks it down and gives me confidence.",5,False,P. Lamar,Fallen in love with coding.,,POSITIVE,break
591,2018-10-03 07:28:42,Its pretty cool how you could challenge others on programming knowledge. Just a cool app overall. Definitely worthy of a download👍🏼,5,False,JohnGonz94,Fun for developers,,POSITIVE,challeng
605,2018-01-11 15:07:41,I love the ability to challenge random people to test my knowledge. Sometimes simple tutorials just don’t do it. SoloLearn does it differently...,5,False,kdeems,Best coding App,,POSITIVE,challeng
656,2018-05-25 22:53:47,"It is a really fun and good app!!!
I love challenging people to html, css, JavaScript, and Python challenges but IT IS SOOO FREAKING SLOW TO LOAD!!
Im only around 12 so I don’t pay for my own internet (of course), but my dad works from home via remote connection (Since his office is about 8 hours away)!
So my dads company pays for... 
wait for it...
GIGABIT INTERNET FOR OUR WHOLE FAMILY!!
And yet even with the super speed of GIGABIT it still takes about 5 minutes for the app to load!!",3,False,See This please,Good i guess...,,NEGATIVE,challeng
658,2019-04-03 21:18:02,I love it! I never had anything that challenged my intelligence with extreme clarity. I’m very excited and tend to complete all task to gain additional knowledge regarding coding. Thanks!,5,False,Codegirl40,Coding,,POSITIVE,challeng
704,2018-03-23 00:46:39,"Fluid app, I’m taking notes along with the questions, and progressing well to this point.",5,False,Mateomane,Fluid,,POSITIVE,"progress, point"
718,2018-08-20 03:04:16,There should be a difficulty setting for people who want more of a challenge.,3,False,King Cyrus III,Questions too easy,"{'id': 4795554, 'body': 'Hi,\n\nYou can choose who you want to challenge. For example if you want a difficult challenge, you can try playing with users who have more experience points and higher level.\nFor more information you can contact us via info@sololearn.com and we will be happy to assist!', 'modified': '2018-08-24T12:19:28Z'}",NEGATIVE,challeng
750,2018-03-09 00:50:16,I can not sing this services prayers enough! For a free app it has virtually no adds. Keep it up!,5,False,Gooser1q2,So Great,,NEGATIVE,virtual
765,2022-11-20 12:05:46,"Used to be really good & actually learned a lot from it. Now, too many caveats. No offline mood anymore. That’s a deal breaker for me & was 1 thing that set it apart really",2,False,Troublesomo,Went downhill,"{'id': 33407483, 'body': 'Hello,Thanks for your feedback.We work tirelessly to improve our content, platform, and services by listening to and responding to members of our community. We value every piece of feedback we get and we love to hear ways to make Sololearn a better place for starting to learn code.Your suggestion has been forwarded to the appropriate team for consideration.', 'modified': '2022-11-28T13:36:33Z'}",NEGATIVE,break
770,2019-07-17 02:28:51,"I have tried multiple times to create an account but it just says “can’t right now try again later” 

Very disappointing since it has such great reviews. I guess I will never know",1,False,toria854,Won’t let me create an account,"{'id': 9808153, 'body': 'We are sorry for the inconvenience.\r\nThe reported issue has been resolved. Whenever you face any issue, please contact us via info@sololearn.com and we will help.', 'modified': '2019-07-23T14:44:06Z'}",NEGATIVE,point
799,2019-04-21 00:30:03,We hope for the new version with chat facility as soon as possible as well as teaming challenges,3,False,Mike_0007,Chat,,POSITIVE,challeng
825,2019-12-27 07:50:38,This is app keeps crashing during quizzes/challenges. Terrible experience...,3,False,Dontusethisap,App keeps crashing during quizzes,"{'id': 12794172, 'body': 'We are sorry for the inconvenience.\r\nPlease let us know more information regarding your issue by contacting us via info@sololearn.com and we will help.', 'modified': '2020-01-08T12:14:03Z'}",NEGATIVE,challeng
838,2018-07-09 13:44:29,"A great refresher on each languages basics. Simple and to the point, just what I needed.",5,False,Anelagyrl,Excellent,,POSITIVE,point
856,2023-03-24 13:31:24,Every time you update the app i lose all of my progress! Where are my certificates and progress in current learning!?,1,False,brett_sss,Updates,,NEGATIVE,progress
909,2018-03-25 03:46:15,This app is a great starting point.,5,False,ddxxmmnniiqquuee,10/10,,POSITIVE,point
923,2020-09-14 00:30:07,This app is dead amazing 🤩kinda a social media for coders,5,False,Emmaaaaaaa3223,A social media for coders!!,,POSITIVE,social
975,2021-02-18 16:13:28,This app used to be amazing! Then it got money hungry not allowing practice or even slowing seeing the current lesson’s example! This is very disappointing I loved this app! 😢,2,False,ABillionMonkey,Money Hungry!,"{'id': 21474360, 'body': ""\r\nWe'd like to inform you that almost the entire content of SoloLearn is completely free! \r\nPRO offering enables advanced tools and provides uninterrupted ad-free access to learning. It is up to you to choose the preferred option of SoloLearn.\r\nYou can just close the PRO popup."", 'modified': '2021-03-05T14:28:38Z'}",NEGATIVE,point
1106,2018-08-28 10:31:18,Really wanted to try but I couldn’t even sign up for an account. The SoloLearn HTML app also gives me an error upon startup. So disappointing.,1,False,Gamehouse Rulez,😓,"{'id': 4857581, 'body': 'Hi,\n\nPlease contact us via info@sololearn.com and we will be happy to help you.', 'modified': '2018-08-29T10:30:00Z'}",NEGATIVE,point
1113,2021-04-09 22:23:23,"Not gonna dwell on praises, except to say that the app and the website are the best, and pro is worth it.

One day I downloaded this app and taught myself Python, and now I’m working in aerospace, coding in many languages including Python. This app has your bases covered. One day at work I suddenly had to learn C, and this app had it. Then I had to learn C++ and this app had it. Then Java, then web development, and this app had it. It even has tutorials for tools like git, and concepts like cryptography.

You won’t become a pro in any area with the app alone, but you’ll get the tools you need to make your ideas a reality.

A computer is like a free brain, you can use to think about and remember things you don’t feel like thinking about and remembering. A computer is not unlike having your own personal “Rain Man”... except this rain man does exactly what you tell him 100% of the time, even to your own demise, and he can telepathically communicate with other rain men.

With programming, you can automate any process, all the way down to the typing and clicking you do as a user (which is why you have to tell websites you’re not a robot). Find yourself in a loop of repeatedly clicking and dragging and typing? All in the same pattern? You can automate it. 

If something is boring and easy, you can automate it. Therefore, by definition, programming is always challenging. For me, it is a deeply satisfying challenge, which is why I made a career out of it. And this app has been a valuable resource.",5,False,Bobbybob32134282,Started my career,,POSITIVE,challeng
