Unnamed: 0,date,content,rating,isEdited,userName,title,developerResponse,sentiment,matched_stem
1164,2020-09-05 16:06:48,"UPDATED REVIEW:
The developer seemed to have fixed whatever the ad issue was that I and several other reviewers pointed out. (Original review is below this one)

The only thing I find kind of odd is that the developer doesn’t actually publicly acknowledge the ad issue, just tells you to contact support. To what end? The issue is obvious?

Regardless of the obvious misstep by SoloLearn support in responding to reviews. As I stated in my original review, the app is quite good. I’ve used it a lot over the past several months and there’s a lot to like and it works fantastically as a means to support other more thorough learning methods (videos, books, mentors, etc.)

I definitely recommend the app as someone looking to add a mobile resource to their learning routine. 

My main suggestion to the developer is to give more time on the challenges and require the authors of the questions to add descriptions and explanations to help aid learning and not just offer competition. 

ORIGINAL REVIEW:
The newest update added a pretty awful feature. 

Ads that can’t be closed or skipped. You sit there looking at the ad thinking it’ll close in 30 seconds or so like every other free app... but no, you can sit there until the zombie apocalypse, it will never close. 

So now I get to force close the app every time I complete a section. 

All kidding aside...
I will 100% return and update this review to 5 stars when this unacceptable bug is fixed as the content and usability of the rest of the app is amazing.",4,True,Dr. Plati,Ads?!?,"{'id': 15186462, 'body': 'Hello! Thank you for your feedback. SoloLearn uses ads to keep the education free - so you will never be charged. If you upgrade your subscription to PRO, you will have an ad-free experience. However, it should not be like that, please contact us at info@sololearn.com. We will help you.', 'modified': '2020-09-05T16:06:48Z'}",NEGATIVE,"competit, challeng, point"
1177,2022-11-07 18:51:19,"removed streaks for a brief period, which was the only thing keeping me around doing a lesson every day. now my streak is lost and gone.",2,False,JasonSoDisappointed,destroyed streaks,"{'id': 33065296, 'body': 'Hello, thanks for your feedback! We are sorry for the inconvenience. Please send more detailed information to us at info@sololearn.com so that we can help resolve the issue asap. Looking forward to hearing from you!', 'modified': '2022-11-09T12:18:02Z'}",POSITIVE,streak
1348,2023-03-13 16:22:52,"1) Have no ability to add, let alone update my name. So my certificates are blank after completion.

2) No feedback tab available in-app to report issues.

3) Code languages are very error sensitive, yet there a lot of careless typos and mistakes in the lessons.

4) 3 hearts are insufficient for free users to be able to have a progressive learning experience, people are going to be tempted to look at the comments for solutions instead of actually learning when they have few chances to get them right. 

5) They aggressively push the pro feature on users — I understand supporting the app, but there also young learners who don’t have that kind of money to just shell out. I get the advert for pro at least twice every time I open the app.

The only reason I put two stars is because I have managed to learn a thing or two through my courses, and there aren’t a lot of C# courses. Otherwise I would slap one star. The community involvement is the only thing keeping it a float — there is a lot of room for improvement here. If Mimo had C# I wouldn’t be using this app.",2,False,sugarplum10001,Issues on issues,,NEGATIVE,progress
1352,2023-02-02 03:49:45,"Fantastic app! Would highly recommend. I use this in small moments of downtime instead of social media. 

Easiest way to start learning how to code for FREE",5,False,Heidarpouredits15,Bite sized way to learn coding,,POSITIVE,social
1354,2023-02-12 14:48:42,"This was one of the best coding apps I ever experienced it had no micro transactions no overexplotation of a points system and everything was simple. Initially you only needed bits for hints and the hints were always optional. Now this app is slow and has become everything that I hate. First there's the aesthetic that had no reason to change you didn't need a mascot I just wanted to code and many others did too. I think we were all fine with how the app initially was designed and liked it's simple aesthetic. I wouldn't have a problem with this change if it didn't make learning slower since each time you learn a lesson you have to see how many points you got. It wasn't this slow 2 years ago! And the hearts system is an exploitative system that doesn't make coding ""fun"" no quite the opposite it punishes newcomers for making natural mistakes! And in order to get more hearts you have to go ""Premium"" or already have a lot of bits as a long-time user who has come back with a new account this is a unfair and unoriginal system that only pushes both veterans and newcomers away from your app. So yes I've not come here to report a bug no I have a problem with how you run this app now. My message to you is just to reflect on why you made this app in the first place because it sure wasn't to make this mess.",1,False,Cut Ge 707,Used to be good,"{'id': 34972802, 'body': 'Hi,\r\nThanks for your feedback. Your suggestions have been forwarded to the appropriate team for consideration.\r\nWe work tirelessly to improve our content, platform, and services by listening to and responding to members of our community. We learn from every piece of feedback we get and we love to hear ways to make Sololearn a better academy for coders.', 'modified': '2023-02-20T14:19:39Z'}",NEGATIVE,point
1355,2023-01-17 13:30:49,"They have an introduction to Java course then code challenges for intermediate Java users so there’s a gap that made me have to stop paying for premium because there’s nothing I can do. If they either made code challenges with solutions that started at the introduction level OR if they made an intermediate Java course that could take me to the point of being able to do the code challenges, I couldn’t kept the premium subscription indefinitely to have practice and learn more.",4,False,NoooWaaaayJoooseee,Excellent app but not enough courses,"{'id': 34435010, 'body': 'Hello,\n\nThanks for reaching out!\n\nWe are sorry for the inconvenience. Could you please send more detailed information to us so that we can understand your issue better and try to resolve it? Currently, with Sololearn you can study the Intermediate Java course as well.\n\nLooking forward to hearing from you at info@sololearn.com\n', 'modified': '2023-01-23T11:57:01Z'}",NEGATIVE,"challeng, point"
1356,2022-11-22 19:28:38,"Tl;dr at the bottom. 

The app so far is great– it's beginner friendly and very step by step, and you're able to look at solutions for practices when you're stumped. There are comment sections on the lessons where you can find helpful information from other users. 

My only problems would be that the ""challenge weapons"" (what code you can use for special challenges) do not include Kotlin, which is the main language I am learning. Many of the solutions for practices do not include what the lesson taught (for example, the Kotlin practice example for filtering arrays does not use that command, instead going for forEach.) They do work of course, but it isn't helpful to see what you did wrong in implementing what you learned. 

A minor problem is there is no way to contact support within the app itself. There is an email and a way to do it through the site, but I would appreciate there being one in the app as well. I haven't contacted support for this due to forgetting my login information (the main reason I would like support within the app) so take it with a grain of salt as there might be a solution, but I bought the annual pro subscription and have not been able to access some of the features promised– the main one being seeing past errors in your practices rather than having them being locked. 

Tl;dr: Good app with a helpful community. Most issues I have with it are relatively minor, and I would definitely still recommend it. So far I wouldn't count the pro subscription as worth it, but you do you.",4,False,WrathOfGaia,"Great app, would like some things to be added",,NEGATIVE,challeng
1369,2022-10-04 16:32:58,"My wife is a data engineer and has been wanting me to learn a little bit about what she does, so I tried a couple of different options. This so far has been the best one. The information is concise and there is practice throughout each lesson. However, there is some information that I’ve learned from my wife and the book she used to learn python that contradicts the way they are teaching me, which is fine. There’s more than one way to get to answer, however she did say that as I progress these little differences will cause problems. Either way, I’ve been having a lot of fun learning what she does.

Additionally, I learn by having a lot of practice to implement what I’ve learned. I subscribed to the pro version because I was under the impression that I would have unlimited practice. However, that is not the case. I’ve completed over 20 lessons and the only practice I’ve had is the the built in code coach near the end of each lesson. I’ve yet to have an option for additional practice with new questions. This is a huge bummer for me and I will likely cancel my subscription because of it and just use the free version.",3,False,BlackSmithToo,Disappointed in Pro Version,"{'id': 32485044, 'body': 'Hey, Thanks for your feedback. We work tirelessly to improve our content, platform, and services by listening to and responding to members of our community. We value every piece of feedback we get and we love to hear ways to make Sololearn a better place for coders. Your suggestions have been forwarded to the Product team for consideration.', 'modified': '2022-10-10T13:12:43Z'}",NEGATIVE,progress
1371,2022-08-15 03:38:34,"I understand that the pro membership provides benefits, but how often it is pushed in my face is annoying. I’d rather have an occasional ad than see the Pro pop up constantly. I am even unable to run the code examples in the lessons. With the difficult user interface in the code writing sections, I am starting regret downloading the app. There are a multitude of free coding resources available on the internet and I might have utilize them. The Pro membership has a lot of features that I am really not interested in for it to be interested in. I’m not interested in any of the leaderboard or following anyone on the app. Really just looking for a refresher on some coding languages I use to write.",1,False,Rinny Kagamine,The Pro membership pop up are a massive nuisance,"{'id': 31550157, 'body': 'Hey Rinny,\nThanks for your feedback.\nWe work tirelessly to improve our content, platform, and services by listening to and responding to members of our community. We value every piece of feedback we get and we love to hear ways to make Sololearn a better place for coders.\nYour suggestions have been forwarded to the Product team for consideration.', 'modified': '2022-08-19T09:13:42Z'}",NEGATIVE,leaderboard
1379,2022-06-25 21:04:43,"Pretty good app to learn. More challenging than your typical “learn to code” apps which actually helps you learn.

The daily streak is broken at 2 days tho. Pretty bad for a coding app to have broken code in it.",3,False,Dmahf14,Daily streak,"{'id': 30663507, 'body': 'Hello! Thanks for your feedback! We are sorry for the inconvenience! Please send more detailed information to us at info@sololearn.com so that we can help resolve the issue. Looking forward to hearing from you!\n', 'modified': '2022-07-01T11:10:13Z'}",NEGATIVE,"streak, challeng"
1381,2022-06-24 18:48:45,"You cannot restart a course which is a huge problem because you cannot review easily. I could care less about the point system.

My experience is with the python course(s) for the most basic things, the explanations are sufficient, but In my opinion, they don’t know how to teach in general. I study some psychology and am good at turning around and teaching things I learn. Many times the questions are confusing or try to get you solve something that hasn’t been explained well at all OR they intentionally make it so challenging that you basically are forced to give up and look at what other people are saying or look at the answer. I don’t have a problem with the right level of challenge because you grow from it, but if challenges are consistently too difficult, humans tend to give up (when you train a dog or a human baby, it is the same. Btw, usually the dog isn’t the problem. It is the trainer. Telling a dog they are a stupid idiot does nothing to make the dog better). About 3/4 of the topics, people in the comments explained the topic better than the app does.. I recently started watching bro code on YouTube. Much better. I was going to use this as a back up resource to refresh my memory of certain topics from a different perspective, but it is too much trouble.",2,False,Fushigimigi,Frustrated,"{'id': 30663362, 'body': 'Hey,\nThanks for your feedback.\nWe work tirelessly to improve our content, platform, and services by listening to and responding to members of our community. We value every piece of feedback we get and we love to hear ways to make Sololearn a better place for coders.\nYour suggestions have been forwarded to the Product team for consideration.', 'modified': '2022-07-01T11:04:10Z'}",NEGATIVE,"challeng, point"
1386,2022-06-01 06:22:05,I keep seeing “undefined” in the code boxes of the Machine Learning course and am a bit disappointed that I have to figure out what’s going on via context clues.. if y’all want more details to fix said bug feel free to reach out to me,3,False,JT McD,Hey really great app just wanted to say,"{'id': 30143481, 'body': 'Hello! Thanks for your feedback! We are sorry for the inconvenience! Please send more detailed information to us at info@sololearn.com so that we can help resolve the issue. Looking forward to hearing from you!', 'modified': '2022-06-03T11:45:21Z'}",NEGATIVE,point
1396,2022-02-12 17:08:41,"I’ve wrote code by hacking apart programs that someone else already wrote - to make them do what I want.  This took considerable time and effort, as not understanding the basics had me searching the web or forums for answers to the most basic things - and even the ones who wanted to help, I couldn’t give context into what I was doing as I wasn’t the one who wrote the code to begin with.

I’ve tried learning from the roots, but everything out there was way too toddler style basic.  Even though I was a hack job of a programmer, I still had a good understanding of syntax.  When I found SoloLearn, and it’s community, I felt like I finally…FINALLY after all these years found a tool that teaches the basics but swiftly brings you up to intermediate and professional.  The coach challenges give great examples and practice as to how or why you would use what you just learned.  The community aspect is thriving and supports each individual lesson for those times you just can’t get it.  

SoloLearn is now a widget on my iOS Home Screen, it’s now the go to app whenever I have free time, and I absolutely love it.  Thank you so much.  Solo Pro was the best thing I ever did.  If you are a dreamer, looking for your own set of tools, this app will get you there - I promise.",5,False,tristanjsmith,For the Dreamers,,POSITIVE,challeng
1409,2021-11-10 13:21:29,"You know how they give you free trials for a short period of time and you forget you even subscribed in the first place and now you’re $$$ less in your pocket? Well, letting that accident happen for me changed my direction in life.

I forgot about this $65 subscription (after tax) & after seeing it in my bank statement (but playing with the app for a couple days), i realized this was an investment, not a mistake. 

Sololearn has quickly grown to become one of my most used apps on my phone & it’s not because of the extensive library of courses, not because of the ability to create an account & save your progress, not because of the ability to add, train, and compete with your friends. It’s mostly due to the comment section feature that has been added to each section/page of each lesson! I love the extra little ‘tips’ everyone has & all the motivation they give each other. 

I’d say this app has made it to stardom in my eyes simply for the classroom aspect of it all. it sure makes it feel like i’m in a class setting, knowing that I can filter the comments by most recent if needed, having multiple Pro teachers within that comment section also helps in situations where you can’t understand the lesson. 

I never once wanted to code because of how complicated everything seemed, how expensive schools were, and how niche it felt. I can’t express enough how natural I feel learning how to program through an app! I would have never imagined. Now I’ve downloaded xCode, followed YouTube coders, and even made learning how to code with Sololearn, a priority. 

Overall, this $5/m purchase that occurred on my device was ultimately one of the best accidental decisions of my life - hands down. 

Try the 7-Day, but you won’t regret it if you pay for the yearly either!",5,False,cjmusto,Best Accident Ever!,,POSITIVE,progress
1410,2021-11-30 18:47:16,"This is a good app to learn coding, but as always, there is room for improvement. 

As part of the pros, you get to learn at your own pace (without the annoyance of running out of hearts to continue). In addition to that, there’s a whole learning community that you can ask for help in the comments section. It feels like a classroom group chat where people send how to reach the desired code and at times the actual code itself (can be considered a con if you intend to reach all solutions without giveaways). 

But as for the cons, it’s worth noting that an advertisement promoting SoloLearnPro continuously shows when reaching the Variables section (which is the third unit in Python Introductory course). This inhibits users abilities to further their knowledge of coding as learning to code requires hands on execution as well as Trial and Error. So by forcing the advertisement on users, the knowledge gained from that point moving forward is reading and occasional practice. It takes away from the example mentioned in the reading sections. For visual learners, it acts as a severe hindrance since it’s hard to retain an ample amount of words about coding rather seeing it in action. Also, a tutorial on how to return to the course learning section would be a nice touch. After reading the community posts and comments, it’s easy to get lost in it all. 

TL;DR 
So in other words, it’s like a written lecture where your college professor skims past each supplementary example slide that is supposed to accompany the lesson notes. Either you retain it or you don’t. There’s no examples shown after a certain point. Hence can be described as coursework or worksheet based learning. I hope to see the advert removed. Then, and only then can I rate this app five stars.

Edit: Upon scrolling through the comments and responses from the developers, I noticed something rather contradictory. The developers response to one reviewer says “that the entire content of SoloLearn is completely free” but in the app, a feature that was once free isn’t any longer after surpassing a certain point (From my experience it was Section 3: Python Variables.) This is extremely misleading and should be addressed.  Thanks again for reading!",3,False,JoyfulJones,Experience Based Learning Must be Prioritized to Fully Learn,,NEGATIVE,point
1412,2021-11-09 16:27:26,"I’m planning on going to college for a CS Degree and I have friend who is going to be coaching me before I go to college to help get me in the mindset of programming. I was able to pick up some of the vocabulary in the language of Java through this app which is great. It teaches you how to code in a broken language kind of way, but it has problems when it comes to execution. 
	Too often do I put in the right inputs and it does not register them correctly to lead me to believe I did not put in the right inputs. This creates a feedback loop of questioning “Am I actually learning?” Even when I decide to run the examples of THEIR CODE that I’m supposed to be following just to see what it outputs it returns an error. This happens so often that I decided to show my friend.
	My friend has come to the conclusion that this app is good for teaching the fundamental idea of what questions to ask during coding, but not actually implementing any kind of learning ability; which is crucial to the world of code.
	If I may speak on behalf of my own cognitive learning it has not done a good job teaching either. The goal of teaching is to break down something in a pure form so that the layman can understand it. This app does not do so.",2,False,RonCott,Fundamentally Flawed,"{'id': 26235506, 'body': 'Hello! Thanks for your feedback! We are sorry for the inconvenience! Please send more detailed information to us at info@sololearn.com so that we can help resolve the issue. Looking forward to hearing from you!', 'modified': '2021-11-12T14:02:56Z'}",NEGATIVE,break
1420,2021-08-29 14:10:27,So far I have started on python and I am progressing fast because Sololearn is very helpful. I have tried another code learning app called Mino but Sololearn is much easy to use and I think there premium service is cheaper also.,5,False,Naches rider,Extremely Easy to Learn,,POSITIVE,progress
1423,2021-08-23 19:03:55,"I’m a Pro member here at Sololearn.com and so far I was enjoying the lessons and challenges! However, I’m starting to consider other free coding options because I keep encountering error pages everytime I try to post a question in the Q&A discussions forums.  The errors state that I have been blocked and unable to access sololearn.com and that I’m rate limited and banned temporarily from sololearn.com. Such errors only occur when I use the Desktop site, but not at all in the mobile app. If it wasn’t for these errors I’m experiencing I would actually rate the site a 5 star.",3,False,STANDARD_DEVIATION,Error Pages everytime I post question on Discuss section of Desktop Site,"{'id': 24755654, 'body': ' Hello! \r\nThanks for your feedback!\r\nPlease send more detailed information to us at info@sololearn.com so that we can help resolve the issue. \r\nLooking forward to hearing from you!\r\n', 'modified': '2021-08-27T10:19:17Z'}",NEGATIVE,challeng
1426,2021-08-02 17:08:39,"Great app overall. However, I enjoyed looking at my win to lose ratio on tracing code challenges. It would be great if this feature was brought back.",5,False,Nxnskajd,Wonder app but...,,POSITIVE,challeng
1438,2021-05-31 00:53:19,I’m completely new to writing code and I like how they break things down and the exercises are fun to work though definitely worth the $70 for a year of pro,5,False,AntMink,First day using it,,POSITIVE,break
1440,2021-05-20 05:38:58,"The lessons can feel a little rushed and brief for someone who is new to coding, but the community aspect is awesome. If the lesson doesn’t explain something to the point where you understand it, someone in the comments or one of the mods will. There’s an option to get help with your code too, where you can submit your try at something and a pro will help explain what you did wrong, why it’s not working and how to fix it. Overall I’m pleased.",5,False,FartNugget56,I like it,,POSITIVE,point
1442,2021-05-21 15:10:26,"Wanted the monthly PRO plan, was charged for the annual plan and it won’t even give me PRO services, still on the free account even after paying $70. Tried to contact SoloLearn, no answer. Will be learning to code elsewhere once I figure out how to get my money back. Super disappointing I was excited about coding with SoloLearn.",1,False,Jordan01120112,Doesn’t work,"{'id': 22995161, 'body': 'Hello! \r\nThanks for your feedback!\r\nPlease send more detailed information to us at info@sololearn.com so that we can help resolve the issue. \r\nLooking forward to hearing from you!\r\n', 'modified': '2021-05-25T08:13:17Z'}",NEGATIVE,point
