Unnamed: 0,date,content,rating,isEdited,userName,title,developerResponse,sentiment,matched_stem
0,2019-03-18 06:00:27,"I’ve been wanting to get into programming a little so i downloaded a few similar apps and ran thru a few of their modules.  Within maybe 10-15 minutes, I would exhaust their free content and would be pressed to upgrade to a pro account to learn any more. I thought about doing it for one of the apps even though the language i was looking for (C#) wasnt available yet.  Then I found this app and my search is over!  It does have a pro version like the rest, but it doesnt appear to hold back content from non pro members.  It also has waaaaay more content to dive into compared to the others.  I love that in addition to the learning/ module side, there is also a challenge mode that turns a tough subject into a game.  Then SoloLearn takes it a step further and lets users share codes they’ve been working on INSIDE THE APP and you can run them on your phone to check out how they work.  This is awesome and is going to keep me hooked for a while!",5,False,The Level: Up,"Tried a few, this is the one!",,POSITIVE,challeng
5,2021-08-20 19:21:28,"I tried 4 other program training before this and just didn’t understand and was too much to take in because they were telling me multiple different ways of doing the same task and what not to do and stuff like that. I find for me it is easier to learn what not to do by experience not by memory. Also this app lets you do challenges against other players and has more examples than any other app or program I have found before this. I would recommend this to any professional or beginner alike to keep learning or refresh your memory. Also they have a wide variety of supported languages, even ones that aren’t used very often, and a LARGE community of friendly users to help with any of the questions you may have. You can also do challenges with other players to test your knowledge of your language.",5,False,Zman32746915,Tried 4 others before this. This application is best.,,POSITIVE,challeng
8,2020-10-24 04:37:41,"SoloLearn is fantastic.  I have taken their online courses in C++, Java, HTML, CSS, PHP, JavaScript, SQL, Python, C, and C#, I am now in the middle of their Data Science with Python course, and I plan to take their Machine Learning  course next.  All the courses I have taken have been really fun and instructive.  Of course you will need a lot of experience beyond the courses before you can really consider yourself to have meaningful coding skills, but the courses will give you a great start, and the community and coding challenges will help you test, practice, and develop the skills taught in the courses.  Last but not least, SoloLearn has a large, active, and devoted community of friendly, helpful, and supportive users.  You will learn a great deal from reading the comments of your fellow students, asking questions, and trying to help answer the questions of others, and you will make new online friends of all ages and backgrounds from all over the world.",5,False,Chill3333,Marvelous app!,,POSITIVE,"vote, challeng"
9,2018-10-24 22:45:00,"I am kind of new to coding. I had already learned HTML and CSS from another online source and then I was told about this app. I absolutely love the app and how the lessons are structured. They offer many different programming languages. This app is great for beginners and even those who are experienced. The community is also a great part of this app. Being able to post your codes, take part in challenges, and get to see codes that others have made public! Seeing others codes (especially those who are at a higher level) can give you ideas of things to create on your own and you can study there codes to see how they created different things. It’s a must download app if you want to learn different programming languages and be involved in a community of programmers.",5,False,Tara1988,Great learning app!,,POSITIVE,challeng
10,2019-04-13 18:17:42,"Overall this is a fantastic app and a fantastic system to be able to learn any of the programming languages offered. I would highly recommend it.

The one problem, however, is that the Community Forums use a ridiculously small font size on any device, with no way of enlarging it. This makes it practically impossible to read at length, no matter whether you are using an iPhone or an iPad. I use an iPad mini most of the time and reading the forums really hurts my eyes (I am 48 years of age and I don’t wear glasses). Just look at the screenshot provided in the app’s own description! The font size in the Community Forum is tiny and there is no button or setting placed anywhere to change it unfortunately.

The reason that this is such a disabling factor is that the community forums are integral to making progress in this app and are one of the most amazing and helpful things! Discussions are available for every topic and for every question and every answer. And that is just the most helpful thing you could imagine as you try to learn a new language.

So I pray that the developer adds the same button that is in the coding lesson text to the community forums to change font size. Then this app would be perfect in my opinion and I would gladly come back and make it a five star review.",4,False,kaliko,Great but Font Size is Terrible for Community Forums,,NEGATIVE,progress
17,2021-05-17 08:09:17,"This app is generally good however if you are planning to motivate yourself by the badges or trying to set a streak of days you study in a row you will be very frustrated. It doesn’t always register lessons you’ve done, it never seems to register lessons done on my computer rather than my iPad, it may change what day it credits you for your work…today it moved all my lessons from yesterday on to today and thus broke my streak for me. (This is particularly frustrating as you get a badge for a 15 day streak and today should have been day 15.) It has gotten to the point that I find it frankly demotivating - I’m thinking about switching entirely to books instead.  It’s a shame because the meat of the app is very good - the gamification is just bad.",3,False,Riyya,Badges/streaks really buggy,"{'id': 22891677, 'body': ' Hello! \r\nThanks for your feedback!\r\nPlease send more detailed information to us at info@sololearn.com so that we can help resolve the issue. \r\nLooking forward to hearing from you!\r\n', 'modified': '2021-05-19T08:53:59Z'}",NEGATIVE,"streak, point"
19,2018-08-03 17:39:08,"I got this app because I wanted to brush up on some old skills and learn new coding languages, and it’s been well worth my while. I’ve taken courses in university, Pluralsight, MVA, etc., and this app has content on par with the best of them, not a simple 'Hello, world' playground. The lessons are expertly written and the app, itself, makes exploration a breeze.

You can very quickly gain advanced and expert knowledge in one of the available languages, then put your knowledge to the test in innumerable challenges. People in the range of novice to intermediate will gain the most, as expected, but even very experienced coders are likely to learn some things from the courses.",5,False,benJephunneh,Professional and valuable content,,POSITIVE,challeng
20,2018-07-18 01:54:23,"I'm new to this coding thing, but I have a passion for challenging projects and logic based applications. I am hoping to transition from sales to computer programming and pursue a computer sciences degree in the near future. This app is really easy since I can repeat lessons for better understanding. The comments make me feel like I'm not alone when I don't understand a certain section. It helps to know that other people have the same questions as me. It feels like being in a classroom of other beginners. I like to slow pace and the easy explanations. I feel confident that I can easily grasp several programming languages with just this one app. Thanks guys.",5,False,tony durrty,Excellent App For Beginners,,POSITIVE,challeng
25,2021-01-12 19:42:29,"I’ve been using it for a little while now and finally got the pro subscription more recently and can honestly say I am understanding many concepts so much better with this app. I’m also taking courses through Udemy but this app is a great tool to use along with my course material. I was struggling a bit with some concepts from my course material and this app with the challenges and projects have really helped me better understand the concepts. I do wish they had some more practice challenges to work on, but regardless I am very happy with this app!",5,False,Kmf05f,Love it!,,POSITIVE,challeng
38,2020-10-14 00:52:06,"This tutorial software source of well but after the first lesson or so rapidly declines. The student reaches a bottleneck early on that prevents them from progressing to the next lesson. The example given in the lesson is poorly programmed with no instructions available on how to get past the bottleneck. With this stateThe purchase price is wasted because Susan cannot progress further. It says you can cancel in settings but I do not see her a cancel button or choice. By the way, when I went into the Apple ID management module it shows how dramatic increase in price each succeeding year. This was not mentioned in any of the literature that I read from the company. My advice is to stay away from this app, but then again I feel ripped off by it.",1,False,bjsineath,The Worst,,NEGATIVE,progress
42,2017-11-20 01:41:55,"This app has been extremely helpful in every way for aiding in learning different coding languages for free. As a college students, it has been extensively helpful in my studies, and I find it quite convenient to use with its dumbed down explanations of many complex ideas. It breaks down logical systems very fluidly to the point where even the average person could understand it with enough time and thought. 
Definitely worth my time to use, would rate again 5/5.",5,False,MiztarPi314,"Easy to Use, Free and Simple",,POSITIVE,"point, break"
49,2019-07-29 20:11:34,At first I was like this is going to be one of those apps where it disappoints you because it’s starts you where you should already know some coding but I really starts you off as a beginner helping you and giving you easy problems to solve. You can even battle other players for points once you get experience enough and the community is really nice. This is the app I personally would recommend if you truly want to hown your skill on 10/10👍👍👍,5,False,saucedoughboy,Review,,POSITIVE,point
50,2022-06-09 10:43:15,"I really like this app and everyone should give it a try. The only downside is I lose hearts not to misunderstanding the question, but to typos and it’s very frustrating. We rely on autocorrect to the point without it we don’t realize that we’re typing so much stuff out wrong. Could you guys look into adding a feature in the settings that enables autocorrect for those “fill in the blank” questions. I literally ran out of hearts because I spelt “print” as “primt”.",4,False,Bleh27275262,I learn more on this than duolingo lol,,NEGATIVE,point
52,2023-03-18 01:03:38,"The business model where an app is created to be downloaded and used for free and then keep annoying the user to pay for the services should be outdated by now. Especially, when those who paid for the service point out there is not much exceptional about the paid version. Developers better find a way to negotiate for a better cut from the hardware manufacturares than continue this path of deceiving business model. I don’t know who out there would decide to pay just because an annoying pop up message keeps appearing when every time the app is turned on for use.",1,False,fvck_capitalism,Annoying popup for subscription,,NEGATIVE,point
53,2019-08-21 12:03:01,"This app is great for learning the basics of a new programming language. I use it everyday to learn new things and I especially love the challenge feature. I don't recommend using solely sololearn, but rather along side your own projects and practice. I have one complaint however, that is when viewing the leaderboard in the following tab, if you choose 'Today', the app will crash. In summary, if you are looking to learn something new, this is the place.",5,False,Ejidifhsodhdbjdkdf,Recommended,,POSITIVE,"leaderboard, challeng"
54,2021-02-23 18:17:03,"Updating the review from 1 star to 3 star as the developer refunded my yearly subscription. A fair review of the app should be 3 stars.

The first half of the Python lessons I took were stellar and I’d rating them as 5 stars. But things started breaking from the chapter OOP and magical methods. There’s not much explanation and I was completely lost. It is either too hard for me to grasp Py OOP, or the authors didn’t put much effort on trying to explain things clearly. I really wish the latter part of the lessons can be designed better and I would be willing to pay monthly subscriptions for good lessons.

—————previous review—————-
It says somewhere around $6 subscription per month after free trial, which sounded acceptable. But the app actually charges $70 right after the tee trial ends, even though the app tells me that my learning plan would be around 6 months.
I have filed a dispute for refunds and see where it goes.",3,True,seventtqqll,"Good effort, things may improve","{'id': 21234657, 'body': ""Hi,\n\nWe'd like to inform you that we have 2 types of subscription: monthly and yearly.\nYou have chosen a yearly one which is $6 per month if you divide the total amount into 12 months.\n\nFor more information you can contact us via info@sololearn.com and we will help."", 'modified': '2021-02-23T18:17:03Z'}",NEGATIVE,break
55,2018-06-06 22:12:04,"This app is great, I just got it today and I love it. I’m done with the Java basics, and halfway through the next course in Java.

How ever, having some prior experience with coding I noticed that  the basics isn’t really that basic. More explaining would be helpful to millions of users.

Another thing suggestion is adding some sort of encyclopedia for each language that has things in it like that language’s functions, methods, definitions, and other useful/complicated things so I don’t have to dig through lessons or google to find it.

Finally, it would be nice if you added Lua. Lua is a wonderful programming language, and some people might see Lua as a better starting point then some other programming languages.

I hope you consider these suggestions, as they will help refine this wonderful app!",5,False,TdaGreat04,Some suggestions.,,POSITIVE,point
64,2020-04-17 17:05:59,"I was skeptical in my initial thoughts. But after a few days of use, I fully support this app. Learning Python has never been so easy. The courses and experiences are in balanced progressive manner from example one. The comments by the community are helpful, and should be read after every questions answered.  I highly recommend anybody remotely interested coding to download this and everything else will fall into place.",5,False,Abdul Babu,Wonderful application,,POSITIVE,progress
68,2019-06-23 16:31:41,"This app is simply amazing and extremely accessible. If you’re a beginner/someone with no coding experience, there are many interactive lessons to teach you countless programming languages with different levels of difficulty. 
In my opinion, the best features are the challenges and coding playground. Definitely give this a go before trying out other coding apps, because this might be the one for you.",5,False,DanielKoKoKo,Great for coders of all levels!,,POSITIVE,challeng
77,2018-10-06 14:36:34,"This app is not going to teach you a subject completely but it is a great way to spend some ""in between"" time assisting in that. 
My path was Python and during commercial breaks while watching tv or in the morning during coffee, etc I would play a few rounds.
Starting over a couple of times I was able to finally complete the module. 
Thanks to sololearn for this nice little app!",5,False,Gregoryu,Great way to get spend some time.,,POSITIVE,break
91,2018-06-20 01:34:08,"Many of the lessons start out good when the material is simple but when the material gets more difficult, the lessons and questions stop making sense. I just reached a point in the Python course where the questions don’t relate to any of the material presented and are confusing or poorly worded. It seems like they might have just a few people trying to write all of the lessons instead of having them written by an expert in each area.",3,False,Rafinesque,Lessons start out good but aren’t that good later,,NEGATIVE,point
106,2020-08-15 06:58:08,"I rarely do reviews, but this app is great, it’s straight to the point and give you a big picture of the topics. The only downside is that there is not enough details, but I’m pretty sure you can find all the rest on stackoverflow. If you are in ECE or CS and you don’t want to read your textbook or your teacher is trash, then this app can help you getting started.",5,False,fk this lag,Amazing,,POSITIVE,point
111,2019-10-28 13:56:33,"The app has ridiculous ""badges"" for achieving the task of replying to the email they sent you to validate your account.   That is regular operating procedure, not an achievement.  There is no pressure to upgrade, you will get to a point where the app tells you there is an updated version in the app and you should goto the app.   Ut you opened the app to get the message, what they want is money to proceed, which I am willing to do, if I believed there were solid coding skills in the other side of the payment, but they cannot get the app right.  Ridiculous effort, UI and communications FAIL",1,False,iRetlaw iTunes acct,Dead end for learning,,NEGATIVE,point
113,2020-09-14 16:49:40,"Only thing I would change is when are in challenges with other people, delete the cap on the amount of characters you can insert as the answer because it gives away the answer. Also, spell check some of the questions. The spelling will be off so I will get the answer wrong.",5,False,astrenat,Amazing app 5/5,,NEGATIVE,challeng
115,2018-05-16 16:04:11,I recommend SoloLearn to my students because it breaks down programming fundamentals into easily digestible chunks. It is so important for people with little or no background in programming to be able to have learning tools that have a good balance of being challenging without causing too much frustration early on. SoloLearn is great at finding that balance.,5,False,alannarisse,Great for students new at coding,,POSITIVE,"challeng, break"
121,2022-05-09 02:09:37,"This app is not free. If you are trying to learn a NEW concept, this app only lets you make a certain amount of mistakes. After you lose hearts by making mistake, you literally can't learn anything. There is no point in using this app to study without paying, so the free version is a scam!",5,False,"Life, Liberty, Awesomeness",Not free! Its a scam!,"{'id': 29681957, 'body': ""\r\nHello, we'd like to inform you that almost the entire content of Sololearn is completely free! The Sololearn premium subscription enables advanced tools and provides uninterrupted ad-free access to learning. It is up to you to choose the preferred option of Sololearn. For more information please contact us via info@sololearn.com\r\n"", 'modified': '2022-05-11T08:54:16Z'}",NEGATIVE,point
122,2017-11-27 03:00:45,"I was using the Swift app by this company and I am unable to use it anymore... it says there is an “updated” version in this app, so I had to download this one to continue. 

However, even though I connected my account, it doesn’t show my progress in the course. I had made it about halfway through the entire thing, and now I would have to start over. 

Obviously, I’m not doing that and I’ll just look elsewhere. It’s totally inconvenient to have to redo everything I’ve already accomplished. I can’t even “test out” because I had some issues with a few concepts and you have an “if you miss a question, you can’t test out” rule... which makes sense, but I’ve literally gone through all this stuff once already. 

Anyway, I’m not doing it all again. I recommend finding a different app that actually has syncing capabilities.",1,False,SailorTriforce,Doesn’t connect to their other apps,"{'id': 1858660, 'body': 'Hi, \nOur apps do sync progress, if you use the same account.\nPlease contact us via info@sololearn.com and we will help!', 'modified': '2017-11-27T15:15:11Z'}",NEGATIVE,progress
124,2019-10-18 15:30:18,"I am a beginner in Python and am going into the coding field. I am very busy with my current job and family so it is hard to sit down and learn, but this app has made it possible for me to learn anywhere, anytime. Extremely convenient and easy to use. It tests your knowledge to ensure your grasp of the concept and progressively gets harder.",5,False,Afelic75,Great learning tool!,,POSITIVE,progress
132,2018-12-21 13:58:43,"I’m actually preparing for a web technology interview. This course has been awesome. They break everything down in short, but detailed segments. The learning plans give you the next best topic to study naturally without you having to pick. The challenges are great, and they increase in difficulty but you gain confidence along the way!",5,False,Mo_Biglow,Awesome & Fun- real review,,POSITIVE,"challeng, break"
136,2019-02-05 00:36:05,"This is the best app or more than that for not even learning coding languages from basic but you can run codes instantly, see others codes that shared and for each step of learning there is an active comment section that can learn more deeply. In nutshell it's a virtual yet lively free university of coding and it's so fun!👌🏻👌🏻👌🏻",5,False,Rojan50,It's not just an app it's an alive beautiful world!✌🏻 🌎,,POSITIVE,virtual
138,2019-12-03 12:39:23,It may be the best app for learning multiple languages on your phone but I have personally discovered that I need to supplement it with other methods of learning since some of the material can be a bit vague and with no in depth explanations other than through the community. Solid app that gets the point across and lets you experiment with different coding languages.,4,False,AngryLookingGuy,Possibly the best,,POSITIVE,point
140,2022-08-31 18:18:06,"I have never left a review on an app in my life, but this one deserves all the reviews. I took a coding bootcamp and this has helped me understand coding more in a week than the entirety of the Bootcamp. I highly recommend downloading and going through lessons instead of social media!!",5,False,Livvstrongg,AN ABSOLUTE MUST,,POSITIVE,social
142,2022-03-04 15:37:35,"I am brand new to coding and this app is the first teaching method that has helped me make any substantial progress.  The courses start from scratch and explain everything in simple, easy to understand terms.  Shout out to the devs for the simplicity and user-friendly design.",5,False,New21Guy,"So far, so good!",,POSITIVE,progress
143,2021-10-09 22:41:51,"If you want to learn coding this is great

It has courses for every big language plus some you’ve maybe never even heard of, it is sometimes confusing and the html course is a little outdated but it is still great for learning

It has a compiler with the app plus lots of practice challenges. And if you have questions you can ask the community or answer other peoples questions.

And on top of all of that, it’s all free and completely optional to get the pro version

Would definitely recommend to anyone who wants to learn programming",5,False,:^),Best way to learn coding,,POSITIVE,challeng
150,2018-11-24 18:01:33,"I had a login/sign-in problem that previously led me to submit a low review in frustration after not being able to continue my progress, but that seemed to be a strictly temporary issue (on their end). It’s been perfect for several weeks now and I’m certainly grateful for this app, for sure.",5,True,Rmcsonics,Really great,"{'id': 5572172, 'body': 'Hi, please contact us via info@sololearn.com and we will be happy to help you.', 'modified': '2018-11-24T18:01:33Z'}",POSITIVE,progress
151,2020-07-01 00:27:55,Another learning tool that isn’t advertised on this app is the comments sections in each chapter in which users who understand what’s going on break it down for people who don’t know what’s going on and get fact checked by people who also know what’s going on,5,False,angelicarbiter,"I don’t like it, I love it",,NEGATIVE,break
152,2021-11-17 16:14:28,This app originally had the option to reset progress for a course. Though it’s a great learning resource I’m only giving it 2 stars due to the removal of that feature. I understand that it was probably removed to encourage people to buy the “Pro” option but as a person who’s paying for “Pro” I expect to be able to reset my progress if I so choose.,2,False,meh653,Removed the ability to reset course progress,"{'id': 26367079, 'body': 'Thanks for your feedback. \nWe work tirelessly to improve our content, platform, and services by listening to and responding to members of our community. We value every piece of feedback we get and we love to hear ways to make SoloLearn a better place for coders. \nYour suggestions have been forwarded to the Product team for consideration.', 'modified': '2021-11-19T14:50:13Z'}",NEGATIVE,progress
