Unnamed: 0,date,developerResponse,content,rating,isEdited,userName,title,sentiment,matched_python,reviewId,userImage,review,thumbsUpCount,reviewCreatedVersion,replyContent,repliedAt
3841,2021-08-23 06:47:37,,,5,,Atiq Nishe,,POSITIVE,python,6cc3e27b-6f71-402a-a940-47011974ae01,https://play-lh.googleusercontent.com/a/AGNmyxZb1el-bEjphOFnMU0cYmm80Wn4vU3lhpxGl6_R=mo,This is very good app learning for python,0.0,1.4.56,,
3845,2021-08-22 22:35:56,,,5,,Justin M.,,POSITIVE,python,6faf3583-a1e8-45d5-8f27-7f110bd720bf,https://play-lh.googleusercontent.com/a-/ACB-R5T6qL6qxQ8f9mMUvl608YboJohdyj8IxK36iHta2qo,"So far, it is the easiest and cheapest way to learn python i found. I really like the use of analogies, makes the concepts much easier to understand. I was so impressed with the quality, i bought lifetime premium right away. Keep it up devs!",1.0,,,
3854,2021-08-22 03:55:10,,,5,,Hasan Shabbir,,POSITIVE,python,62aa594c-a6bd-4c4a-bff4-9f524d99b45e,https://play-lh.googleusercontent.com/a/AGNmyxY-uTeuTHKjv9gxQosU59tanSmgu5o9yiMQZmRW=mo,Best Application ever to learn python!♥,0.0,1.4.56,,
3859,2021-08-21 15:19:59,,,5,,Valiant Highcore,,POSITIVE,python,b713023c-e58e-4bb3-bd2f-c014a7afe1e0,https://play-lh.googleusercontent.com/a-/ACB-R5TfESNQ3Z6MUy48m5Xq1312F3zWJwoIqYUWqoe-,Excellent App for anyone who's looking forward to learn python programming and other IT skills,1.0,1.4.56,,
3915,2021-08-17 02:05:03,,,5,,Prince Gohel,,POSITIVE,python,82ba9515-9b86-418d-989d-df636fae6fa9,https://play-lh.googleusercontent.com/a-/ACB-R5T0pAkRUgKEpND_GrJmC4-EMRxGytmKukakgK7Y,This is a very useful app i will learn python with this app,0.0,,,
3935,2021-08-14 04:09:20,,,5,,Iman Mukhlis,,POSITIVE,python,6c290cbf-e26a-4dc1-900c-e19093674b54,https://play-lh.googleusercontent.com/a/AGNmyxafY-RobMGiV7t8xPTi-H1p8OZ7Su0t3CKuJTmN=mo,So far this is the most interactive way to learn python,0.0,1.4.56,,
3982,2021-08-09 18:30:55,,,5,,Y BEATZ ZM (ITS A SMASH HIT),,POSITIVE,python,c95602c1-27c8-42bd-bcfd-8f274812dc58,https://play-lh.googleusercontent.com/a-/ACB-R5TGUwHNBo-ZaDAjNbRMn0ZRy_2akR-0GucXCCkJ,This app is the best if you wanna persue you career in programming. But i do think they should fix some bugs in the play ground compiler for python.,1.0,1.4.56,,
3998,2021-08-08 12:20:42,,,5,,Prince hu mai,,POSITIVE,python,27ed4727-def4-4662-baba-7fdd987c4afb,https://play-lh.googleusercontent.com/a-/ACB-R5T84TwHpkiUkBlJnujedFfS0JsbrE9GaWlqmsJ3,"A pretty nice app. It's Fun. Learning code like this makes me learn more fast I've learned the half of the python from this app thank you so much. I wanted to say it would be Great if JavaScript could be added. I'm curious to learn JavaScript. I've searched so many apps but I got none. So Please add JavaScript. And everyone, Download this app it's a pretty good so to learn coding languages.",99.0,1.4.55,"Dear Prince, Grandma accepted your request! Javascript is coming soon!
Love from Team Programming Hero! 💕",2021-08-08 12:34:33
4019,2021-08-07 05:09:18,,,5,,Mukut Dutta,,POSITIVE,python,c0a7dbab-bee1-4477-8715-d84d666fc434,https://play-lh.googleusercontent.com/a-/ACB-R5Tnfx-ycxoNduRRZBpFiKrePFioqPoJzgQHPES6zg,Very good app I worked hard on learning python and made a game 🙂,0.0,1.4.56,,
4044,2021-08-04 09:30:18,,,5,,Nucleus,,POSITIVE,python,4b61c689-1f10-4dda-8b1d-83ad40934753,https://play-lh.googleusercontent.com/a-/ACB-R5QKTL4hPpSYKelqQTp2qRmUoO_x8adTun0D9SUKow,This app is pretty decent to learn python easily and with fun!,0.0,,,
4064,2021-08-03 04:24:24,,,5,,Farhan Elias,,POSITIVE,python,6270dcca-21a8-4643-bf30-8f7a03f75f03,https://play-lh.googleusercontent.com/a-/ACB-R5TPilpgTkF3qAVlYply5yPbHXLUI7dxVt36xYUGdw,It's absolutely fantastic for learning python as a beginner. It's recommend,0.0,1.4.55,,
4082,2021-08-01 22:01:26,,,5,,SP Praveen,,POSITIVE,python,44530f77-97c9-488c-ae11-1ae54eb7fd9f,https://play-lh.googleusercontent.com/a-/ACB-R5TQBm_JIyWDe1FKpBcaoSUegHYYHCde2cismGjL,Great app to learn python,0.0,1.4.55,,
4178,2021-07-27 06:10:51,,,5,,JyotiKalpesh,,NEGATIVE,python,c581a9cb-8a5f-4d2a-9a40-2c57240538d3,https://play-lh.googleusercontent.com/a-/ACB-R5T6rOblnBrFGekx-rAYWTlp8cnTa0WAGc90bYa3ng,I have learn basics of python 3 yeahh,0.0,1.4.49,,
4203,2021-07-25 10:26:11,,,5,,Syed Haider Abbass Bukhari,,POSITIVE,python,c41c9a98-685b-491c-b97d-ddf288856527,https://play-lh.googleusercontent.com/a-/ACB-R5SXaz5fSlppY1O6VWwZkL9yIchRn-eRdgTUVmoo8F0,Very colorful and intersting. I feel like im gonna learn python finally. Good job👍👍👍,0.0,1.4.49,,
4236,2021-07-23 09:19:16,,,5,,Vinod Kumar,,POSITIVE,python,f0a40d10-9555-4bee-99a5-3f23e40988ed,https://play-lh.googleusercontent.com/a/AGNmyxZqrQXwXjzYcWb4WsWKEYkLOcgQeLiUYhe8NAH2=mo,It's to fun to learn python with this app. I Love this app. If you also want to learn python like me. Just download it,0.0,1.4.49,,
4241,2021-07-23 00:25:26,,,5,,Sameer,,POSITIVE,python,28e2f05f-97df-4d2b-a8ec-c119c0684f86,https://play-lh.googleusercontent.com/a-/ACB-R5SXq_6dArczTOwdIuiYjXKexff-JkYstnYtGgCTjw,The bestest app for python,0.0,1.4.53,,
4305,2021-07-14 11:21:54,,,5,,Apon Rayhan,,POSITIVE,python,a51dbd8e-87ad-49c9-9c6f-87854708b7a2,https://play-lh.googleusercontent.com/a-/ACB-R5RccgK5-4IZQ8puWzU1-Mw7avooue5ZgH8jr9eLRQ,Best app to learn python. Bangladesh ❤️ Bangladeshi programmers ❤️ Jhankar Mahabub vai ❤️,0.0,1.4.53,,
4311,2021-07-13 23:02:55,,,5,,Shakil Babu,,POSITIVE,python,7e045d21-95d6-4ebe-8ee0-06a4d4f91b5e,https://play-lh.googleusercontent.com/a-/ACB-R5Tg3dZgZqGwS3MbaU8Dktv8wOY06QcDXeJe9RGJ,Programming hero it's an awesome app to learn about web dev and python. There are lots of tutorial which are very helpful❤,0.0,,,
4395,2021-07-05 23:33:35,,,5,,Siamul hasan,,POSITIVE,python,e107b299-2752-4c97-b46d-aac60a5bb547,https://play-lh.googleusercontent.com/a/AGNmyxaqaUopBgyIiolygE5DBtDNVINJSM8oUpL2fdt2=mo,it is so fun to learn python.,0.0,1.4.53,,
4407,2021-07-04 23:15:08,,,5,,Neelam sharma,,POSITIVE,python,fec89453-c0e4-4e93-8d55-4558763f1ca7,https://play-lh.googleusercontent.com/a-/ACB-R5S9itrNJSTMhYBcnaypuT4uHOwsXcaay22d8Xjn,this app will allow us to learn python course in just 1 month,0.0,1.4.53,,
4475,2021-06-29 00:54:20,,,5,,Monir Hossain Rabby,,POSITIVE,python,c3fb0ade-6c95-42c0-9ac3-dd90b5f090fe,https://play-lh.googleusercontent.com/a-/ACB-R5Q3kGM-G7GkzSefq3sLKPkYQ1MqtVclRTTp2sBa5g,It's Absolutely amazing for learning python programme,0.0,1.4.53,,
4568,2021-06-21 09:10:24,,,5,,Maliha Mostafa,,POSITIVE,python,e46acbe3-8483-4982-82b3-01a328dfbdfe,https://play-lh.googleusercontent.com/a/AGNmyxbtZYoLd0IhWNjv6vxoKG_mUc5srqIkat7WqieNkA=mo,Best BD app for learning python i used it is fun adult child any one can use as it is a friendly using app cuz i using it for 3 years,0.0,1.4.53,,
4574,2021-06-21 00:48:16,,,5,,Mohammad Hasan,,POSITIVE,python,c751f7a5-7747-48bc-857d-4a733de6cf1e,https://play-lh.googleusercontent.com/a/AGNmyxZMBzga6tSXG06hwbWuv1fXTDMzGidifZ2iTRfY=mo,Really amazing this app to learn python,0.0,1.4.53,,
4579,2021-06-20 05:39:04,,,5,,Vartika Singh,,POSITIVE,python,7d482d20-2437-4c2f-b660-c06dccf20263,https://play-lh.googleusercontent.com/a/AGNmyxbpfE8EALssOV0Jwo-mA5CiY3jfQWksWHCUb3By=mo,Before starting learning to code in python I have a question that I am in class 9 right now....so can I learn coding without (pro) ....is there will be less information in free classes....I request to answer this? Thank you 😊,0.0,,"Hi Vartika Singh, 90% of our app contents are available for free for you and that is enough for you to learn and get hired as a junior developer.
Grandma sent blessings for you. She is very happy to know that you have started learning programming. We wish you best of luck on this journey.",2021-06-20 10:14:43
4625,2021-06-16 05:26:28,,,5,,Sadman Sakib,,POSITIVE,python,28a72980-23c0-4d73-a302-6fb732126db3,https://play-lh.googleusercontent.com/a-/ACB-R5SdMKNgqlbs7MC0aRqZxgEN8EFr9-YNxUAdENIdKQ,best for learning python,0.0,1.4.53,,
4630,2021-06-16 01:15:13,,,5,,Md Habibullah,,POSITIVE,python,e1e72ce6-3e15-4571-8840-5d0199d2f6a9,https://play-lh.googleusercontent.com/a/AGNmyxZM8aV5QEl44bBp1z-WyEriNNzv20jrL5pfI252=mo,Really The app is very helpfull.i have already learned html.and learning python.,0.0,1.4.53,,
4656,2021-06-14 05:17:37,,,5,,Akash Khan,,POSITIVE,python,a3c5cca0-2b2a-4928-a206-f2a0bd700fab,https://play-lh.googleusercontent.com/a/AGNmyxY__LYQ5rVGpralWGiJ2tAd_LMYnBKi6yDqr-gM=mo,My experience was awesome..... Very good app and helpful for learning python on easy way.,0.0,1.4.53,,
4686,2021-06-11 23:48:06,,,5,,Ramulu Kundhanapally,,NEGATIVE,python,5456b9a2-5398-49b6-aa4b-4bae26dd07a1,https://play-lh.googleusercontent.com/a/AGNmyxbVv43wzcNdQH8h8bZTyIAwpy_-GoFE8B2fawLX=mo,This is the best app to learn python But java is not understanding,0.0,1.4.53,,
4689,2021-06-11 22:12:14,,,5,,vikram reddy,,POSITIVE,python,2a048ce2-fe56-4c6a-86c4-bd06a16f01d0,https://play-lh.googleusercontent.com/a-/ACB-R5SJQxy_qgEciQvh7akdihxxQgiJmH1Xjb3LWHqCyw,Best app to learn basics of python,0.0,,,
4692,2021-06-11 14:36:13,,,5,,Shawon Ahmmed,,POSITIVE,python,69dfb62c-965a-4cbc-937e-0da3f4e8f919,https://play-lh.googleusercontent.com/a-/ACB-R5RZU6wdD4Hn2bGnTMz9-nrifq3VkGDLHTrWbVmb,This is an amazing app to learn python!,0.0,,,
4696,2021-06-11 09:10:58,,,5,,Cardinal,,POSITIVE,python,27f826a1-ad12-455c-bce4-5052995273d3,https://play-lh.googleusercontent.com/a-/ACB-R5QtOxKLasYZhKbBAtadmSVpvuk3aGSM7k8FWdUqDQ,Very easy way to learn about python,0.0,1.4.53,,
4701,2021-06-11 01:45:31,,,5,,Mahamood Husain K,,POSITIVE,python,8a3ef73c-1a65-4ee8-aca9-aa7565c015a6,https://play-lh.googleusercontent.com/a-/ACB-R5RLQg4jdJa4KgCZtWZp7xjxXj2a06gV3cOORxA,"This helped me alot to learn the hard concepts of python,Java,Html languages very easily and It is so useful for beginners to become experts in a short period. I am on the way of becoming an expert. Thank you for the programming hero team for your help.",35.0,1.4.53,,
4736,2021-06-09 04:41:09,,,5,,Jobayer Hossen,,POSITIVE,python,08e0a660-e0e1-4ee6-90cc-d3d09750cdfc,https://play-lh.googleusercontent.com/a-/ACB-R5T3d-sHySiGTDW0Q1DvcXg9esRWX3w8y7J-Phuw-A,It is very helpful app🥰 Thanks for giving us this app for Learn python programming 😍,0.0,1.4.53,,
4763,2021-06-07 10:50:32,,,5,,Sajjad Wasel,,POSITIVE,python,e977640a-8906-45f3-888c-0327589ee516,https://play-lh.googleusercontent.com/a-/ACB-R5RRw-l86EDSn3b6yQdqVYLEZSQKEhoWeFblbdeq7Q,awesome simple app for learning programing and especially for python language learners,0.0,1.4.53,,
4791,2021-06-06 08:15:40,,,5,,Mahtamun Hoque Fahim,,POSITIVE,python,97d3b8af-5a42-432d-a4e8-9ce5ee62a619,https://play-lh.googleusercontent.com/a-/ACB-R5RvpZxLNz97GJSZMQZURLiFyxbkQc_qTM7vK4yAZw,"Awesome app, started learning python today and fell in love with it!",0.0,,,
4874,2021-06-01 11:51:52,,,5,,4you videos,,POSITIVE,python,705071fe-7181-4cd8-9913-6823d85f81b9,https://play-lh.googleusercontent.com/a/AGNmyxbTRPRNGRJc-yHk0rb9EmizBAuKzM74lyZRNcsB=mo,Amazing app. I learn python with this app without taking pro. Amazing .you should download this,0.0,1.4.52,,
4897,2021-05-29 11:26:17,,,5,,Maimunul Islam,,POSITIVE,python,ccdcfdcf-9556-4a79-8bf0-486387b5b3c4,https://play-lh.googleusercontent.com/a/AGNmyxYPBTvzOMwQW9PQ-cL4IKqdVCJWKf6oI0w-ccOT=mo,This app is very interesting app fir learn python programing language. Play game and learn phython.,0.0,1.4.52,,
4922,2021-05-27 09:45:20,,,5,,Joan Munyua,,POSITIVE,python,16e6a892-ab31-4831-a6f8-4664f5484676,https://play-lh.googleusercontent.com/a-/ACB-R5RTfcsVWN1pXQqJSWRR3WD2yuVdLiMQE4hIEnwgU7A,Helps beginners understand python programming in an easy and fun way,0.0,1.4.52,,
4957,2021-05-24 15:20:50,,,5,,Rahul PHP OOPs,,POSITIVE,python,2ecf1d6c-0122-435e-9aaf-008d98b08578,https://play-lh.googleusercontent.com/a-/ACB-R5QW3x8_g4njpABGWJHCAR2H9AvP0rX6JkJ5qYUKaw,Awesome means really really awesome Best programming explaination ever in app Please add more and more topics on python Advanced and advanced programing language whenever you add new ones Please add following... 1).Python Gaming tutorial (with unity) 2).JavaScript Canvas in beginer to advanced (This app gonna be crazy next day...),0.0,,,
4976,2021-05-23 00:25:07,,,5,,Arun Shete,,POSITIVE,python,7549fea2-6fa9-4dc7-aa78-6ac35e9a9b31,https://play-lh.googleusercontent.com/a-/ACB-R5Qo1q21F902-bIspCwPM36LDa0y26geKIQ-fVJj,It is very educational app about python,0.0,1.4.52,,
5002,2021-05-20 02:46:20,,,5,,Om prakash .B,,POSITIVE,python,5965c9a8-1106-494e-b3bd-f6d0aacc64f0,https://play-lh.googleusercontent.com/a-/ACB-R5S1jgXtLZCsp2R6nKBovdzBIiCmlkoi_AcV4hR-cw,"I like this app tooo much it really very awesome to learn coding i also buy pro version of this app this making learn easy but please add this courses Game development, Java, Ethical hacking and UI/UX designing in this app I wish You can Add it and also please add videos for C++ and C like python add animated videos like byjus app then children can able to learn easy Thank you very much for giving us such a quality education",12.0,1.4.52,,
5027,2021-05-16 15:17:49,,,4,,SedDev,,POSITIVE,python,1c3bea22-4f92-4275-8cd6-96e24d9c0752,https://play-lh.googleusercontent.com/a-/ACB-R5RDOfySEsh8qEMuUNz9mbITLnuG9Wnw5i0AtA8S1g,"This app so really good but please make it with lua, lua is easy to learn and is a mix of python",0.0,1.4.49,,
5039,2021-05-15 00:33:00,,,5,,Paul Raj,,POSITIVE,python,91639f90-24f6-4030-929e-1cf51e28bd9b,https://play-lh.googleusercontent.com/a-/ACB-R5Qz_YRjDSQHLnj3gEZ7zIZ5A2z1JePTgz0JRgxU,2019 i joint for python. After one year i came for advance python. Now i can see lots of changes. . Good Job Programme Hero Team,0.0,1.4.49,,
5053,2021-05-13 20:36:18,,,5,,Lesion Baloyi,,POSITIVE,python,a7dbd34f-f381-4597-bee8-018a0d0ed389,https://play-lh.googleusercontent.com/a-/ACB-R5Rso04hLEZ0VxpmSXbpL9XrPGrE088BalTajusUoQ,It's by far the best app I'd recommend for anyone willing to learn python.,0.0,1.4.49,,
5057,2021-05-13 12:50:53,,,5,,Sudharsan N M,,POSITIVE,python,f1d8ac7e-1a15-43a9-8f2d-6e01b874a7c9,https://play-lh.googleusercontent.com/a-/ACB-R5RxljfDkkgXP5OAADclwT0OggT6D7wnMa0SMz9XKQ,Really a good application to learn python in easy way. More attractive and really interesting app. I can't able tell it in words it is such a good app. I like this app. Pls guys go on to make such app.,0.0,,,
5122,2021-05-07 06:20:55,,,5,,Padilam Venkat Sai,,NEGATIVE,python,85a09c21-2e75-4ed9-a37a-f0fba6996945,https://play-lh.googleusercontent.com/a-/ACB-R5SgUO7L68y5v8Ct-l0jdVQtg28lmcGy_HJyCFyLoeM,After the update. I can't go Fundamentals part in python class I completed my basic part.... Can you please fix this issue Even after I clear app data still I have the issue,0.0,1.4.51,Click on the galaxy name to enter into that galaxy. Please mail us on support@programming-hero.com if still you are not able to enter into that part.,2021-05-12 16:25:28
5127,2021-05-07 02:33:13,,,5,,Renu Parmar,,POSITIVE,python,f23e19a8-1484-4364-b8c0-84481c66de25,https://play-lh.googleusercontent.com/a-/ACB-R5SNiDU8kTcQq2feujFgwlILGmbPhxt00YEJgqqkKA,The new update is tha best update and this app is very good to learn python and HTML and I have learned all my coding from here.....,0.0,1.4.50,,
5147,2021-05-05 10:51:42,,,4,,A.N. collections,,NEGATIVE,python,7d117cee-988d-4a2b-821a-c6d7a1c2e1ff,https://play-lh.googleusercontent.com/a-/ACB-R5T2HX3JCpZakSrHv614dFL3XoRpcMnt9QyvLh3hvw,"Everything is perfectly fine ,it made python learning fun and easy but one and only problem is that the app is incomplete ☹️☹️🙁.The app got stuck in GUI module ,no data is being displayed there it's jst a blank screen🙁. I was so excited to learn that I completed all the previous modules in 2 days but when it got stuckked at such a high note🙁 it made me feel disappointed. Pls pls do something and make it to work.",0.0,,"Please clear your app data from settings and log in again.
Let us know if you are still facing that issue.
We are extremely sorry for the inconvenience.",2021-05-07 05:35:43
5149,2021-05-05 10:37:47,,,5,,Freezy Stan,,POSITIVE,python,1d35fef4-3db9-4044-8076-bff9decd6890,https://play-lh.googleusercontent.com/a-/ACB-R5Qqv3ieuElw8zlghv6T1l5C-D6Yohg3ui7flbJjwQ,I want to be a game developer can this app make me i want to make aspp or games independently can it will make me to do it if yes . Your best And i wanna ask why you only start with python not with scratch,0.0,1.4.49,,
5164,2021-05-04 09:43:51,,,5,,Nushrat Zahan,,POSITIVE,python,66c462e9-5e6f-4339-8512-e272154d2eb0,https://play-lh.googleusercontent.com/a-/ACB-R5TultGFr-gUely0x95w47VzFh_qjDZ_qpaBclahZQ,"i am having a great time with this app... A best way to learn python programming ... more like, without notching, we will learn a language.. Great app...",0.0,1.4.49,,
5168,2021-05-03 10:49:15,,,5,,rupli Kusalkar,,NEGATIVE,python,42f9f03e-5f7d-4006-9a1c-2b5f2af07bef,https://play-lh.googleusercontent.com/a/AGNmyxbaEP67G7E1SIA60gGhRC2cgHOXY38zfiAFmjOD=mo,"Good app but asks for pro for half content this is realy bad and I am from India and if ur aslo then just bring more Langs like django ,node js , And may be robotics with python and c what else Arduino plz bring atleast Arduino or raspberry Pi both with java,c,and python this is request plz try and I am respecting u cause I am 13 male ans plz don't ask for pro in Arduino and raspberry Pi or will kill myself..😁🙏😁🙏😁😁😁😁",0.0,,,
5177,2021-05-02 20:12:50,,,5,,Muhammad Mahin,,POSITIVE,python,ba475bbc-e194-4af7-a663-1844f4894c09,https://play-lh.googleusercontent.com/a/AGNmyxalV2zjaqSH5SXMEiTPePKs3QpN4-5OX4hPu_oR=mo,"Awesome app! To learn python, its awesome! Besides, the writter has some books too. Love you Jhanankar Mahbub bro❤️.",0.0,1.4.49,,
5192,2021-05-01 10:50:09,,,5,,it's A.N.K,,POSITIVE,python,3077b411-c28a-4571-82d8-034e1e56a793,https://play-lh.googleusercontent.com/a-/ACB-R5TjFF7DBjIZ4v0ikoy5Z_1iDW7OnS5OspJeqCNLMzo,Loved this app. It made python learning fun and interesting.,0.0,1.4.28,"Thanks a lot, An Photography INdia! 😊
We're really glad you liked our app.

Please keep exploring Programming Hero and keep supporting us…

This month, we brought a brand new Dark mode. Now we're working on to bring advanced Web Development course contents. So, please stay tuned…

Love from Team Programming Hero! ❤",2020-07-06 13:17:10
5228,2021-04-28 06:17:16,,,5,,Kakelli John Bright,,POSITIVE,python,60248562-81a6-4a10-9f08-a365263bd10e,https://play-lh.googleusercontent.com/a/AGNmyxYhRugptwqAVVjxLoti5zb-zslYXfPXxPrFZ9mjHQ=mo,"This app is super for python learning beginners. We can learn Python in easy, simple and in fun way. Very nice app.",1.0,1.4.49,,
5263,2021-04-24 12:05:07,,,5,,Mithun Rajan,,POSITIVE,python,e2d93361-ddcd-4c69-b527-68762adf907c,https://play-lh.googleusercontent.com/a-/ACB-R5Q7AOOM4CYIe_93Cysdz2QgM4suhYKAQH0SzTfcPg,I love this app it start from the biginning that i have no idea about python i got the basic idea from today i just installed and i recomment for every one,0.0,1.4.49,,
5301,2021-04-21 07:17:00,,,5,,FUN LEARNING,,POSITIVE,python,03f6280f-8823-4e6e-88c4-271345cc6239,https://play-lh.googleusercontent.com/a-/ACB-R5Tm79VRqSvFKyvZrwGr7NxmGrem0U_kHC4rmj06Jw,World's best python Learning app.I learn many much from this app and I also use it as a python offline compiler best app ever.,0.0,,,
5321,2021-04-19 23:27:34,,,5,,Vishal,,NEGATIVE,python,407003d9-83ff-4a38-9192-8f18e596adf1,https://play-lh.googleusercontent.com/a-/ACB-R5SlF3_4zq33pU5MicudT45kM_AbgFcxfFDIb9ut,Kindergarden student can also learn python in this app,0.0,1.4.49,,
5378,2021-04-14 10:26:35,,,5,,Himanshu Kumar,,POSITIVE,python,7766046f-a402-43e2-b20a-0bbdca180b62,https://play-lh.googleusercontent.com/a/AGNmyxb6AIwiSrVqsFlaB8Bfs9RmrvLS-15yRMM_AEbr=mo,"Enjoy the python programming like you are playing a game, learning while playing !",0.0,,,
5394,2021-04-12 11:48:53,,,5,,DG gamers,,POSITIVE,python,056c5801-8068-4171-8d38-319ab510ba39,https://play-lh.googleusercontent.com/a-/ACB-R5R4EXYHkWzDu-Sj69yUhXjAIRsk9m4zXnY6BmhC,It's a good app.To learn python as a baginer it is a great app,0.0,1.4.48,,
5414,2021-04-10 03:50:39,,,5,,DEEN WAY,,POSITIVE,python,fcf6653f-93e5-4a0f-bd6a-ed78bc42fbd7,https://play-lh.googleusercontent.com/a-/ACB-R5Qidc_xDNF_o6x8KP08SE0ThwPhTUiSTwqlRT184QQ,This is amazing useful I would really recommend to those who want to learn python in fun and easy interaction really so useful and just go for it,0.0,1.4.48,,
5417,2021-04-10 01:46:40,,,5,,Fatema Main,,POSITIVE,python,9a1eee59-6bc6-4891-83a8-700665d30953,https://play-lh.googleusercontent.com/a/AGNmyxYCPVQs_Ed86ZGxMXp0rvRqZUgbufrvhUcHnRVq=mo,Great app for learning python 👍,0.0,1.4.48,,
5461,2021-04-04 04:51:31,,,4,,jasbir singh,,NEGATIVE,python,a2e13386-0518-4c4b-86a0-8f2b575024d4,https://play-lh.googleusercontent.com/a/AGNmyxYiOWjWf0RrJ80e3aewoBp7XeakfxfI5cluE4Gv=mo,The app is so good i have learnt python and made a login interface. I have noticed that there r many mistakes in the app. I write correct word in the quiz but it changes and say wrong att the end. Like-(in)changes into (index) You should fix them.,5.0,1.4.48,,
5466,2021-04-03 04:38:03,,,5,,bhalchandra desai,,POSITIVE,python,0e5a8c5f-fb06-49c2-b087-f5e891c81698,https://play-lh.googleusercontent.com/a/AGNmyxaJFXhxqO1vxJ03ZoIWzgnykmx9nIQWD19jWvcN=mo,Best platform to learn python and programming but some paid things differ this a lot on your learning in this application,0.0,,,
5481,2021-04-01 05:56:41,,,5,,Tania Jhuma,,POSITIVE,python,f9f9860b-8a5d-4507-8ccd-3a80c128be97,https://play-lh.googleusercontent.com/a/AGNmyxZh-L8hwL45P68OWA-m98sQFe2Yahh9FmIKPees=mo,This is a very good app for the beginners who want to learn python. The most interesting part is it's way of teaching. It can't be more fun and entertaining while learning. So highly recommended.,3.0,1.4.48,,
5530,2021-03-25 23:59:44,,,5,,Ashwani,,POSITIVE,python,3af2f083-4130-4830-a194-b2ee5a4a625c,https://play-lh.googleusercontent.com/a-/ACB-R5T86dX6Gktf0SWlWU9lYg8kSyPoFVIYP7LslaURyA,"Nice application for developer dreamer , I love this app, i want to become a python developer i think ,this can help me lot . Really you are working for c language 😍😍😍😍😍🤩🤩🤩🤩🤩🤩🤩🤩🤩🤩 i can't tell you how much I am happy I love you tooooooo. PLEASE brings some tips to get job at google",0.0,1.4.35,"Thanks a ton, technical guy! 😊

We're really glad you liked our app.


Please keep exploring Programming Hero and keep supporting us…


This month, we brought a brand new web development video course. Now we're working on to bring Machine Learning and C Programming courses. So, please stay tuned…


Love from Team Programming Hero! ❤",2020-09-27 10:21:48
5531,2021-03-25 23:33:15,,,5,,Tarik Erpolat,,POSITIVE,python,ec419dd3-013f-47d2-96d8-a4345b5cad41,https://play-lh.googleusercontent.com/a-/ACB-R5TaO7sn15Dj9dsvXWA2J6gEreQ2cItY6WHu0VwPU0Y,Enjoying and very helpful. Thank you for this app and also for your tutorials on YouTube. Ive been watching many python tutorials but yours is the best and easiest to learn,1.0,1.4.48,,
5628,2021-03-14 10:13:58,,,5,,Sandhya Ram,,POSITIVE,python,7c6d717e-4497-44d9-ab3b-79511ee964ee,https://play-lh.googleusercontent.com/a-/ACB-R5SVL1udC7JX9KnEinnOEO6ilrWF-w8-XJ9uzgaf,Very nice app to learn python,0.0,1.4.46,,
5629,2021-03-14 09:42:24,,,5,,Zahin Ahamed,,POSITIVE,python,164f844c-764b-4084-84e9-6810859610a1,https://play-lh.googleusercontent.com/a-/ACB-R5RSP5CktTkb4wW7BfKES4wPPE6zdOsVzTTrLJNF,I really enjoy this app. Thanks for build this types of a apps. I learn basic of python and it's make me more faster in python programming.,0.0,1.4.46,,
5649,2021-03-11 21:06:19,,,5,,Nur damia Iskandar,,POSITIVE,python,03b09235-9a56-4f29-b41c-bc0903704fa5,https://play-lh.googleusercontent.com/a-/ACB-R5T-ntgxX_gy4N9HUGCiyKTjp1Sk5jOeCTw72UO5,tios game is the best game ever i am 9 years old and i thouth that scratch was the only progaming language but as soon as I downloaded this app i am learning python. THIS IS THE BEST APP EVER. I LIKE SOOOOO MUCH,1.0,1.4.46,,
5659,2021-03-11 07:02:18,,,5,,tAhmina'r PaaK Ghor,,POSITIVE,python,3ecc8b1f-1441-474a-8b0b-07e5fd092560,https://play-lh.googleusercontent.com/a-/ACB-R5QcSI3Pk7NUbi9upKloTHXvjdv4mAKKcfTP9mvq,Good app for python,0.0,1.4.46,,
5667,2021-03-10 04:25:28,,,5,,Bharath raj,,POSITIVE,python,99566fee-6421-4573-b323-d1f0acbbbd8a,https://play-lh.googleusercontent.com/a-/ACB-R5Qu7f6OSbyvXoswRnUxEtMzepUM4txbCIcoQtJIw3U,Cool to learn python,0.0,1.4.46,,
5793,2021-02-26 03:02:00,,,5,,Baishik Poddar,,POSITIVE,python,1a431f60-a418-4b53-915c-867a93dc5a30,https://play-lh.googleusercontent.com/a/AGNmyxZwKKJ4c0eNkrbdJbMrCFTVD0ANV-Mnl0adWlga=mo,Very good app for starters in python 3 programming language.,1.0,1.4.46,,
5841,2021-02-21 22:48:49,,,5,,Bhawna Mishra,,POSITIVE,python,0a1293de-15e3-4d7f-809b-99878cced47d,https://play-lh.googleusercontent.com/a/AGNmyxY0yhgQHAeyzr_5qxKp9_kvB5YLG6q8Hk40LGOr=mo,One of my child's favorite learning app of python.He can easily learn python and understand the concept of it. I make sure to keep eye on it and I always found he is learning code with this app and I feel that my child can be a programmer and can make career in programming.,0.0,,,
5843,2021-02-21 20:02:02,,,5,,Vikash Kumar,,POSITIVE,python,6d569aad-467c-4bef-8901-762641699d20,https://play-lh.googleusercontent.com/a-/ACB-R5RlfUS0flIX9yGzim7FOyyzCru45f1FI9ErU-NJ,Is in this app Can I learn python Please reply me. Ok Thanks To all members of programming hero team.,0.0,1.4.46,"Thanks a ton, Vikash! 😊
Glad you loved our app.

Please keep exploring Programming Hero and keep supporting us.

This month, you'll look hotter in your brand new profile page.

You can produce a baby robot in one night with your ""Python In One Night"" video course. 

Next is the C course. Stay tuned.

Love from Team Programming Hero! ❤",2021-01-14 01:53:02
