Unnamed: 0,date,developerResponse,review,rating,isEdited,userName,title,sentiment
0,2022-01-31 03:54:08,"{'id': 28235453, 'body': 'Hey, \r\nThank you so much for the great review! If you need any assistance feel free to reach us at hello@prghub.com, we are more than happy to serve you.-PS \r\n', 'modified': '2022-02-24T11:53:51Z'}","I feel obligated to do so for this one. I’m a complete noob in IT, programming, Coding, hacking, all of it. But, always had a huge interest in learning and knowing how to completely understand, build and use a computer, network, internet, virtual machines and websites. Though I don’t think I’m anywhere near knowledgeable enough to land any entry level job into any of the related fields, this app has really made learning the basics super user friendly and easy to comprehend. I’m not sure yet how in depth some of these courses go. But, I’ve started with the basics so far and can say I’ve grasped it all and retained most well. Which has always been hard for me. I bought the pro version, so I get certificates at the end of each course. I’m sure they’re not accredited with any sought after employers or firms but stepping stones towards the knowledge needed then applied in real life as practice would likely be sufficient in a year or two with consistent effort every day, multiple times a day in this app. I’m on day 2, completed 2 courses (fundamentals and SEO), I just started my 3rd (IT Basics) and don’t plan on stopping until every course is completed. Sorry for going on and on. Figured I could share as much as possible since I won’t be leaving anymore reviews on anything else for a solid 5 years or so.",5,False,Doug Parker - Hostile Ginger,"From the guy who never reviews apps & has NO background in computers, coding or related.",POSITIVE
1,2022-12-06 23:07:14,"{'id': 29149173, 'body': 'Hey \nWe are very happy that you find us to be the best. Your feedback keeps us motivated to make your learning experience absolutely enjoyable. If you need any assistance, feel free to get in touch with us at Hello@prghub.com so that we can help you better. Happy Learning!\n-PS', 'modified': '2022-12-06T23:07:14Z'}",I was always weary of the reviews but TRUST ME. You wanna practice certain things? Want to learn how to make a website? No? What about Python? No? How about Ethical hacking? You have over 50 different paths. You learn the basics.. once you complete the course you will have access to this area that you can mess with the codes and it shows you SO MUCH on what you can do. HTML has so much to offer and I can say you can easily put about 5000 hours into this app. Get the pro. I know paying for an upgrade is not the greatest BUT! It’s worth it. I was going to regret it until I figured out the amount of stuff you can do with it. Sololearn can’t compare to this. They have a community yes but I can’t do half of the things this app offers.,5,True,LeReviewer>_>,Well! This was unexpected.,POSITIVE
2,2020-11-10 05:08:14,"{'id': 19096924, 'body': 'Hi there,\r\n\r\nWe were grieved by the experience you had. We have worked hard to make everything right. We have a philosophy -Your issue is our issue and we leave no stones unturned, to get it rectified. You can always write to us at hello@prghub.com, for any assistance. We will be glad to help. - AS\n\n\r\n', 'modified': '2020-11-13T18:12:07Z'}","I bought Pro and am happy I did. A wide variety of topics, most lessons are compact and not wasting anyone’s time, and clearer explanations than other apps. However, there are a few bugs and the Grammar/English can be tough at times. To me, the point of language is to convey ideas, so it doesn’t matter if you use the wrong “your” or say ain’t, but some of these statements in here have to be read several times to make sense. Lots of typos. For bugs, my courses don’t track progress correctly. I refresh and the percentage hops around, even if I’ve completed the course. Completed courses don’t show up under completed. I’ve done six or seven and only one is there. I can’t change my name or picture even though I’m typing in my password correctly. I think the save button doesn’t work in the top right corner. Several random crashes. I am running the newest update of the app and iOS. Also, quit asking me to rate five stars after every lesson. I’ve rated 5 stars several times. Here’s 3 more",3,False,mullybigmully,"Worth it, but beware of bugs.",NEGATIVE
3,2022-07-03 19:36:54,"{'id': 30725795, 'body': ""Dear Friend,\r\nWe're glad that we’ve been helpful to you. It is our goal to make your learning experience truly delightful and enjoyable. Do recommend us to your friends too! :)If you need any assistance, please reach us at hello@prghub.com and we'll be very happy to assist you!\r\n-PS\r\n"", 'modified': '2022-07-05T12:03:22Z'}","I haven’t done much, but the few courses I’ve made it through have been easy to understand and not overly technical. So many of these programming apps and courses assume that the student has a certain level of understanding and at some point they become confusing if you aren’t familiar with whatever they assume you already understand about programming. These courses don’t make assumptions, so while some of it may seem remedial, it’s also nice to know that they aren’t going to suddenly start speaking a language you don’t understand, leaving you lost and frustrated. I’ve been happy with what I’ve seen thus far and I’m excited to continue learning through the app!",5,False,Famtwins,Impressed Thus Far!,POSITIVE
4,2020-02-05 13:40:23,"{'id': 13315801, 'body': 'Dear Friend,\nWe apologize that your experience with us less than satisfactory. We truly want the best for our learners. Can you provide more details about your experience so we can take note of it and make improvements on our future updates? Please reach us at Hello@prghub.com so that we can assist you better.\n-PA\n', 'modified': '2020-02-05T18:57:44Z'}","I’ve been using the app for several days and enjoying the basic information about programming and how well things are explained. Really nice to see something that focuses on the concepts first. 

Unfortunately, there are a few things that would stop me from buying the pro version. There are several small bugs in the basic course, and also in the function of the app that are surprising. You can’t use just your email to sign up, since the window is buggy. The feedback form isn’t obvious, but even when you eventually find it, it doesn’t submit correctly, meaning that there is no way to give feedback on the bugs. Another big thing is that there’s no indication as to what courses are only for the pro version, and what’s free. 

For casual use, a nice app, but needs work.",4,False,Takoon,Good information but buggy,NEGATIVE
5,2019-11-17 17:13:43,"{'id': 11929117, 'body': 'Dear Friend,\nWe are truly delighted to know that your experience with us has been great. It really helps us keep ourselves motivated to continuously improve our content and serve our learners better. If you need any help, feel free to get in touch with us at Hello@prghub.com and it will be our pleasure to assist you!\n-PA\n', 'modified': '2019-11-19T10:37:35Z'}",There are so many apps and courses that promise to give you all the starter materials/info you need to get started. Most fall short of expectations....but not Programming Hub!! This app is honestly one of the best on the market in terms of affordability and value. They add new courses very regularly and the ability to earn certifications is an added bonus (proving to others you know what you’re talking about). I recommend Programming Hub for anyone who wants to keep learning and growing their skills. Their customer support is also amazing. 10/10. Thank you for making an awesome app for aspiring full stack developers.,5,False,DigitalComms,AMAZING app for aspiring full stack developers!!,POSITIVE
6,2022-10-06 19:30:54,"{'id': 32493312, 'body': ""Hey, We're glad that we’ve been helpful to you. It is our goal to make your learning experience truly delightful and enjoyable. We also have advanced courses for advanced learners like you. Do recommend us to your friends too! :)If you need any assistance, please reach us at Hello@prghub.com and we'll be very happy to assist you! -NY"", 'modified': '2022-10-10T20:34:08Z'}","I’m rating this app 4 out of 5 because it would be nice to add an advance courses section.

Now! Don’t get me wrong for the promo price it’s a great app specially for the entire courses available and a plus for the certified completion certificate especially for beginners. Also if you love to listen more than reading it’s just great, it’s simple and it explains everything very simple. For example I am a financial advisor(licensed) and I have strong skills on investing and trading on stocks and cryptocurrencies so I have a vast knowledge on the field and I want it to give a shot to one of the courses included on this app and it is about creating your own crypto etc. I already know about this crypto world so I took a shot and I saw that it is very summarized and easy to understand for beginners.",4,False,JMcruzPR,4 stars out of 5,POSITIVE
7,2019-12-21 18:16:17,"{'id': 12525566, 'body': 'Dear Friend,\nWe apologize that your experience with us less than satisfactory. We truly want the best for our learners. Can you provide more details about your experience so we can take note of it and make improvements on our future updates? Please reach us at Hello@prghub.com so that we can assist you better.\n-PA\n', 'modified': '2019-12-22T09:32:41Z'}","I got this to learn programming languages like python and C++. I took the fundamentals course just to check it out. I already know HTML and CSS. If I didn’t I wouldn’t have been able to figure out this course at all! It asked questions related to things it did not teach. At one point it registered my answer as incorrect even though I did not choose that answer. The text is also often grammatically incorrect, with words in the wrong order. They required me to rate the app only a minute into the course and there was no way out of it. Trying to share the certificate I earned was impossible. I got the pro version because the “for life” option seemed like a good deal and this app came highly recommended from a friend. I will not be using this app. I saw that some of these problems were described a year ago, and the developer said they would fix it. They did not. I would like to get my money back, and I certainly question my friend’s judgement now!",1,False,Quellcrist,Definitely buggy and strange,NEGATIVE
8,2020-06-12 08:09:21,"{'id': 16061229, 'body': ""Hi Friend!\nThank you so much for updating your review for us! This made our motivation to provide the best quality content to our learners stronger. If it ain't too much to ask, we hope that you could update the title of your review as well as others may interpret it differently :) If you need any assistance, please reach us at Hello@prghub.com and we'll be happy to assist you!\n-PA\n"", 'modified': '2020-06-18T06:18:09Z'}","This app and its team is very fraudulent.I paid for the get lifetime access but still shows that I need to pay ... the customer support will respond to your queries till the time you have made the purchase and after they will not even respond to you or fix the issue .. there is no customer support number to call only email ...this is fraud team please please please stay away !!!!!!!!!!!!!!!!!!!!!!!!

Update :

The team responded and fixed the issue even though it took few days of back and forth emails .. appreciate it ! Hope it will work without any further issues and will remain life time access as promised ...hence I’m giving 4 stars for showing the honesty to fix it 🙏",4,False,hgy223,Fraud and please stay away from this app,NEGATIVE
9,2018-08-17 17:32:33,"{'id': 4717634, 'body': 'Dear Friend,\nWe apologize for the inconvenience caused. The content in the pro version is based on scientific research which comes in bite-sized information to ensure a deep learning experience. In order to provide you the best and to sustain ourselves, we had to monetize the course. The free content is available in the Learn section of the App.', 'modified': '2018-08-19T08:29:31Z'}","I wanted to get s clear understanding of JavaScript because I thought I had a bad base understanding of it. So I started searching around for apps because I can’t bring Pluralsight with me everywhere. I saw an app called “Mimo” and I started learning. After the first lesson it said I needed to upgrade to Pro. I mean come on! At least tell people in the description that you will charge them besides saying that it has in app purchases. So I continued looking for an app and I found this app. I thought there would be a catch, but I wasn’t sure. I downloaded the app and started on the JavaScript course. After 2 lessons, it says I need to upgrade to Pro! How annoying can you people get? Now, I’m speaking on behalf of other people when I say that not everyone has the money to buy an upgrade just after two lessons. At least make some courses free and others cost money.",1,False,PhantomWare_,Just another Mimo,NEGATIVE
10,2020-12-16 19:33:52,"{'id': 19860810, 'body': 'Hola, \r\n\r\nThank you for taking the time to provide a magical rating. Your opinion is valued greatly and it helps us to maintain the excellent standard of service. Anytime need support! - hello@prghub.com , is the address to reach out to. - AS\n\n', 'modified': '2020-12-18T18:33:36Z'}","It was a good Lesson. There was a little confusion on my_part about adding a space to go in between DogCat I’m guessing it would be Dog_Cat if you wanted a space between two strings/words... 
 
WORDSMITHS IDEA:  Most people don’t have a very good understanding of words and their message(s). The language or I meant to say the interpretation of the message is taken wrong a-lot of times because most single/plural word has a positive or a negative connotation. Like this prefix “con-“ actually means to learn and to be misleading others. So if we could fix the language problems like a computer, things would be more understandable ... !",5,False,WireWireWireYoYo,ProgramingHub: Variables(BOX)_My_Name,NEGATIVE
11,2018-11-25 16:46:29,"{'id': 6173496, 'body': 'Dear Friend, We sincerely apologize for the inconvenience caused and truly understand the difficulty faced. We would kindly request you to drop your email ID so that we can get in contact with you. We promise to look into the issue and correct it ASAP. Please get in touch with us at hello@prghub.com. Thank You for your patience. -SS', 'modified': '2018-11-30T06:22:20Z'}","I tried the free version just to see what I would be getting for my money.  I selected the Java course and got to the first quiz.  It asks, “what is  Java? I selected “it is a programming language”.  The system then comes back and says, “oops it’s not a video game or a desert island”. It’s obvious it’s not registering my answer.  I don’t see a way to skip over or continue without the programming registering my answer.  I wrote the company to let them know and give them a chance to fix it before I wrote this review. They responded right away but then never corrected the glitch. It’s been over a month now.  I have also deleted the app and downloaded it again.  I’m certainly not paying for something like this.  The app is suppose to teach you how to program but obviously they don’t know how to program their stuff correctly.  Frustrated to say the least.",1,False,Lyones79,Java glitch,NEGATIVE
12,2022-05-09 02:54:07,"{'id': 29729413, 'body': 'Hey,\r\nWe are very happy that you find us to be the best. Your feedback keeps us motivated to make your learning experience absolutely enjoyable. If you need any assistance, feel free to get in touch with us at h ello@prghub.com so that we can help you better. Happy Learning!\r\n-PS\r\n', 'modified': '2022-05-13T13:31:01Z'}","I’m a college student that took a photography/ web design class. I thrived up until now. The only coding experience is changing my MySpace layouts when I was in high school. My final projects are all coding assignments. After lots of panic, I stumble onto this app and after a couple free courses, my memory is jogged and I do not feel so overwhelmed by my finals. Also, the modules on the app are are short and to the point. If you suffer from ADD or whatever the case may be, I found the interactive module/ courses intriguing and extremely helpful.",5,False,Momplantx,Godsend,POSITIVE
13,2019-06-05 13:10:29,"{'id': 9046227, 'body': ""Dear Friend,\nWe apologize for the issues you've experienced. As a learning platform, we have to ensure that we only provide precise information to our learners. Please get in touch with us at Hello@prghub.com so that we can work on a solution together and improve your experience :)\n-PA"", 'modified': '2019-06-06T17:19:56Z'}",A good app with a lot of material. I have found a good amount of small typos and logic errors for example: in the IT basics course there is a diagram with arrows labeled “input” “output” “process” when really “process” should be in the middle and “output” should be last. There was a quiz on this later and I’m concerned that if I hadn’t already known that it would interfere with my learning. I tried to leave feedback suggesting the implementation of an error/typo found button so users can report these errors to get them fixed for future customers to they don’t get confused but when I tried to submit the feedback I got an error and couldn’t submit anything. Overall not a bad app and should help you learn the content,3,False,Dawson Paul,Not bad,POSITIVE
14,2020-07-30 16:37:36,"{'id': 16974331, 'body': ""Hi Friend!\nWe truly appreciate your feedback and support. Feel free to let us know if you're confused with a topic and we'll do our best to help you out and make your learning experience a delightful one. If you need any assistance, please get in touch with us at Hello@prghub.com and we'll be very glad to help you out.\n-PA\n"", 'modified': '2020-07-30T16:37:36Z'}",Frick why the heck do I have to buy Pro or share it on Facebook for some of the features. I’m too young for Facebook you morons. Also I bet you would make a lot more money if you lowered the price permanently of buying the pro Version. And I don’t mean a sale I actually mean permanently. If you hack me you would see that I have Facebook but that’s actually just messenger kids. But this is still a good app. Just lower the prices and get rid of that entire share on Facebook Thing. I bet you would have a lot more good reviews and a lot more customers if you just did that. Otherwise this is a great app.,4,True,LJDRAGONMAN,Great but one really bad problem.,NEGATIVE
15,2022-12-17 21:17:43,"{'id': 35298209, 'body': 'Dear Friend,\nThank you for your kind words.\nWe have received your query. Sincere apologies for any inconvenience caused. Please be assured that we are here to help you Can you please help us by explaining your issue in detail at hello@prghub.com so that we can assist you better :)\n-KY', 'modified': '2023-03-09T18:31:57Z'}","This is a great app. There are a few bugs in the app that causes some issues. The main one that I have noticed is when you all are using lists, it will only show the first item on the list, then when you click the next button, they are blank until you exit the list. Not sure if just having the entire list populate at once would help this or not.",5,False,Fullchaingang,Great app,NEGATIVE
16,2021-04-26 02:18:33,"{'id': 22569655, 'body': 'Hello, Apologies for the inconvenience caused to you. This is certainly not the experience, we wanted you to have. We would request you to please reach out to us at hello@programminghub.io . Rest assured, the issue will be fixed. - AS', 'modified': '2021-05-01T20:55:39Z'}","I like it, and can get through the often incorrect English grammar and word use (e.g., “Let’s Revise” ??  it should be “Let’s Review”).  I can’t find the dark mode switch which is advertised in the FAQ as being at the bottom of the settings pop-out from the Home Screen.  I can’t change my avatar.  I can’t pick my iOS voice of choice.  I can’t see all the matching items in a question...the scrolling doesn’t work, and the videos at the end of a module should be at the start. I purchased the 6th anniversary Lifetime Pro package, and I’m hoping you REGULARLY make updates to the app.  Thank you.",3,False,Stuke,"Hmmm, hoping for some app improvements",NEGATIVE
17,2021-12-08 23:21:15,"{'id': 27054700, 'body': 'Hello, Apologies for any inconvenience caused to you. We would request you to please reach out to us at hello@programminghub.io . Rest assured, we will try our best to convert it to a more positive experience for you.- AS', 'modified': '2021-12-26T12:16:26Z'}","I’m not sure what happened to the development team, but there are several BIG issues present on iOS 15 for iPhone 12 Pro Max users. For starters, the Back button doesn’t work. 

Also, I completed a new course and the Certificate said I couldn’t download it unless I complete the test… which I did. So it’s not recognizing completed courses… (not a big deal bc these Certs aren’t usable in a business environment)

And then there is the content itself. It’s great for beginners, but the courses I have taken don’t provide a great deal of depth. Don’t expect to get much outside of the bare minimum… which is enough to hold a conversation with someone… but not enough to fix a problem or start a project.",1,False,Kyle Puckett,Pro Lifetime Member > It’s a Subpar Experience,NEGATIVE
18,2019-12-04 12:43:43,"{'id': 12214828, 'body': 'Dear Panoptic,\nApologies for the delayed response.\nWe would like to thank you for taking your valuable time and giving your genuine feedback. You will be glad to know that we are constantly working on improvements.\nThe content is available offline, you have to download it once and it will stay offline till you have the app installed.\n\nFor In-App purchases, we do have limitations based on platforms hence while making the purchase on mobile platforms the pro version is active only on the platform on which the Purchase was made. However we ask our users to contact us via email to activate the Pro version on other platforms, which is done for free.\n\nThere are number of offers going on within the app, and we extend the offers on user demand. The countdown might have some issues on the implementation end, we will check and fix it ASAP, thank you for pointing it out.\n\nAs for your progress, we would  love to know more details about it to help us understand the issue and work on a solution as soon as possible. \n\nWe appreciate your Time and Efforts to help us make the app better, you can always reach us out at Hello@PrgHub.com for any queries, we will be happy to help :)', 'modified': '2019-12-04T19:19:14Z'}","This app is, an app trying to teach you programming, is riddled with errors. Both in the logic it is trying to teach you and the app it self. 

The app seldom saves your progress. So if you want to do the same lessons over and over again, sure get it. But to me this is annoying and a waste of time I don’t have. 

Second don’t buy into their possible UDAAP violating count down on your special deal price for membership. It appears to count down making you think you need to hurry and purchase but give it an hour and go back in and surprise! It’s reset. Oh also if you want web access too you need to purchase your membership on the web. Buy it through the phone and you won’t have it. They don’t tell you that. 

Everything about this app screams scam to me. There are plenty of sites teaching this stuff for either free or cheap and plenty of books in the library. I figured it may be nice to have something on my phone to jog my memory on my commute to work but boy was I wrong. I’ll just bring my kindle as well.",1,False,panoptic,This isn’t an amazing app. Don’t trust the reviews,NEGATIVE
19,2018-02-22 08:52:01,"{'id': 4580160, 'body': 'Dear Friend, We sincerely apologise for the delayed response. We are glad to inform you that we Have Launched a New Version for our Application with Lots of New Content, Courses, Features and Bug Fixes. We would kindly request you to Update to the Latest Version to enjoy the Latest Content, Courses & Features. If you face any issues regarding the same, do not hesitate to reach us out at hello@prghub.com. We will surely help you out. Happy Learning!', 'modified': '2018-08-08T14:05:07Z'}","This app was my favorite for reference. It didn't have anything behind payments, all the information was a few taps away. Now its a completely different app targeted at training. The courses that are offered are tap to continue slide shows with questions at the end. Most of the languages aren't available because the course for them is being prepared, which is frustrating because it used to all be there in the old version. This is 2 different apps... I only wanted the first version. I have no problem at all deleting this new version, there are better courses than this that are free and finished. 0 stars for the new version, 4-5 stars for the old version.",1,False,jsmartin83,Completely different app,NEGATIVE
