Unnamed: 0,date,developerResponse,review,rating,isEdited,userName,title,sentiment
132,2022-12-29 14:50:39,"{'id': 32855247, 'body': ""Hey Friend, \nWe're glad that we’ve been helpful to you. It is our goal to make your learning experience truly delightful and enjoyable. Do recommend us to your friends too! :)If you need any assistance, please reach us at Hello@prghub.com and we'll be very happy to assist you! \n-NY"", 'modified': '2022-12-29T14:50:39Z'}",This works well for people new to the industry and its a great thing to do while you have down time at work.,5,True,Killer Klown )~,Works great for basics,POSITIVE
133,2022-11-03 19:22:30,"{'id': 35298081, 'body': 'Dear Carlsoel,\nThanks for the awesome review, We work hard to meet expectations like yours, and we’re happy to hear we hit the mark for you. For any assistance do not hesitate to reach out at Hello@prghub.com, we would be very happy to support you\n-KY', 'modified': '2023-03-09T18:24:48Z'}",I like how the lessons are arranged so far. I’m still only on the 1st lesson. But it’s easy to understand and work through. No complaints so far!,5,False,Carlsoel,So far so good,POSITIVE
134,2020-12-01 12:27:40,"{'id': 19525899, 'body': 'Hi, \r\n\r\nWe were grieved by the experience you had. We have worked hard to make \reverything right. Please update with a more positive rating. It would be gratifying to us. We request you to please reach out to us at hello@prghub.com. Rest assured, your issue will be resolved. Thank you. - AS', 'modified': '2020-12-03T19:55:41Z'}",This app helps break everything down better than any other that I have tried. I would give 5 stars but when purchased it previously and made an account I attempted to go back recently and use my pro version but it won’t recognize I have already paid. I have my receipt and showed the account I purchased with but haven’t received anything.,1,False,TsaikaJen,Really amazing,NEGATIVE
135,2020-05-20 07:38:02,"{'id': 15463132, 'body': 'Dear Nick,\r\nThank you for taking your valuable time and giving a genuine feedback, we do welcome criticism, it help us improve more and more.\r\nWe agree that there are Plenty of free resources available online each resource has their set of audiance, our courses are targeted towards absolute beginners who find it difficult to learn programming.\r\nAn Intermediate or an Expert will find our courses to be very basic and will have a similar feedback to yours, but if a beginner takes our courses he will find it simple and easy to understand. Most of our users have thanked us for making the courses in such a way.\r\nOur Certificates conveyst that the person has completed our courses which are backed by Scientific research and teaching methodologies.\r\nFeel free to get in touch with us at Hello@PrgHub.com for any query, we will be happy to help :)\r\n-Team Programming Hub', 'modified': '2020-05-21T08:00:18Z'}","Filler content with grammatical errors. Does it matter that unity was founded in 2005?? Uses game addictive techniques to pretend to teach but really its just giving you a good feeling for getting simple answers. Plenty of great sources out there with real world teaching that gives real world results. Try khab academy, its free and actually has useful content. This is a money grabbing scam. certificates don’t mean anything from this app! They’re useless to employers!",1,False,Nick21305,Garbage,NEGATIVE
136,2022-04-25 10:51:43,"{'id': 29495044, 'body': ""Hey,\r\nWe're glad that we’ve been helpful to you. It is our goal to make your learning experience truly delightful and enjoyable. Do recommend us to your friends too! :)If you need any assistance, please reach us at hello@prghub.com and we'll be very happy to assist you!\r\n-PS\r\n"", 'modified': '2022-05-01T13:08:51Z'}",Breaks everything down in easy ways to learn. Only drawback is having to pay 20 % of the way into each lesson.,5,False,Fully530,Cool way to learn,NEGATIVE
137,2022-09-30 16:22:21,"{'id': 32493300, 'body': ""Hello, We're thrilled to receive such a great rating. Thank you. We are gleeful to know, that you are having a mesmerizing experience with us. We're always at your service when you need us at hello@prghub.com.- KY"", 'modified': '2022-10-10T20:33:03Z'}",I am nine. I used to take coding classes that were paid. I love this app because it’s so easy to learn and most of its free! Exept I don’t know how to put a file on a web. Browser 5 stars definitely!,4,False,HotMessJess915,I love this app!,POSITIVE
138,2022-08-08 16:25:30,"{'id': 28235652, 'body': 'Hey,\nApologize for the inconvenience caused, please reach us at hello@prghub.com, so that we can help you by resolving the issue. We assure you that we are always here to help you.-PS', 'modified': '2022-08-08T16:25:30Z'}",I can’t use pro features even though I’ve already subscribed for it. It’s the second time to happen like this.🤷‍♂️🤷‍♂️,4,True,William Mirk,A great app but has some problems!!,NEGATIVE
139,2022-05-01 16:32:05,"{'id': 29548402, 'body': 'Hey \r\nSincere apologies for the inconvenience caused, we understand how frustrating it will be.  Please reach us at hello@prghub.com, so that we could help you better.\r\n -PS\t\r\n', 'modified': '2022-05-04T08:51:18Z'}","My HTML Cert won’t show up in completed Certs 
I cant set up a profile says user not found
I can’t access the website from anyones phone
Completed courses will not show up in my learn page and when I click on the course again it says 0% complete even though I have the cert. I need assistance I’ve sent emails with screenshots",1,False,greyfern,I need support,NEGATIVE
140,2022-02-28 13:34:50,"{'id': 28376092, 'body': 'Hey, \r\nApologize for the inconvenience caused, please reach us at hello@prghub.com, so that we can serve you better-PS', 'modified': '2022-03-04T07:57:04Z'}",This is best app to learn programming but there is a problem whenever I try to write python program it says error although I wrote right so pls do something.,5,False,SHITVIP,Awesome app👌👌👌👌👌👌👌👌,NEGATIVE
141,2020-11-06 20:42:29,"{'id': 18903387, 'body': 'Hola, \r\n\r\nThank you for taking the time to provide a magical rating. Your opinion is valued greatly and it helps us to maintain the excellent standard of service. Anytime need support! - hello@prghub.com , is the address to reach out to. - AS\n\n\r\n', 'modified': '2020-11-06T20:42:29Z'}","I recommend the full version, I like that the voice AI reads to you and the review videos at the end of each lessons",5,True,Ink'n Bass,Very good learned a lot,POSITIVE
142,2022-01-03 15:39:24,"{'id': 28235734, 'body': 'Hey, \r\nThank you so much for the great review! If you need any assistance feel free to reach us at hello@prghub.com, we are more than happy to serve you.-PS \r\n', 'modified': '2022-02-24T12:06:20Z'}",I’m a noob and I was able to learn quite a bit from this and from lifetime purchase I can put it down for months and come back to it when I need it. Great job.,4,False,DeliverTheNoise,Great app.,POSITIVE
143,2020-10-28 16:16:40,"{'id': 18753998, 'body': ""Hi Friend!\r\nWe're glad that we’ve been helpful to you. It is our goal to make your learning experience truly delightful and enjoyable. Do recommend us to your friends too! :)If you need any assistance, please reach us at Hello@prghub.com and we'll be very happy to assist you!\r\n-PA\r\n"", 'modified': '2020-10-28T16:16:40Z'}",Easy and very well done. I have tried several other boot camps and applications. This is by far one of the best I have used. Very informational and direct. Has helped me tremendously.,5,True,~The Message~,Great Application,POSITIVE
144,2019-07-10 16:36:49,"{'id': 9624468, 'body': 'Dear Friend,\nWe are truly delighted to know that your experience with us has been great. It really helps us keep ourselves motivated to continuously improve our content and serve our learners better. If you need any help, feel free to get in touch with us at Hello@prghub.com and it will be our pleasure to assist you!\n-PA', 'modified': '2019-07-12T06:19:06Z'}",Been using this app for a 4 days now and so far it is great. Easy to follow and they keep you active by giving you a little quiz at the end. I’m new to programing and this app is helping toons.,5,False,Dee_1957,Best Programing app ever,POSITIVE
145,2020-01-03 05:17:57,"{'id': 12706860, 'body': ""Hi Friend!\nWe're glad that we’ve been helpful to you. It is our goal to make your learning experience truly delightful and enjoyable. Do recommend us to your friends too! :)If you need any assistance, please reach us at Hello@prghub.com and we'll be very happy to assist you!\n-PA\n"", 'modified': '2020-01-03T12:33:30Z'}",I love the approach they took with the Data Science course by going through the actual process starting with collecting and cleaning data before they go into a single line of python.,5,False,Symphony Crack Orchestra,Unique Approach,POSITIVE
146,2019-04-11 00:22:05,"{'id': 8168975, 'body': ""Dear Friend,\nWe're glad that you're enjoying our courses. Our goal is to provide you with a learning experience that's full of fun. Please recommend us to your friends too! :) If you need any assistance, please get in touch with us at Hello@prghub.com and we will be very happy to assist you.\n-PA"", 'modified': '2019-04-11T10:35:56Z'}",This is a great app with content designed to be understood users of all levels. The interface is user friendly and I look forward to completing more courses.,5,False,ELDUBYAH,Programming Hub Review,POSITIVE
147,2022-01-28 18:17:54,"{'id': 28235459, 'body': 'Hey,\r\nYour feedback really means a lot for us, and if you need any assistance feel free to reach us at hello@prghub.com, we will be happy to help you-PS\r\n', 'modified': '2022-02-24T11:54:06Z'}",The program is great and I am really having fun with the app. The course is easy too understand and the graphic are great.,5,False,NiecyB@72,Interactive,POSITIVE
148,2023-02-11 23:51:41,"{'id': 35279232, 'body': ""Dear Friend\nWe'd love to offer everything for free but we have to balance between free sustainable content and an awesome user experience and for that, we had to sustain our team of experts. We also apologise for the fact that the UI was not responsive at times.\nPlease reach us out at Hello@PrgHub.com, we will definitely reach you with a solution that makes you delighted.\n-KY"", 'modified': '2023-03-08T20:59:26Z'}",It doesn’t have very much free content but from what I did experience I didn’t feel like it was worth the money. Some buttons wouldn’t work. When I hit the back button it wouldn’t go back. When I hit what course I wanted to take it wouldn’t do anything.,2,False,Matt8385727,Unresponsive,NEGATIVE
149,2019-06-06 06:32:44,"{'id': 9046238, 'body': ""Hi Friend!\nWe're glad that we’ve been helpful to you. It is our goal to make your learning experience truly delightful and enjoyable. Please recommend us to your friends too! If you need any assistance, please reach us at Hello@prghub.com and we'll be very happy to assist you!\n-PA"", 'modified': '2019-06-06T17:21:04Z'}","I CAN STUDY ON THE GO

AND ITS SO SIMPLE AND CLEAR.
i hate classes that are boring and I wanted something i can also refer to when i am on the computer. It also has cheat sheets very helpful when I forget a comand!",5,False,FunnyHatterDude,Love this app. Yes I payed for everything!,POSITIVE
150,2021-11-25 17:12:02,"{'id': 27054596, 'body': 'Hola, Thank you for taking the time to provide a magical rating. Your opinion is valued greatly and it helps us to maintain the excellent standard of service. Anytime need support! - hello@prghub.com , is the address to reach out to. - AS', 'modified': '2021-12-26T12:08:35Z'}",This app is fun way to learn or review the basics of many programming languages. It’s great for those times when you’re on the go and want to get some coding instruction.,5,False,NewDeveloper21,Cool!,POSITIVE
151,2019-05-29 02:08:57,"{'id': 8921948, 'body': ""Dear Friend,\nWe apologize for a less than satisfactory experience with us. We'd love to learn more about the issues you have faced. May we request you to write to us at Hello@prghub.com so we can work together to find a solution? It would be our pleasure to help you out.\n-PA"", 'modified': '2019-05-29T16:43:38Z'}","I’m only at the beginning two topics so far but I’ve found a problem with them. The questions are very vague, it only explains something and asks you to choose the correct answer.",4,False,Samuel724414,Pretty good,NEGATIVE
152,2022-10-30 18:56:10,"{'id': 32968713, 'body': 'Dear Friend,\n\nWe apologize for the inconvenience caused. Each course is designed from its basics so that even beginners can learn easily and we are striving to update our content for experienced learners like you. We take all efforts to give the best learning experience for both experts and beginners. We will definitely note your feedback and make the necessary changes to make the experience wonderful for our learners. Can you please share your expectations at hello@prghub.com , so that we could note them down and work on them as a priority? \n\n-NY', 'modified': '2022-11-04T08:02:56Z'}","Original review: 
This app is hands-down the best for learning C#. But please, PLEASE make a night/dark mode. The brightness deters me from having the nightly reviews that I need to.

Updated:
This app teaches fundamentals and alludes to an Advanced C# course that doesn’t exist. The C# completion test within the only C# course references things that are never taught. So I just wasted my money on Pro. Thanks.",1,False,heliomagnolia,Changed my Review,NEGATIVE
153,2021-08-24 16:37:42,"{'id': 24775101, 'body': 'Hello, Seeing that you had a 5-Star experience, is the best thing we could hope for! Thank you. Your review means a lot. We look forward to serving you, for many years to come at hello@prghub.com.- AS', 'modified': '2021-08-28T20:05:50Z'}",This app is a great app for beginners. It has a ton of coding languages to learn and it even tells you about hacking! I love this app and I hope every one does too!,5,False,The DHT's,Great App!,POSITIVE
154,2020-11-26 21:29:46,"{'id': 19438604, 'body': ""Hey, \r\n\r\nWow! Thank you. This is what we always love to see. A good positive experience and an awesome rating. \rWe did it right this time. We'd love to hear more from you at hello@prghub.com. - AS"", 'modified': '2020-11-30T13:14:17Z'}",...but let’s be real. This is great for a good basic understanding of each offered. It is very well much worth the price if you are really about it.,5,False,ITHINK GENIUS,Sure I’m no genius,POSITIVE
155,2020-05-26 05:19:48,"{'id': 15651000, 'body': ""Dear Friend,\nWe're glad that you're having a great time with us. Every little encouragement helps us continuously improve :) Please get in touch with us at hello@prghub.com with regards to the issue you're facing so that we can help you sort it out and become worthy of your 5-star review :)\n-PA"", 'modified': '2020-05-29T10:39:53Z'}",The app is amazing and everything but the issue I have with it is i cant click the links it gives me and i cant do the exercises at all. And i dont know how im gonna truly learn if i cant do it hands on 😞💔,4,False,Bboyraf,Link issue,NEGATIVE
156,2020-04-12 22:50:44,"{'id': 14637937, 'body': 'Hi Friend!\nThank you so much for your support. We will definitely take note of your feedback so that we can improve our service further. If you need any assistance, please contact us at Hello@prghub.com and we’ll be more than happy to help you :)\n-PA\n', 'modified': '2020-04-13T18:18:46Z'}",The trial is ok but the pro version is great. Developers should consider allowing at least 1 cert without purchase. All aside having fun so far easy setup and easy to utilize the courses.,5,False,Jess Detkowski,Pro hub,NEGATIVE
157,2020-08-23 11:38:05,"{'id': 17514637, 'body': ""Dear Friend,\nWe apologize for a less than satisfactory experience with us. We'd like to request for some more details about the issue you've faced. Please get in touch with us at Hello@prghub.com so that we can work to resolve this together as soon as possible :)\n-PA\n"", 'modified': '2020-08-26T12:31:37Z'}","Hi, I have a bad experience of losing my progress in 4 free courses. I was learning the stuff and lessons were very interesting. Once I log out after I finish completing my learning goal and next time I logged in my previous progress was gone and only in-progress courses were appearing in my profile. I have spent many hours to complete the courses and now its just gone 😟.",1,False,Jelly1239,Progress Gone,NEGATIVE
158,2021-12-15 06:32:00,"{'id': 27054662, 'body': 'Hola, Thank you for taking the time to provide a magical rating. Your opinion is valued greatly and it helps us to maintain the excellent standard of service. Anytime need support! - hello@prghub.com , is the address to reach out to. - AS', 'modified': '2021-12-26T12:11:48Z'}",So easy to learn on the go. I’m actually learning how to read c# on my phone. Highly recommend.,5,False,kaylee bora,Great app for learning a lot of in demand skills,POSITIVE
159,2021-07-14 07:03:30,"{'id': 23973857, 'body': ""Hello, We're thrilled to receive such a great rating. Thank you. We are gleeful to know, that you are having a mesmerizing experience with us. We're always at your service, when you need us at hello@prghub.com.- AS"", 'modified': '2021-07-16T21:12:54Z'}","I paid the lifelong using of this app, but it still shows that I have to pay Pro to continue learning. It is so annoying.",4,False,shcnxid,Review,NEGATIVE
160,2022-06-24 00:56:57,"{'id': 30575594, 'body': 'Dear Friend, We are truly delighted to know that your experience with us has been great. It really helps us keep ourselves motivated to continuously improve our content and serve our learners better. If you need any help, feel free to get in touch with us at hello@prghub.com and it will be our pleasure to assist you! -PS', 'modified': '2022-06-27T10:21:10Z'}",So much good content for learning instead of scrolling through social media.,5,False,JHutch89,Amazing app for learning on the go,POSITIVE
161,2019-12-28 21:02:20,"{'id': 12652404, 'body': ""Dear Friend,\nWe're glad that you're having a great time with us. Every little encouragement helps us continuously improve :) So, if you like our app, please consider increasing your rating for us. If you have any suggestions, please let us know at Hello@prghub.com. We'll be very very happy to hear from you!\n-PA\n"", 'modified': '2019-12-30T17:05:42Z'}","While I have yet to complete all that programming hub has to offer. I am super engaged in the easy flow of information. And sport anticipation for more, with each completed topic.
I use it daily thus my knowledge increases.
Thank you",4,False,BaerITaLL,Paced learning ...,POSITIVE
162,2019-06-04 11:37:15,"{'id': 9016875, 'body': ""Hi Friend!\nPlease take your time to learn and browse through our wide variety of content. If you think that we deserve a 5-star review, then please don't hesitate or kindly let us know how we can improve further. Feel free to reach us out at Hello@prghub.com if you need any help and we'll be very happy to assist you! :)\n-PA"", 'modified': '2019-06-05T04:21:56Z'}",I still don’t completely understand this yet but I’ll get it the more I practice I understand a lot about the hardware of computers and I’m still working on learning and understanding the software end of it.,4,False,OoOSuPeRNoVaOoO,Not Bad,POSITIVE
163,2023-02-12 16:50:01,"{'id': 35279109, 'body': 'Dear Friend,\nWe apologize for any inconvenience caused and we ensure to make each and every learner of ours happy. Can you please reach us at hello@prghub.com\xa0so that we can communicate and serve you better?\n-KY', 'modified': '2023-03-08T20:50:27Z'}","I don’t know if it was a recent update or what but the application will NOT stop telling me I’m a pro user, it stops the lesson and returns me to the central hub after the notification is actuated and responded to in various ways. Hope this is fixed soon.",2,False,DisNoth,App was neat but is now unusable with payment.,NEGATIVE
164,2022-02-18 20:19:37,"{'id': 28214821, 'body': 'Hey,\r\nYour feedback really means a lot to us. We will definitely take note of your review as we actively work on improvements to provide you with a much better service. If you need any assistance feel free to reach us at hello@prghub.com, we will be happy to help you-PS\r\n', 'modified': '2022-02-23T13:06:34Z'}",I’m loving it so far. Please reduce the lecture time. Like now I have about 8 hours to wait for before my next lecture. I’m on free mode though. Lol 😂 thanks. I love it,5,False,EndNigeria,Love it 😍,POSITIVE
165,2019-10-05 13:58:21,"{'id': 11071955, 'body': ""Dear Friend,\nWe apologize for a less than satisfactory experience with us. We'd love to learn more about the issues you have faced. Please get in touch with us at Hello@prghub.com so that we can work on a solution together :)\n-PA\n"", 'modified': '2019-10-05T18:21:27Z'}","I was not able to install this app. I did download it but when tried to launch it displayed the progress icon but didn’t go further than that. Tried 4 times. Environment: iPhone 8 Plus, software version 13.1.2",3,False,Mar-feja,Couldn’t install,NEGATIVE
166,2021-02-23 17:50:12,"{'id': 21289888, 'body': ""Hello, \n\nWe're thrilled to receive such a great rating. Thank you. We are gleeful to know, that you are having a mesmerizing experience with us. We're always at your service, when you need us at hello@prghub.com.- AS"", 'modified': '2021-02-25T12:19:02Z'}","I am currently attending University of Phoenix and this app is a big help in understanding and the how’s of variables, strings, etc... Thank you for making a free easy to understand lingo to programming language, especially C#.",5,False,Dusted Gaming,Simplified,POSITIVE
167,2022-04-03 14:21:18,"{'id': 29149201, 'body': ""Hey,\r\nWe're glad that we’ve been helpful to you. It is our goal to make your learning experience truly delightful and enjoyable. Do recommend us to your friends too! :)If you need any assistance, please reach us at Hello@prghub.com and we'll be very happy to assist you!\r\n-PS\r\n"", 'modified': '2022-04-13T12:47:01Z'}","Perfect, whether you are just beginning your coding journey or are a more experienced coder looking to brush up on your skills!",5,False,LuvizintheHeir,Loving this app!!!,POSITIVE
168,2021-09-07 09:54:16,"{'id': 25010747, 'body': 'Hello, Seeing that you had a 5-Star experience, is the best thing we could hope for! Thank you. Your review means a lot. We look forward to serving you, for many years to come at hello@prghub.com.- AS', 'modified': '2021-09-09T20:18:30Z'}",It the best coding system I have used it makes difficult tasks easier,5,False,manirex,Great,POSITIVE
169,2019-03-15 16:01:17,"{'id': 7762696, 'body': 'Dear DrRuss,\nWe sincerely apologize for the inconvenience caused and truly understand the difficulty faced. We would like to inform you that the Courses are designed for Beginners to give a headstart into the World of Programming. We have over 22+ Courses which can be accessed if you upgrade to Pro Version. We would like to know more about where we failed to meet your expectations during your learning process at hello@prghub.com so that we can look into it and improve ourselves. Thank you for your patience. -SS', 'modified': '2019-03-16T15:42:32Z'}","I’m halfway through the free courses, and I haven’t even learned anything about computer language yet. The format is really easy to follow and easy to understand, but I really wish you would get to the meat and potatoes of the programming already.",3,False,DrRuss888,OK...but haven’t done much,POSITIVE
170,2018-12-30 01:47:34,"{'id': 6614015, 'body': 'Dear Friend, Thank you very much for the review and your feedback is of a great value for us. We are glad that you are happy with our application. Keep loving and supporting us. We will definitely keep you satisfied and provide you with the best learning experience. -SS', 'modified': '2018-12-31T07:04:13Z'}","I really like the app, I just wish that they wouldn’t have a premium version but I know that they have to create money. It still helps me learn though which is very nice so good job to the developers.",4,False,Jeuebenso,Really nice,POSITIVE
171,2020-10-07 11:35:51,"{'id': 18413556, 'body': ""Hi Friend!\nThank you for your wonderful feedback! Our goal is to make your learning experience with us enjoyable and straightforward. Do recommend us to your friends too! :) If you need any assistance, please reach us at Hello@prghub.com and we'll be very happy to assist you!\n-PA\n"", 'modified': '2020-10-12T05:38:44Z'}","I'm currently taking the Unity course. I absolutely love it! Now, I have a better understanding of how the game engine works. Thanks to all app developers who helped make this app!",5,False,Paper 818 (user on YouTube),Amazing!!!,POSITIVE
172,2021-06-19 20:42:07,"{'id': 23508595, 'body': 'Hello, Our sincere Apologies for the inconvenience caused. This is certainly not the experience, we wanted you to have. We would request you to please reach out to us at hello@programminghub.io . Rest assured, the issue will be fixed. - AS', 'modified': '2021-06-21T20:38:33Z'}","I loved this app because it’s a great way to learn coding but it crashes every time I try to get in a course.
It would be better is there were more bug fixes and less bugs",3,False,BizMarquee2343222,It’s great but...,NEGATIVE
