Unnamed: 0,reviewId,userName,userImage,content,rating,thumbsUpCount,reviewCreatedVersion,date,replyContent,repliedAt,sentiment,matched_python,matched_stem
1827,fc687f13-2a30-45ec-8810-03da34c19197,Lev D,https://play-lh.googleusercontent.com/a-/ACB-R5RtTkWtNCiKpJpikNoFa2twjEBikO69lUbL2REuaQ,"Installed the app to refresh SQL knowledge. I was about to abandon the app when I had to choose between web development and python. Luckily, at last I found the course I needed. Having finished the course, I find it pretty boring, with too simple tasks that didn't really reinforce knowledge. Especially it was inconvenient to type commands on the phone keyboard. + No free certificates :( On the good side, the gamification engine with streaks and leaderboards seemed engaging.",3,73,3.111,2023-01-15 16:05:39,"Hi there, thank you for the feedback. We also have a web version now for people who prefer to type the codes instead of studying on their phone. We already keep all our content for free so a few things are available for Pro users only such as certificates!",2023-02-09 08:40:47,NEGATIVE,python,"streak, leaderboard"
2333,d14054fb-c609-40ea-b6c6-63e3e689f1f0,waffle master,https://play-lh.googleusercontent.com/a-/ACB-R5TV7dYnuLOQMrjBsGxec3_6vgkqZZ18PQUPvt69,"The app is good and I learned python from it. I'm giving it 3 stars because when I run out of hearts, I can't do any more lessons for 3 hours. I can't even practice to get the hearts back. So that's why I lost my hard earned 82 day streak. The app also crashes when you run out of hearts. I would love if you can fix this, that the app will be amazing!",3,0,,2022-12-21 15:14:45,,,NEGATIVE,python,streak
2391,35a23eb6-a8ca-469f-9122-09cb246a574e,Jakub M,https://play-lh.googleusercontent.com/a-/ACB-R5Rv_MpMCibAd2sOwHWH0JAiyA8ThwYH7ifuP9fp,Overall great app but glitched af can't progress in python lessons becuse everytime i finish one lesson it does not count it even tho i finished it im getting 0Xp for it and can't progress to next lesson please fix as soon possible couse is unplayable right now.,3,0,3.107,2022-12-18 04:13:00,,,NEGATIVE,python,progress
8772,c82ed61c-42df-4449-a9b2-82cc4580a00b,Hammoudi Sh,https://play-lh.googleusercontent.com/a-/ACB-R5QcKTdk0hKWEXLJFG-mWUhDesm-Mf_SUVCXVIlIWg,"THIS IS THE PERFECT APP I NEEDED! i tried programming hero and programming hub and some other apps, but no one worked with me. BUT I CANNOT BELIEVE IM FINALLY KNOWING HOW TO CODE BECAUSE OF THIS! Thanks you so much for this amazing app. Edit: this app was really amazing until the new update where i lost all my progress. Im not a professional python programmer but i still have more to learn. Like suddenly the app resets all the progress and now i need to start from variables.",5,2,3.83,2022-06-10 17:47:42,,,NEGATIVE,python,progress
8843,cf18e88e-e716-4daa-a93d-ab6a70bc4f90,Larry Garver,https://play-lh.googleusercontent.com/a-/ACB-R5R3nvUKd7puJGc2B8u9BceYuSx9M_CklCmSwSJT,Love this app! Great starting point for learning python.,5,0,3.83,2022-06-08 12:08:32,,,POSITIVE,python,point
9396,f74f6123-ebc2-441c-93f9-24820739a43d,mark reilly,https://play-lh.googleusercontent.com/a-/ACB-R5SC99ETMZ3d4BXA3oh4fkHgpFUFY2DJpgDqQxJEtQ,Ok could be a few more languages even if it's pro only so far looks like html SQL python and CSS there might be more in pro but I can't account at moment as still behind pay wall its number 1 on play for a reason nice social with projects and playrooms so I give it 5 stars the pay part is so we can cloth and feed the dedicated developers im fine with that also if its hard to learn with this style of teaching simple get a note pad and make notes for future reference no time limit,5,0,3.80,2022-05-19 08:57:55,,,POSITIVE,python,social
10515,d35d134c-83a9-4c91-8e84-3ebd0f5a7111,Bob The Dog Gangster,https://play-lh.googleusercontent.com/a/AGNmyxYyCctfHAgqlehvpzIJKzs25BFTTA_bMLom8Yie=mo,I personally learned a lot of stuff like that when you want to make something strong like the word dog slaps cat you do this * dog slaps cat * and if you forget something you just swipe and It is like Duolingo but for coding as a unity user I am glad I found this now I will be using python to create a social app were you can see who whatchrd which message,5,0,3.75,2022-04-06 15:28:50,,,POSITIVE,python,social
11124,10115134-1521-432c-9cd3-391a4f835405,Opwonya Daniel,https://play-lh.googleusercontent.com/a-/ACB-R5Tzw56FqT7gdTPO8kZJMkZc3niG_rbZVRr54MEhaA,"What's up guys , it's a good application for learning programming but here is my challenging question from my side to the developers and managrment of this application ;can I also receive my certificate immediately after paying for the monthly pro version/plan? Remember that am talking about the web development part not python and SQL",4,0,3.72,2022-03-12 10:03:35,,,NEGATIVE,python,challeng
13317,8b8b3c17-b93f-4532-bbeb-9c351bbeed79,myew,https://play-lh.googleusercontent.com/a-/ACB-R5RMd9yGinIG4zF_ehr6SlxA5NMx031kA7NjHlHGZA,"I love it! It's like Duolingo but with drastically better explanations and for code. I wasn't super serious about learning python but with every new function I've learned, I've gotten more and more excited about it and have been playing on this on all of my work breaks. I can tell that A LOT of thought and careful planning went into making this app and I really really appreciate it!",5,45,3.58,2021-12-03 00:17:24,,,POSITIVE,python,break
13726,d6691582-ac5e-4d1a-ae61-7b51a1ebc29f,Zetsu Tsuletsu,https://play-lh.googleusercontent.com/a-/ACB-R5St4pKiEwDMvxWRY-2R8ozKFqFpme1kNM4nFfyZiQ,So far so good. Learning the basic of the basics of python. Will update If I'm unsatisfied with my progress.,4,3,3.55.1,2021-11-15 14:32:52,,,POSITIVE,python,progress
13938,1823c1dc-7665-4ee0-bce3-48708cea3fa8,Rahul Khare,https://play-lh.googleusercontent.com/a-/ACB-R5TSftxL5SozcE-vHjNvHHYs_JQkxLGDeQop_Rc45A,Used it to learn python. Worked fine till a little beyond intermediate. Then said I was offline even though I was not. Logged out and all my progress was lost. While teaching it was pretty good. Too bad it has a severe technical glitch. Would not recommend.,1,4,3.54,2021-11-08 05:07:46,"Yikes! We're sorry to hear you've run into an issue. To get to the bottom of the issue, please tell Johanna at support (support@getmimo.com) what exactly happened. She's great at figuring such things out.",2021-11-08 08:23:11,NEGATIVE,python,progress
14100,91859d06-bd01-42c8-9424-6e67a4fd32a3,Nasim Obeid,https://play-lh.googleusercontent.com/a-/ACB-R5SLBgFG6zlpIqAYzjLooDAUFqtmoFQgLV2q7JpfeL8,"It's a Good coding app but horrible customer service. After an update that removed half of the courses, my progess in the python track has been completely reset. I contacted customer service but they weren't very helpful retrieving my progress. They told me that I have to make sure I'm using the right account. But Im using the right account then how was I able to access premium in the first place? I just don't think they care for their users. You'll be spending $30+ annually for bad support",2,38,3.53,2021-11-02 00:11:50,,,NEGATIVE,python,progress
15072,9ccf1a42-1347-4dc7-a898-30669c75cd5f,Piyush Raghav,https://play-lh.googleusercontent.com/a-/ACB-R5SMl7MpjXoAv1G5xJxAtc_7NB9rpyN0oHtGJWruJA,Awesome app and great for learning the python language..... And the plus point is that this app also provides u the certificate. I am using the app from 2 weeks and it's awesome,5,0,,2021-10-03 03:49:37,,,POSITIVE,python,point
15175,029a0a84-9ff0-4841-8918-603560a4cde7,Grant,https://play-lh.googleusercontent.com/a-/ACB-R5SrnFduBOaUUZSskZCPwj-rUD9Rv8ARxFveyNmFFQ,"Mimo is an app that's value speaks for itself. $60 a year and a week long free trial, but they remind you when the trial ends with push notifications when the time gets close. They don't try to take your money if you forget because the app knows how to keep you coming back with stress-free, fun, competitive, and educational programming content. I'm using it to brush up on my python and learn SQL. Love Mimo.",5,48,3.49,2021-09-30 10:25:52,,,POSITIVE,python,competit
15385,7d27f451-4f23-4e24-84d8-e1d8a7e5b2e5,CuztomModz Xxx,https://play-lh.googleusercontent.com/a-/ACB-R5SaoC6V5fL0H0gSkd7jRKI448R2jOHN1KD9ZTwdqg,"I literally just downloaded this app in hopes that it would not disappoint, and so far it has not. It's very fun and simple to use and understand. I'm doing the python course and I feel I will a great grasp of the curriculum by the time my trial is over. It's a great app, it explains things very simply and clearly. I would keep it if I could pay for it😂👌🏾",5,3,3.48,2021-09-23 22:41:17,,,POSITIVE,python,point
16119,86b542f5-9f64-47e2-90bd-2a5984dced79,Lucas Rocha Ferreira,https://play-lh.googleusercontent.com/a-/ACB-R5QM0-5T_X7Kicx0ugnrnyzLO_AzQcTBRYANfmoIhw,Good introduction to python. I felt a need for more challenging exercises.,5,0,3.46.1,2021-09-03 13:44:51,,,POSITIVE,python,challeng
16319,4eaa9464-83cd-4f40-b4a3-fb3eb7d09b3a,Chris Ward,https://play-lh.googleusercontent.com/a/AGNmyxYen8yNgfQrgJnD5fteBbP4R5eOYW5U2Sz9K-UN=mo,"Nicely paced learning. However, content is now restricted to web (html, css and java script), python and sql. There is not enough here to justify a subscription and gameification is pointless and annoying once you've finished the content.",3,3,3.46.1,2021-08-29 06:11:45,,,NEGATIVE,python,point
17488,f9a10321-5beb-4a39-8dc1-abbde80807f7,Ian,https://play-lh.googleusercontent.com/a-/ACB-R5QVHMvs1l0Zw290Vx1HamcQ4xWS3XNkC39ZoSK2f-4,"It's super disappointing how only 5 of 37 courses are available for free, this app only works if you wanna learn python or web development for free and for the rest you have to pay",3,0,3.44,2021-07-29 11:01:28,,,NEGATIVE,python,point
17669,8cca93c0-0b9f-481b-b87b-ce344f01dced,Chris Wactor,https://play-lh.googleusercontent.com/a/AGNmyxa5ZDm8Nu33eWizInThtCLkXi0FeAjwIeOEfAkS=mo,So far so good. I've gotten pretty far and python because of Mimo. Some of the functions could be outdated but that's okay because it's small compared to what I have learned. The competition side is awesome!!! Constantly making me want to beat number one. I WILL BE NUMBER 1!,5,7,3.43.1,2021-07-24 19:29:12,,,POSITIVE,python,competit
20244,96c62254-be62-40e4-874c-52add9a21499,Bartek Miniszewski,https://play-lh.googleusercontent.com/a/AGNmyxaegRgAI8zp51-pDxAfl4Atrk74QVtqlRwpARF3=mo,"Too ""beginner friendly"". I checked that I do program a bit, and have small projects, and I've got very shallow introduction to python instead. I do know how to code in python more or less, so I don't see a point in starting all over with close to no level.",2,2,3.31.1,2021-06-12 15:57:47,Hi there! Thanks for your review. We're working hard to provide the best content that will allow our users from all levels to learn something new. Just keep going through the chapters and we promise it will get harder. Hang in there!,2021-07-06 06:34:54,NEGATIVE,python,point
20910,ac5038ce-de0c-4213-828c-22a0eb936d9e,Bilal H. Salman,https://play-lh.googleusercontent.com/a/AGNmyxaa22VB3E7pmDw1CqHnFBzJSL1mSVkQv7EQtyQR=mo,What an app...love it! Please add more programming languages. (Edit 30/05/21) There are a few issues that I have noticed: 1. I can no longer access the leaderboard it keeps saying finish another lesson. 2. All the older python lessons that I completed no longer show the complete list of sub topics that I completed.,3,23,3.35,2021-05-29 22:46:36,"Yikes! We're sorry to hear you've run into an issue. To get to the bottom of the issue, please tell Johanna at support (support@getmimo.com) what exactly happened. She's great at figuring such things out.",2021-06-28 04:48:18,POSITIVE,python,leaderboard
20957,8b06ec9a-4457-47d4-ba17-c431d93ab619,larry stemke,https://play-lh.googleusercontent.com/a/AGNmyxZud9x-oV3t0ki3bL0ZgZglSfn9hnBo4_ZRwNz1=mo,"I finished a module, it says I earned 80 points, but the leader board did not update. That is a frustrating bug. I will uninstall and get a book on python.",3,2,3.35,2021-05-28 20:42:57,,,NEGATIVE,python,point
22983,90bd6e2a-1b89-4a3d-ab13-fcd841944352,Ryan Brinklow,https://play-lh.googleusercontent.com/a/AGNmyxY8SLFLYYmZUZuuTRGkgYpNU8TB1ncvSwsHxei5=mo,"I've subscribed so I can't comment on ads. Completing this, on an 8 day streak so far, along with a python course has helped reinforce and introduce concepts well. Recommended",5,0,3.28,2021-04-13 06:20:00,,,POSITIVE,python,streak
24756,77ee7759-7fa1-452e-9fda-b26a7ec00702,Lisa Eyre,https://play-lh.googleusercontent.com/a-/ACB-R5Q8kmXVoVIUksGzMePWs7_5H1LoG9x2ysXknbo,"Great app to learn so much about different programming language basics, and some wider IT info too. Only gripe is the courses tab on Android which doesn't look as good or work as seamlessly as the main 3 learning tracks (sql, python, web design) and doesn't progress your current place in the course to the big green button, meaning you have to hunt for it.",4,35,3.23,2021-03-08 02:06:22,,,POSITIVE,python,progress
25814,b46edc4e-c599-4e1d-8bf1-f53f32e93643,Z the Inkling,https://play-lh.googleusercontent.com/a-/ACB-R5Qeao5Zz4T5H_SqFbQiCVOxUSz0GBOdR9OglTQF,"An excellent way to learn how to code. I wanted to learn python for free for AGES and now I finally can! (Yes, I am a real person. A robot would not make a pointless comment within parentheses of a review.)",5,3,3.21,2021-02-21 18:47:33,,,POSITIVE,python,point
29603,0c6f966b-6a23-4895-8113-c332090f3380,Maciej,https://play-lh.googleusercontent.com/a/AGNmyxZq-mJZnqvO7iNpf6vmGk82m3fvx3QffGGpgHu7=mo,"Very good app! Kill your time and learn! But... When you finish it even paid one option, mimo team add lessons with big delays... It takes around week waiting. Meantime you missing your day strike, rank position and losing will for further education. Mimo team please add more lessons, courses, and allow to get python certificate... Thanks",3,1,3.14,2020-12-29 05:14:53,,,NEGATIVE,python,strike
30226,19415c4f-7f26-424a-a60e-55f3953f46c8,Eagle,https://play-lh.googleusercontent.com/a-/ACB-R5RHNDm72nCjAHNyZZJUrEywugrR2tNyQ64BbEWf,"Absolutely amazing app. It is very useful for learning varities of programming languages from scratch to the top. It is very competitive as well, because of the leaderboards system. I will recommend you this application if you are a beginner, intermediate or even an expert at coding. This app will help you get more knowledge, for sure. 😁 And yes, I am learning python.",5,0,,2020-12-16 04:45:20,,,POSITIVE,python,"competit, leaderboard"
30373,653ebec8-eac9-4d50-af1b-1d28f3d469fa,Dhairya Kanodia,https://play-lh.googleusercontent.com/a-/ACB-R5QFFIZtp60mNgT_2roEEvDeulEM8OkOvdoxP5bxCw,Great app I am learning python and a great progress is made P.s-i am using the free version,5,0,3.12,2020-12-13 08:25:03,,,POSITIVE,python,progress
32047,f18c7862-3ce0-41f5-9e27-a5b5c5da3aef,Mark Linton,https://play-lh.googleusercontent.com/a/AGNmyxZV5-QpqAJtHh_a9pTFvIeFocEzyZaf__XoxRJh=mo,"I""ve been coding on and off for 25 years and I wanted to have as look at python. My son is using Mimo to learn some HTML so suggested I have a look at it. Learning ti code on my phone is not ideal but by breaking everything down into small chunks it's easy to find five minutes here and there to do a lesson. Yes it's a bit slow for me but add I can choose in other languages the basics it's stuff that I already know, but I do like the way it is done.",5,1,3.7.1,2020-11-10 07:23:48,,,POSITIVE,python,break
32309,c5be2a68-e3cf-49b2-bd2a-96070d265eba,Kenyon Kluge,https://play-lh.googleusercontent.com/a-/ACB-R5QVNR-FSxNFzpK2309kp1d8CTtcq2Z-HETEAUAZ4Q,I liked it at first but just as i felt like it was getting to the interesting point of learning python it ran out of lessons. You can learn what is taught here for free on the python web site as well as a lot more.,2,0,3.4,2020-11-05 23:31:20,,,NEGATIVE,python,point
42090,b45e91fd-996f-4c48-82e4-30a982ad2e99,Sudhanshu Suryawanshi,https://play-lh.googleusercontent.com/a-/ACB-R5QciD4jGqpqPAG3IAD8tspsh3eIl5jxX4sCtAtni6o,"A fun and competitive way to learn HTML , JavaScript, and python. You all must try it I know that you will love it.",5,0,,2020-07-31 22:33:47,,,POSITIVE,python,competit
44598,c746bce3-d271-46b3-96cc-a7caf185762c,Elijah Davis,https://play-lh.googleusercontent.com/a-/ACB-R5Ttt2rpw1kDVqVNOKIIZngfYWDeG40JSy0mcX1c5w,This app is amazing to me you learn HTML CSS and JavaScript and you can do extra things to like learning about a.i and programming and inernet and network and challenges and python,5,0,2.26.1,2020-07-06 12:38:18,,,POSITIVE,python,challeng
46460,8473ed1d-90e3-4983-a649-1068a16b7455,tenshichan131193,https://play-lh.googleusercontent.com/a/AGNmyxbM5bwF6tPE899TGFcn6MWt5e7CwtxN-1FjXEe1=mo,"I really liked the app to get a fist try at learning python, but I changed my phone and now, on the same day, it is no longer available. This is really disappointing because I was in the middle of the module.",3,2,2.23,2020-06-18 05:26:03,,,NEGATIVE,python,point
55009,c506a477-3fb0-4cb1-ab23-799e1f9d94e9,A Google user,https://play-lh.googleusercontent.com/EGemoI2NTXmTsBVtJqk8jxF9rh8ApRWfsIMQSt2uE4OcpQqbFu7f7NbTK05lx80nuSijCz7sc3a277R67g,"Good, but dissapointed it doesn't have python",3,0,,2020-03-16 03:15:14,,,NEGATIVE,python,point
67668,2b39a18d-c10f-449c-a5c3-028854c987fb,A Google user,https://play-lh.googleusercontent.com/EGemoI2NTXmTsBVtJqk8jxF9rh8ApRWfsIMQSt2uE4OcpQqbFu7f7NbTK05lx80nuSijCz7sc3a277R67g,"I downloaded this app in hopes that I could start learning on my mobile device, while im on the ferry, bus or train or even on lunch break at times. I went through the greeting tutorial on how the app works, then went on with the python course. I liked how it started taking me step by step and i was feeling that I was going to learn something. Well after 2 questions I got smacked with a Paywall to pay a very expensive monthly or yearly fee. People are better off with FreeCodeCamp. I uninstalled",1,8,1.5.6,2019-07-12 00:11:39,,,NEGATIVE,python,break
67681,f601f4d2-d157-4869-97e4-92a7640997c3,A Google user,https://play-lh.googleusercontent.com/EGemoI2NTXmTsBVtJqk8jxF9rh8ApRWfsIMQSt2uE4OcpQqbFu7f7NbTK05lx80nuSijCz7sc3a277R67g,"I've learned coding easily and perfectly by Mimo, thank you guys, keep it up, and please add python challenge in the next update🙏",5,0,,2019-07-11 18:05:21,,,POSITIVE,python,challeng
70933,d96c4c21-8942-40b6-9751-2784fc2192e7,A Google user,https://play-lh.googleusercontent.com/EGemoI2NTXmTsBVtJqk8jxF9rh8ApRWfsIMQSt2uE4OcpQqbFu7f7NbTK05lx80nuSijCz7sc3a277R67g,please add more content on ansible python automation . please add python in earn certificate and in daily challenge . please add projects and new chapter in python i have buy for python but i think that it has very low study material in python . please update,4,0,1.5.2,2019-05-05 16:05:57,,,NEGATIVE,python,challeng
72293,11615f7e-bfde-4fc7-aae1-e60ea86206ab,A Google user,https://play-lh.googleusercontent.com/EGemoI2NTXmTsBVtJqk8jxF9rh8ApRWfsIMQSt2uE4OcpQqbFu7f7NbTK05lx80nuSijCz7sc3a277R67g,"As one who has experience in numerous programming languages, this seamlessly catches up to my skill level and expounds upon it. For learning new languages, however, I can't stress enough how easy it is to build new foundations! I let a 12 year old try learning python from scratch using this app, and in an hour they had progressed farther than I had in 2 and with fewer mistakes.",5,1,1.3.6,2019-02-17 12:58:06,,,POSITIVE,python,progress
85311,7d7ace26-ef92-4649-a376-6f23fcbbe37e,A Google user,https://play-lh.googleusercontent.com/EGemoI2NTXmTsBVtJqk8jxF9rh8ApRWfsIMQSt2uE4OcpQqbFu7f7NbTK05lx80nuSijCz7sc3a277R67g,"I've only just started python but I must admit the approach for learning is 
refreshing in comparison to long standing competitors like codecademy. I 
just really like how human the content feels, and the simple plain English 
(with the odd pop culture reference). I hope the app continues to feel this 
way throughout",5,0,1.0.7,2018-07-31 16:28:15,,,POSITIVE,python,competit
