Unnamed: 0.2,Unnamed: 0.1,Unnamed: 0,date,review,rating,isEdited,userName,title,developerResponse,sentiment,reviewId,userImage,thumbsUpCount,reviewCreatedVersion,replyContent,repliedAt,standardizedReview,mentionedFeature,mentionedSynonyms
0,0,0,2017-09-29 04:15:45,"I wanted to learn coding during my commute. But so many free to start apps require a constant Internet connection, and my train is often stuck underground without service. I greatly appreciate that you can use Encode even offline. (It being offline also means that it can't load the ads, if you find that annoying.)

The lessons included are indeed simple, and I absolutely think if you're an intermediate study in JavaScript or HTML/CSS you won't get much out of this. But as a beginner cramming these lessons in to/from work, who was only ever able to make good old 90's GeoCities webpages at best, the bite-sized chunks it's broken down into makes computing language much easier for to process.

The extra challenges as reinforcement and the compound lessons putting everything together is worth the $4.99 unlock, but even if you're looking to just start learning for free you could do much worse than Encode.",5,False,jellocube,Perfect for beginners!,,NEGATIVE,,,,,,,wanted learn coding commute many free start apps require constant internet connection train often stuck underground without service greatly appreciate use encode even offline offline also means cant load ads find annoying lessons included indeed simple absolutely think youre intermediate study javascript htmlcss wont get much beginner cramming lessons tofrom work ever able make good old 90s geocities webpages best bitesized chunks broken makes computing language much easier process extra challenges reinforcement compound lessons putting everything together worth 499 unlock even youre looking start learning free could much worse encode,challenges,challeng
2,2,2,2019-09-05 02:30:21,"So I learned all my basics for HTML and CSS through Encode (the previous name before Knowin) and I have to say I loved the interactive, hands-on, you-type-it mode that It had. But don’t get me wrong, this app is still very good at teaching the basics for coding in any of its available subjects. But just as someone who still remembers the very interactive mode of Encode, I do miss it. Personally it was better for me to type it out than to press buttons to questions. So if its possible to bring this back into Knowin, that would be awesome. Like I said awesome app that can teach you so much, I would just like to see that type-it-yourself mode back. But overall, it is a very solid app, good job developers!",4,False,JrD1az,"Good for learning, but wished that the Hands-On was there again",,POSITIVE,,,,,,,learned basics html css encode previous name knowin say loved interactive handson youtypeit mode dont get wrong app still good teaching basics coding available subjects someone still remembers interactive mode encode miss personally better type press buttons questions possible bring back knowin would awesome like said awesome app teach much would like see typeityourself mode back overall solid app good job developers,status quo sloth,person
4,4,4,2019-07-18 08:52:58,"After this app made the switch from Encode to Knowin, I had my doubts, but the interface itself is beautiful and intuitive, plus the themes (plum, sea, and night) are gorgeous. The ghost of Encode still haunts the app when it opens, and sometimes the swipes lag a little, but that’s to be expected with such a massive overhaul & turnaround for an education app. Not nearly enough to warrant taking off a star, especially when the app itself is supplementing my coding journey so well. Thanks for a great and affordable learning experience!",5,False,N1mk11,💙💕Excellent!,,POSITIVE,,,,,,,app made switch encode knowin doubts interface beautiful intuitive plus themes plum sea night gorgeous ghost encode still haunts app opens sometimes swipes lag little thats expected massive overhaul turnaround education app nearly enough warrant taking star especially app supplementing coding journey well thanks great affordable learning experience,boosters,special
7,7,7,2022-04-03 13:13:07,"This app is fun, light and great for those who are trying to reenforce their skills. It is a little personal and I do feel like I am being socially engineered at times. It ask you to input data such as: what was you elementary schools name, what was the name of your childhood best friend. What is your age and name. These are all passwords reset/ authentication questions and should NOT be shared with any app.",5,False,bubblehead1,Great but too personal,,NEGATIVE,,,,,,,app fun light great trying reenforce skills little personal feel like socially engineered times ask input data elementary schools name name childhood best friend age name passwords reset authentication questions shared app,status quo sloth,person
146,146,146,2022-06-17 05:52:13,Every app of learning code like mimo has limitations but I like this because you can learn code for free unlike other Apps! When I installed it I see ads but all of that was for encode premium you don’t have lives like mimo that when the lives are ended you can’t learn code anymore until hours,5,False,Ryan esmaeelzadeh2,I never seen an app like that,,POSITIVE,,,,,,,every app learning code like mimo limitations like learn code free unlike apps installed see ads encode premium dont lives like mimo lives ended cant learn code anymore hours,torture breaks,live
148,148,148,2022-05-30 14:38:05,"I am a total beginner at coding and downloaded this app, as well as a few others. I want to say before giving my complaints/suggestions that this IS a decent way to memorize how to code. It doesn’t feel so much like learning through practice so much as learning through reading. It’s still informative and teaches you to code and what everything (well, most things) is for and how/why/when/where to use it. 

First off, just a minor suggestion for the devs: this app doesn’t keep score or reward  your progress really, other than ticking off the lessons you’ve completed, which is fine honestly, it’s certainly not a dealbreaker, but I think it does make learning apps like this more enjoyable and fun to use. 

Second, the lessons feel a bit condescending sometimes. The way the answers to the questions are usually just the value of one of the blank spaces of the code and you just tap it and it appears in the space, and a lot of times it’s just one space that needs to be filled in so it just feels like “what’s the point in me tapping the ONLY answer there is, and having it just appear in the blank space?” Feels a little kindergarten to me. And again, it DOES educate you on coding, it’s just more of a READING way of learning, like reading a slightly interactive book basically, where sometimes you need to fill in one of the sentences with the word(s) that belong there…literally. 

Third, and this is again just another personal opinion/suggestion based on preference, but the app just feels very plain and basic I guess is the best way to describe it. There’s just really no “pop!” or personality to it. And I understand it’s an app about learning how to code, and code is often very plain and boring and concise looking, so I understand it not being anything crazy, I just wish there was a little more personality to the app and that it was a bit more interactive than it currently is. As mentioned above, there’s no reward or incentive for doing anything on there, which is fine, the learning of new things about coding is absolutely a reward in itself. However, it would be nice to have a little more feeling of connection and interaction with the app and a little more incentive and personality. 

I don’t mean to sound like a complainer just being captious about the app and picking it apart. I do appreciate the dev(s) taking the time to create this app to help people learn to code, because it is a nice little interactive textbook of coding information at this point, and it is appreciated being provided with that information. I just wish it didn’t feel so condescending and plain. With a few little tweaks I really think this app could be amazing because it does explain things very simply and easy to understand and learn. 

Thank you! If you made it this far and read the whole review, you’re beautiful and I wish you all the best in life and in coding!!! <3€><>

                          ¥~<>*<>~¥",2,False,Sventography,A tad condescending…,,NEGATIVE,,,,,,,total beginner coding downloaded app well others want say giving complaintssuggestions decent way memorize code doesnt feel much like learning practice much learning reading still informative teaches code everything well things howwhywhenwhere use first minor suggestion devs app doesnt keep score reward progress really ticking lessons youve completed fine honestly certainly dealbreaker think make learning apps like enjoyable fun use second lessons feel bit condescending sometimes way answers questions usually value one blank spaces code tap appears space lot times one space needs filled feels like whats point tapping answer appear blank space feels little kindergarten educate coding reading way learning like reading slightly interactive book basically sometimes need fill one sentences words belong thereliterally third another personal opinionsuggestion based preference app feels plain basic guess best way describe theres really pop personality understand app learning code code often plain boring concise looking understand anything crazy wish little personality app bit interactive currently mentioned theres reward incentive anything fine learning new things coding absolutely reward however would nice little feeling connection interaction app little incentive personality dont mean sound like complainer captious app picking apart appreciate devs taking time create app help people learn code nice little interactive textbook coding information point appreciated provided information wish didnt feel condescending plain little tweaks really think app could amazing explain things simply easy understand learn thank made far read whole review youre beautiful wish best life coding 3,status quo sloth,person
150,150,150,2021-08-22 18:30:43,This is a really good app if you want to start learning to code. Especially for me since I’m studying to be an electronics technician & I’ll be working on both physical & digital circuits.,5,False,B-boy Va-Van,Jovan Vedrene,,POSITIVE,,,,,,,really good app want start learning code especially since im studying electronics technician ill working physical digital circuits,boosters,special
151,151,151,2021-07-24 10:23:59,"I love how this guide to code helps you better understand variables, constants, and so on. It makes learning coding simpler to the average person so that way it helps make a skill set for that person’s resume. Whoever made this app than you so much cause I’ve  been trying to learn at least one code language since i don't have a laptop so thank you again for this absolutely amazing app",5,False,ban_671,Learning the basics,,POSITIVE,,,,,,,love guide code helps better understand variables constants makes learning coding simpler average person way helps make skill set persons resume whoever made app much cause ive trying learn least one code language since dont laptop thank absolutely amazing app,status quo sloth,person
159,159,159,2020-08-31 22:17:41,"So.... learning any coding language is super hard, especially when you’re using an app. (I’m too young for Mimo, my Swift Playgrounds photo work course feels more like a dragging lesson than a coding lesson, and Code playground is just a book (coding is learned best hands on).)
It’s very hard to remember what you learned.

So.... Knowin comes along!
An awesome app for learning coding languages and actually remembering them.
I recommend this app for people that are having a hard time learning coding (that aren’t that serious about learning to code).
I may get the pro version if it’s that much better. (This app is hard to beat)",5,False,Existing Person 500,Learn to code and actually REMEMBER WHAT YOU LEARNED later,,POSITIVE,,,,,,,learning coding language super hard especially youre using app im young mimo swift playgrounds photo work course feels like dragging lesson coding lesson code playground book coding learned best hands hard remember learned knowin comes along awesome app learning coding languages actually remembering recommend app people hard time learning coding arent serious learning code may get pro version much better app hard beat,boosters,special
173,173,173,2019-06-06 18:00:16,"I tried to complete one of the extra challenges where I had to print a string a number of my choice times. The number I chose was 10^100(10**100 in Python), equivalent to one googol. After I tried to print the three letter word ""Yes""('Yes' in Python) the app crashed. I think that you need to add more support for extremely large quantities. Thanks for reading.",3,False,Aidan Anthony,Crash,,NEGATIVE,,,,,,,tried complete one extra challenges print string number choice times number chose 1010010100 python equivalent one googol tried print three letter word yesyes python app crashed think need add support extremely large quantities thanks reading,challenges,challeng
267,267,83,2021-12-29 19:23:18,Uninstalled after 5 minutes. Lessons were blank & I'm unable to even see what I was typing in. I've got a new S20 so it's not my hardware. Definitely TRY BEFORE YOU BUY. Glad I didn't buy pro version smh. Maybe the next person will have better luck.,1,,Superfelon 87,,,NEGATIVE,c3c49868-2c68-45e8-a6a4-81fe5113cab1,https://play-lh.googleusercontent.com/a/AGNmyxYo3wH-CyWd5Q_UVS8Ry4t8EQz6tIp_PA3UEXm7=mo,20.0,,Sorry for the inconvenience caused by this bug. We've now updated the app to fix the issue of the lessons becoming blank on some phone models.,2022-04-03 05:55:53,uninstalled 5 minutes lessons blank im unable even see typing ive got new s20 hardware definitely try buy glad didnt buy pro version smh maybe next person better luck,status quo sloth,person
283,283,99,2021-11-06 08:26:53,Its a very nice app Not much ads Easy to use Good lessons and challenges 😊😊👌👍,5,,R VAISHNAVI,,,NEGATIVE,474ff625-ca0f-41d3-b815-5ce80487d096,https://play-lh.googleusercontent.com/a-/ACB-R5Td09C2SZBz2FXalZPVvR8JhSZttqnIH3b7yeGu,0.0,4.6,,,nice app much ads easy use good lessons challenges,challenges,challeng
325,325,141,2021-02-10 04:23:31,"This is the best app for the beginners who want to learn web developement and python.Overall it's a good app for learning JS,HTML,CSS and PYTHON.But the reason for giving it 4 stars is quite simple: Firstly it doesn't have the interface of account where you can see which topics you have already learnt as you you have to check each individual lesson while studying after a long time.Secondly,there are some topics which are paid , you have to pay for the advance learning , but I'm sure it'll worth",4,,Ayush indexeus,,,POSITIVE,c47a5298-5b11-4ff0-9045-21e10d8b0aeb,https://play-lh.googleusercontent.com/a/AGNmyxbzywoF0YIsNiwZ7wIowBXhsQppmJRyqVZXIvUz=mo,32.0,4.6,,,best app beginners want learn web developement pythonoverall good app learning jshtmlcss pythonbut reason giving 4 stars quite simple firstly doesnt interface account see topics already learnt check individual lesson studying long timesecondlythere topics paid pay advance learning im sure itll worth,status quo sloth,account
355,355,171,2020-10-13 02:29:47,"I bought the pro version and am loving it so far. However, I wish there were indicators on the home screen for what lessons you've completed so you didn't have to check each individual lesson. Also, a blank page to experiment with the ideas you're learning would be nice. None of these things take away from the experience, they'd just be appreciated additions. Great app, especially for the price! You get your money's worth for sure, I'm learning a lot.",4,,Inhumanick,,,POSITIVE,af607a86-5f97-49a2-a7ee-786eabdb3c7b,https://play-lh.googleusercontent.com/a-/ACB-R5QhnX0hL7BaHFU79FR3cc5X79V1DeXtHjYiGD-WfA,46.0,,,,bought pro version loving far however wish indicators home screen lessons youve completed didnt check individual lesson also blank page experiment ideas youre learning would nice none things take away experience theyd appreciated additions great app especially price get moneys worth sure im learning lot,boosters,special
382,382,198,2020-08-29 15:32:17,Ok but it should maybe free up some topics mostly for people who live in third world countries,3,,Matt Keneth,,,NEGATIVE,0c0d4f5f-6c75-40fa-a4d2-e577ce45fa15,https://play-lh.googleusercontent.com/a/AGNmyxZrhFXNXOGMwe04-x_hRiFiIWuXMGswjUs0G2y7=mo,0.0,4.6,,,ok maybe free topics mostly people live third world countries,torture breaks,live
440,440,256,2020-05-11 10:26:19,It's really an amazing app. It is useful for every person who wants to learn from basics,5,,Nalla Vedavathi,,,POSITIVE,766aa6e2-e212-4928-aa91-d5582fabcc29,https://play-lh.googleusercontent.com/a-/ACB-R5QKGm0c3io8MaX9DSF_dfWJBCLpv25B_rB2OPWW,0.0,4.6,,,really amazing app useful every person wants learn basics,status quo sloth,person
476,476,292,2020-03-19 18:02:06,It's a very good app bit I wish it could have an little more challenge. And never forget that programing/coding is all about problem solving.,4,,A Google user,,,POSITIVE,00977a88-5018-4ab9-827b-656dd6eff20f,https://play-lh.googleusercontent.com/EGemoI2NTXmTsBVtJqk8jxF9rh8ApRWfsIMQSt2uE4OcpQqbFu7f7NbTK05lx80nuSijCz7sc3a277R67g,13.0,4.6,,,good app bit wish could little challenge never forget programingcoding problem solving,challenges,challeng
505,505,321,2019-12-10 05:10:37,Really good so far a tip would be make a customization panel so it doesnt feel like your being treated as a kid :),4,,A Google user,,,POSITIVE,10a73257-e3cb-4402-b10c-c3c20444fde8,https://play-lh.googleusercontent.com/EGemoI2NTXmTsBVtJqk8jxF9rh8ApRWfsIMQSt2uE4OcpQqbFu7f7NbTK05lx80nuSijCz7sc3a277R67g,1.0,4.6,,,really good far tip would make customization panel doesnt feel like treated kid,status quo sloth,custom
512,512,328,2019-11-16 14:13:06,Easy to learn and i like the extra challenges when you buy pro,5,,A Google user,,,POSITIVE,ae5cd074-c904-4ef2-9f29-2948aa8c6df8,https://play-lh.googleusercontent.com/EGemoI2NTXmTsBVtJqk8jxF9rh8ApRWfsIMQSt2uE4OcpQqbFu7f7NbTK05lx80nuSijCz7sc3a277R67g,0.0,4.6,,,easy learn like extra challenges buy pro,challenges,challeng
519,519,335,2019-10-31 22:46:39,It's great! They give you a small selection of text to read then give you a coding challenge every couple of readings to test what you read. Makes it really easy to practice your coding step by step!,4,,A Google user,,,POSITIVE,d224f239-e658-4067-928a-d96f98e7a58d,https://play-lh.googleusercontent.com/EGemoI2NTXmTsBVtJqk8jxF9rh8ApRWfsIMQSt2uE4OcpQqbFu7f7NbTK05lx80nuSijCz7sc3a277R67g,17.0,4.6,,,great give small selection text read give coding challenge every couple readings test read makes really easy practice coding step step,challenges,challeng
529,529,345,2019-09-28 18:01:19,love it am getting better at coding though i am 12. thank you so much the person that created this app without this app i would have not known haw to code. add more features and if i could i would rate this 20/5,5,,A Google user,,,POSITIVE,ed33181a-9411-4a5e-849a-140443d4aae7,https://play-lh.googleusercontent.com/EGemoI2NTXmTsBVtJqk8jxF9rh8ApRWfsIMQSt2uE4OcpQqbFu7f7NbTK05lx80nuSijCz7sc3a277R67g,0.0,4.6,,,love getting better coding though 12 thank much person created app without app would known haw code add features could would rate 205,status quo sloth,person
536,536,352,2019-09-05 19:39:25,Its not bad I just wish that you could have your own personal page to where you can type out codes.,3,,A Google user,,,POSITIVE,7d8f6f9f-9557-4803-ba9f-934bc53fa972,https://play-lh.googleusercontent.com/EGemoI2NTXmTsBVtJqk8jxF9rh8ApRWfsIMQSt2uE4OcpQqbFu7f7NbTK05lx80nuSijCz7sc3a277R67g,0.0,4.6,,,bad wish could personal page type codes,status quo sloth,person
540,540,356,2019-08-30 07:12:26,I have currently only done 3 of the many java script challenges and i must say it is incredible unlike other apps that teach you to program (mimo) it gives you every thing you need to start coding for free. Thanks to the developers of this app for making it.,5,,A Google user,,,POSITIVE,7c4709b2-48ec-4de3-8c80-1d191bd50fa8,https://play-lh.googleusercontent.com/EGemoI2NTXmTsBVtJqk8jxF9rh8ApRWfsIMQSt2uE4OcpQqbFu7f7NbTK05lx80nuSijCz7sc3a277R67g,2.0,4.6,,,currently done 3 many java script challenges must say incredible unlike apps teach program mimo gives every thing need start coding free thanks developers app making,challenges,challeng
548,548,364,2019-08-14 21:16:58,Not worth the money for pro. Challenges are not hard enough even for a beginner like myself,2,,A Google user,,,NEGATIVE,b9cc41c0-d7b9-49a8-99e0-8e86cfeb9a3d,https://play-lh.googleusercontent.com/EGemoI2NTXmTsBVtJqk8jxF9rh8ApRWfsIMQSt2uE4OcpQqbFu7f7NbTK05lx80nuSijCz7sc3a277R67g,1.0,4.6,,,worth money pro challenges hard enough even beginner like,challenges,challeng
555,555,371,2019-08-04 17:09:27,"Quick and easy to follow project-based lessons! I went through all the CSS, HTML, & Javascript Courses. This app is great for beginners. I was hoping the Extra Challenges would help out with the more complex concepts; but it was more of a reiterations of what was taught.",4,,A Google user,,,POSITIVE,f6ff787b-c5e1-4a87-8dcd-b08e9aff3c3d,https://play-lh.googleusercontent.com/EGemoI2NTXmTsBVtJqk8jxF9rh8ApRWfsIMQSt2uE4OcpQqbFu7f7NbTK05lx80nuSijCz7sc3a277R67g,0.0,4.6,,,quick easy follow projectbased lessons went css html javascript courses app great beginners hoping extra challenges would help complex concepts reiterations taught,challenges,challeng
582,582,398,2019-06-26 04:44:09,"Amazing app for beginner coders. Funny and easy to follow.Make sure you uprade to pro for the extra challenges, it is totally worth the money.",5,,A Google user,,,POSITIVE,f71ef34f-a285-4dd7-9fce-d53278cb830e,https://play-lh.googleusercontent.com/EGemoI2NTXmTsBVtJqk8jxF9rh8ApRWfsIMQSt2uE4OcpQqbFu7f7NbTK05lx80nuSijCz7sc3a277R67g,0.0,4.6,,,amazing app beginner coders funny easy followmake sure uprade pro extra challenges totally worth money,challenges,challeng
615,615,431,2019-05-14 19:44:33,"Pros: 2 languages. python and javascript. Explains a concept and then run the code as an example. next page they give you the barebones of the code and ask you to enter your own values. they include hotkeys with the code, so that instead of typing 10 you can click a button that SAYS 10 and it enters it in the code for you. Drawbacks: No ""coding playground"" to test code you have written. Too many lessons are ""pay to access"" Dont sell knowledge, add coding playground behind paywall instead.",4,,A Google user,,,NEGATIVE,2fa7eb7c-30f4-46f1-9b2d-d19abbb50107,https://play-lh.googleusercontent.com/EGemoI2NTXmTsBVtJqk8jxF9rh8ApRWfsIMQSt2uE4OcpQqbFu7f7NbTK05lx80nuSijCz7sc3a277R67g,5.0,4.6,,,pros 2 languages python javascript explains concept run code example next page give barebones code ask enter values include hotkeys code instead typing 10 click button says 10 enters code drawbacks coding playground test code written many lessons pay access dont sell knowledge add coding playground behind paywall instead,torture breaks,paywal
619,619,435,2019-05-10 10:33:35,First time I ever used such an app. but I'm having a blast. I love a challenge and I'm probably looking at a side hobby or even a career of sorts.,5,,A Google user,,,POSITIVE,81dcba2b-467c-4684-828e-2706bd6adc91,https://play-lh.googleusercontent.com/EGemoI2NTXmTsBVtJqk8jxF9rh8ApRWfsIMQSt2uE4OcpQqbFu7f7NbTK05lx80nuSijCz7sc3a277R67g,0.0,,Thanks for your review Elieser! It's so great to hear you're diving into a hobby or career in coding!,2019-05-11 20:50:04,first time ever used app im blast love challenge im probably looking side hobby even career sorts,challenges,challeng
634,634,450,2019-04-23 09:13:34,excellent for beginner level! nice UI and challenging questions. Amount of ads is low this app really focuses on learning!,5,,A Google user,,,POSITIVE,00d192ff-1522-47ee-8336-9e980b7ae717,https://play-lh.googleusercontent.com/EGemoI2NTXmTsBVtJqk8jxF9rh8ApRWfsIMQSt2uE4OcpQqbFu7f7NbTK05lx80nuSijCz7sc3a277R67g,0.0,4.6,,,excellent beginner level nice ui challenging questions amount ads low app really focuses learning,challenges,challeng
638,638,454,2019-04-16 16:08:26,love the simplicity and minimalistic design of this app beside of its night mode(it's a must have) and it's tiny lessons and challenges. totally worth to pay,5,,A Google user,,,POSITIVE,31a6becf-0c38-44c0-821c-3054b3adecea,https://play-lh.googleusercontent.com/EGemoI2NTXmTsBVtJqk8jxF9rh8ApRWfsIMQSt2uE4OcpQqbFu7f7NbTK05lx80nuSijCz7sc3a277R67g,0.0,4.6,,,love simplicity minimalistic design app beside night modeits must tiny lessons challenges totally worth pay,challenges,challeng
663,663,479,2019-03-18 16:02:40,Really good but it needs to have a sync function so that you can keep track of your progress and lessons on all devices and using Google account.,4,,A Google user,,,POSITIVE,63236c1c-cf73-4e92-afea-f53dcc58cc96,https://play-lh.googleusercontent.com/EGemoI2NTXmTsBVtJqk8jxF9rh8ApRWfsIMQSt2uE4OcpQqbFu7f7NbTK05lx80nuSijCz7sc3a277R67g,1.0,4.6,,,really good needs sync function keep track progress lessons devices using google account,status quo sloth,account
