Unnamed: 0,reviewId,userName,userImage,review,rating,thumbsUpCount,reviewCreatedVersion,date,replyContent,repliedAt,sentiment,standardizedReview,mentionedFeature,mentionedSynonyms
2858,cfb75e71-8f02-4208-9cf5-d6747a1e6f4e,A Google user,https://play-lh.googleusercontent.com/EGemoI2NTXmTsBVtJqk8jxF9rh8ApRWfsIMQSt2uE4OcpQqbFu7f7NbTK05lx80nuSijCz7sc3a277R67g,"I have a Codecademy account with Gmail and am able to log in easily to the app. The app is quite nice and I find a variety of questions using the unpaid version by finishing the practice questions and selecting the ""Get another pack"" option that appears below after completing the module. There is some overlap or repetition I questions, but not nearly as much as others seem to report. It is great practice that helps remind me of concepts as a beginning, which I find very important for retention.",4,9,1.8.1,2019-09-25 12:47:09,,,POSITIVE,codecademy account gmail able log easily app app quite nice find variety questions using unpaid version finishing practice questions selecting get another pack option appears completing module overlap repetition questions nearly much others seem report great practice helps remind concepts beginning find important retention,status quo sloth,account
2863,884b8419-3fb7-4c44-a082-5877e1fdc5ee,A Google user,https://play-lh.googleusercontent.com/EGemoI2NTXmTsBVtJqk8jxF9rh8ApRWfsIMQSt2uE4OcpQqbFu7f7NbTK05lx80nuSijCz7sc3a277R67g,"Nice app overall. Very appealing to look at and is very smooth in operation; very helpful app especially with Pro subscription... except when finishing a review, it seems to reset the app. One thing that I would do to improve the app is being able to remove a skill path/career path/etc from your Today page/dashboard (the ""<>"" at the bottom). I'm focused on the Data Science path, so C++ is not yet a skill I'm interested in. Also, add a feedback link in app.",4,6,1.8.1,2019-09-21 10:46:25,,,POSITIVE,nice app overall appealing look smooth operation helpful app especially pro subscription except finishing review seems reset app one thing would improve app able remove skill pathcareer pathetc today pagedashboard bottom im focused data science path c yet skill im interested also add feedback link app,boosters,special
2866,7a67109e-6efa-4242-912d-fef7c3bf4420,A Google user,https://play-lh.googleusercontent.com/EGemoI2NTXmTsBVtJqk8jxF9rh8ApRWfsIMQSt2uE4OcpQqbFu7f7NbTK05lx80nuSijCz7sc3a277R67g,"I cannot sign in with my Google account on Pixel 3 with Android 9. My app version is 1.8.1, please help fix this issue!!",1,0,,2019-09-19 11:29:44,,,NEGATIVE,cannot sign google account pixel 3 android 9 app version 181 please help fix issue,status quo sloth,account
2882,8eb50569-172b-4c54-bcdf-7b5d688f26fc,A Google user,https://play-lh.googleusercontent.com/EGemoI2NTXmTsBVtJqk8jxF9rh8ApRWfsIMQSt2uE4OcpQqbFu7f7NbTK05lx80nuSijCz7sc3a277R67g,"There are no other sign in options in your app like you have in your site, I have used Google sign in option and have not created a local account. Hence cannot log in and hence your app is Useless to me. Please provide sign in options, if you want me to change my review. Other wise your site is excellent. EDIT They have finally added those other sign in options and am glad that they did it.",4,4,1.8.1,2019-09-07 17:39:59,"Arunav, thank you for the feedback! We've had some issues with Google sign in, but believe it should be available (and working) in the latest release (1.8.1). Could you try updating in the Google Play store?",2019-09-07 15:21:26,NEGATIVE,sign options app like site used google sign option created local account hence cannot log hence app useless please provide sign options want change review wise site excellent edit finally added sign options glad,status quo sloth,account
2886,53ad7bdf-fe77-4c39-88a3-9107b52246b0,A Google user,https://play-lh.googleusercontent.com/EGemoI2NTXmTsBVtJqk8jxF9rh8ApRWfsIMQSt2uE4OcpQqbFu7f7NbTK05lx80nuSijCz7sc3a277R67g,Can't log in to my account,1,1,1.8.1,2019-09-06 22:30:24,"Deepi, thank you for the feedback! Sorry you had this experience with our app 😥.

We had some issues with Google sign in, but believe it should be available (and working) in the latest release. Could you try updating in the Google Play store?",2019-09-07 21:16:35,NEGATIVE,cant log account,status quo sloth,account
2893,6d4b57d7-b715-4111-86bc-601af6f58b68,A Google user,https://play-lh.googleusercontent.com/EGemoI2NTXmTsBVtJqk8jxF9rh8ApRWfsIMQSt2uE4OcpQqbFu7f7NbTK05lx80nuSijCz7sc3a277R67g,"Won't let me login either my email, username or Google account",1,1,1.8,2019-09-03 06:22:20,"Francisco, there was an issue with Google login in the previous version of the app. Sorry you had to experience this frustration.

Could you try updating to version 1.8.1 in the Google Play store?",2019-09-07 21:21:14,NEGATIVE,wont let login either email username google account,status quo sloth,account
2900,010a5290-1aa0-4fa3-8bbc-32c4b2f564d3,A Google user,https://play-lh.googleusercontent.com/EGemoI2NTXmTsBVtJqk8jxF9rh8ApRWfsIMQSt2uE4OcpQqbFu7f7NbTK05lx80nuSijCz7sc3a277R67g,Couldn't register as i don't trust to sign in with Google account and also don't have Facebook. Sad,3,1,1.8,2019-08-25 11:45:21,,,NEGATIVE,couldnt register dont trust sign google account also dont facebook sad,status quo sloth,account
2906,eee5e339-1c8a-46fa-b80b-4035878e3fb6,A Google user,https://play-lh.googleusercontent.com/EGemoI2NTXmTsBVtJqk8jxF9rh8ApRWfsIMQSt2uE4OcpQqbFu7f7NbTK05lx80nuSijCz7sc3a277R67g,Please add an option to sign in with a linked account so most of us can actually use the app.,2,3,1.7,2019-08-20 07:18:22,"NateTheCarrot, thanks for the feedback. We've added options for Google and Facebook. You should be able to use those with the latest version of the app (1.8.1).",2019-09-07 21:36:54,NEGATIVE,please add option sign linked account us actually use app,status quo sloth,account
2911,ea8bb3bb-0fd5-4bfe-b556-1be888f9f82f,A Google user,https://play-lh.googleusercontent.com/EGemoI2NTXmTsBVtJqk8jxF9rh8ApRWfsIMQSt2uE4OcpQqbFu7f7NbTK05lx80nuSijCz7sc3a277R67g,"My account is linked through Google so I don't have a real log in, however there is no linked account login support so I can't use this app.",2,3,1.7,2019-08-17 06:04:22,"Thanks for your feedback. We recently added the option to log in with Google.

Could you try updating to version 1.8.1 in the Google Play store?",2019-09-07 21:40:43,NEGATIVE,account linked google dont real log however linked account login support cant use app,status quo sloth,account
2913,ed1c6f2a-6962-4626-891d-40f028496bb0,A Google user,https://play-lh.googleusercontent.com/EGemoI2NTXmTsBVtJqk8jxF9rh8ApRWfsIMQSt2uE4OcpQqbFu7f7NbTK05lx80nuSijCz7sc3a277R67g,"For everyone complaining that they can't log in because they signed up with social media, you need to reset your account password by using the ""I forgot my password"" button at the website login. I had to do this because I signed up with github. The app is great once you log in.",5,1,1.7,2019-08-16 21:17:33,,,NEGATIVE,everyone complaining cant log signed social media need reset account password using forgot password button website login signed github app great log,status quo sloth,account
2915,3403817b-032f-418d-9fdc-3cb4667605c2,A Google user,https://play-lh.googleusercontent.com/EGemoI2NTXmTsBVtJqk8jxF9rh8ApRWfsIMQSt2uE4OcpQqbFu7f7NbTK05lx80nuSijCz7sc3a277R67g,"Can't sign in on the app. I registered with my Google account, but there's no option on the app.",1,5,1.7,2019-08-13 03:26:31,"Juan, thanks for your feedback!

In version 1.8.1, you should be able to use your Google account to sign in.",2019-09-07 22:10:30,NEGATIVE,cant sign app registered google account theres option app,status quo sloth,account
2916,7f24656a-6a26-4006-a666-33f5ae33a61c,A Google user,https://play-lh.googleusercontent.com/EGemoI2NTXmTsBVtJqk8jxF9rh8ApRWfsIMQSt2uE4OcpQqbFu7f7NbTK05lx80nuSijCz7sc3a277R67g,Update: I was finally able to sign in on the app. I will reserve a 5 stars for it until I am able to poke around it some more. I signed up with an email on the desktop and then found the app. Every single time I try to sign in on the app it says it's unable to log in to make sure it's a valid account or try again later. Can't use an app I can't sign into.,3,6,1.7,2019-08-12 12:30:21,"Natasha, we're glad you were able to sign in! Thank you for your feedback.",2019-09-07 15:22:38,NEGATIVE,update finally able sign app reserve 5 stars able poke around signed email desktop found app every single time try sign app says unable log make sure valid account try later cant use app cant sign,status quo sloth,account
2920,a8eebcf3-4a72-4180-a0fc-5b88b9b5c42c,A Google user,https://play-lh.googleusercontent.com/EGemoI2NTXmTsBVtJqk8jxF9rh8ApRWfsIMQSt2uE4OcpQqbFu7f7NbTK05lx80nuSijCz7sc3a277R67g,"I've been using the Codecademy website for a few days now and can honestly say I'm enjoying the experience. I'm new to coding but I find the layout and course modules engaging & interesting. Only criticism is the mobile app... I signed up for Codecademy by linking my Google account, unfortunately the app does not do the same so I cant log into it. Hopefully they will fix it asap!",5,6,1.7,2019-08-10 09:34:25,,,POSITIVE,ive using codecademy website days honestly say im enjoying experience im new coding find layout course modules engaging interesting criticism mobile app signed codecademy linking google account unfortunately app cant log hopefully fix asap,status quo sloth,account
2923,b15617ac-20f8-438f-beed-8f55a7e40e7a,A Google user,https://play-lh.googleusercontent.com/EGemoI2NTXmTsBVtJqk8jxF9rh8ApRWfsIMQSt2uE4OcpQqbFu7f7NbTK05lx80nuSijCz7sc3a277R67g,worest app cannot go ahead without making account ...,1,0,,2019-08-05 13:38:00,,,NEGATIVE,worest app cannot go ahead without making account,status quo sloth,account
2927,bb05d760-64f4-45c4-9d13-677ea645fe57,A Google user,https://play-lh.googleusercontent.com/EGemoI2NTXmTsBVtJqk8jxF9rh8ApRWfsIMQSt2uE4OcpQqbFu7f7NbTK05lx80nuSijCz7sc3a277R67g,I can't log in using my Google account,1,1,1.7,2019-07-31 12:37:38,"Thanks for the feedback! Google sign in is now available and should work.

Can you give version 1.8.1 a try in the Google Play store?",2019-09-07 22:39:03,NEGATIVE,cant log using google account,status quo sloth,account
2933,34ac1fe2-6baf-40ed-9a9b-5cce3582b6b5,A Google user,https://play-lh.googleusercontent.com/EGemoI2NTXmTsBVtJqk8jxF9rh8ApRWfsIMQSt2uE4OcpQqbFu7f7NbTK05lx80nuSijCz7sc3a277R67g,"i can't sign in on the app, i linked my social media accounts on the website to enable seamless sign-in but i cant find it on the app and i cant do ""forget password""",1,8,1.7,2019-07-26 10:40:53,"Thanks for the feedback! Google and Facebook sign in are now available and should work.

Can you give version 1.8.1 a try in the Google Play store?",2019-09-07 22:39:51,NEGATIVE,cant sign app linked social media accounts website enable seamless signin cant find app cant forget password,status quo sloth,account
2940,708b41ff-f121-4128-b0a3-2d1deac0f0ba,A Google user,https://play-lh.googleusercontent.com/EGemoI2NTXmTsBVtJqk8jxF9rh8ApRWfsIMQSt2uE4OcpQqbFu7f7NbTK05lx80nuSijCz7sc3a277R67g,Logged in with Google account. Completed the first lesson. Now I want to create an account to study on my plone. But I can't log in with Google. And when I am trying to create an account. It says that this email is already taken. How can I fix this problem?,4,10,1.7,2019-07-16 08:12:43,"Thanks for the feedback! Google sign in is now available and should work.

Can you give version 1.8.1 a try in the Google Play store?",2019-09-07 22:40:35,NEGATIVE,logged google account completed first lesson want create account study plone cant log google trying create account says email already taken fix problem,status quo sloth,account
2942,c36912b2-9e24-4b15-8731-3c6e424bb2a8,A Google user,https://play-lh.googleusercontent.com/EGemoI2NTXmTsBVtJqk8jxF9rh8ApRWfsIMQSt2uE4OcpQqbFu7f7NbTK05lx80nuSijCz7sc3a277R67g,You can't login with your google account,2,2,1.7,2019-07-12 08:33:52,,,NEGATIVE,cant login google account,status quo sloth,account
2948,f089b010-416b-413f-a4dc-eb1398424cdd,A Google user,https://play-lh.googleusercontent.com/EGemoI2NTXmTsBVtJqk8jxF9rh8ApRWfsIMQSt2uE4OcpQqbFu7f7NbTK05lx80nuSijCz7sc3a277R67g,"Theres no option to sign in via Github, Facebook etc. so the only way to use this app is to have an actual codecademy account.",1,5,1.7,2019-07-09 08:34:21,,,NEGATIVE,theres option sign via github facebook etc way use app actual codecademy account,status quo sloth,account
2954,6f7d8064-7f08-4ffc-9832-9f0bc65a96cd,A Google user,https://play-lh.googleusercontent.com/EGemoI2NTXmTsBVtJqk8jxF9rh8ApRWfsIMQSt2uE4OcpQqbFu7f7NbTK05lx80nuSijCz7sc3a277R67g,won't let me login with my Google account?,1,7,1.7,2019-07-06 11:08:51,"Thanks for the feedback! Google sign in is now available and should work.

Can you give version 1.8.1 a try in the Google Play store?",2019-09-07 22:41:11,NEGATIVE,wont let login google account,status quo sloth,account
2956,701483f3-575a-461a-aa86-321ea0a2e853,A Google user,https://play-lh.googleusercontent.com/EGemoI2NTXmTsBVtJqk8jxF9rh8ApRWfsIMQSt2uE4OcpQqbFu7f7NbTK05lx80nuSijCz7sc3a277R67g,top worst app...can't sign in...I was new at this app but it shows to sign in to your codecademy account...but I havn't any account...so going to delete it...or solve my problem...😾😾😾,1,31,1.7,2019-07-05 09:06:32,,,NEGATIVE,top worst appcant sign ini new app shows sign codecademy accountbut havnt accountso going delete itor solve problem,status quo sloth,account
2962,8df6e1db-e944-48f7-a599-9f228ee807bd,A Google user,https://play-lh.googleusercontent.com/EGemoI2NTXmTsBVtJqk8jxF9rh8ApRWfsIMQSt2uE4OcpQqbFu7f7NbTK05lx80nuSijCz7sc3a277R67g,Why can't we login through google account? Could you fix it please?,1,5,1.7,2019-07-03 13:04:33,,,NEGATIVE,cant login google account could fix please,status quo sloth,account
3005,2fb4caf0-f955-4189-bb7e-b891419e3f24,A Google user,https://play-lh.googleusercontent.com/EGemoI2NTXmTsBVtJqk8jxF9rh8ApRWfsIMQSt2uE4OcpQqbFu7f7NbTK05lx80nuSijCz7sc3a277R67g,Can't login with google account. When you type in your credentials and confirm its you you're redirected to google login page. Infinite login loop,2,4,1.4,2019-03-19 03:16:22,,,NEGATIVE,cant login google account type credentials confirm youre redirected google login page infinite login loop,status quo sloth,account
3019,a03d4bba-3ea2-4097-832b-6203dfed4467,A Google user,https://play-lh.googleusercontent.com/EGemoI2NTXmTsBVtJqk8jxF9rh8ApRWfsIMQSt2uE4OcpQqbFu7f7NbTK05lx80nuSijCz7sc3a277R67g,"Edit: I walked away from my phone for several minutes, and when I came back, was logged in. I have a strong wifi and data connection. Giving one extra star, but so far unimpressed. Topsitive review is incorrect. I have a pro account and when I attempt to log in, the process gets hung up. I uninstalled and reinstalled the app, double checked that my password is correct, and it's hung up again. I'm on Android. Was never able to login.",2,51,1.4,2019-01-25 11:10:25,,,NEGATIVE,edit walked away phone several minutes came back logged strong wifi data connection giving one extra star far unimpressed topsitive review incorrect pro account attempt log process gets hung uninstalled reinstalled app double checked password correct hung im android never able login,status quo sloth,account
3023,fa67bf4e-9a32-49da-933d-ed3f1daf653e,A Google user,https://play-lh.googleusercontent.com/EGemoI2NTXmTsBVtJqk8jxF9rh8ApRWfsIMQSt2uE4OcpQqbFu7f7NbTK05lx80nuSijCz7sc3a277R67g,"As of writing this review I am able to sign into my account through Google. Overall, I think this app is a great idea, it does what it says it's supposed to do. Whenever I have the spare time I will be sure to visit this app and complete the daily reviews and practices.",5,0,,2019-01-04 01:02:49,,,POSITIVE,writing review able sign account google overall think app great idea says supposed whenever spare time sure visit app complete daily reviews practices,status quo sloth,account
3028,eb61a0be-13aa-4e3a-89e7-eb5113d087b0,A Google user,https://play-lh.googleusercontent.com/EGemoI2NTXmTsBVtJqk8jxF9rh8ApRWfsIMQSt2uE4OcpQqbFu7f7NbTK05lx80nuSijCz7sc3a277R67g,"is this a codecademy app? it doesnt let me log into my account, it just crashes. Either this app is fake or I shouldn't be using Codecademy in the first place.",1,8,1.2,2018-12-25 08:52:12,,,NEGATIVE,codecademy app doesnt let log account crashes either app fake shouldnt using codecademy first place,status quo sloth,account
3040,054423b0-2219-4fc5-a153-9099b980575e,A Google user,https://play-lh.googleusercontent.com/EGemoI2NTXmTsBVtJqk8jxF9rh8ApRWfsIMQSt2uE4OcpQqbFu7f7NbTK05lx80nuSijCz7sc3a277R67g,"I LOVE CODECADEMY!!! Once again, your customer service is Stellar! I had a billing issue: they were quick to respond and fixed it right away; I had an issue with the app not working, and it was fixed quickly! This app, the company, and website is awesome! Keep up the incredible hard work!",5,9,1.1.1,2018-11-10 00:35:15,,,POSITIVE,love codecademy customer service stellar billing issue quick respond fixed right away issue app working fixed quickly app company website awesome keep incredible hard work,status quo sloth,custom
3047,2bcb3d52-f1a5-46b6-aa91-369b9d417a04,A Google user,https://play-lh.googleusercontent.com/EGemoI2NTXmTsBVtJqk8jxF9rh8ApRWfsIMQSt2uE4OcpQqbFu7f7NbTK05lx80nuSijCz7sc3a277R67g,Cannot log in with my account...,5,0,1.1.1,2018-10-30 23:20:19,,,NEGATIVE,cannot log account,status quo sloth,account
3056,4bae5797-7503-4728-ad0e-f612568e0ff4,A Google user,https://play-lh.googleusercontent.com/EGemoI2NTXmTsBVtJqk8jxF9rh8ApRWfsIMQSt2uE4OcpQqbFu7f7NbTK05lx80nuSijCz7sc3a277R67g,Search-Function doesn't work. First tab never loads. App needed reinstall to notice that I have a Pro-account. I can't select any course in the catalog. So basically nothing works. I was really looking forward to using codecademy on mobile.,1,6,1.1.1,2018-10-19 09:42:15,,,NEGATIVE,searchfunction doesnt work first tab never loads app needed reinstall notice proaccount cant select course catalog basically nothing works really looking forward using codecademy mobile,status quo sloth,account
3064,a4061f1d-d904-44f4-8042-d496804e2964,A Google user,https://play-lh.googleusercontent.com/EGemoI2NTXmTsBVtJqk8jxF9rh8ApRWfsIMQSt2uE4OcpQqbFu7f7NbTK05lx80nuSijCz7sc3a277R67g,"Glad I have access to it bc of my pro account, but the app wouldnt load everytime I go to another country (I'm in the EU). Please fix",3,4,1.1.1,2018-10-07 08:18:21,,,NEGATIVE,glad access bc pro account app wouldnt load everytime go another country im eu please fix,status quo sloth,account
3066,0e8fdbbb-7184-4c4a-ba7a-4283de2f53a7,A Google user,https://play-lh.googleusercontent.com/EGemoI2NTXmTsBVtJqk8jxF9rh8ApRWfsIMQSt2uE4OcpQqbFu7f7NbTK05lx80nuSijCz7sc3a277R67g,"I already have a Codecademy account and have purchased several courses, but when I log in to the app none of my history or courses are there. Useless.",1,9,1.1.1,2018-10-05 05:50:49,,,NEGATIVE,already codecademy account purchased several courses log app none history courses useless,status quo sloth,account
3067,1e839252-cda6-4950-b0df-9ea9a2a7ba0f,A Google user,https://play-lh.googleusercontent.com/EGemoI2NTXmTsBVtJqk8jxF9rh8ApRWfsIMQSt2uE4OcpQqbFu7f7NbTK05lx80nuSijCz7sc3a277R67g,"Requires pro to access content that free accounts can access on the site (JavaScript for instance) only free courses here is Python and HTML. I realize you need money, Codecademy, but this doesn't make me want to sign up for pro. Far from it, actually. Shame, I wanted the ability to practice JS. Oh well... =/",2,3,1.0,2018-09-28 23:48:25,,,NEGATIVE,requires pro access content free accounts access site javascript instance free courses python html realize need money codecademy doesnt make want sign pro far actually shame wanted ability practice js oh well,status quo sloth,account
3072,ae5fbce6-00f7-435c-b3bf-7d0796b74193,A Google user,https://play-lh.googleusercontent.com/EGemoI2NTXmTsBVtJqk8jxF9rh8ApRWfsIMQSt2uE4OcpQqbFu7f7NbTK05lx80nuSijCz7sc3a277R67g,Not working here. (Pro user) I cannot log with my Google account. Please fix it 👍,1,2,1.0,2018-09-19 14:37:02,,,NEGATIVE,working pro user cannot log google account please fix,status quo sloth,account
3075,5d5a7d35-eb63-4bc4-b460-4f7449a0f383,A Google user,https://play-lh.googleusercontent.com/EGemoI2NTXmTsBVtJqk8jxF9rh8ApRWfsIMQSt2uE4OcpQqbFu7f7NbTK05lx80nuSijCz7sc3a277R67g,Can't log in with Google account,1,0,1.0,2018-09-13 06:05:28,,,NEGATIVE,cant log google account,status quo sloth,account
3077,32ba4af8-d56e-448e-bd86-2a7fbe2316d4,A Google user,https://play-lh.googleusercontent.com/EGemoI2NTXmTsBVtJqk8jxF9rh8ApRWfsIMQSt2uE4OcpQqbFu7f7NbTK05lx80nuSijCz7sc3a277R67g,I love code academy. But it does not recognize my google account when trying to login for whatever reason. I can sign in via web browser on android but not through the app directly.,3,7,1.0,2018-09-12 21:03:25,,,NEGATIVE,love code academy recognize google account trying login whatever reason sign via web browser android app directly,status quo sloth,account
3078,b392ea46-5bad-46fa-8f46-9858ec4aaa71,A Google user,https://play-lh.googleusercontent.com/EGemoI2NTXmTsBVtJqk8jxF9rh8ApRWfsIMQSt2uE4OcpQqbFu7f7NbTK05lx80nuSijCz7sc3a277R67g,If your account is linked to google.. You cannot open the app. This is a untested app by a platform which teaches you to code.... Isn't that a irony...,2,2,1.0,2018-09-12 05:21:03,,,NEGATIVE,account linked google cannot open app untested app platform teaches code isnt irony,status quo sloth,account
3079,fc6373c9-e8d6-43d3-9a59-7eee4af82db6,A Google user,https://play-lh.googleusercontent.com/EGemoI2NTXmTsBVtJqk8jxF9rh8ApRWfsIMQSt2uE4OcpQqbFu7f7NbTK05lx80nuSijCz7sc3a277R67g,Can't sign in with my Google account even though that's how I log in on the website,4,0,1.0,2018-09-11 20:36:01,,,NEGATIVE,cant sign google account even though thats log website,status quo sloth,account
3098,6643ffcc-c0be-4bc1-9203-669f1cac259c,A Google user,https://play-lh.googleusercontent.com/EGemoI2NTXmTsBVtJqk8jxF9rh8ApRWfsIMQSt2uE4OcpQqbFu7f7NbTK05lx80nuSijCz7sc3a277R67g,"I have trouble signing in. I am trying to sign in using the Google account 
but it just goes back to the get started page instead of signing in.",2,0,,2018-08-02 10:13:20,"Hi there, we'd be happy to help you logged in. Can you send us an email at support@codecademy.com, including the email address associated with your Codecademy account?",2018-08-02 14:37:27,NEGATIVE,trouble signing trying sign using google account goes back get started page instead signing,status quo sloth,account
