Unnamed: 0,reviewId,userName,userImage,review,rating,thumbsUpCount,reviewCreatedVersion,date,replyContent,repliedAt,sentiment,standardizedReview,mentionedFeature,mentionedSynonyms
3,81179f47-40c2-4dd2-8e5b-1c8be51cd33e,V Leandros,https://play-lh.googleusercontent.com/a/AGNmyxbkCPDwNAcW7i0V-XdBnv11_LS-SeCSXcw2go3-=mo,"It seems it is impossible to login with my pro account which is not a gmail. I suddenly got logged out 24 hrs ago when I was doing this app, walking my dog outside.",1,0,,2023-03-19 12:20:01,,,NEGATIVE,seems impossible login pro account gmail suddenly got logged 24 hrs ago app walking dog outside,status quo sloth,account
22,22e9ffc1-33dd-4103-9760-8ba9a4773f93,Harsh Singh,https://play-lh.googleusercontent.com/a/AGNmyxaWQ7dLaYDXs_3RnYBlTi_bIknjAPAQEXG2ZdMt=mo,codecademy is a free and good platform to learn coding from any level specially as a beginner,5,0,1.14.0,2023-03-05 22:16:47,,,POSITIVE,codecademy free good platform learn coding level specially beginner,boosters,special
66,545a0b53-7183-452e-9ff5-e2a1f1faa3e7,Filippo Casa,https://play-lh.googleusercontent.com/a-/ACB-R5RBlzKlpBZUMjJ5Mb0Qe0ghLWkjX6WEmaCtmfRxBg,"Cannot sign in with a google account. I have an account on Codecademy linked with LinkedIn and google. I tried to sign in using google but I can only see a blank page with no possibility to go back. For now, I cannot use the app.",2,0,1.14.0,2023-02-08 04:03:29,,,NEGATIVE,cannot sign google account account codecademy linked linkedin google tried sign using google see blank page possibility go back cannot use app,status quo sloth,account
99,01a99dfc-3541-4f56-9544-3551b4695791,Carlos Garcia,https://play-lh.googleusercontent.com/a-/ACB-R5Svb_XXxQtwLrk8RMP7tsq0DLBo1zC8oW7tZajK1_M,"How can after 2 years of subscribing the app sucks so much. It makes no sense. Free apps make more sense and have more content. You review stuff you have no idea about, then you take a take on content barely reviewed and move on. Plus it's nowhere near comprehensive as the website. Fix your app. I like to learn on the go and the trash app is not it.",1,3,1.14.0,2023-01-16 16:46:01,,,NEGATIVE,2 years subscribing app sucks much makes sense free apps make sense content review stuff idea take take content barely reviewed move plus nowhere near comprehensive website fix app like learn go trash app,voting,content r
163,883107de-0649-49f7-b3b6-8e1865e48a21,SANJAY H R,https://play-lh.googleusercontent.com/a-/ACB-R5SZawCsLrCbuwLPOzOZl3WP_DB8BX-w_JXxqkLM6A,this is one of the best application for coding learners and especially for beginners just go and crack it..,5,0,1.14.0,2022-12-06 09:16:30,,,POSITIVE,one best application coding learners especially beginners go crack,boosters,special
170,49b0a5af-fa09-41be-8513-2e48cc81c790,Ruben Mendes,https://play-lh.googleusercontent.com/a-/ACB-R5Q2DCdqeNyqLIv18g8mBpaybjN9BMJj90EJQvmiB8Y,"Cannot even sign in to the app as it keeps giving an error of incorrect email our password. Already followed the steps mentioned on the ""What information do I use to login to Codecademy Go?"" by resetting my password but to no avail. I am still unable to sign in. On the previous mentioned help article it stated that you would be supporting login with GitHub account in the near future... The article is dated from 4 years ago.",1,0,1.14.0,2022-12-03 01:08:20,,,NEGATIVE,cannot even sign app keeps giving error incorrect email password already followed steps mentioned information use login codecademy go resetting password avail still unable sign previous mentioned help article stated would supporting login github account near future article dated 4 years ago,status quo sloth,account
250,7998844a-0bd9-41f3-9f30-1bdbc7d0e896,Jennifer M,https://play-lh.googleusercontent.com/a-/ACB-R5SWlsrshn2UbSJ8wWOT2o2tvR8Aj2M94ZPYxtD_dA,"Can only sign up with google or facebook. Oh, and if signing up with google account, which is signed in on same device, still asks for the password instead of sending verification email. The whole point of signing up/in with google was to not have to remember all these flipping passwords!",1,0,1.14.0,2022-10-19 01:31:08,,,NEGATIVE,sign google facebook oh signing google account signed device still asks password instead sending verification email whole point signing upin google remember flipping passwords,status quo sloth,account
267,ecd97b9e-0efb-4768-8b85-0f07b12c6e32,Anoop S,https://play-lh.googleusercontent.com/a-/ACB-R5QD2MVMxoP3cR9IVOMLVwdZajfW1IXWB8Qafcoo,I'm not able to change accounts..,3,0,1.14.0,2022-10-06 09:12:23,,,NEGATIVE,im able change accounts,status quo sloth,account
392,7acc556f-1002-4d16-83de-291b0ccc68c7,solo,https://play-lh.googleusercontent.com/a-/ACB-R5RQCdE3WM3DGzii8feF_ue_TuWa3tOEHUYZTdQJqw,"It's a bit mediocre. It seems like this is meant to be used as an accessory to the main Code Academy experience, where you do the bulk of your studying online and then use the app to review certain tidbits. If you're trying to use the app as a standalone learning tool, you're not going to have a good time. I'm okay with that, personally. An accessory app can still be useful. The issue for me is that I encounter questions fairly often that are very poorly formatted.",2,69,1.14.0,2022-08-03 23:24:25,,,NEGATIVE,bit mediocre seems like meant used accessory main code academy experience bulk studying online use app review certain tidbits youre trying use app standalone learning tool youre going good time im okay personally accessory app still useful issue encounter questions fairly often poorly formatted,status quo sloth,person
415,83be6d8a-fe5c-44be-9578-15fe9446cb7c,Yakisoba Subs,https://play-lh.googleusercontent.com/a/AGNmyxaWXC6qwsPNQvjxeF3KBdbSdvrGR5X5067tnbYa=mo,"Good for entry level, but that's about it. I'm only talking about Java, because that's what I used to try this app. If you're someone who can build a simple customer management program, for example, you're already beyond what this app can teach you. Would be cool to get some more advanced content.",4,0,,2022-07-24 01:21:08,,,NEGATIVE,good entry level thats im talking java thats used try app youre someone build simple customer management program example youre already beyond app teach would cool get advanced content,status quo sloth,custom
496,3729cca7-ff6e-4f3f-b09a-2c0f4e9fbe5b,Marci Ha,https://play-lh.googleusercontent.com/a-/ACB-R5S9muI7V0_Kp-l7RO_pjEpKm3UJbDdshuQoXigcEmI,The app won't let me sign in via Google. I get the request in my phone to confirm that I want to log in and then an error shows up. The app is useless if I can't access the account.,1,2,1.14.0,2022-06-25 21:14:41,,,NEGATIVE,app wont let sign via google get request phone confirm want log error shows app useless cant access account,status quo sloth,account
529,530cd684-df40-4f7b-a7a9-365f93594648,Kingdom4Crusher,https://play-lh.googleusercontent.com/a/AGNmyxZg8lT3aEesYmztrqyUA9Te3mzpDfbT7VZLS4s=mo,"This is perfect to keep your streak going when you cant get to your pc however the randomized lessons without context for the practice lessons is terribly confusing especially if it gives you questions not related to the 5 pieces of ""flashcards"" or when you havent gone over the entirety of all the material in that particular lesson and i become lost on what would be the correct answer",3,0,1.14.0,2022-06-07 13:53:54,,,NEGATIVE,perfect keep streak going cant get pc however randomized lessons without context practice lessons terribly confusing especially gives questions related 5 pieces flashcards havent gone entirety material particular lesson become lost would correct answer,boosters,special
534,c24784b7-90e0-438f-a739-d12e7866e5aa,Keith Morse,https://play-lh.googleusercontent.com/a/AGNmyxavTNu_q5kCbmdwKQMIESgPucObFCFQ39eUnRSq=mo,Simple straight to the point but not too advanced To overcomplicate Keeps to improving the person not expecting everything at once,4,0,1.14.0,2022-06-07 05:38:31,,,POSITIVE,simple straight point advanced overcomplicate keeps improving person expecting everything,status quo sloth,person
542,44faeb59-060f-4ad4-8b33-2d6909e88f93,Gary McCloskey,https://play-lh.googleusercontent.com/a-/ACB-R5TjZAMdQbiU4V1OsuMw637ubu8a8mrOQVmXgiTw6A,"While presumably far from the depth (and commitment!) of a CS degree, Codecademy is an easy entry point to learning popular programming languages. Delivered in bite-sized, and addictive, chunks of info, projects, puzzles, and quizzes, Codecademy provides the tactile feedback and quick dopamine rewards (✅, 👍👏'yay!'s, 'you got it!', 'Completed!') that make learning something you can do while pooping. Note: I hope to see fresh content regularly added, or I'm changing this review to 4 stars.",5,84,1.14.0,2022-06-01 00:24:52,,,POSITIVE,presumably far depth commitment cs degree codecademy easy entry point learning popular programming languages delivered bitesized addictive chunks info projects puzzles quizzes codecademy provides tactile feedback quick dopamine rewards yays got completed make learning something pooping note hope see fresh content regularly added im changing review 4 stars,"torture breaks, voting","live, content r"
551,b2089dab-835c-4695-87ea-28a8ccef1306,KATHERINE BULAC,https://play-lh.googleusercontent.com/a-/ACB-R5SKg0SOKTsELNqAK9JwczlyszPWLzCN60WTpeA074M,Challenging! 😁,5,0,1.14.0,2022-05-24 08:45:20,,,POSITIVE,challenging,challenges,challeng
684,f718759d-db58-45de-b625-9a0719f8be93,Rob,https://play-lh.googleusercontent.com/a/AGNmyxavBbyE3s7zyBw-LAf7mmPnsBeWfNjrncPOvOtT=mo,Created multiple accounts with different emails approved them still couldn't log in tried my difference facebooks neither worked so uninstalled seemed sketchy,1,1,,2022-03-11 17:56:07,,,NEGATIVE,created multiple accounts different emails approved still couldnt log tried difference facebooks neither worked uninstalled seemed sketchy,status quo sloth,account
707,60df8d0d-5d30-4cd6-83c0-ae1110d5c51a,Nathan Black,https://play-lh.googleusercontent.com/a/AGNmyxZDEAfqZcuGKVptMIpWmf6oZJ1x9rFIBnUOg498=mo,"Automatically charged a new debit card I got despite me never authorizing the switch, and has zero customer support options for disputing charges.",1,1,1.14.0,2022-02-22 17:25:52,,,NEGATIVE,automatically charged new debit card got despite never authorizing switch zero customer support options disputing charges,status quo sloth,custom
729,40d39071-45ef-4a39-9bf5-debc7178b216,Matthew Gammon,https://play-lh.googleusercontent.com/a-/ACB-R5T_P89R37xYa-qMaRbm8if8ZHw2RjlhyyWwezkpIpM,Good for a quick on the go review or to keep your daily streak going and that's it. It's all flash cards and fill in the blanks and the card packs that you get repeat all the time. Several user created cards end up in your study packs and half the time they are straight up garbage with incorrect answers or no way to properly solve the problem. Don't fool yourself into thinking you are learning and look elsewhere for more serious study. App receives no updates. Don't bother.,1,169,1.14.0,2022-02-11 08:46:01,,,NEGATIVE,good quick go review keep daily streak going thats flash cards fill blanks card packs get repeat time several user created cards end study packs half time straight garbage incorrect answers way properly solve problem dont fool thinking learning look elsewhere serious study app receives updates dont bother,daily streaks,daily streak
794,3ad75895-77e6-4849-82db-62a2278fcdc9,Geos Tricks,https://play-lh.googleusercontent.com/a/AGNmyxb1FYgshsV7_jF_y6URe_GUJS_Y0h9qpCrWpTyy=mo,"Cant even log into my Pro account, cant see when typing. For a company that sells and teaches that cant even get an app to work properly is worrying. Think its best to cancel subscription.",1,3,1.14.0,2022-01-09 19:17:43,,,NEGATIVE,cant even log pro account cant see typing company sells teaches cant even get app work properly worrying think best cancel subscription,status quo sloth,account
848,2831ada6-7dd2-4e96-843a-c3d140ab9ef0,Foday Gray,https://play-lh.googleusercontent.com/a-/ACB-R5TC0aGgjgMAt9wl1w_ENQOWMlO0cRs2PRxf62sj0Q,this app is very useful to most programer most especially for the mm. n beginner,5,0,1.14.0,2021-12-15 01:49:42,,,POSITIVE,app useful programer especially mm n beginner,boosters,special
870,0147fe32-6d29-465a-8463-754d254f4e7b,Lia G,https://play-lh.googleusercontent.com/a-/ACB-R5QIBc2zjlsediRDXdZuosj2JI8fugLR9DIFEAKRGQ,"Great app to keep reviewing the same five concepts in your lesson but not advance any further. Would be nice, especially on the pro plan, to be able to do lessons on the go or anything beyond the same flash cards each day. The quiz items don't even change?",1,8,1.14.0,2021-12-04 07:28:42,,,POSITIVE,great app keep reviewing five concepts lesson advance would nice especially pro plan able lessons go anything beyond flash cards day quiz items dont even change,boosters,special
876,441b9364-39f8-44bb-ae25-07678656fbbd,khaleefa r shehu,https://play-lh.googleusercontent.com/a-/ACB-R5SAsvDADXWhsNNidZlAJ9XCaZeLYNq8d41s4dYLwQ,very simple and easy for begginers to understand they used very personalized interface wonderful,4,3,1.14.0,2021-12-01 09:14:46,,,POSITIVE,simple easy begginers understand used personalized interface wonderful,status quo sloth,person
881,0dd67895-d32f-4d0a-b3b4-779281fba177,John Mituniewicz,https://play-lh.googleusercontent.com/a/AGNmyxaVLRwZeGJn11c1kNZVUQxY007LsiiSLnSCjpNb=mo,"I do like Codecademy thier website is amazing especially if you subscribed to Pro, but for the app there needs to be more especially if you are paying for a subscription. There are other apps that will actually let you practice coding and go through the course without needing a computer. This comes in really handing especially when some of us work 50 hours a week and only get to use their apps on breaks most days. Other then that you guys doing a really great job!!!",3,88,1.14.0,2021-11-28 17:20:40,,,POSITIVE,like codecademy thier website amazing especially subscribed pro app needs especially paying subscription apps actually let practice coding go course without needing computer comes really handing especially us work 50 hours week get use apps breaks days guys really great job,boosters,special
886,083f133f-0b7f-48b3-bf92-987b0f6919f7,Marcone Ribeiro,https://play-lh.googleusercontent.com/a-/ACB-R5Ss84idiPBkkuLt_9FAlKlrCW_W13QlfrzxIWSmbQ,Can't log-in with LinkedIn account. Now my course progress can't be accessed in the application. :(,1,0,1.14.0,2021-11-23 20:26:45,,,NEGATIVE,cant login linkedin account course progress cant accessed application,status quo sloth,account
928,124432c7-38fb-44c3-8281-1496ccb89270,Fathi Hilmi,https://play-lh.googleusercontent.com/a/AGNmyxbI2sryaDFem8YuZF6sTtIW3mpjUrXqxQOQjhFM=mo,"The app sucks. I made an account on the app with Google and I can't find a way to Log In the account on my computer. Plus, there's no setting for me to delete this account since I don't know what is the password.",1,3,1.14.0,2021-10-25 07:02:24,,,NEGATIVE,app sucks made account app google cant find way log account computer plus theres setting delete account since dont know password,status quo sloth,account
968,2f7d5625-25f5-4c6a-8249-80019b03d481,Ari,https://play-lh.googleusercontent.com/a-/ACB-R5RPk0V_L5u4wnbF-98QG-uEd0h5jD8msgVwogxpXA,"Wonderful for reviewing but I was really hoping to take my lessons on the go. I work a full time job and on my breaks I would have loved to sneak in some bits of lessons. Instead I'm reviewing with this flashcard like app. For being a Pro member I'm quite disappointed, I expected more. Especially for the amount paid for Code Academy Pro. This app shouldn't even be locked to Pro members for its contents. Maybe if you were to make the actual lesson paths mobile, then it could be locked to Pro.",1,48,1.14.0,2021-09-24 10:05:17,,,NEGATIVE,wonderful reviewing really hoping take lessons go work full time job breaks would loved sneak bits lessons instead im reviewing flashcard like app pro member im quite disappointed expected especially amount paid code academy pro app shouldnt even locked pro members contents maybe make actual lesson paths mobile could locked pro,boosters,special
977,b7e13fbd-c4a5-4d9d-a07a-4a6a40a3e23e,Florin Valentin,https://play-lh.googleusercontent.com/a-/ACB-R5TlPJOoELrGfcvebDVCXdVlD8-uhvjMRelG4HjoUQ,Challenging = Good,4,0,1.14.0,2021-09-21 01:47:27,,,POSITIVE,challenging good,challenges,challeng
981,d887e1eb-d397-4434-8266-b4467546091b,Duy Pham,https://play-lh.googleusercontent.com/a-/ACB-R5TguKH19AjZDNz3ZHgHTWiW6qNkOKSBPSvlLbO9ug,"I cannot sign in or even sign up with my Google account, since I want to synchronizw my progress on PC. Pls check that my device is Xiaomi Mi8",3,0,1.14.0,2021-09-19 09:40:59,,,NEGATIVE,cannot sign even sign google account since want synchronizw progress pc pls check device xiaomi mi8,status quo sloth,account
991,57bda7c6-8166-4e79-8fd1-44f0e51ad0d9,Alan Baldwin,https://play-lh.googleusercontent.com/a-/ACB-R5RcT5Y45VvLkSSomo-2Qg3wu-snuWlqpgKP7v11TQ,*update - it seems the login with linkedin is no longer visible on the mobile app. So i cant login with that method anymore* Logs you out while you are learning with no way to reset your password from the app itself. Kind of given up on the app now. I am a paid sub user. Lost the will to live re-logging in all the time.,2,17,1.14.0,2021-09-14 03:20:55,,,NEGATIVE,update seems login linkedin longer visible mobile app cant login method anymore logs learning way reset password app kind given app paid sub user lost live relogging time,torture breaks,live
999,24640e93-8b43-4ab7-82dd-9dddc4b3425e,Jacob Combrink,https://play-lh.googleusercontent.com/a-/ACB-R5QDORLy82SMvjv4cna7RIrWTXLi9f1pn9r6YTCQiw,"it works as intended, and the content is REALLY good, but I can't give 5/5 as my progress on desktop browser isn't showing here and i cannot continue my full-stack software engineer path... infact, it's not an option on the app. Since that's the content I actually want, the app isn't actually giving me downloaded it for... but it looks pretty, interface is sensible and what content is available works as expected.",4,27,1.14.0,2021-09-10 05:48:47,,,NEGATIVE,works intended content really good cant give 55 progress desktop browser isnt showing cannot continue fullstack software engineer path infact option app since thats content actually want app isnt actually giving downloaded looks pretty interface sensible content available works expected,voting,content r
1028,e862105e-3d8f-447a-8a41-28e484b03fec,Divemasterorc,https://play-lh.googleusercontent.com/a-/ACB-R5TxshQLJZ-gdnY2wwQnspzs5LoAormRTpRco03pBvU,DO NOT GIVE YOUR MONEY TO THIS COMPANY! This company is an absolute scam and will gladly steal from it's customers. You cannot remove your cc from their website and you cannot get ahold of a live person under any circumstances to fix billing or any issues. STAY AWAY. I wish I could rate with negative stars.,1,0,1.14.0,2021-08-22 19:32:13,,,NEGATIVE,give money company company absolute scam gladly steal customers cannot remove cc website cannot get ahold live person circumstances fix billing issues stay away wish could rate negative stars,"torture breaks, status quo sloth","live, person, custom"
1030,757bac94-2e71-4f61-9386-782adefba804,Mentor Aliu,https://play-lh.googleusercontent.com/a/AGNmyxZsej91qiRhkuPjDRaURlwMEKuTvJjwyGiBKJLT=mo,"Courses are great, but I logged in on Desktop with my Github account but can't login on mobile with the same account because there is no option Github login on mobile",3,0,1.14.0,2021-08-22 09:33:47,,,NEGATIVE,courses great logged desktop github account cant login mobile account option github login mobile,status quo sloth,account
1092,edb9048a-ef82-4885-856a-b9c10b2380d4,Caitlyn “MsCat96”,https://play-lh.googleusercontent.com/a-/ACB-R5SNOkkIBF8-09erdcrORkIOX9PrMB8FfL-4GovO,"Very handy to have when you want to pass the time away, and also want a challenge at hand 😸",5,2,1.14.0,2021-07-26 01:09:44,,,POSITIVE,handy want pass time away also want challenge hand,challenges,challeng
1118,79f21846-1c7d-4bf5-9a6d-d3e1d4aac2c2,Tiarnach O'Cathain,https://play-lh.googleusercontent.com/a/AGNmyxYqTctSroZZylT-b0mIbgqsOOWDPFdYXO_3my4q=mo,Do not give them your account details. Took nearly 200 quid off me and they do not give refunds,1,0,1.14.0,2021-07-12 02:03:50,,,NEGATIVE,give account details took nearly 200 quid give refunds,status quo sloth,account
1129,d08f35c1-2db3-4eaa-b66a-be73a1694b01,Isaac Alvarado Valverde,https://play-lh.googleusercontent.com/a-/ACB-R5T-V2awUn0FiSbypBQKFynD3JP3I7u7ysnGkCS3Ig,"Having an application for Pro members is not at all helpful if it does not adhere to the website learning. I thought it was absolutely obvious that if I had a learning subject on the website and I had progressed on it, that the mobile app was a secondary platform that allowed me to continue that learning path, not start a new one o a new practice. Why would I start a new subject or the same subject from scratch if the only thing I'm doing is changing devices? I'm not changing my account, so why?",1,28,1.14.0,2021-07-07 22:35:06,,,NEGATIVE,application pro members helpful adhere website learning thought absolutely obvious learning subject website progressed mobile app secondary platform allowed continue learning path start new one new practice would start new subject subject scratch thing im changing devices im changing account,status quo sloth,account
1169,b29f65f3-8fcc-4e4b-a508-26c2eaf749f2,E 770,https://play-lh.googleusercontent.com/a-/ACB-R5SsRZkI4EZPzhZUUIjDzaXLDlyeAiMxKc5qlpolgA,"No sign up with email address, Forcing the user to use Facebook account or a Google account, probably for getting more of the user's data, very disappointing.",1,2,,2021-06-24 17:35:16,,,NEGATIVE,sign email address forcing user use facebook account google account probably getting users data disappointing,status quo sloth,account
1203,10fe093a-5821-46f3-a242-226eb363c5f5,Britt Bratt Lungu,https://play-lh.googleusercontent.com/a-/ACB-R5QVSicLo0FNrEnXdxM4IgiE3KbSDEqy74LZSIP3_w,great for learning especially switching from the Healthcare field,5,0,1.14.0,2021-06-11 22:19:31,,,POSITIVE,great learning especially switching healthcare field,boosters,special
1211,aa405174-692e-41ed-848f-39a2c633bd3c,Balaguru Mamundi (Ghostofmj),https://play-lh.googleusercontent.com/a-/ACB-R5T_LXOx4nUIg1rrPzCFpVV45mvAqxjD9vQABSp_la4,"Cant signin or signup to the app via gmail account. Though I logged in using the same in the website,",1,0,,2021-06-09 01:35:34,,,NEGATIVE,cant signin signup app via gmail account though logged using website,status quo sloth,account
1270,53338715-3965-4bf3-ac7c-cd26319e1a00,Abdullah Hassan,https://play-lh.googleusercontent.com/a-/ACB-R5RD1HeBcHFVWKD0xVJgrLgPFkknRkdzzxfOjwdAugw,"Would've loved to see full-fledged courses such as the website, and also more challenging practice questions.",4,0,1.14.0,2021-05-19 14:25:44,,,POSITIVE,wouldve loved see fullfledged courses website also challenging practice questions,challenges,challeng
1307,777dea43-9f7e-4344-87c5-711f22086f4b,Prince Etiet,https://play-lh.googleusercontent.com/a-/ACB-R5R8vFZRDtKoJUSmWYUIA_qwdm_8pUNzVSPcSJrM,"I can't get past the LogIn/SignUp section from the first launching of the app... I use my Google Account for log in authentication, but after authorisation has completed via Chrome I'm still stuck in the log in and sign up screen always and always.",2,3,1.14.0,2021-05-03 15:31:42,,,NEGATIVE,cant get past loginsignup section first launching app use google account log authentication authorisation completed via chrome im still stuck log sign screen always always,status quo sloth,account
1334,4fff10b9-0e0e-46c0-a98a-74f564f88a2d,Leyla Suleymanova,https://play-lh.googleusercontent.com/a/AGNmyxZU4NJNm522o108D8Ypc8_ZHVXMHTLz-Q0eaWe8=mo,"Daily reminders doesn't work at all. Fil-in-the-gap tasks always show the 1st cell several times, repeating it in every line. And the practice section is uncomfortable to use",2,0,1.14.0,2021-04-23 01:18:46,,,NEGATIVE,daily reminders doesnt work filinthegap tasks always show 1st cell several times repeating every line practice section uncomfortable use,daily streaks,daily remind
1367,1ac0d32b-97b4-4c67-b6f9-83c5373180e8,Nhlakanipho Bright Mzelemu,https://play-lh.googleusercontent.com/a-/ACB-R5Q467m_5gkBlPQUhJ_cclqwMeNpodkcyZsPpGi1,"some sentences can't fit or show on the screen, especially at the beginning of the paragraph. So that makes me to assume what was the sentence.",3,1,1.14.0,2021-04-06 15:10:07,,,NEGATIVE,sentences cant fit show screen especially beginning paragraph makes assume sentence,boosters,special
1433,495288d1-dfad-4894-a8b8-7531439b89a9,Tanner Siebel,https://play-lh.googleusercontent.com/a-/ACB-R5R1olsJoAiumJ5N8JYJnL2yiwvrGFJw74xKvBEPoQ,"I signed in using my Google account on pc and now no matter whether I use my phone, email or username it tells me my sign in info is incorrect.",1,1,1.14.0,2021-03-08 12:22:02,,,NEGATIVE,signed using google account pc matter whether use phone email username tells sign info incorrect,status quo sloth,account
1470,4f75ac13-0ce2-449c-b44f-88601aff69dc,Benjamin Martin,https://play-lh.googleusercontent.com/a/AGNmyxa11LzVSFTqiOOKtVlwzxtv0MgjPoszefsj9y7e=mo,"Honestly a decent app for beginners, but unfortunately there is little to no customer support unless you count a bot/chat menu as support. Currently I'm trying to find anyone to contact about my credit card being charged even though I tried to cancelled my account and every email I find auto replies telling me to use the websites chat function. This website has no problem taking your money but it's impossible to find anyone to talk to.",1,33,1.14.0,2021-02-16 20:37:46,,,NEGATIVE,honestly decent app beginners unfortunately little customer support unless count botchat menu support currently im trying find anyone contact credit card charged even though tried cancelled account every email find auto replies telling use websites chat function website problem taking money impossible find anyone talk,status quo sloth,"custom, account"
