Unnamed: 0,reviewId,userName,userImage,review,rating,thumbsUpCount,reviewCreatedVersion,date,replyContent,repliedAt,sentiment,standardizedReview,mentionedFeature,mentionedSynonyms
1487,cf19a361-f86f-4b3b-816c-9302ce9733ce,Adam Shepherd,https://play-lh.googleusercontent.com/a-/ACB-R5Qu1KQTPizu044Ay8YjNwQYzxH9dj_a3MRbdYbTNA,"There are some UI problems, especially at parts where you have to insert pre-determined answers. And it accepts complete s__t answers as correct. Just for an example; for a simple html h1 tag in a code snippet it requires 4 closing/h1 tag to solve that question.",2,2,1.14.0,2021-02-07 04:20:08,,,NEGATIVE,ui problems especially parts insert predetermined answers accepts complete s__t answers correct example simple html h1 tag code snippet requires 4 closingh1 tag solve question,boosters,special
1502,44f46b22-1cdb-49e5-99cb-210a4009c15e,Mobius Grey,https://play-lh.googleusercontent.com/a-/ACB-R5Rq7YUqXVlwsUY2NxaPkFxlnA26WI9n3j9XsePR5w,I pay for Pro and signed up using Google on my laptop. When you log into the app on your phone through Google there's no option to select an account and so I can't use my Pro account! What's the point.,1,1,1.14.0,2021-02-01 15:15:57,,,NEGATIVE,pay pro signed using google laptop log app phone google theres option select account cant use pro account whats point,status quo sloth,account
1558,845737fa-535a-487a-b1ff-a9b8929c5dc2,Joshua Lowry,https://play-lh.googleusercontent.com/a-/ACB-R5Re-qD9UvShkjOtNMCSBYBZQFk-acGGrzNWWQ_tLWA,"I like the flow of the lessons and the ability to practice in my phone. I wish I could make progress on lessons through the app, especially to read the articles.",4,0,1.14.0,2021-01-09 14:46:33,,,POSITIVE,like flow lessons ability practice phone wish could make progress lessons app especially read articles,boosters,special
1639,e5b0dc9c-2145-4ad6-9f9a-a531ab052c5e,Chase Flanigan,https://play-lh.googleusercontent.com/a-/ACB-R5SXaYIGuLxeOfUBI0VBTcHlF7GTwGKEcaOgzYx3uv0,"App will not let me get past notifications screen. I keep choosing the course I'd like to get daily reminders for. Then it will populate to the main screen for a second and loop back to the notification screen. I'd like to begin studying, this bug needs to be fixed",1,23,1.14.0,2020-12-14 20:17:48,,,NEGATIVE,app let get past notifications screen keep choosing course id like get daily reminders populate main screen second loop back notification screen id like begin studying bug needs fixed,daily streaks,daily remind
1682,8c36666b-dcc7-4a27-adc0-707ea297ef92,Chenjerai Chigubhu,https://play-lh.googleusercontent.com/a-/ACB-R5RWugUybWz-Ps_V_CiUSPnHpgmaWxrYobV15fk-,"its pretty especially the practice quiz part, the only thing which is not a major issue is how to link the app to the website so I can review the things I've been learning. great app",5,5,1.14.0,2020-11-25 21:07:57,,,POSITIVE,pretty especially practice quiz part thing major issue link app website review things ive learning great app,boosters,special
1754,d3622b17-1c32-4b38-93ad-b67da8e6c984,MrBaggieBug,https://play-lh.googleusercontent.com/a-/ACB-R5ScOGxAclImncbaF8imoKP1F5H4yidfNg5aWhpuyg,Doesnt sync with my pc account,2,0,1.13.1,2020-11-02 03:04:42,,,NEGATIVE,doesnt sync pc account,status quo sloth,account
1776,94cd6f08-9229-4b80-be41-b524f391eb3c,shubham rathod,https://play-lh.googleusercontent.com/a-/ACB-R5SqTZw-e_R1xhai6dvw8JAEI4cQjHqU9s5qu7L2cw,"Well the platform is simply awesome, but for some reason i cannot login to this app using my google account and Facebook account and i have my pro account using Google account. So how do i login now🤔",3,1,1.13.1,2020-10-23 04:54:09,,,NEGATIVE,well platform simply awesome reason cannot login app using google account facebook account pro account using google account login,status quo sloth,account
1797,c6906397-3f3b-42bb-912b-6a1cc976fba6,Katie Playz,https://play-lh.googleusercontent.com/a-/ACB-R5SQdk1av07deDSRZI5xQBGdeKyU3doLMR9PSUQblsY,It is personally the best experience for actually learning how to program and learn more programming skills i like how they give you certification for the completion of the language to help you and motivate you every time you finish a language and i hope that the app becomes more similar to the one on the computer because it doesn't show all the things that they show on the site so I hope that the app gets improved 😀.,5,23,1.13.1,2020-10-13 23:08:49,,,POSITIVE,personally best experience actually learning program learn programming skills like give certification completion language help motivate every time finish language hope app becomes similar one computer doesnt show things show site hope app gets improved,status quo sloth,person
1820,b20e1657-c779-4675-8ebd-22c6f532bc27,VINIT SHARMA,https://play-lh.googleusercontent.com/a-/ACB-R5SK-JcVm_A9NADPP_gzXNfUWWVGLZiuLmDn5PZKsV8,Apps content is really good loved it but problem is it works only 1st time then leads me to white screen please fix I tried clearing data it works only 1 time then throws me to white screen!,3,0,1.13.1,2020-10-07 05:50:16,,,NEGATIVE,apps content really good loved problem works 1st time leads white screen please fix tried clearing data works 1 time throws white screen,voting,content r
1824,ac909eea-5387-44ac-aad4-147113166869,Kayla Cruz,https://play-lh.googleusercontent.com/a-/ACB-R5TGSvIarth7cUnEtSplh7K4uGqKbh49QYY0cvYr,As a person w/ little and no prior tech experience; this app makes it super easy and fun to understand stuff compaired to your regular old text book style of learning! It's especially useful when your're out and about. 5 out of 5 for sure!,5,6,1.13.1,2020-10-05 17:24:24,,,POSITIVE,person w little prior tech experience app makes super easy fun understand stuff compaired regular old text book style learning especially useful yourre 5 5 sure,"boosters, status quo sloth","special, person"
1825,eab99140-ba87-4022-b003-6d86741a58d8,Guinanao Clifford,https://play-lh.googleusercontent.com/a-/ACB-R5Rn-6E_YbAqYpPFS4OhcAngJXyQQ_qXE-jAvc3WEw,I learned new coding skills on this app. Its great and user friendly especially the practice mode.,5,0,1.13.1,2020-10-05 06:28:07,,,POSITIVE,learned new coding skills app great user friendly especially practice mode,boosters,special
1826,97f8e68c-5ea6-427b-8a8c-60e9a1b0ad95,Shawn Rains,https://play-lh.googleusercontent.com/a-/ACB-R5QxjLqAHdImYYK7grWsddH__p5jyvZgH76HRzyd8Q,"I'm working my way through a free course on the desktop version, but it seems that it's locked behind a paywall in the app. Why would I pay for a course that's already free? Pro version is already expensive as is.",1,8,1.13.1,2020-10-04 12:01:25,,,NEGATIVE,im working way free course desktop version seems locked behind paywall app would pay course thats already free pro version already expensive,torture breaks,paywal
1832,adede0fe-b155-4719-b9cb-2f5072d73638,Rohit,https://play-lh.googleusercontent.com/a-/ACB-R5QVUciCux_MvAf99-WS2QWq6pIKYFD79QdAIVC4AQ,Can't even login with my google account !,1,0,,2020-10-02 03:37:59,,,NEGATIVE,cant even login google account,status quo sloth,account
1833,5e977b69-c212-48ca-8e39-09eb5ee2170f,Damandarin,https://play-lh.googleusercontent.com/a-/ACB-R5TAXs2H616J9jHChxtsNtLbE-qw9B5faPesvPc-hA,Really well designed programming app which looks nice but delivers functionality (good learning experience),5,0,1.13.1,2020-10-02 02:28:26,,,POSITIVE,really well designed programming app looks nice delivers functionality good learning experience,torture breaks,live
1846,d9bacb62-b263-4905-85e3-a5b0030d6522,Aldy Andita,https://play-lh.googleusercontent.com/a-/ACB-R5Q4BSCFA03jivR8HRSNXuVfOLnXsq9H3nxyLs40jg,"Very good app for coding learning, thanks for giving me 3 Months Pro Account during this pandemic, really appreciate it, thanks for your kindness :)",5,0,1.13.1,2020-09-28 22:02:08,,,POSITIVE,good app coding learning thanks giving 3 months pro account pandemic really appreciate thanks kindness,status quo sloth,account
1859,9eb8d990-fd29-40ce-b39e-26307bf2cc7c,Ken Tolembek,https://play-lh.googleusercontent.com/a-/ACB-R5TpOvAnie4LjK-6g3qaqUyPj5Jx4rTjCwtEK3sdWw,Too many bugs. I am literally frustrated. There are free apps that deliver much better quality.,1,2,1.13.1,2020-09-26 18:38:13,,,NEGATIVE,many bugs literally frustrated free apps deliver much better quality,torture breaks,live
1901,5357a828-8ff7-4b42-9925-523ffdd4d38a,Lukman Moeslich,https://play-lh.googleusercontent.com/a-/ACB-R5TemJm-covEWUz_4HZid8MPxK1Cl1DWaepf8BnsbA,Cool apps for my Academy account.,4,0,1.13.1,2020-09-15 11:55:05,,,POSITIVE,cool apps academy account,status quo sloth,account
1903,11d7ff52-aac2-4782-a26a-28b706de4ce9,Jennifer Roberts,https://play-lh.googleusercontent.com/a-/ACB-R5T5pw9Ol1E0fpLJnZVRQtxuLRLXnBu5SiKDr8QfOEI,Great supplement for those who have busy lives but want to do something during their small gaps of freetime to continue working on their education.,5,0,1.13.1,2020-09-14 07:27:37,,,POSITIVE,great supplement busy lives want something small gaps freetime continue working education,torture breaks,live
1928,77a28639-dd44-4dbd-8027-c25971dada21,Adam Janik,https://play-lh.googleusercontent.com/a/AGNmyxalx3Trbbk6l0o3UaLnTW6-gWzuzJ4aCJ-mTqlE=mo,"Can't use without account, stupid.",1,0,1.13.1,2020-09-08 05:54:18,,,NEGATIVE,cant use without account stupid,status quo sloth,account
1934,a193ad76-a427-43de-92ed-7c324f76b610,Richard “Richarmed” Parker,https://play-lh.googleusercontent.com/a-/ACB-R5S-h1Po6Tv3rZs-kg70mqZTmMMVYp0T0qV5lWUdag,Really something special here! I have been using the phone app and my computers browser to work my way through some courses. I did not actually think I would take to it this quickly but am now hooked. The courses are engaging without chucking you straight in the deep end.. great stuff 👏,5,8,1.13.1,2020-09-05 13:19:39,,,POSITIVE,really something special using phone app computers browser work way courses actually think would take quickly hooked courses engaging without chucking straight deep end great stuff,boosters,special
1952,e228cc70-e580-4ee4-8283-e271e753fbed,steve hicks,https://play-lh.googleusercontent.com/a-/ACB-R5RcXF_WXs5TjcecFsMPw2wGLot83_dDuRV00U9jww,Wasn't able to open account using an email address. Promptly uninstalled without even getting to try it. Not everyone wants to be tied to either Facebook or google.,1,1,,2020-08-31 06:39:28,,,NEGATIVE,wasnt able open account using email address promptly uninstalled without even getting try everyone wants tied either facebook google,status quo sloth,account
1963,c3567c7c-5f87-4217-989c-73931a4adee0,David Atkinson,https://play-lh.googleusercontent.com/a-/ACB-R5SGaxSZkKl0kWugTbPh4tNX2VG7j4n9_JxzBb0UR9E,"I wish I could flag cards I'd like to revisit or make a separate custom deck out of them. Also, I wish the text size in the flashcards adjusted to my phone screen size so that the lives of code look like they do on a computer. Right now, lines of code spill over to the next like, making it harder to read. It could be fixed if the text was just slightly smaller.",4,87,1.13.1,2020-08-28 15:50:08,,,NEGATIVE,wish could flag cards id like revisit make separate custom deck also wish text size flashcards adjusted phone screen size lives code look like computer right lines code spill next like making harder read could fixed text slightly smaller,"torture breaks, status quo sloth","live, custom"
2016,38819599-2427-4e91-a6be-198aaccb0457,Raj simaria,https://play-lh.googleusercontent.com/a-/ACB-R5RQzofC5S1Xt7bfsp_Pp-nqksOwBNTzaoUHOtHvlA,A great app for intermediate developers and beginners i personally like the app and I would suggest it to others too. A great work done by the team,5,1,,2020-08-18 05:49:17,,,POSITIVE,great app intermediate developers beginners personally like app would suggest others great work done team,status quo sloth,person
2050,3adc8737-85f2-4517-840d-df22fe939de7,Farris,https://play-lh.googleusercontent.com/a-/ACB-R5RcyCHZ2zKrGuZ2Y6ws62fkEuCorQhSFJT31tSsqA,Started on computer and live the practice tools the phone offers. Worth it if you're trying to code.,5,0,1.13.1,2020-08-10 09:20:44,,,POSITIVE,started computer live practice tools phone offers worth youre trying code,torture breaks,live
2056,fba9a6c7-b2bc-4bb7-92fe-f85b1982746a,Ben Maleki,https://play-lh.googleusercontent.com/a-/ACB-R5TWC3Fq8H8zWmuJqKi3dUhHEQ5zS-7jUdrDAshzHA,I like being able to keep my streak alive with the app.,5,0,1.13.1,2020-08-09 16:50:33,,,POSITIVE,like able keep streak alive app,torture breaks,live
2082,53e55d26-d398-46d9-abc3-4b130aa8b0f3,Uy Nguyen,https://play-lh.googleusercontent.com/a/AGNmyxYCV3f7RGTMpoJc1syt1I0LmIOvEn5VVMbnWmeA=mo,Sign in options Please add the option where users can log in with their GitHub accounts,3,0,1.13.1,2020-07-31 12:21:12,,,NEGATIVE,sign options please add option users log github accounts,status quo sloth,account
2197,e09aba8a-86d5-42dc-a4ed-c44329d9c68b,Dhruv Kandpal,https://play-lh.googleusercontent.com/a-/ACB-R5QOdiqeYufksW0AkOkM9452wh3psPxRUV4mKPfdnes,I'm starting do learn how to code very efficiently. It's a beautiful feeling to complete daily challenges.,5,2,1.13.1,2020-06-28 21:46:00,,,POSITIVE,im starting learn code efficiently beautiful feeling complete daily challenges,"daily streaks, challenges","daily challeng, challeng, daily challeng"
2223,67b7fb26-2e38-4983-b653-ae4f839918d3,webothdo,https://play-lh.googleusercontent.com/a-/ACB-R5R9SjHrQ0hTrQlQONRP-5zmmGyqxSeOLciDpki85g,"What a dumb app, I can't even sign in. Everytime I try to sign in with my google account, it just cradhes and restart the app. This is a terrible bug. Fix it and I'll change my review about you.",1,11,1.13.1,2020-06-22 06:27:44,,,NEGATIVE,dumb app cant even sign everytime try sign google account cradhes restart app terrible bug fix ill change review,status quo sloth,account
2303,f912ffab-4896-468f-9ebd-ca6337ed24a3,Paula Atkinson,https://play-lh.googleusercontent.com/a/AGNmyxb20zPw3h-UKT8i7PPfqNcBGWLnn8SrxVzjHJ36=mo,"Great to be able to learn on the go, especially when time is limited!",5,0,1.13.0,2020-06-03 10:00:55,,,POSITIVE,great able learn go especially time limited,boosters,special
2336,0d9002a3-2ede-40fd-8ccf-c971107a54c9,David Sawh,https://play-lh.googleusercontent.com/a-/ACB-R5Qc4PQyHXNpkbdHqUhGi-LHZilGjBBk0UeXT-pisw,"Once you keep at it codecademy will lead you to success. Its encouraging and very insightful and especially for me, starts from the most basic of basics and goes all the way up depending on your path. Its definitely worth your time as an investment.",5,1,1.13.0,2020-05-25 01:57:24,,,POSITIVE,keep codecademy lead success encouraging insightful especially starts basic basics goes way depending path definitely worth time investment,boosters,special
2374,59805be0-57b9-4a0f-9cf8-f485ea5b6240,Ben Walter,https://play-lh.googleusercontent.com/a-/ACB-R5QgzLrCeHVcl1GSJRXEETiwTbIWx6VrKF6pJQ6Sfw,"I am enrolled in Pro and I use chrome normally. For some reason my account didn't sync and I had to choose what I wanted to be enrolled in all over again, instead of just jumping to where I was. Additionally, the app crashes frequently when I try to open it. I'll keep using a browser to learn, the app has some work to be done.",3,19,1.13.0,2020-05-13 11:46:03,,,NEGATIVE,enrolled pro use chrome normally reason account didnt sync choose wanted enrolled instead jumping additionally app crashes frequently try open ill keep using browser learn app work done,status quo sloth,account
2405,b0e768c2-9a0e-4cb8-afc5-85668e9c6cf5,Thomas van Schalkwyk,https://play-lh.googleusercontent.com/a-/ACB-R5S2hPCJkGUUbJCcGHnpQCB1uQ2lLKrIbEKp0s9lGjw,Needs ability to go back a page for review or if a mistake has been made. And especially to go back where you left off if you go out by mistake,4,0,1.13.0,2020-05-06 08:58:24,,,POSITIVE,needs ability go back page review mistake made especially go back left go mistake,boosters,special
2415,008fa57c-4ddd-4b5b-b20d-987e2f183201,Daniel Okwoli,https://play-lh.googleusercontent.com/a/AGNmyxYd7smNRUp2ELQSK4_Bc__3AgEBOT80LaPwEZ0p=mo,"I am glad have the app for my use and convenience, but I was unable to successfully login with a valid credential that works perfectly on the website. I keep getting this response ""unable to log in make sure the account you logging in with is a valid code academy account or try again later until I used a USA vpn. This was my experience. I hope this is fixed in the shortest possible time so that user from other country can login their account with out worries. Thanks",4,8,1.13.0,2020-05-04 06:57:42,,,NEGATIVE,glad app use convenience unable successfully login valid credential works perfectly website keep getting response unable log make sure account logging valid code academy account try later used usa vpn experience hope fixed shortest possible time user country login account worries thanks,status quo sloth,account
2427,449b11c0-4cff-44e7-8421-8a65e388f44b,Norbert Zohó,https://play-lh.googleusercontent.com/a-/ACB-R5R1Lf-eI3DFrY4SX0KvtKsulr0pYcHbbborgOMVowI,Impossible to log in with my social account.,1,0,1.13.0,2020-05-01 20:40:37,,,NEGATIVE,impossible log social account,"strike habit/competition, status quo sloth","social account, account"
2440,52348049-3827-4f1c-9029-cc5ca859e94f,Adil Shehzad,https://play-lh.googleusercontent.com/a-/ACB-R5TrxxNFUFp0Z2jYkf_IZuQGeDmhSX-BPXCJb7-OKQ,Cannot login to my account . I try several times but still not working,1,0,,2020-04-28 19:52:22,,,NEGATIVE,cannot login account try several times still working,status quo sloth,account
2464,d68ef20a-a3ec-4b50-aa2f-aef8bc3fb59e,A Google user,https://play-lh.googleusercontent.com/EGemoI2NTXmTsBVtJqk8jxF9rh8ApRWfsIMQSt2uE4OcpQqbFu7f7NbTK05lx80nuSijCz7sc3a277R67g,"Your a company that teaches coding, learn how to fix the white screen issue, it should be your speciality",1,0,1.13.0,2020-04-24 06:47:15,,,POSITIVE,company teaches coding learn fix white screen issue speciality,boosters,special
2504,987ba48b-2673-4414-9add-e47a7f02ac4e,A Google user,https://play-lh.googleusercontent.com/EGemoI2NTXmTsBVtJqk8jxF9rh8ApRWfsIMQSt2uE4OcpQqbFu7f7NbTK05lx80nuSijCz7sc3a277R67g,This is a really good app the fact that I get stuck on a difficult lesson and I really have to think about what type of technical problem I have but then I figure it out also it is very precise so when I do understand I feel smarter coding is fun and a challenge.,4,0,1.13.0,2020-04-12 00:26:01,,,POSITIVE,really good app fact get stuck difficult lesson really think type technical problem figure also precise understand feel smarter coding fun challenge,challenges,challeng
2579,368e89cd-a163-4fd5-9147-7746e1efaa17,A Google user,https://play-lh.googleusercontent.com/EGemoI2NTXmTsBVtJqk8jxF9rh8ApRWfsIMQSt2uE4OcpQqbFu7f7NbTK05lx80nuSijCz7sc3a277R67g,I give it 4 stars because unlike the website( it's awsome!!!) I think (personel opinion) the application needs some more work. (Thanks for the scholarship guyss !!!),4,0,1.13.0,2020-03-26 13:37:40,,,NEGATIVE,give 4 stars unlike website awsome think personel opinion application needs work thanks scholarship guyss,status quo sloth,person
2635,b7bd36f2-7777-468b-b12d-0970768e3502,A Google user,https://play-lh.googleusercontent.com/EGemoI2NTXmTsBVtJqk8jxF9rh8ApRWfsIMQSt2uE4OcpQqbFu7f7NbTK05lx80nuSijCz7sc3a277R67g,can't even get in the app. I have created my account by google button down there but in the app there is no such button. Edit: I've updated the app and its great but I wish you could learn new sections too instead of only reviewing older courses,5,1,1.7,2020-03-14 12:08:56,"Parsa, thanks! We had some issues with our google linking, but it is now back and working in version 1.8.1 of the app.

If you update in the Google Play store, you should now be able to sign in.",2019-09-07 22:19:45,NEGATIVE,cant even get app created account google button app button edit ive updated app great wish could learn new sections instead reviewing older courses,status quo sloth,account
2663,fab842b8-d849-4733-81cf-7f0d600abb66,A Google user,https://play-lh.googleusercontent.com/EGemoI2NTXmTsBVtJqk8jxF9rh8ApRWfsIMQSt2uE4OcpQqbFu7f7NbTK05lx80nuSijCz7sc3a277R67g,"Cannot create an account :) Xiaomi mi 8, android 10. 'This site cannot be reached'",1,0,1.13.0,2020-03-04 05:12:56,,,NEGATIVE,cannot create account xiaomi mi 8 android 10 site cannot reached,status quo sloth,account
2684,0316ea13-e2ed-47c8-a3bd-9dfff5c36561,A Google user,https://play-lh.googleusercontent.com/EGemoI2NTXmTsBVtJqk8jxF9rh8ApRWfsIMQSt2uE4OcpQqbFu7f7NbTK05lx80nuSijCz7sc3a277R67g,"I am paying for pro, which includes the use of the App. Then i try using the app and get a white screen. Will I pay half price then until you fix this? It's at least disrespectful to your customers, not to mention that it is a CODING school that cannot fix it's own bugs.",1,6,1.13.0,2020-02-26 07:27:40,,,NEGATIVE,paying pro includes use app try using app get white screen pay half price fix least disrespectful customers mention coding school cannot fix bugs,status quo sloth,custom
2711,1f9998d5-5623-42aa-b159-14b353b65f94,A Google user,https://play-lh.googleusercontent.com/EGemoI2NTXmTsBVtJqk8jxF9rh8ApRWfsIMQSt2uE4OcpQqbFu7f7NbTK05lx80nuSijCz7sc3a277R67g,A useful supplement for in the car practice and content retention,4,0,1.13.0,2020-02-18 16:31:57,,,POSITIVE,useful supplement car practice content retention,voting,content r
2724,5bb15f26-6e71-4eba-9190-b381df6eafb2,A Google user,https://play-lh.googleusercontent.com/EGemoI2NTXmTsBVtJqk8jxF9rh8ApRWfsIMQSt2uE4OcpQqbFu7f7NbTK05lx80nuSijCz7sc3a277R67g,Unable to login with the same account i can login on the desktop vers.,4,1,1.13.0,2020-02-13 05:45:38,,,NEGATIVE,unable login account login desktop vers,status quo sloth,account
2749,cb63b751-a037-4e22-b088-8c7799db739e,A Google user,https://play-lh.googleusercontent.com/EGemoI2NTXmTsBVtJqk8jxF9rh8ApRWfsIMQSt2uE4OcpQqbFu7f7NbTK05lx80nuSijCz7sc3a277R67g,"Unable to sign into the app. I signed up on the website with my GitHub account but the app doesn't provide this option. When I try to create a password in my web profile I get asked for my original password, which I don't have as I sign in with my GitHub account. A serious oversight by the app developer.",1,2,1.13.0,2020-02-07 13:01:45,,,NEGATIVE,unable sign app signed website github account app doesnt provide option try create password web profile get asked original password dont sign github account serious oversight app developer,status quo sloth,account
2764,5223d4de-43b2-4a69-b53b-dd99e47dc31d,A Google user,https://play-lh.googleusercontent.com/EGemoI2NTXmTsBVtJqk8jxF9rh8ApRWfsIMQSt2uE4OcpQqbFu7f7NbTK05lx80nuSijCz7sc3a277R67g,"Good supplement to the web site. Had some trouble logging in via my Google account, had to try repeatedly, but eventually got it to work. It's flash cards, quizzes mainly and good for quick reviews on the subway, for instance. I write this review after using it for only a short while - remains to be seen if there are other issues. Hey Google, why ask me to review the app so quickly after installing?",4,17,1.13.0,2020-02-04 09:50:31,,,POSITIVE,good supplement web site trouble logging via google account try repeatedly eventually got work flash cards quizzes mainly good quick reviews subway instance write review using short remains seen issues hey google ask review app quickly installing,status quo sloth,account
2777,4c7b9df7-649e-440b-b67c-98d0b51f10de,A Google user,https://play-lh.googleusercontent.com/EGemoI2NTXmTsBVtJqk8jxF9rh8ApRWfsIMQSt2uE4OcpQqbFu7f7NbTK05lx80nuSijCz7sc3a277R67g,First install and i cant even login with my google account keeps saying something went wrong since yesterday,2,1,1.11.1,2020-02-01 08:25:47,,,NEGATIVE,first install cant even login google account keeps saying something went wrong since yesterday,status quo sloth,account
2779,fec37c21-da8f-452e-b608-87dd39a03b1a,A Google user,https://play-lh.googleusercontent.com/EGemoI2NTXmTsBVtJqk8jxF9rh8ApRWfsIMQSt2uE4OcpQqbFu7f7NbTK05lx80nuSijCz7sc3a277R67g,I use code academy on the computer. But far as the app. The app wont let me log in and wont let my son sign up for an account. 5 stars only because codeacademy is great.,5,2,1.11.1,2020-01-26 22:18:01,,,NEGATIVE,use code academy computer far app app wont let log wont let son sign account 5 stars codeacademy great,status quo sloth,account
2845,62ae2202-6fac-4f32-a011-f72b4e3a220a,A Google user,https://play-lh.googleusercontent.com/EGemoI2NTXmTsBVtJqk8jxF9rh8ApRWfsIMQSt2uE4OcpQqbFu7f7NbTK05lx80nuSijCz7sc3a277R67g,"I mostly learn on their web platform because it's more comfortable but the lessons themselves are really good. The knowledge on JS for example is very current and practical. I haven't seen other apps or sites that are so succinct and easy to absorb without being unintentionally patronising by treating their audience as if they're children. The one thing that I wish that they had is more lessons on web development especially best practices, coding patterns, that kind of thing.",4,62,1.8.1,2019-10-12 06:00:19,,,POSITIVE,mostly learn web platform comfortable lessons really good knowledge js example current practical havent seen apps sites succinct easy absorb without unintentionally patronising treating audience theyre children one thing wish lessons web development especially best practices coding patterns kind thing,boosters,special
2847,79eec9fb-a642-4cb0-b5e4-c98d2785a0dc,A Google user,https://play-lh.googleusercontent.com/EGemoI2NTXmTsBVtJqk8jxF9rh8ApRWfsIMQSt2uE4OcpQqbFu7f7NbTK05lx80nuSijCz7sc3a277R67g,"Tried to login using my google account, but as soon as I choose the account it just sends me back to the login screen as if nothing happened.",1,9,1.8.1,2019-10-07 19:14:48,,,NEGATIVE,tried login using google account soon choose account sends back login screen nothing happened,status quo sloth,account
