Unnamed: 0,reviewId,userName,userImage,content,rating,thumbsUpCount,reviewCreatedVersion,date,replyContent,repliedAt,sentiment,matched_synonym
8621,c2676bd9-265c-4d90-8c6f-99a006b23359,Audrick Mwabah,https://play-lh.googleusercontent.com/a-/ACB-R5Rfa1hfZe7fmKISDJXTcxghvGgeJhA1BlYe3AtnMQ,Best app for learning web development and programming... Its a must have. Thumbs up to all SoloLearn team,5,0,4.6.1,2022-05-07 01:27:00,,,POSITIVE,Thumbs up
9183,06d7203b-a1b9-450c-803f-754c5a9176c8,Yasir Arafath,https://play-lh.googleusercontent.com/a-/ACB-R5R-RdRvzDTyKc9ffgoRoCmVuMkTozzxkfWEpSstaw,Motivational learning app,5,0,4.16.0,2022-04-20 14:40:25,,,POSITIVE,Motivation
10125,4bdb826e-f430-45cf-bb15-eb8e08a49020,Kyla Gordon (Kyla G),https://play-lh.googleusercontent.com/a-/ACB-R5TYcnNjxew4c0W1JJfAkPYyVv0FqyAJwds2BMEZIA,"Very well put together and easy to learn through. Simple ways of teaching, accurately. I love that you can do practicals as well. Teach yourself any code language. Rewarding certificates issued after completing a course. Points for completing courses and more. I highly recommend this app for self-teaching.",5,15,,2022-03-17 08:44:29,,,POSITIVE,Rewarding
12242,439a0d11-c1f1-4da0-aaa6-fb01adbd2cc9,Libuseng Morake,https://play-lh.googleusercontent.com/a-/ACB-R5TdN8oVHEN7F0MJSzLbUEYoVMf0DvpRPFSUm-bfFQ,"Please Add more courses for python in finance. Thumbs up to SOLOLEARN App developers,you're indeed amazing and you deserve lifetime achievement award. 🤩😁😍#anybodycanlearncoding.",5,0,4.10.0,2022-01-09 08:03:56,,,POSITIVE,Thumbs up
15002,87d10681-85bf-4f06-96ff-091ca9fe646a,magfoo (pearls),https://play-lh.googleusercontent.com/a/AGNmyxaYQlL5jvn_rvdZ2MW0TVe-ksxoZDYxo44GEMM0KA=mo,Loving it. Breaks it down into easily digested chunks,5,0,4.8.5,2021-09-14 08:02:37,,,POSITIVE,Breaks
16315,d30b1e37-59ca-4467-9037-52f578544f26,Ifunanya Iloh,https://play-lh.googleusercontent.com/a-/ACB-R5RY3VIPD_cw2vsG8qz4-4cb33ajmxuVSi87iV8nEA,My login difficulty is rectified and app works as fine as it used to. Thumbs up.,5,4,4.8.0,2021-07-19 06:47:59,"Hello,
Thank you very much for updating your review.
Enjoy Sololearning!",2021-07-19 07:38:15,POSITIVE,Thumbs up
18245,8c49c3ae-5273-42e1-b7d3-1bf8f735e28a,Hannah D. Adefalujo,https://play-lh.googleusercontent.com/a/AGNmyxajRW05iHETU_vFzS0UXAGgeDq3WWyGxV6PU2NB=mo,It's a good app for learning language programming. Thumbs up to the developer.,4,0,4.6.2,2021-04-16 13:42:37,,,POSITIVE,Thumbs up
18374,77ff4736-7c4a-45fc-bed7-db05d401b2a4,agyeirichmond owusu,https://play-lh.googleusercontent.com/a/AGNmyxb2bGP3RZs5WICtxUpWuhc-nKzOGz_cL4cRKKiW=mo,The best initiative for learning how to code.Thumbs up👍,5,0,4.6.2,2021-04-09 21:40:15,,,POSITIVE,Thumbs up
20265,efb2abdb-4bd2-495d-8114-574fec05f1c0,okechukwu ejiogu,https://play-lh.googleusercontent.com/a-/ACB-R5TxR1C6Z3yq6rbUME6OXZGvZw_dFwcE252pwFAM,"Smooth learning, at your own pace. Thumbs up",5,0,4.1.0,2021-01-07 16:18:24,,,POSITIVE,Thumbs up
20420,1c48ba44-130a-4ff4-8991-fb41c4aa7a6a,Monowar Hossen,https://play-lh.googleusercontent.com/a-/ACB-R5QZde9UjRTibRU27e8eOzZ8KDkrSd2G7ecLNIvvcQ,Motivation forgive sololqrn,5,0,4.2.0,2020-12-30 09:42:59,,,NEGATIVE,Motivation
22394,3c34c244-3a4a-44b6-88d9-be51459c5761,Confidence Peter,https://play-lh.googleusercontent.com/a-/ACB-R5TbbwcO3DSM6C6IlO-OAyagA9bKlNqou3LH2HYJFsk,It is simple but deep.Breaks down every thing bit by bit which makes it fit for beginners,5,0,3.5.0,2020-10-17 20:04:33,,,POSITIVE,Breaks
23633,816e6e5e-fbc9-4983-a733-5ee922187f40,Dan Filz,https://play-lh.googleusercontent.com/a/AGNmyxaGm2eTmBAAUmPLw8E_CG0Gqa_g9LlYus9ytz7u=mo,Rewarding and challenging,4,0,3.4.9,2020-09-17 20:55:17,,,POSITIVE,Rewarding
23830,b4a36395-3d98-44d9-bda9-34b0b3ec85ad,Jasmine Ansah-Antwi,https://play-lh.googleusercontent.com/a-/ACB-R5QU81cTSYUCn88j2Ij6AXB72ovBwJnZVkB8pfXSng,To be honest this is a really good app to learn coding. You even have access to the lessons offline once you begin them. The forum for discussion is really helpful because your questions get answered and you can understand better. Thumbs up SoloLearn😁😁😁,5,0,3.5.0,2020-09-14 03:05:50,,,POSITIVE,Thumbs up
25018,a9297bd5-f99b-44e8-9824-2146437ac045,MIRACLE ADEWUMI,https://play-lh.googleusercontent.com/a-/ACB-R5Tg88nhx13y7NHjJVfSXiad1loBT-JF5DKvjxFVFQ,"It's interesting, and provides a suitable learning environment. Thumbs up!",5,0,3.4.8,2020-08-22 07:57:43,,,POSITIVE,Thumbs up
25799,c64d6209-220c-4f28-b3ef-1e0400f975d7,IT' Basi,https://play-lh.googleusercontent.com/a-/ACB-R5R7fzSRoEQfGDz2n92PtFPdJ8XtItxYJKP5xuNnFQ,Thumbs up,5,0,2.2.4,2020-08-03 07:55:55,,,POSITIVE,Thumbs up
26218,f7eb6acb-71d3-4dff-bf6a-5eeae7d76cac,Salem Tomi,https://play-lh.googleusercontent.com/a/AGNmyxY-QyRi0KQCHF3uEdavWsuwKv9YX-M1mfbzNN8t=mo,"I give it all for this app, fantastic, easy to use, coding learning has never been so made easy. Thumbs up for the developers.",5,0,,2020-07-24 06:17:30,,,POSITIVE,Thumbs up
26715,772e538a-aa7c-4f17-b029-551808722b43,Moses Mtonga (malz),https://play-lh.googleusercontent.com/a-/ACB-R5RgDuzoVwkcRdTre9StU_kNInX75aMrLYKCSCMBSw,Thumbs up to the developers 👍,5,0,3.1.3,2020-07-13 04:06:26,,,POSITIVE,Thumbs up
27818,1820787a-e8ed-40b4-884d-9a0ce229d1ea,Lucas Serral,https://play-lh.googleusercontent.com/a-/ACB-R5ToYgcbUe0acHlCgfvwLn4-j3WaZcqEqpLpSm6wPA,Great free way to start learning. I didn't purchase anything and works for me. Thumbs up!,5,0,3.4.1,2020-06-20 02:18:18,,,POSITIVE,Thumbs up
29553,abddf49e-483d-4821-91ea-e0b3eb995b58,Freshperry GH,https://play-lh.googleusercontent.com/a-/ACB-R5RREjLVv4xn1unI3g3GtBChfr8hM_aIonvWE1-Zig,"Great app, teaches me coding at my own learning pace. Thanks to SoloLearn for this great app. The most thing I like is the certificate at the end of every course. Thumbs up for SoloLearn.",5,0,3.2.4,2020-05-21 11:49:24,,,POSITIVE,Thumbs up
29939,26bc00b3-1498-4d0d-b087-e742dd514a03,Antonio Ortega-Fuentes,https://play-lh.googleusercontent.com/a/AGNmyxYQvsCuFNX7McHaDqSk4ztMkhWw2kitByP5Vo3M=mo,Quarantine Goals,5,0,3.2.4,2020-05-14 21:45:53,,,POSITIVE,Goals
31792,48a93a96-3641-4d74-a543-bc62871a764d,A Google user,https://play-lh.googleusercontent.com/EGemoI2NTXmTsBVtJqk8jxF9rh8ApRWfsIMQSt2uE4OcpQqbFu7f7NbTK05lx80nuSijCz7sc3a277R67g,Thumbs up,4,0,3.2.3,2020-04-16 15:28:25,,,POSITIVE,Thumbs up
34299,916e31dc-2a50-49c5-8ef9-81dcb0c6ab20,A Google user,https://play-lh.googleusercontent.com/EGemoI2NTXmTsBVtJqk8jxF9rh8ApRWfsIMQSt2uE4OcpQqbFu7f7NbTK05lx80nuSijCz7sc3a277R67g,The app is really helping me in areas of web development in as much as thats why i specialized. As there are so maany other programming languages to learn feom sololearn all alone without any physical instructor. Thumbs up for the developer of this program because its more than ordinary app but school,5,0,3.1.1,2020-02-29 23:00:21,,,POSITIVE,Thumbs up
34317,ef636596-2be6-4e8c-8752-a953b704ecd8,A Google user,https://play-lh.googleusercontent.com/EGemoI2NTXmTsBVtJqk8jxF9rh8ApRWfsIMQSt2uE4OcpQqbFu7f7NbTK05lx80nuSijCz7sc3a277R67g,Enjoying this app... Thumbs up,4,0,3.1.1,2020-02-29 13:23:54,,,POSITIVE,Thumbs up
36095,3258f30f-341f-4ffc-97db-a4fe7acd0cd7,A Google user,https://play-lh.googleusercontent.com/EGemoI2NTXmTsBVtJqk8jxF9rh8ApRWfsIMQSt2uE4OcpQqbFu7f7NbTK05lx80nuSijCz7sc3a277R67g,"😍😍😍😍😍😍 Courses= 10/10 World at hand= 10/10 Friends= 10/10 Practice= 10/10 Competitive=10/10 Gamelike= 10/10 Examples= 10/10 Simplicity= 10/10 Feedback= 10/10 Helpers= 10/10 Cost= (FREE🎊) .....and so on and on and on EVERYTHING= 10/10!! Anyone poor or rich, Science-student or Arts-student, 7 years or 70 years, whoever might it be, ANYONE can master HTML, CSS, PHP, JS, JAVA, PHYTHON...100s+ with this APP and ONLY this APP itself is enough, nothing else is needed! AMAZING 😍😍😍 I LOVE IT!!!",5,0,,2020-01-21 18:56:38,,,POSITIVE,Feedback
36329,57bf1dcc-4563-4636-820a-3a5b29072383,A Google user,https://play-lh.googleusercontent.com/EGemoI2NTXmTsBVtJqk8jxF9rh8ApRWfsIMQSt2uE4OcpQqbFu7f7NbTK05lx80nuSijCz7sc3a277R67g,"Splendid work on letting students learn what they want to learn. Feedbacks in lessons are extremely useful as well. Thank you, developers!",5,0,3.1,2020-01-16 23:30:03,,,POSITIVE,Feedback
38214,01386af5-d0fd-4610-9128-7de4edc2dd2a,A Google user,https://play-lh.googleusercontent.com/EGemoI2NTXmTsBVtJqk8jxF9rh8ApRWfsIMQSt2uE4OcpQqbFu7f7NbTK05lx80nuSijCz7sc3a277R67g,Good app but there are so many subjective answers for their quizzes which needs updating but the developer hasn't fixed them in years. Feedback is useless.,3,0,3.0.3,2019-12-08 10:33:16,"Thanks for your feedback!

Please let us know more information regarding your remark by contacting us via info@sololearn.com.",2019-12-10 01:53:54,NEGATIVE,Feedback
39229,021be7d8-d8c5-47da-a2cd-fc03ad6a992f,A Google user,https://play-lh.googleusercontent.com/EGemoI2NTXmTsBVtJqk8jxF9rh8ApRWfsIMQSt2uE4OcpQqbFu7f7NbTK05lx80nuSijCz7sc3a277R67g,"Thank you sololearn for this, i learnt these languages long time and there was no source of knowledge like this, i got into a different career but now its interesting am re-learning them easily n conviniently on my phone. Thumbs up sololearn🤙",4,0,3.0.2,2019-11-17 02:21:32,,,POSITIVE,Thumbs up
39679,5e657939-cc63-4500-9fe7-090d36d1ed2a,A Google user,https://play-lh.googleusercontent.com/EGemoI2NTXmTsBVtJqk8jxF9rh8ApRWfsIMQSt2uE4OcpQqbFu7f7NbTK05lx80nuSijCz7sc3a277R67g,Thumbs up for your amazing app. You made an effort to share coding knowledge in an enjoying way .,5,0,3.0.2,2019-11-07 06:40:50,,,POSITIVE,Thumbs up
41836,0f27ed53-e293-49ba-9dc3-ae1f08d6dd0d,A Google user,https://play-lh.googleusercontent.com/EGemoI2NTXmTsBVtJqk8jxF9rh8ApRWfsIMQSt2uE4OcpQqbFu7f7NbTK05lx80nuSijCz7sc3a277R67g,Feedback could be much better. Questions r occasionally too easy but uts free,4,0,2.4.8,2019-09-29 15:27:07,,,NEGATIVE,Feedback
42302,8ddad45e-602c-4ff3-a4d8-06069373965d,A Google user,https://play-lh.googleusercontent.com/EGemoI2NTXmTsBVtJqk8jxF9rh8ApRWfsIMQSt2uE4OcpQqbFu7f7NbTK05lx80nuSijCz7sc3a277R67g,Easy tutorials. Q&A Forum is really active. People in Solo Learn just love to share their knowledge and it's awesome. Tasks and Challenges are really helpful in improving our skill towards any Language.,5,1,2.6.4,2019-09-22 09:18:57,,,POSITIVE,Tasks
42596,358e3360-dfd0-416c-8c6a-3ae15f1dc559,A Google user,https://play-lh.googleusercontent.com/EGemoI2NTXmTsBVtJqk8jxF9rh8ApRWfsIMQSt2uE4OcpQqbFu7f7NbTK05lx80nuSijCz7sc3a277R67g,"This app is fantastic, I finally got a platform to improve my coding skills. Thumbs up to the developer",4,0,2.6.3,2019-09-18 12:24:48,,,POSITIVE,Thumbs up
43870,f00dea27-c16d-49c1-9521-054e378c3950,A Google user,https://play-lh.googleusercontent.com/EGemoI2NTXmTsBVtJqk8jxF9rh8ApRWfsIMQSt2uE4OcpQqbFu7f7NbTK05lx80nuSijCz7sc3a277R67g,"OMG!!! This app is so so so amazing😁 I have been trying to learn programming since but it seemed so boring. Now with this app as a social network of programmers and the interactive tutorial, programming is more than fun. Thumbs up to the developer of this app.",5,0,2.5.5,2019-09-02 09:10:46,,,POSITIVE,Thumbs up
44824,35743516-a0b3-4fd9-97a3-89531d649014,A Google user,https://play-lh.googleusercontent.com/EGemoI2NTXmTsBVtJqk8jxF9rh8ApRWfsIMQSt2uE4OcpQqbFu7f7NbTK05lx80nuSijCz7sc3a277R67g,It is informative and Motivational,5,0,2.5.5,2019-08-20 12:08:43,,,POSITIVE,Motivation
45068,842e9745-f6d9-4d0b-9271-40195be3a557,A Google user,https://play-lh.googleusercontent.com/EGemoI2NTXmTsBVtJqk8jxF9rh8ApRWfsIMQSt2uE4OcpQqbFu7f7NbTK05lx80nuSijCz7sc3a277R67g,Such an amazing app. Many different languages to learn. Ranking system. Q & A. You can submit your own code and have other people analyze it and much MUCH more. 10/10 👌,5,0,2.5.5,2019-08-17 18:35:44,,,POSITIVE,Ranking system
45406,b5da5826-dad8-4bf1-bc97-1656dc5819ea,A Google user,https://play-lh.googleusercontent.com/EGemoI2NTXmTsBVtJqk8jxF9rh8ApRWfsIMQSt2uE4OcpQqbFu7f7NbTK05lx80nuSijCz7sc3a277R67g,"I thought this would be a good tool to refresh and keep updated with programming. But its tutorials are all pretty basic, and the challenges are user-generated, meaning they fail to demonstrate good coding practices and are nothing more than time-limited ""gotchas"" using obtuse, deliberately poorly written code to catch out the unwary (and not to encourage good code, best practice or proper learning). Feedback gets no response, it's just a tool to make money from pushing ads. Avoid, uninstall.",1,5,2.5.5,2019-08-13 14:01:12,,,NEGATIVE,Feedback
45839,44e39f94-1bbc-413f-ac77-d03b6e37a720,A Google user,https://play-lh.googleusercontent.com/EGemoI2NTXmTsBVtJqk8jxF9rh8ApRWfsIMQSt2uE4OcpQqbFu7f7NbTK05lx80nuSijCz7sc3a277R67g,"Great and rewarding experience! Breaks down coding for me to understand it piece by piece. As someone with no programming background whatsoever, this is such a great tool for learning coding.",4,0,2.5.5,2019-08-07 18:25:07,,,POSITIVE,Breaks
47811,a09cd4b6-404b-48ce-888b-a3679759473d,A Google user,https://play-lh.googleusercontent.com/EGemoI2NTXmTsBVtJqk8jxF9rh8ApRWfsIMQSt2uE4OcpQqbFu7f7NbTK05lx80nuSijCz7sc3a277R67g,"I have enjoyed learning on SoloLearn, its a great app with immense content on lots of programing langs.. Thumbs up to the app devs!!",4,0,2.5.5,2019-07-13 03:53:38,,,POSITIVE,Thumbs up
48833,47cafe30-6fce-4bea-949a-c7fb8830f899,A Google user,https://play-lh.googleusercontent.com/EGemoI2NTXmTsBVtJqk8jxF9rh8ApRWfsIMQSt2uE4OcpQqbFu7f7NbTK05lx80nuSijCz7sc3a277R67g,I love this app. It is helping me a lot. Daily challenges and the badges given helped me boosting my speed.,5,0,2.5.5,2019-06-28 06:24:17,,,POSITIVE,Daily challenges
50200,28715c7c-d16d-45fc-9eab-d3b0ecccfa59,A Google user,https://play-lh.googleusercontent.com/EGemoI2NTXmTsBVtJqk8jxF9rh8ApRWfsIMQSt2uE4OcpQqbFu7f7NbTK05lx80nuSijCz7sc3a277R67g,"Overall, I think this is a really great app for people to start learning programing. 1. The interface looks really good. 2. Short programming courses written in the an easy to understand way. 3. Gamification to keep you engaged in the learning process. 4. Community of beginner and experienced coders to learn with you or answer your questions not taught in the courses.",5,0,2.5.5,2019-06-07 13:13:40,,,POSITIVE,Gamification
54062,548289dd-9a44-4918-951e-32f3e47b1109,A Google user,https://play-lh.googleusercontent.com/EGemoI2NTXmTsBVtJqk8jxF9rh8ApRWfsIMQSt2uE4OcpQqbFu7f7NbTK05lx80nuSijCz7sc3a277R67g,Thumbs up,5,0,2.5.4,2019-04-16 11:27:20,,,POSITIVE,Thumbs up
58240,7093977c-5b3e-49e9-bd01-2097e0fefc7f,A Google user,https://play-lh.googleusercontent.com/EGemoI2NTXmTsBVtJqk8jxF9rh8ApRWfsIMQSt2uE4OcpQqbFu7f7NbTK05lx80nuSijCz7sc3a277R67g,I love this app. It's good for a beginner like me. Thumbs up for the developers and the whole team.,5,0,2.5.1,2019-02-23 13:06:48,,,POSITIVE,Thumbs up
58311,de73c1fa-007e-4fa2-9902-2fad18026916,A Google user,https://play-lh.googleusercontent.com/EGemoI2NTXmTsBVtJqk8jxF9rh8ApRWfsIMQSt2uE4OcpQqbFu7f7NbTK05lx80nuSijCz7sc3a277R67g,"Its Just Awesome !! I'm 14 when I found this app Marked As Editor's Choice For Coding . The best part of this app is that unlike other editor's choice app【 Programming Hub 】is that It is totally free and the More best part is that You can type , practise & run your program in this app only.You can do challenges , Follow legends in this app , Unlock Missions and can even chat. overall I'm in love with this app And I would give 10 out of 5. I would recommend this app to everyone who loves coding!!",5,8,2.5.1,2019-02-22 13:11:11,,,POSITIVE,Missions
61440,7f0a8bca-a777-46f3-bb9a-3e3e97af2adb,A Google user,https://play-lh.googleusercontent.com/EGemoI2NTXmTsBVtJqk8jxF9rh8ApRWfsIMQSt2uE4OcpQqbFu7f7NbTK05lx80nuSijCz7sc3a277R67g,"Just a fantastic app for learning languages. No, we don't get bored to hell and it keeps testing us at all small topics, so that we don't loose our way in between. And It also introduces a Friendly Competition in between us friends, on the basis of ""Level"" and ""Points"" and ""Courses Completed"". (Even in a non-Nerdy fashion). A must have APP if you learn to code. Thanks to the Developers' Team, they keep fixing all the bugs and introducing content, and making this Amazing App. Thank You.",5,61,2.4.8,2019-01-07 20:31:19,,,POSITIVE,Competition
61567,6aeb2e8e-3123-4c33-b0ea-d0f3620f43e6,A Google user,https://play-lh.googleusercontent.com/EGemoI2NTXmTsBVtJqk8jxF9rh8ApRWfsIMQSt2uE4OcpQqbFu7f7NbTK05lx80nuSijCz7sc3a277R67g,So far so good. Breaks everything down into small chunks. Could use a little more in depth explanation but if you get confused look at the comments. They are usually very insightful to helping understand. Will update if my opinion changes.,4,1,2.4.8,2019-01-05 18:17:44,,,POSITIVE,Breaks
62584,4875449e-44a7-4144-8030-40d7c798446b,A Google user,https://play-lh.googleusercontent.com/EGemoI2NTXmTsBVtJqk8jxF9rh8ApRWfsIMQSt2uE4OcpQqbFu7f7NbTK05lx80nuSijCz7sc3a277R67g,Fun way to learn. Motivation is far more since there is a community of enthusiastic learner's to interact with.,5,0,2.4.8,2018-12-19 03:35:47,,,POSITIVE,Motivation
63895,ad3ec8fd-8455-43cf-b6f7-9a6abe596cf2,A Google user,https://play-lh.googleusercontent.com/EGemoI2NTXmTsBVtJqk8jxF9rh8ApRWfsIMQSt2uE4OcpQqbFu7f7NbTK05lx80nuSijCz7sc3a277R67g,Really helpful learning tool for coding. Breaks down everything really well and makes learning to code so easy.,5,1,2.4.8,2018-11-28 14:20:16,,,POSITIVE,Breaks
69664,9b09fb21-d00a-4f77-b92c-ab585a7df867,A Google user,https://play-lh.googleusercontent.com/EGemoI2NTXmTsBVtJqk8jxF9rh8ApRWfsIMQSt2uE4OcpQqbFu7f7NbTK05lx80nuSijCz7sc3a277R67g,Very nice app for getting a basic knowledge in a fun way. Achievements are helpful and give additional motivation. Thanks ;),5,0,2.3.1,2018-09-06 08:28:11,,,POSITIVE,Achievements
70604,b3fa465f-ed04-42d7-a3c5-13722a3d15c6,A Google user,https://play-lh.googleusercontent.com/EGemoI2NTXmTsBVtJqk8jxF9rh8ApRWfsIMQSt2uE4OcpQqbFu7f7NbTK05lx80nuSijCz7sc3a277R67g,This is a wonderful place to learn coding. Thumbs up!,5,0,2.2.4,2018-08-25 05:36:29,,,POSITIVE,Thumbs up
70647,b53ac861-83f8-4ee8-a59c-f7a102edfa46,A Google user,https://play-lh.googleusercontent.com/EGemoI2NTXmTsBVtJqk8jxF9rh8ApRWfsIMQSt2uE4OcpQqbFu7f7NbTK05lx80nuSijCz7sc3a277R67g,Really nice app.. Anyone can learn how to code even without a PC.. It's cool.. Thumbs up,5,0,2.2.4,2018-08-24 15:34:55,,,POSITIVE,Thumbs up
70815,8100be1a-be02-4d90-92a9-331ccad05fde,A Google user,https://play-lh.googleusercontent.com/EGemoI2NTXmTsBVtJqk8jxF9rh8ApRWfsIMQSt2uE4OcpQqbFu7f7NbTK05lx80nuSijCz7sc3a277R67g,I think the developers are doing and have done a nice job with this app. Learning at my own pace is quite interesting on this platform and enjoying it free of charge is a huge blessing. Thumbs up!,5,0,2.2.4,2018-08-22 16:01:37,,,POSITIVE,Thumbs up
70884,fbab581b-8150-477a-ba01-00630f757f07,A Google user,https://play-lh.googleusercontent.com/EGemoI2NTXmTsBVtJqk8jxF9rh8ApRWfsIMQSt2uE4OcpQqbFu7f7NbTK05lx80nuSijCz7sc3a277R67g,"Tasks are to easy.. mane add ""show solution"" button if some difficult one really happens",5,0,2.2.4,2018-08-21 23:44:52,,,NEGATIVE,Tasks
72376,379ae382-8232-42ed-b64e-2a6ef8cec825,A Google user,https://play-lh.googleusercontent.com/EGemoI2NTXmTsBVtJqk8jxF9rh8ApRWfsIMQSt2uE4OcpQqbFu7f7NbTK05lx80nuSijCz7sc3a277R67g,Breaks programming logic into bite sized concepts and lessons. Very helpful.,5,0,2.2.4,2018-08-03 07:35:54,,,POSITIVE,Breaks
74068,394dca97-5ab0-4da1-a08f-86ee69075a5b,A Google user,https://play-lh.googleusercontent.com/EGemoI2NTXmTsBVtJqk8jxF9rh8ApRWfsIMQSt2uE4OcpQqbFu7f7NbTK05lx80nuSijCz7sc3a277R67g,"Awesome platform for people like me who are just learning the ropes in 
coding. I will recommend it to anyone anytime. Thumbs up for the entire 
team and Sololearn community.",5,0,2.2.4,2018-07-13 05:04:55,,,POSITIVE,Thumbs up
74555,846f3fb9-fe00-47cd-99a3-a1078945c665,A Google user,https://play-lh.googleusercontent.com/EGemoI2NTXmTsBVtJqk8jxF9rh8ApRWfsIMQSt2uE4OcpQqbFu7f7NbTK05lx80nuSijCz7sc3a277R67g,Awesome app for beginners in coding. Thumbs up!!,5,0,2.2.3,2018-07-07 16:50:30,,,POSITIVE,Thumbs up
74594,db9ce2e8-6c07-4b82-9142-962acfe35854,A Google user,https://play-lh.googleusercontent.com/EGemoI2NTXmTsBVtJqk8jxF9rh8ApRWfsIMQSt2uE4OcpQqbFu7f7NbTK05lx80nuSijCz7sc3a277R67g,Thumbs up,4,0,2.2.3,2018-07-07 04:35:13,,,POSITIVE,Thumbs up
74789,1cef5bd4-ffe0-4c69-94e8-16d173e9a095,A Google user,https://play-lh.googleusercontent.com/EGemoI2NTXmTsBVtJqk8jxF9rh8ApRWfsIMQSt2uE4OcpQqbFu7f7NbTK05lx80nuSijCz7sc3a277R67g,"I really thing that it would a really good idea to give people some 
""projects"" or so to do every week. In every language that the platform 
teches. Like I don't know ""Make a php login script"". Or "" Daily challenges 
so in this way they can practice more what they learned. Other than that 
the app is a great learning app. :)",5,8,2.2.3,2018-07-04 16:10:36,,,POSITIVE,Daily challenges
76643,458dd8aa-3d5c-432f-bc67-523cda2ca7b7,A Google user,https://play-lh.googleusercontent.com/EGemoI2NTXmTsBVtJqk8jxF9rh8ApRWfsIMQSt2uE4OcpQqbFu7f7NbTK05lx80nuSijCz7sc3a277R67g,"The experience has bn awesome so far... Especially the community it's 
amazing.. Thumbs up",5,0,2.2.2,2018-06-12 08:34:13,,,POSITIVE,Thumbs up
77031,5d2a0f58-5271-4910-9ebd-960481c6da4d,A Google user,https://play-lh.googleusercontent.com/EGemoI2NTXmTsBVtJqk8jxF9rh8ApRWfsIMQSt2uE4OcpQqbFu7f7NbTK05lx80nuSijCz7sc3a277R67g,"Best app for beginners who wants to know more about programming and coding 
. Thumbs up 👍🏼",5,0,2.2.1,2018-06-08 03:06:02,,,POSITIVE,Thumbs up
77634,30002216-b6a3-48e0-af6f-d3ae9e3e088f,A Google user,https://play-lh.googleusercontent.com/EGemoI2NTXmTsBVtJqk8jxF9rh8ApRWfsIMQSt2uE4OcpQqbFu7f7NbTK05lx80nuSijCz7sc3a277R67g,"Good way to start your developer career. Very nice user interface, fast, 
clean and no annoying ads. Good community and very exciting lessons to 
learn with. Ive tried some apps before but this is probably the best. 
Lessons are very well explained. Thumbs up for me. Keep up the good work 
team solo learn. Continue making this impressive. Thanks and more power.",5,1,,2018-06-01 15:33:33,,,POSITIVE,Thumbs up
79694,0f080da8-2d9d-43b3-9fd4-a85cf7115aca,A Google user,https://play-lh.googleusercontent.com/EGemoI2NTXmTsBVtJqk8jxF9rh8ApRWfsIMQSt2uE4OcpQqbFu7f7NbTK05lx80nuSijCz7sc3a277R67g,"I've tried lots of apps on android for learning to code, this is by far the 
best (second is Enki). The thing that make this the best is the community 
and the wide variety of user created and official tutorials that are broken 
up into small chunks. Also no ads :D Feedback for the devs, it would be 
good to have a way to bookmark entire sections rather than just individual 
pages",5,32,2.1,2018-05-10 06:06:36,,,POSITIVE,Feedback
80748,90f23d8b-5973-4ac8-8c6e-dc8851f9c588,A Google user,https://play-lh.googleusercontent.com/EGemoI2NTXmTsBVtJqk8jxF9rh8ApRWfsIMQSt2uE4OcpQqbFu7f7NbTK05lx80nuSijCz7sc3a277R67g,This is an exellent app. You can learn on the go. Thumbs up!,5,0,2.0.6,2018-04-27 10:03:12,,,POSITIVE,Thumbs up
81673,d140357e-b0e6-4c57-928e-bbe1d241ef4e,A Google user,https://play-lh.googleusercontent.com/EGemoI2NTXmTsBVtJqk8jxF9rh8ApRWfsIMQSt2uE4OcpQqbFu7f7NbTK05lx80nuSijCz7sc3a277R67g,"It has a very clear step by step instructions that are really helpful to 
starters. Thumbs up for your great work.",5,0,2.0.6,2018-04-17 20:20:03,,,POSITIVE,Thumbs up
82603,1df736c6-8891-4f20-9eb9-38a57a4710db,A Google user,https://play-lh.googleusercontent.com/EGemoI2NTXmTsBVtJqk8jxF9rh8ApRWfsIMQSt2uE4OcpQqbFu7f7NbTK05lx80nuSijCz7sc3a277R67g,"Woow, I must say upon all programming apps out there, this' one of the best if not the best. It has a friendly environment, easy to navigate around the platform and also very motivating. Thumbs up👍 to the developers☺️👌",5,0,,2018-04-07 21:38:11,,,POSITIVE,Thumbs up
84124,cda2d8d1-28fb-4aad-9001-7a5664dfbfce,A Google user,https://play-lh.googleusercontent.com/EGemoI2NTXmTsBVtJqk8jxF9rh8ApRWfsIMQSt2uE4OcpQqbFu7f7NbTK05lx80nuSijCz7sc3a277R67g,"This is the best App I have used.. Imagine me a c++,Java programmer..also a coder.. Thumbs up to sololearn. #proudlysololearner",5,0,2.0.3,2018-03-22 03:25:31,,,POSITIVE,Thumbs up
84237,ec3dd611-6f1b-4a5f-95e7-37cca447f4a2,A Google user,https://play-lh.googleusercontent.com/EGemoI2NTXmTsBVtJqk8jxF9rh8ApRWfsIMQSt2uE4OcpQqbFu7f7NbTK05lx80nuSijCz7sc3a277R67g,Thumbs up,5,0,1.5.1,2018-03-20 17:20:43,,,POSITIVE,Thumbs up
85207,ab170919-7554-4c8a-961a-63c5c0ccb925,A Google user,https://play-lh.googleusercontent.com/EGemoI2NTXmTsBVtJqk8jxF9rh8ApRWfsIMQSt2uE4OcpQqbFu7f7NbTK05lx80nuSijCz7sc3a277R67g,Good to learn from the basics and can try different programs and see the output instantly.Tasks helps to learn the topics and it is given as topic wise from the base c++ so I suggest u to learn from this and be perfect,4,0,2.0.3,2018-03-10 01:12:51,,,POSITIVE,Tasks
86205,d2fc57df-8dd5-41f0-bd8d-352513d579ef,A Google user,https://play-lh.googleusercontent.com/EGemoI2NTXmTsBVtJqk8jxF9rh8ApRWfsIMQSt2uE4OcpQqbFu7f7NbTK05lx80nuSijCz7sc3a277R67g,Tasks can be easy abused by predictions(u mostly have questions on syntactic and thats not good) Think how to improve ur tasks,5,0,2.0.1,2018-02-27 15:30:49,,,NEGATIVE,Tasks
86904,1a130e71-8cb7-406e-94e4-8dd9a81dbbaa,A Google user,https://play-lh.googleusercontent.com/EGemoI2NTXmTsBVtJqk8jxF9rh8ApRWfsIMQSt2uE4OcpQqbFu7f7NbTK05lx80nuSijCz7sc3a277R67g,Perfect Gamification,5,0,2.0.1,2018-02-20 20:50:40,,,POSITIVE,Gamification
87009,e90ae58a-6295-47af-8c04-a875a0f12a9e,A Google user,https://play-lh.googleusercontent.com/EGemoI2NTXmTsBVtJqk8jxF9rh8ApRWfsIMQSt2uE4OcpQqbFu7f7NbTK05lx80nuSijCz7sc3a277R67g,Thumbs up!,5,0,2.0.1,2018-02-19 15:58:39,,,POSITIVE,Thumbs up
